"Pathway","pVal","pValFDR","pValBonferroni","Genes","HitGenes","HitGeneNames"
"RNA transport",0.001,0.326,0.326,156,88,"SNUPN, SRRM1, SAP18, EIF1B, TACC3, RPP30, PAIP1, NUP50, RPP40, RNPS1, POP1, NUPL2, STRAP, DDX20, RPP25L, PABPC5, EEF1A1, EIF2S3, EIF4A1, EIF4B, EIF4E, EIF4EBP1, EIF4EBP2, CASC3, NCBP2, FMR1, NUP188, PABPC1, CYFIP2, NXT1, PABPC1L2A, EIF3E, KPNB1, RGPD1, MAGOH, NUP98, PABPC3, GEMIN4, TRNT1, POP5, PHAX, NUP54, GEMIN8, ELAC1, NDC1, NUP133, NXT2, NXF3, THOC2, RANBP2, RANGAP1, SENP2, SEC13, PABPC1L2B, SMN2, SUMO2, RGPD2, UBE2I, SUMO1, THOC6, GEMIN7, GEMIN6, RPP21, THOC7, AAAS, FXR1, SEH1L, THOC3, RAE1, GEMIN2, EIF4EBP3, EIF3B, EIF3C, EIF3H, EIF3I, EIF3J, PABPC4, EIF2B4, EIF2B3, EIF2B2, EIF2B5, NUP210L, EIF4E2, NUP155, EIF5B, POM121, NUP153, THOC1"
"Spliceosome",0.025,0.998,1,128,68,"PQBP1, SMNDC1, BCAS2, SF3A1, PPIE, PPIH, SLU7, PRPF8, USP39, TXNL4A, SRSF8, SF3A3, SF3B2, DDX42, U2AF2, ZMAT2, NCBP2, SNRNP200, U2SURP, LSM5, PRPF6, PRPF40B, LSM4, SYF2, PRPF31, LSM3, PRPF19, HNRNPA1, HNRNPK, HSPA1L, HSPA2, HSPA6, HSPA8, MAGOH, HNRNPM, SNU13, PCBP1, CDC40, CWC15, PPIL1, WBP11, PLRG1, PRPF38B, XAB2, THOC2, LSM2, RP9, SRSF2, SRSF3, SRSF5, TRA2B, SNRPA, SNRPA1, SNRPB, SNRPD2, SNRPF, U2AF1, SF3B5, THOC3, SRSF9, BUD31, SART1, EFTUD2, DDX23, AQR, DDX46, CDC5L, THOC1"
"Endocytosis",0.029,0.998,1,240,121,"ARPC3, ARPC1B, STAM2, ARPC1A, ARFGEF2, EHD1, RAB35, ARAP1, AP2M1, AP2S1, ZFYVE27, CLTA, CLTC, GRK7, WIPF2, GRK2, AP2A1, DAB2, DNM1, EGFR, EPS15, FGFR4, RAB11FIP2, KIAA1033, PIP5K1C, FOLR1, FOLR3, ACAP2, PSD4, CHMP2B, DNM3, RAB11FIP5, LDLRAP1, ARFGAP3, CYTH4, SNX5, CHMP2A, AMPH, BIN1, GRK4, GRK6, GIT1, EPN1, SNX12, SH3KBP1, HLA-F, HLA-G, HSPA1L, HSPA2, HSPA6, HSPA8, IGF1R, IL2RB, CXCR2, ARF1, KIF5A, KIF5C, ARF5, ARF6, FAM21A, LDLR, ARRB2, RAB8A, NEDD4, ASAP1, PARD6A, SH3GLB1, VPS28, PDGFRA, CHMP3, VPS29, PLD1, VPS37C, ASAP3, VPS35, PARD3, SH3GLB2, RAB4A, RAB5A, GRK1, SMAP1, SH3GL1, SMAP2, SMURF2, SNX1, TFRC, TGFBR1, TSG101, RAB7A, CHMP6, ARPC5L, CAPZA1, CAPZB, PIP5K1B, ARFGAP2, RAB11FIP4, PARD6G, CAV1, CAV2, CAV3, CBLB, SNX4, SNX3, GBF1, RAB11A, ASAP2, HGS, CHMP7, CHMP4C, CYTH2, CYTH1, MVB12A, CAPZA3, VPS4B, VPS26A, RAB11FIP3, ACAP1, IST1, GIT2, IQSEC1, CDC42"
"Renin secretion",0.045,0.998,1,65,36,"ADCYAP1R1, CLCA1, CTSB, ADRB3, ACE, AGT, CLCA4, GNAI1, GNAI2, GNAI3, GNAS, GUCY1A3, GUCY1B3, KCNJ2, KCNMA1, PDE3B, PDE1B, CALML5, PLCB2, PLCB3, PLCB4, PPP3CA, PPP3CC, PPP3R2, PRKACB, PRKACG, PRKG2, PTGER2, CACNA1D, CACNA1S, CALM1, CALM2, CALM3, ORAI1, CALML4, CLCA2"
"Ether lipid metabolism",0.046,0.998,1,43,25,"PLD4, PLA2G4E, PLD3, PLA2G4F, PLA2G2D, PLA2G4D, PLA2G2E, PAFAH1B2, PAFAH1B3, PAFAH2, ENPP2, PLA2G1B, PLA2G2A, PLA2G4A, PLA2G5, PLD1, LPCAT2, CHPT1, PLA2G2F, PLA2G7, LPCAT1, PLA2G12A, PLA2G6, PLPP3, GAL3ST1"
"Phototransduction",0.059,0.998,1,28,17,"CNGB1, CNGA1, GRK7, GNAT1, GUCY2D, PDE6A, CALML5, RCVRN, RHO, GRK1, SAG, CALM1, CALM2, CALM3, RGS9, CALML4, GUCA1C"
"FoxO signaling pathway",0.065,0.998,1,129,66,"AKT3, BCL2L11, SGK2, CDKN1A, CDKN1B, KLF2, PLK4, GABARAPL2, CHUK, FBXO32, PLK3, CREBBP, CSNK1E, S1PR1, EGFR, EP300, AKT2, FOXG1, SGK3, G6PC, GRM1, IGF1, IGF1R, IKBKB, FASLG, IL6, IL7R, IL10, INS, IRS1, FOXO4, ATM, PCK2, PDPK1, NLK, PIK3R2, PLK1, PRKAG3, PRKAB1, PRKAG1, MAPK1, MAPK8, MAPK13, MAP2K1, PTEN, RAF1, RAG1, MAPK12, SGK1, SKP2, SLC2A4, BNIP3, SOD2, SOS1, BRAF, STK11, TGFB2, TGFBR1, USP7, SETD7, IRS4, CCNB3, CCNB1, CCNG2, CCNB2, HOMER3"
"Phospholipase D signaling pathway",0.068,0.998,1,144,73,"AKT3, LPAR6, AGPAT1, AGPAT2, GNA13, ADCY1, PLA2G4E, DGKK, DGKB, DGKG, DGKQ, DNM1, LPAR1, EGFR, AKT2, MRAS, PIP5K1C, LPAR3, GAB1, PLA2G4F, SHC2, DNM3, CYTH4, GNA12, GNAS, PLA2G4D, LPAR4, GRM1, GRM5, GRM6, GRM8, CXCL8, CXCR2, INS, ARF1, KIT, ARF6, KITLG, PDGFA, PDGFB, PDGFRA, PIK3CG, PIK3R2, PLA2G4A, PLCB2, PLCB3, PLCB4, PLCG1, SHC3, PLD1, AVPR1A, AVPR1B, MAPK1, MAP2K1, SPHK2, PTPN11, RAF1, RALA, RALGDS, RHEB, SHC1, SOS1, SYK, TSC2, PDGFD, PIP5K1B, DGKZ, DGKE, PLPP3, SPHK1, CYTH2, CYTH1, GAB2"
"Neuroactive ligand-receptor interaction",0.072,0.998,1,273,133,"LPAR6, NMUR1, CGA, CHRM2, CHRNA1, CHRNA3, CHRNA5, CHRNA7, CHRNB1, CHRNB4, CHRNE, GRIN3A, GRIN3B, ADCYAP1R1, RXFP2, TAAR9, ADORA2A, ADRA2B, CTSG, ADRB3, DRD1, DRD2, DRD3, DRD5, S1PR1, LPAR1, EDNRB, F2RL2, P2RX2, LPAR3, FPR2, FPR3, NTSR2, FSHB, GABRA1, GABRA2, GABRA4, GABRA5, GABRA6, GABRB1, GABRB3, GABRE, GABRG1, GABRR2, GH2, GIPR, GLP1R, GLRA1, GLRA2, NPBWR2, PRLHR, LPAR4, MCHR1, MLNR, P2RY8, GRID1, GRIK3, GRIK5, GRIN2A, GRIN2C, GRIN2D, GRM1, GRM5, GRM6, GRM8, GRPR, HCRTR2, TAAR6, HTR1F, HTR2C, HTR4, HTR5A, HTR7, LEPR, LHB, MC1R, MC2R, MC3R, MC4R, MC5R, MTNR1A, MTNR1B, NMBR, NPY1R, NPY5R, OPRM1, OXTR, P2RX4, P2RY2, P2RY6, P2RY11, RXFP3, S1PR5, P2RY13, AVPR1A, AVPR1B, PRL, PARD3, LTB4R2, NMUR2, CHRNA10, CYSLTR2, PTAFR, PTGER2, PTGIR, PTH2R, HRH4, RXFP1, BDKRB1, BDKRB2, SSTR1, SSTR4, SSTR5, TACR2, TACR3, TBXA2R, TSPO, THRA, THRB, TRHR, TSHB, C5AR1, VIPR2, CALCR, MCHR2, KISS1R, GALR2, F2RL3, TAAR5, TAAR2, S1PR2, GLP2R, P2RY14"
"Tight junction",0.08,0.998,1,160,80,"PATJ, TUBA1B, MYL9, CLDN16, CFTR, TUBA3E, CLDN4, CLDN23, CLDN19, IGSF5, AMOTL1, DLG3, CTTN, CLDN15, GATA4, HCLS1, ITGB1, LLGL1, MAP3K5, RAB8A, AFDN, MSN, MYH2, MYH4, MYH11, MYL6, NEDD4, CLDN20, CLDN11, PARD6A, PCNA, AMOTL2, RAB8B, PRKAG3, ARHGAP17, PPP2R2B, PRKAB1, PRKACB, PRKACG, PRKAG1, MAPK8, PARD3, ACTR3B, CGN, MYH7B, RAP2C, JAM2, RDX, ROCK1, MPP5, STK11, TJP1, ACTG1, CLDN5, TUBA4A, EZR, CACNA1D, MICALL2, MYH14, TUBAL3, ACTN4, SYMPK, JAM3, PARD6G, TUBA1C, CGNL1, YBX3, ACTN1, MYH13, CLDN6, CLDN2, CD1A, CD1B, CD1C, CD1E, ARHGEF2, MAGI1, CRB3, ROCK2, CDC42"
"Ascorbate and aldarate metabolism",0.083,0.998,1,25,15,"ALDH2, ALDH1B1, ALDH9A1, UGT1A8, UGT1A7, UGT1A5, UGT1A9, UGT1A1, UGT1A3, UGDH, UGT2B4, UGT2B7, UGT2B15, UGT2A3, RGN"
"Linoleic acid metabolism",0.084,0.998,1,27,16,"PLA2G4E, CYP2C19, CYP2C8, CYP2J2, ALOX15, PLA2G4F, PLA2G2D, PLA2G4D, PLA2G2E, PLA2G1B, PLA2G2A, PLA2G4A, PLA2G5, PLA2G2F, PLA2G12A, PLA2G6"
"Thyroid hormone signaling pathway",0.088,0.998,1,116,59,"AKT3, MED16, NCOA2, PLCD3, CREBBP, CTNNB1, DIO1, RCAN1, EP300, AKT2, ATP1B4, SIN3A, GATA4, MED4, GSK3B, HDAC1, ITGAV, MYH6, ATP1A1, ATP1B2, NOTCH1, NOTCH4, FXYD2, ATP2A2, PDPK1, PIK3R2, PLCB2, PLCB3, PLCB4, PLCG1, PLN, SLCO1C1, MED1, PRKACB, PRKACG, PRKCG, MAPK1, MAP2K1, BAD, RAF1, RHEB, RXRB, RXRG, BMP4, SLC16A2, THRA, THRB, ACTG1, TP53, TSC2, NCOA3, PLCD4, NCOA1, HDAC3, KAT2B, MED30, MED14, MED17, TBC1D4"
"NF-kappa B signaling pathway",0.09,0.998,1,93,48,"TAB1, TNFSF13B, CHUK, PARP1, CSNK2A1, TICAM1, DDX58, TAB3, LAT, CXCL2, XIAP, TICAM2, IKBKB, IL1B, CXCL8, IRAK1, LBP, LCK, LTA, LTB, ATM, NFKB1, PIAS4, PLAU, PLCG1, PIDD1, PRKCQ, PTGS2, RELA, RELB, CCL4, CCL13, SYK, BTK, TNFAIP3, TRAF1, TRAF2, TRAF3, TRAF5, UBE2I, TRIM25, CARD11, IKBKG, RIPK1, TNFRSF11A, BCL10, CCL4L2, CD40LG"
"TNF signaling pathway",0.094,0.998,1,108,55,"AKT3, TAB1, CREB3, CEBPB, CHUK, MAP3K8, ATF2, ATF6B, CSF1, CSF2, DAB2IP, EDN1, PGAM5, AKT2, TAB3, CXCL2, IKBKB, IL1B, IL6, IL15, CXCL10, LIF, LTA, MAP3K5, MMP3, NFKB1, PIK3R2, MAPK1, MAPK8, MAPK13, MAP2K1, MAP2K6, PTGS2, RELA, BCL3, MAPK12, CCL2, CX3CL1, SELE, TNFAIP3, TNFRSF1B, TRAF1, TRAF2, TRAF3, TRAF5, VEGFC, CASP7, CASP8, CREB3L3, IKBKG, RIPK1, RPS6KA4, CREB3L1, BAG4, CREB5"
"Gap junction",0.096,0.998,1,87,45,"TUBA1B, TUBB3, TUBB4A, ADCY1, MAP3K2, TUBA3E, DRD1, DRD2, LPAR1, EGFR, GNA11, GNAI1, GNAI2, GNAI3, GNAS, GRM1, GRM5, GUCY1A3, GUCY1B3, HTR2C, TUBB8, TUBB2B, PDGFA, PDGFB, PDGFRA, PLCB2, PLCB3, PLCB4, PRKACB, PRKACG, PRKCG, PRKG1, PRKG2, MAPK1, MAP2K1, GJD2, RAF1, SOS1, TJP1, TUBA4A, TUBAL3, PDGFD, TUBB6, TUBA1C, CDK1"
"ABC transporters",0.11,0.998,1,44,24,"ABCB6, ABCC9, CFTR, ABCA13, ABCA1, ABCA2, ABCD2, ABCB10, ABCA6, ABCA5, ABCA4, ABCB5, ABCC6, ABCD3, ABCD4, ABCG4, ABCG5, ABCC8, TAP1, ABCB11, ABCC3, ABCC10, ABCC12, ABCG2"
"Antigen processing and presentation",0.11,0.998,1,71,37,"PSME3, IFI30, KIR3DL3, CTSB, CTSS, PDIA3, HLA-DMA, HLA-DOA, HLA-DOB, HLA-DQB1, HLA-DRA, HLA-DRB5, HLA-F, HLA-G, HSPA1L, HSPA2, HSPA6, HSPA8, KIR2DL1, KIR2DL4, KIR2DS3, KIR3DL2, KLRC2, NFYA, NFYC, LGMN, B2M, PSME1, RFX5, RFXAP, TAP1, TAPBP, CALR, CANX, KLRC4, CD4, CD74"
"Ferroptosis",0.112,0.998,1,40,22,"ATG7, SAT2, CYBB, ACSL3, ACSL6, SLC39A14, ALOX15, GCLM, GSS, SLC11A2, PCBP1, PCBP2, PRNP, SAT1, SLC3A2, TF, TFRC, TP53, VDAC2, VDAC3, MAP1LC3B, MAP1LC3A"
"Terpenoid backbone biosynthesis",0.117,0.998,1,22,13,"PMVK, NUS1, FDPS, FNTB, PDSS1, HMGCR, HMGCS1, HMGCS2, IDI1, MVK, DHDDS, IDI2, RCE1"
"Pentose and glucuronate interconversions",0.117,0.998,1,30,17,"AKR1A1, DHDH, GUSB, UGT1A8, UGT1A7, UGT1A5, UGT1A9, UGT1A1, UGT1A3, RPE, UGDH, UGT2B4, UGT2B7, UGT2B15, UGT2A3, KL, XYLB"
"Glyoxylate and dicarboxylate metabolism",0.118,0.998,1,28,16,"AFMID, GLYCTK, DLD, AGXT, GCSH, AMT, PGP, MDH1, MUT, ACO1, PCCA, PCCB, SHMT1, SHMT2, HYI, MCEE"
"Insulin signaling pathway",0.134,0.998,1,136,67,"AKT3, FLOT1, SORBS1, PPARGC1A, SOCS4, EIF4E, EIF4EBP1, AKT2, FASN, FBP1, FLOT2, EXOC7, RHOQ, G6PC, SHC2, GSK3B, GYS1, HK1, HK2, ACACB, IKBKB, INS, IRS1, PCK2, PDE3B, PDPK1, INPP5K, CALML5, PHKA1, PHKB, PHKG1, PIK3R2, PKLR, SHC3, PRKAG3, PPP1CC, PPP1R3C, PPP1R3D, PRKAB1, PRKACB, PRKACG, PRKAG1, PRKAR2A, PRKAR2B, MAPK1, MAPK8, MAP2K1, BAD, PTPRF, PYGM, RAF1, RHEB, SHC1, SLC2A4, SOS1, BRAF, TSC2, CALM1, CALM2, CALM3, IRS4, SOCS1, CBLB, SOCS2, PPP1R3F, CALML4, EIF4E2"
"Melanogenesis",0.142,0.998,1,100,50,"CREB3, ADCY1, CREBBP, CTNNB1, DCT, DVL1, EDN1, EDNRB, EP300, GNAI1, GNAI2, GNAI3, GNAO1, GNAS, GSK3B, KIT, MC1R, KITLG, MITF, ASIP, LEF1, CALML5, PLCB2, PLCB3, PLCB4, PRKACB, PRKACG, PRKCG, MAPK1, MAP2K1, RAF1, TCF7, TCF7L2, WNT2, WNT5A, WNT7B, WNT8B, WNT10B, WNT9A, FZD5, CALM1, WNT10A, CALM2, CALM3, FZD7, TCF7L1, CREB3L3, WNT3A, CREB3L1, CALML4"
"Arachidonic acid metabolism",0.153,0.998,1,58,30,"PTGES3, CYP4F8, PLA2G4E, FAM213B, CYP2C19, CYP2C8, CYP2J2, EPHX2, ALOX5, ALOX15, PLA2G4F, PLA2G2D, GGT5, HPGDS, PLA2G4D, GPX1, GPX7, PLA2G2E, CYP4F3, GPX8, PLA2G1B, PLA2G2A, PLA2G4A, PLA2G5, PTGS2, PLA2G2F, PLA2G12A, PLA2G6, AKR1C3, CBR1"
"alpha-Linolenic acid metabolism",0.164,0.998,1,23,13,"PLA2G4E, PLA2G4F, PLA2G2D, PLA2G4D, PLA2G2E, ACOX1, PLA2G1B, PLA2G2A, PLA2G4A, PLA2G5, PLA2G2F, PLA2G12A, PLA2G6"
"Adipocytokine signaling pathway",0.166,0.998,1,69,35,"AKT3, CAMKK2, PPARGC1A, CHUK, CPT1C, CPT1B, AGRP, AKT2, ACSL3, ACSL6, G6PC, ACACB, IKBKB, IRS1, LEPR, NFKB1, NPY, PCK2, PRKAG3, PRKAB1, PRKAG1, PRKCQ, MAPK8, PTPN11, RELA, RXRB, RXRG, SLC2A4, STK11, TNFRSF1B, TRAF2, ADIPOR2, ACSBG2, IRS4, IKBKG"
"cGMP-PKG signaling pathway",0.174,0.998,1,162,78,"AKT3, KCNMB2, MYL9, CREB3, GNA13, ADCY1, CNGB1, CNGA1, ATF2, ATF6B, ADRA2B, ADRB3, KCNU1, EDNRB, AKT2, ATP1B4, GATA4, GNA11, GNA12, GNAI1, GNAI2, GNAI3, GTF2I, GUCY1A3, GUCY1B3, INS, IRS1, KCNMA1, MEF2C, MEF2D, MYLK, ATP1A1, NFATC4, ATP1B2, NOS3, FXYD2, ATP2A1, ATP2A2, ATP2A3, ATP2B3, ATP2B4, PDE3B, CALML5, PIK3CG, PLCB2, PLCB3, PLCB4, PLN, PPP1CC, PPP3CA, PPP3CC, PPP3R2, PRKG1, PRKG2, MAPK1, MAP2K1, BAD, RAF1, ROCK1, BDKRB2, SLC8A2, SRF, TRPC6, VDAC2, VDAC3, CACNA1D, CACNA1S, CALM1, CALM2, CALM3, CREB3L3, IRS4, PDE5A, CREB3L1, CALML4, ROCK2, GTF2IRD1, CREB5"
"RNA degradation",0.183,0.998,1,76,38,"TOB1, EXOSC8, DIS3L, EXOSC6, PABPC5, DDX6, DCP2, DHX36, XRN2, EXOSC2, LSM5, CNOT6L, PAN3, LSM4, PABPC1, LSM1, LSM3, DCPS, CNOT7, HSPD1, PABPC1L2A, CNOT3, PABPC3, PARN, EXOSC3, EXOSC9, EXOSC10, XRN1, EXOSC4, EXOSC5, LSM2, PABPC1L2B, SKIV2L, BTG2, ZCCHC7, PNPT1, PABPC4, TTC37"
"Lipoic acid metabolism",0.196,0.998,1,2,2,"LIAS, LIPT1"
"Propanoate metabolism",0.201,0.998,1,32,17,"LDHAL6A, DBT, DLD, MLYCD, HADHA, ACACB, ACADM, LDHB, MUT, PCCA, PCCB, BCKDHA, ACSS3, MCEE, SUCLG2, SUCLA2, LDHAL6B"
"ECM-receptor interaction",0.208,0.998,1,79,39,"COL1A1, COL4A2, COL4A3, COL6A1, COL9A1, COL9A3, DAG1, ITGA11, SV2C, COL6A5, GP1BA, GP9, LAMA1, HSPG2, TNC, ITGA1, ITGA2B, ITGA5, ITGAV, ITGB1, ITGB6, ITGB7, LAMA2, LAMA4, LAMA5, LAMB3, LAMC1, RELN, TNN, THBS3, THBS4, TNR, TNXB, VTN, VWF, ITGA8, CD44, CD47, SV2A"
"Fc gamma R-mediated phagocytosis",0.219,0.998,1,88,43,"AKT3, ARPC3, ARPC1B, ARPC1A, CFL2, PLA2G4E, DOCK2, AKT2, FCGR2B, PIP5K1C, PLA2G4F, LAT, AMPH, BIN1, PLA2G4D, INPP5D, ARF6, LIMK2, MYO10, ASAP1, PIK3R2, PLA2G4A, PLCG1, PLD1, ASAP3, PRKCG, MAPK1, MAP2K1, SPHK2, PTPRC, RAF1, MARCKSL1, SYK, VAV2, ARPC5L, PIP5K1B, PLA2G6, SCIN, PLPP3, ASAP2, SPHK1, GAB2, CDC42"
"Steroid biosynthesis",0.227,0.998,1,20,11,"FAXDC2, CYP2R1, CYP24A1, CYP27B1, FDFT1, LIPA, LSS, SC5D, SQLE, TM7SF2, SOAT2"
"Homologous recombination",0.233,0.998,1,39,20,"RAD50, POLD3, TOPBP1, RAD54B, MRE11A, NBN, ATM, SYCP3, UIMC1, POLD1, BARD1, RAD52, RPA2, BLM, BRCA2, TOP3A, XRCC3, BRCC3, PALB2, BRE"
"Non-alcoholic fatty liver disease (NAFLD)",0.238,0.998,1,141,67,"AKT3, BCL2L11, NR1H3, CEBPA, COX4I1, COX5B, COX6C, COX7A1, COX7A2, COX7C, CYC1, AKT2, MLXIP, GSK3A, GSK3B, IKBKB, IL1A, IL1B, FASLG, IL6, IL6R, CXCL8, INS, IRS1, NDUFS7, LEPR, MAP3K5, MAP3K11, NDUFA1, NDUFA2, NDUFA5, NDUFA8, NDUFA10, NDUFAB1, NDUFB2, NDUFB4, NDUFB6, NDUFB8, NDUFB9, NDUFC2, NDUFS1, NDUFV2, NFKB1, NDUFA13, MLXIPL, PIK3R2, PKLR, PRKAG3, PRKAB1, PRKAG1, NDUFA12, MAPK8, BAX, RELA, SDHA, MLX, TRAF2, UQCRB, UQCRFS1, UQCRH, XBP1, ADIPOR2, CASP7, CASP8, COX4I2, EIF2AK3, CDC42"
"Glutathione metabolism",0.241,0.998,1,52,26,"GSTO2, GGT6, GGT5, GCLM, HPGDS, GPX1, GPX7, GSR, GSS, GSTA1, GSTA3, GSTA4, GSTM5, GSTP1, GSTT1, IDH2, MGST1, MGST2, GPX8, LAP3, NAT8B, PGD, RRM1, RRM2, SRM, GSTO1"
"Vitamin B6 metabolism",0.242,0.998,1,6,4,"PSAT1, AOX1, PNPO, PDXK"
"Taurine and hypotaurine metabolism",0.245,0.998,1,10,6,"GGT6, GAD2, GGT5, CSAD, BAAT, ADO"
"Valine, leucine and isoleucine degradation",0.253,0.998,1,48,24,"HIBADH, DBT, DLD, ALDH2, ALDH1B1, ALDH9A1, IL4I1, ACAD8, HADHA, HADHB, HMGCS1, HMGCS2, AOX1, ACADM, ACADSB, MUT, OXCT1, PCCA, PCCB, BCKDHA, MCCC2, AGXT2, AACS, MCEE"
"Serotonergic synapse",0.255,0.998,1,111,53,"TPH2, PLA2G4E, CYP2C19, CYP2C8, CYP2J2, DDC, HTR3C, DUSP1, HTR3D, ALOX5, ALOX15, PLA2G4F, GABRB1, GABRB3, GNAI1, GNAI2, GNAI3, GNAO1, GNAS, GNB3, GNG3, GNGT2, PLA2G4D, HTR3E, HTR1F, HTR2C, HTR3A, HTR4, HTR5A, HTR7, APP, KCNJ3, KCNJ6, KCNJ9, MAOA, PLA2G4A, PLCB2, PLCB3, PLCB4, PRKACB, PRKACG, PRKCG, MAPK1, MAP2K1, PTGS2, RAF1, GNB4, SLC18A2, BRAF, CACNA1D, CACNA1S, HTR3B, GNG8"
"Antifolate resistance",0.257,0.998,1,31,16,"SLC46A1, CHUK, FOLR1, FOLR3, IKBKB, IL1B, IL6, MTHFR, NFKB1, RELA, SHMT1, SHMT2, TYMS, IKBKG, ABCC3, ABCG2"
"Estrogen signaling pathway",0.258,0.998,1,98,47,"AKT3, CREB3, ADCY1, ATF2, ATF6B, HBEGF, EGFR, AKT2, FKBP4, FKBP5, SHC2, GNAI1, GNAI2, GNAI3, GNAO1, GNAS, GPER1, GRM1, HSPA1L, HSPA2, HSPA6, HSPA8, KCNJ3, KCNJ6, KCNJ9, NOS3, OPRM1, CALML5, PIK3R2, PLCB2, PLCB3, PLCB4, SHC3, PRKACB, PRKACG, MAPK1, MAP2K1, RAF1, SHC1, SOS1, CALM1, CALM2, CALM3, CREB3L3, CREB3L1, CALML4, CREB5"
"Platinum drug resistance",0.262,0.998,1,72,35,"AKT3, CDKN1A, CDKN2A, GSTO2, SLC31A1, ERCC1, AKT2, GSTA1, GSTA3, GSTA4, GSTM5, GSTP1, GSTT1, APAF1, XIAP, BIRC5, FASLG, MAP3K5, MGST1, MGST2, MSH2, ATM, PDPK1, PIK3R2, ATP7A, MAPK1, BAD, BAX, REV3L, TOP2A, TOP2B, TP53, XPA, CASP8, GSTO1"
"Fat digestion and absorption",0.281,0.998,1,40,20,"AGPAT1, AGPAT2, ABCA1, FABP1, PLA2G2D, PLA2G2E, APOA1, APOA4, APOB, PLA2G1B, PLA2G2A, PLA2G5, PNLIP, PNLIPRP1, PNLIPRP2, ABCG5, PLA2G2F, PLA2G12A, DGAT2, PLPP3"
"Vascular smooth muscle contraction",0.295,0.998,1,119,56,"KCNMB2, RAMP2, RAMP3, MYL9, GNA13, ADCY1, PLA2G4E, ADORA2A, KCNU1, PLA2G4F, PLA2G2D, GNA11, GNA12, GNAS, PLA2G4D, GUCY1A3, GUCY1B3, PLA2G2E, KCNMA1, MYH11, MYL6, MYLK, PPP1R12B, CALML5, PLA2G1B, PLA2G2A, PLA2G4A, PLA2G5, PLCB2, PLCB3, PLCB4, PPP1R12C, PPP1CC, AVPR1A, AVPR1B, PRKACB, PRKACG, PRKCG, PRKCQ, PRKG1, MAPK1, MAP2K1, PTGIR, RAF1, ROCK1, PLA2G2F, BRAF, CACNA1D, CACNA1S, CALM1, CALM2, CALM3, PLA2G12A, PLA2G6, CALML4, ROCK2"
"One carbon pool by folate",0.304,0.998,1,19,10,"ALDH1L1, FTCD, MTFMT, MTHFD1L, AMT, MTHFR, MTR, SHMT1, SHMT2, TYMS"
"Notch signaling pathway",0.305,0.998,1,47,23,"DTX2, CREBBP, PTCRA, DVL1, EP300, DLL1, HDAC1, HES1, RBPJ, JAG2, HES5, MFNG, NOTCH1, NOTCH4, APH1A, PSEN2, ADAM17, MAML2, KAT2B, NUMBL, CIR1, NCOR2, MAML1"
"Endocrine and other factor-regulated calcium reabsorption",0.305,0.998,1,47,23,"AP2M1, AP2S1, CLTA, CLTC, AP2A1, DNM1, ATP1B4, DNM3, GNAS, KLK2, ATP1A1, ATP1B2, FXYD2, PLCB2, PLCB3, PLCB4, PRKACB, PRKACG, PRKCG, TRPV5, BDKRB2, RAB11A, KL"
"Peroxisome",0.314,0.998,1,80,38,"ACOT8, ECI2, PMVK, CRAT, AGXT, EPHX2, ACSL3, ABCD2, ACSL6, MLYCD, AMACR, MPV17L, PRDX5, HSD17B4, IDH2, MVK, NOS2, ACOX1, PEX1, PEX12, PEX13, FAR2, BAAT, PEX19, ABCD3, ABCD4, PEX2, PEX5, SOD1, SOD2, NUDT12, FAR1, GNPAT, MPV17L2, PEX3, PEX11A, PEX11G, PEX16"
"Glucagon signaling pathway",0.315,0.998,1,102,48,"AKT3, CREB3, PPARGC1A, CPT1C, CPT1B, ATF2, CREBBP, SIK1, LDHAL6A, EP300, AKT2, FBP1, SIK2, G6PC, GNAS, GYS1, ACACB, LDHB, PCK2, PDE3B, PDHA1, CALML5, PGAM2, PHKA1, PHKB, PHKG1, PLCB2, PLCB3, PLCB4, PRKAG3, PPP3CA, PPP3CC, PPP3R2, PRKAB1, PRKACB, PPP4R3A, PRKACG, PRKAG1, PPP4R3B, PYGM, CALM1, CALM2, CALM3, CREB3L3, CREB3L1, CALML4, LDHAL6B, CREB5"
"Lysosome",0.319,0.998,1,122,57,"TCIRG1, AP4B1, AP3M2, AP3S1, CLN5, CLTA, CLTC, CTSB, CTSD, CTSG, CTSK, CTSV, CTSS, CTSZ, AP1B1, AP1G1, ABCA2, GGA3, AP4E1, FUCA1, GAA, GALNS, GBA, LAMP3, GLA, SUMF1, GUSB, HEXB, HYAL1, IDS, LAMP1, LIPA, ARSB, NPC1, SLC11A2, ATP6V1H, ATP6V0C, ATP6V0B, ATP6V0A1, ACP5, CTSA, LAPTM4B, LGMN, PSAP, SORT1, SGSH, SLC11A1, SMPD1, AP3B2, AP3B1, CTSF, CD164, AP1M1, AP3D1, PPT2, SCARB2, LAPTM4A"
"Type I diabetes mellitus",0.322,0.998,1,43,21,"GAD2, HLA-DMA, HLA-DOA, HLA-DOB, HLA-DQB1, HLA-DRA, HLA-DRB5, HLA-F, HLA-G, HSPD1, ICA1, IL1A, IL1B, IL2, FASLG, INS, LTA, PTPRN, PTPRN2, CD28, CD86"
"Regulation of lipolysis in adipocytes",0.327,0.998,1,54,26,"AKT3, ADCY1, CGA, MGLL, ADRB3, AKT2, GNAI1, GNAI2, GNAI3, GNAS, INS, AQP7, IRS1, NPY, NPY1R, ABHD5, PDE3B, PIK3R2, PLIN1, PRKACB, PRKACG, PRKG1, PRKG2, PTGS2, TSHB, IRS4"
"Nicotinate and nicotinamide metabolism",0.333,0.998,1,28,14,"NADK2, NT5C2, NT5C, AOX1, NMNAT3, NNMT, NT5E, ENPP1, NMRK1, NADSYN1, NMNAT1, NADK, NUDT12, NT5C1A"
"Oxidative phosphorylation",0.338,0.998,1,116,54,"TCIRG1, ATP5L, ATP6V1G3, COX4I1, COX5B, COX6C, COX7A1, COX7A2, COX7C, CYC1, ATP6V0E2, NDUFS7, NDUFA1, NDUFA2, NDUFA5, NDUFA8, NDUFA10, NDUFAB1, NDUFB2, NDUFB4, NDUFB6, NDUFB8, NDUFB9, NDUFC2, NDUFS1, NDUFV2, ATP12A, ATP4A, ATP5B, ATP5C1, NDUFA13, ATP5E, ATP5F1, ATP5G1, ATP6V1H, ATP5G2, ATP5I, ATP5J, ATP6V1A, ATP6V0C, ATP6V1C1, ATP6V0B, ATP6V0A1, ATP5O, PPA1, NDUFA12, SDHA, UQCRB, UQCRFS1, UQCRH, COX4I2, ATP6V1F, ATP6V1G1, ATP5J2"
"Tryptophan metabolism",0.341,0.998,1,39,19,"INMT, TPH2, AFMID, ACMSD, AANAT, DDC, ALDH2, ALDH1B1, ALDH9A1, HAAO, IL4I1, AOC1, GCDH, HADHA, AOX1, MAOA, AADAT, TDO2, KMO"
"Hematopoietic cell lineage",0.342,0.998,1,94,44,"CSF1, CSF2, DNTT, EPO, FLT3, FLT3LG, GP1BA, GP9, GYPA, HLA-DMA, HLA-DOA, HLA-DOB, HLA-DQB1, HLA-DRA, HLA-DRB5, IL1A, IL1B, IL4, IL6, IL6R, IL7, IL7R, IL11, ITGA1, ITGA2B, ITGA5, KIT, KITLG, MME, TFRC, CD1A, CD1B, CD1C, CD1E, CD2, CD3D, CD4, CD7, CD9, MS4A1, CD33, CD34, CD37, CD44"
"Ras signaling pathway",0.346,0.998,1,223,102,"AKT3, PAK4, RALBP1, CHUK, RASGRP4, PLA2G4E, CSF1, EFNA2, EGFR, EPHA2, AKT2, ETS2, FGF6, FGF8, FGF11, FGF12, FGF13, FGF14, FGFR1, FGFR4, MRAS, RASA3, GAB1, PLA2G4F, SHC2, PLA2G2D, LAT, GNB3, GNG3, GNGT2, PLA2G4D, GRIN2A, PLA2G2E, HTR7, IGF1, IGF1R, IKBKB, FASLG, INS, KIT, ARF6, MET, KITLG, AFDN, FOXO4, NF1, NFKB1, NGF, PDGFA, PDGFB, PDGFRA, CALML5, PIK3R2, PLA2G1B, PLA2G2A, PLA2G4A, PLA2G5, PLCG1, SHC3, PLD1, PRKACB, PRKACG, PRKCG, MAPK1, MAPK8, MAP2K1, PAK6, BAD, PTPN11, RAB5A, RAF1, RALA, RALGDS, RASA1, RASA2, RASGRF2, GNB4, RELA, PLA2G2F, SHC1, RASAL3, SOS1, VEGFC, CALM1, PDGFD, CALM2, FGF23, CALM3, PLA2G12A, BRAP, PLA2G6, RASAL1, IKBKG, FGF17, SYNGAP1, KSR1, CALML4, GNG8, RIN1, RAPGEF5, GAB2, CDC42"
"Ubiquinone and other terpenoid-quinone biosynthesis",0.347,0.998,1,11,6,"NQO1, COQ2, HPD, COQ6, COQ3, COQ5"
"Long-term depression",0.354,0.998,1,59,28,"GNA13, PLA2G4E, PLA2G4F, GNA11, GNA12, GNAI1, GNAI2, GNAI3, GNAO1, GNAS, PLA2G4D, GRM1, GUCY1A3, GUCY1B3, IGF1, IGF1R, PLA2G4A, PLCB2, PLCB3, PLCB4, PRKCG, PRKG1, PRKG2, MAPK1, MAP2K1, RAF1, RYR1, BRAF"
"Cell adhesion molecules (CAMs)",0.369,0.998,1,137,63,"CDH3, CDH4, CDH5, CDH15, CLDN16, CLDN4, CLDN23, VCAN, CTLA4, CLDN19, NLGN1, ICOSLG, CADM1, CLDN15, NEGR1, CNTNAP2, GLG1, HLA-DMA, HLA-DOA, HLA-DOB, HLA-DQB1, HLA-DRA, HLA-DRB5, HLA-F, HLA-G, ICAM3, ITGAV, ITGB1, ITGB7, L1CAM, CD99, CLDN20, CLDN11, NLGN2, LRRC4C, CADM3, PTPRC, PTPRF, NECTIN1, JAM2, SDC2, SELE, SELPLG, LRRC4, SPN, CLDN5, CD276, JAM3, NTNG2, CNTNAP1, ITGA8, CLDN6, CLDN2, CD2, CD4, CD6, NRXN3, CD28, LRRC4B, CD86, CD34, CD40LG, SDC3"
"Vasopressin-regulated water reabsorption",0.374,0.998,1,44,21,"CREB3, DCTN6, DYNC1H1, DYNC1I1, DYNC1I2, DYNC1LI2, GNAS, AQP2, ARHGDIB, NSF, DYNC1LI1, DCTN4, PRKACB, PRKACG, RAB5A, DYNC2H1, CREB3L3, DYNLL1, RAB11A, CREB3L1, CREB5"
"Pancreatic secretion",0.377,0.998,1,95,44,"CELA3A, ADCY1, CFTR, CLCA1, CPA1, CPB1, CTRB1, CTRL, SLC26A3, CLCA4, ATP1B4, PLA2G2D, GNAS, AMY2B, PLA2G2E, KCNMA1, KCNQ1, RAB8A, ATP1A1, ATP1B2, FXYD2, ATP2A1, ATP2A2, ATP2A3, ATP2B3, ATP2B4, CELA2B, PLA2G1B, PLA2G2A, PLA2G5, PLCB2, PLCB3, PLCB4, PNLIP, PNLIPRP1, PNLIPRP2, PRKCG, RYR2, PLA2G2F, SLC12A2, PLA2G12A, SLC4A4, RAB11A, CLCA2"
"Basal transcription factors",0.385,0.998,1,42,20,"TAF6L, GTF2A1, GTF2E1, GTF2E2, GTF2F2, GTF2H3, GTF2H4, GTF2I, TBPL2, TAF7L, TAF1, TAF2, TAF4, TAF11, TAF12, TAF13, GTF2H2C_2, TAF15, TBPL1, GTF2IRD1"
"Mineral absorption",0.393,0.998,1,51,24,"SLC46A1, CLCN2, SLC31A1, SLC26A3, ATP1B4, STEAP1, MT1A, MT1B, MT1F, MT1G, MT1H, MT2A, ATOX1, ATP1A1, ATP1B2, FXYD2, SLC11A2, ATP7A, TRPV6, MT1HL1, SLC26A6, TF, S100G, HEPH"
"PPAR signaling pathway",0.394,0.998,1,71,33,"NR1H3, SORBS1, CPT1C, CPT1B, CPT2, DBI, FABP1, FABP3, FABP6, FABP7, ACSL3, ACSL6, GK2, HMGCS2, APOA1, ACADM, APOC3, AQP7, LPL, MMP1, PLIN5, ACOX1, PCK2, PDPK1, PLIN1, PPARD, RXRB, RXRG, SCD, PLIN4, UBC, SCD5, ACSBG2"
"Porphyrin and chlorophyll metabolism",0.396,0.998,1,40,19,"EARS2, CPOX, ALAS1, GUSB, UGT1A8, UGT1A7, UGT1A5, UGT1A9, UGT1A1, UGT1A3, PPOX, BLVRA, UGT2B4, UGT2B7, UGT2B15, UROD, UROS, UGT2A3, HEPH"
"Other glycan degradation",0.396,0.998,1,18,9,"FUCA1, FUCA2, GBA, HEXDC, HEXB, MAN2C1, NEU2, GBA2, ENGASE"
"Glycosaminoglycan degradation",0.396,0.998,1,18,9,"GALNS, GUSB, HEXB, HYAL1, IDS, ARSB, HPSE2, SGSH, SPAM1"
"Ovarian steroidogenesis",0.403,0.998,1,49,23,"ADCY1, CGA, ACOT2, PLA2G4E, CYP2J2, CYP17A1, CYP19A1, ALOX5, FSHB, PLA2G4F, GNAS, PLA2G4D, HSD3B2, IGF1, IGF1R, INS, LDLR, LHB, PLA2G4A, PRKACB, PRKACG, PTGS2, AKR1C3"
"Complement and coagulation cascades",0.407,0.998,1,78,36,"PROCR, VSIG4, CLU, F2RL2, F5, F8, F10, F12, F13A1, F13B, FGA, FGB, FGG, SERPIND1, CD46, SERPINC1, SERPINA5, PLAT, PLAU, PROS1, MASP1, BDKRB1, BDKRB2, CFB, TFPI, SERPING1, C1S, C4A, C4B, C4BPB, C5, C5AR1, C6, VTN, VWF, F2RL3"
"Calcium signaling pathway",0.412,0.998,1,181,82,"ADCY1, CHRM2, PLCD3, CHRNA7, ADORA2A, ADRB3, DRD1, DRD5, EDNRB, EGFR, ERBB4, P2RX2, GNA11, GNA15, GNAS, GRIN2A, GRIN2C, GRIN2D, GRM1, GRM5, GRPR, HTR2C, HTR4, HTR5A, HTR7, ITPKA, MYLK, NOS2, NOS3, ATP2A1, ATP2A2, ATP2A3, ATP2B3, ATP2B4, OXTR, P2RX4, PDE1B, PDGFRA, CALML5, PHKA1, PHKB, PHKG1, PLCB2, PLCB3, PLCB4, PLCG1, PLN, AVPR1A, AVPR1B, PPP3CA, PPP3CC, PPP3R2, PRKACB, PRKACG, PRKCG, LTB4R2, SPHK2, CYSLTR2, PTAFR, STIM2, BDKRB1, BDKRB2, RYR1, RYR2, SLC8A2, TACR2, TACR3, TBXA2R, TRHR, VDAC2, VDAC3, CACNA1D, CACNA1S, CALM1, CALM2, CALM3, PLCD4, ORAI1, SPHK1, CACNA1I, CALML4, GNA14"
"Inflammatory mediator regulation of TRP channels",0.413,0.998,1,96,44,"ADCY1, PLA2G4E, CYP2J2, PLA2G4F, GNAS, PLA2G4D, HTR2C, IGF1, IL1B, ASIC2, ASIC1, NGF, NTRK1, P2RY2, TRPV2, ASIC5, CALML5, PIK3R2, PLA2G4A, PLCB2, PLCB3, PLCB4, PLCG1, PPP1CC, ASIC4, PRKACB, PRKACG, PRKCG, PRKCQ, MAPK8, MAPK13, MAP2K6, PTGER2, BDKRB1, BDKRB2, MAPK12, TRPM8, CALM1, CALM2, CALM3, PLA2G6, TRPA1, CALML4, ASIC3"
"Biotin metabolism",0.414,0.998,1,3,2,"HLCS, BTD"
"Intestinal immune network for IgA production",0.415,0.998,1,47,22,"TNFSF13B, CCR9, ICOSLG, HLA-DMA, HLA-DOA, HLA-DOB, HLA-DQB1, HLA-DRA, HLA-DRB5, IL2, IL4, IL6, IL10, IL15, IL15RA, ITGB7, PIGR, CCL28, TNFRSF17, CD28, CD86, CD40LG"
"Thyroid hormone synthesis",0.426,0.998,1,74,34,"CREB3, ADCY1, CGA, ATF2, ATF6B, ATP1B4, GNAS, GPX1, GPX7, GSR, LRP2, ASGR1, ATP1A1, ATP1B2, FXYD2, GPX8, SLC26A4, PLCB2, PLCB3, PLCB4, PRKACB, PRKACG, PRKCG, SLC5A5, SERPINA7, TPO, TSHB, TTF1, TTR, CANX, CREB3L3, CREB3L1, CREB5, PDIA4"
"RIG-I-like receptor signaling pathway",0.446,0.998,1,70,32,"CHUK, DDX58, IFNA2, IFNA7, IFNA8, IFNA13, IFNA14, IFNA16, IFNA17, IFNB1, IKBKB, CXCL8, CXCL10, NFKB1, RNF125, OTUD5, MAPK8, MAPK13, RELA, MAPK12, IFIH1, AZI2, TRAF2, TRAF3, TRIM25, DHX58, NLRX1, CASP8, IKBKG, RIPK1, ISG15, TBKBP1"
"Base excision repair",0.448,0.998,1,32,15,"PARP3, POLD3, PARP1, NEIL2, APEX2, HMGB1, APEX1, LIG1, LIG3, MUTYH, NTHL1, PCNA, POLB, POLD1, TDG"
"Protein processing in endoplasmic reticulum",0.451,0.998,1,160,72,"PREB, PDIA6, BCAP31, DNAJA2, 6-Mar, SEC23B, SEC23A, HYOU1, SEC24A, MAN1A2, SEC61B, OS9, LMAN2, ATF6B, CRYAA, TRAM1, SEC31B, PDIA3, SEC61A1, UBQLN2, DNAJB2, DNAJA1, HSPA1L, HSPA2, HSPA6, HSPA8, MAN1A1, MAP3K5, EIF2AK4, UBQLN3, PARK2, UBE2J1, DNAJC10, YOD1, NPLOC4, EDEM2, UGGT2, SELENOS, NSFL1C, MAPK8, EIF2AK2, DNAJC3, ERO1B, UGGT1, UBQLN4, MAN1C1, BAG1, BAX, RAD23B, RPN2, SEC13, DNAJC1, SIL1, SKP1, SEC62, TRAF2, UBE2D3, UBE2G2, XBP1, DERL1, LMAN1L, DNAJC5, CALR, CANX, CUL1, DERL3, RNF185, EIF2AK3, BAG2, PDIA4, SEC24C, EDEM1"
"Oxytocin signaling pathway",0.451,0.998,1,151,68,"CDKN1A, CACNG3, CACNG2, MYL9, CAMKK2, ADCY1, PLA2G4E, RCAN1, EGFR, PLA2G4F, CACNG4, GNAI1, GNAI2, GNAI3, GNAO1, GNAS, PLA2G4D, GUCY1A3, GUCY1B3, KCNJ2, KCNJ3, KCNJ4, KCNJ6, KCNJ9, KCNJ12, MEF2C, MYL6, MYLK, PPP1R12B, NFATC4, NOS3, OXTR, CALML5, PIK3CG, PLA2G4A, PLCB2, PLCB3, PLCB4, PRKAG3, PPP1R12C, PPP1CC, PPP3CA, PPP3CC, PPP3R2, PRKAB1, PRKACB, PRKACG, PRKAG1, CACNA2D3, PRKCG, MAPK1, MAP2K1, CAMK1D, PTGS2, RAF1, ROCK1, RYR1, RYR2, ACTG1, CACNA1D, CACNA1S, CALM1, CALM2, CALM3, CAMK1, CALML4, CACNA2D2, ROCK2"
