"Pathway","pVal","pValFDR","pValBonferroni","Genes","HitGenes","HitGeneNames"
"Hippo signaling pathway",0,0,0,150,65,"APC2, RASSF1, FZD10, FRMD6, WTIP, CSNK1D, CTNNA1, CTNNA2, GDF7, AMOT, DLG2, DVL2, DVL3, SCRIB, LATS2, BBC3, GLI2, CRB2, CTNNA3, BIRC2, ID1, ITGB2, SMAD2, SMAD7, MYC, SERPINE1, WNT4, PPP1CA, PPP1CB, PPP2CA, PPP2R1A, PPP2R1B, PPP2R2A, PPP2R2C, MOB1A, CCND1, BMP2, BMP6, BMPR1A, SNAI2, SOX2, TGFB1, TGFB3, TGFBR2, TP53BP2, TP73, WNT1, WNT3, WNT6, WNT7A, WNT8A, WNT2B, YWHAE, FZD3, WNT5B, GDF5, AXIN2, FZD1, FZD6, FZD9, TEAD2, NKD1, BTRC, LIMD1, CDH1"
"ErbB signaling pathway",0,0.001,0.001,85,39,"NRG3, CRK, ELK1, ERBB2, ERBB3, EREG, AKT1, CBLC, MTOR, ABL1, NRG1, HRAS, ARAF, MYC, NCK1, NRAS, PAK1, PAK3, PIK3CB, PIK3CD, PLCG2, PRKCA, PRKCB, MAPK9, MAPK10, MAP2K2, MAP2K7, PAK5, PTK2, RPS6KB1, RPS6KB2, MAP2K4, SRC, STAT5A, BTC, CAMK2D, CAMK2G, NCK2, CBL"
"Wnt signaling pathway",0,0.001,0.003,140,56,"APC2, FZD10, CSNK1A1L, CSNK2B, CTBP2, DVL2, DVL3, DAAM1, PLCB1, FRAT2, DAAM2, CACYBP, DKK4, DKK2, LRP6, MMP7, MYC, NFATC1, NFATC2, NFATC3, SERPINF1, WNT4, PPP3CB, PPP3R1, PRKCA, PRKCB, MAPK9, MAPK10, PSEN1, CHD8, RAC1, RAC3, CCND1, SFRP5, TBL1X, WNT1, WNT3, WNT6, WNT7A, WNT8A, WNT2B, TBL1XR1, FZD3, FOSL1, WNT5B, CAMK2D, CAMK2G, AXIN2, FZD1, FZD6, FZD9, NKD1, NKD2, RUVBL1, BTRC, RBX1"
"Glutamatergic synapse",0,0.01,0.052,113,44,"GNB5, ADCY2, ADCY3, ADCY5, ADCY6, ADCY7, ADCY8, ADCY9, SHANK2, PLCB1, GLS2, GLS, GLUL, GNB1, GNGT1, GRIA1, GRIA2, GRIA4, GRIK1, GRIK2, GRIK4, GRIN1, GRIN2B, GRM3, GRM4, GRM7, ITPR2, SHANK1, PLD2, GNG2, SLC38A2, PPP3CB, PPP3R1, PRKCA, PRKCB, GNG12, SLC17A7, SLC1A1, TRPC1, CACNA1A, SHANK3, PLA2G4C, DLGAP1, HOMER1"
"Olfactory transduction",0,0.01,0.056,399,125,"OR5I1, ADCY3, OR4X2, OR5P3, OR2D2, OR52W1, OR10P1, OR10AD1, OR4L1, SLC24A4, OR4D2, OR1M1, CNGA2, CNGA3, OR1I1, OR2T12, OR14C36, OR2B11, OR10X1, OR6K6, OR9A2, OR6B1, OR13C5, OR13F1, OR1N1, OR52I2, OR51E1, OR4C6, OR5D18, OR5T2, OR8K3, OR5R1, OR5AR1, OR10S1, OR9I1, OR5A1, OR4D6, OR4D11, OR1L4, OR51F1, OR1C1, OR1A2, OR1J4, OR2K2, OR7A17, OR5H1, OR10J1, OR8B8, OR10A3, OR10G3, OR8B2, OR7E24, OR7A5, OR4F4, OR2H1, OR1L1, GNAL, GNB1, OR8D1, OR9G4, OR4N4, OR2Z1, OR13D1, OR5F1, OR8S1, OR6S1, OR6V1, OR2A1, OR1B1, OR52K1, OR51D1, OR52E6, OR56A3, OR10A6, OR8H2, OR5T1, OR8K1, OR5M1, OR5AK2, OR5B12, OR4D10, OR4D9, OR6M1, OR6C75, OR4K2, OR4K13, OR4F6, OR10K1, OR6Y1, OR13C2, OR1L6, OR5C1, OR1K1, OR2A5, OR14I1, OR2T27, OR4A47, OR4C45, OR6C65, ARRB1, OR4Q3, OR4M1, OR2B3, OR10C1, OR2A2, OR2C1, PDE1C, PDE2A, OR2S2, SLC8A1, SLC8A3, OR5H6, OR4K5, OR2H2, OR51G1, CALML3, OR51G2, OR4A5, OR4A15, OR6N2, OR2G3, OR2G2, CAMK2D, OR12D3, CAMK2G"
"Cellular senescence",0,0.01,0.073,158,57,"CDK2, TRAF3IP2, CHEK1, MAPK14, RAD9B, HIPK4, GADD45A, E2F1, HIPK1, AKT1, RRAS2, FOXO1, FOXO3, SIRT1, MTOR, HIPK2, SLC25A5, SLC25A6, HLA-A, HLA-C, HLA-E, HRAS, ITPR2, SMAD2, MDM2, MYC, GADD45B, NFATC1, NFATC2, NFATC3, NRAS, SERPINE1, PIK3CB, PIK3CD, PPID, TRPM7, PPP1CA, PPP1CB, PPP3CB, PPP3R1, MAPK11, MAP2K2, RAD9A, RBBP4, RBL2, TRPV4, CCND1, TGFB1, TGFB3, TGFBR2, VDAC1, CALML3, CAPN1, RASSF5, SQSTM1, BTRC, CDC25A"
"Necroptosis",0,0.01,0.081,162,58,"PARP2, RBCK1, RIPK3, FAF1, SPATA2L, CHMP4B, PARP4, MLKL, GLUL, PYCARD, SLC25A5, SLC25A6, H2AFX, H2AFZ, BIRC2, BIRC3, HSP90AA1, IFNA1, IFNA4, IFNA5, IFNA6, IFNA10, IFNAR1, IFNAR2, IFNG, IFNGR2, JAK2, JAK3, H2AFB2, PPIA, PPID, TRPM7, MAPK9, MAPK10, PYGB, PYGL, BCL2, STAT3, STAT5A, STAT6, VDAC1, ZBP1, CAMK2D, CAMK2G, CAPN1, HIST1H2AI, HIST1H2AK, HIST1H2AJ, HIST1H2AC, HIST2H2AC, H2AFB3, PLA2G4C, TNFSF10, TNFRSF10B, SQSTM1, HIST3H2A, H2AFV, H2AFY"
"AGE-RAGE signaling pathway in diabetic complications",0,0.01,0.088,99,39,"COL4A1, COL4A4, MAPK14, AKT1, VEGFD, FOXO1, PLCB1, FN1, HRAS, JAK2, SMAD2, MMP2, NFATC1, NRAS, NOX4, SERPINE1, PIK3CB, PIM1, PIK3CD, PLCD1, PLCG2, PRKCA, PRKCB, PRKCD, PRKCE, MAPK11, MAPK9, MAPK10, RAC1, CCND1, BCL2, STAT3, STAT5A, TGFB1, TGFB3, TGFBR2, THBD, VCAM1, VEGFA"
"Dopaminergic synapse",0,0.01,0.117,130,48,"GNB5, ADCY5, COMT, MAPK14, CREB3L4, AKT1, PLCB1, FOS, GNAL, GNB1, GNGT1, PPP2R3B, GRIA1, GRIA2, GRIA4, GRIN2B, ITPR2, KCNJ5, KIF5B, MAOB, ATF4, CALY, GNG2, PPP1CA, PPP1CB, PPP2CA, PPP2R1A, PPP2R1B, PPP2R2A, PPP2R2C, PPP2R5C, PPP2R5D, PPP3CB, PRKCA, PRKCB, GNG12, MAPK11, MAPK9, MAPK10, SCN1A, CREB3L2, SLC18A1, TH, CACNA1A, CALML3, CAMK2D, CAMK2G, PPP1R1B"
"MAPK signaling pathway",0,0.01,0.118,252,83,"RASGRP1, RASGRP2, CRK, MAPK14, DAXX, GADD45A, DDIT3, DUSP2, DUSP3, DUSP4, DUSP8, ELK1, AKT1, FGF2, FGF5, FGFR2, RRAS2, FLNA, MAPK8IP3, FLNB, FLNC, FOS, RASGRP3, FGF22, CACNG5, HRAS, HSPA1A, HSPB1, ARRB1, MAPT, MAP3K4, MYC, GADD45B, ATF4, NFATC1, NFATC3, NFKB2, NRAS, NTF4, NTRK2, PAK1, ECSIT, PPP3CB, PPP3R1, PRKCA, PRKCB, GNG12, MAPK11, MAPK9, MAPK10, MAP2K2, MAP2K5, MAP2K7, MAP4K2, RAC1, RAC3, CACNG7, CACNG6, RPS6KA2, RPS6KA3, MAP2K4, TGFB1, TGFB3, TGFBR2, CACNA1A, CACNA1E, MAP3K12, CACNB1, CACNB2, IL1R2, DUSP16, MAP4K3, MAPKAPK5, MKNK1, PLA2G4C, LAMTOR3, FGF18, FGF16, CACNA1H, CACNA1G, RPS6KA5, CACNA2D4, MAP4K4"
"mTOR signaling pathway",0,0.01,0.119,147,53,"FZD10, DVL2, DVL3, AKT1, LPIN1, MTOR, RICTOR, HRAS, LAMTOR4, LRP6, NRAS, ATP6V1D, ATP6V1B1, ATP6V1E1, PIK3CB, PIK3CD, ATP6V1G2, WNT4, MIOS, DDIT4, LAMTOR1, PRR5, PRKAA1, PRKAA2, PRKCA, PRKCB, MAP2K2, RRAGD, RPS6, RPS6KA2, RPS6KA3, RPS6KB1, RPS6KB2, RRAGC, MLST8, DEPTOR, WNT1, WNT3, WNT6, WNT7A, WNT8A, WNT2B, MAPKAP1, FZD3, WNT5B, FZD1, FZD6, FZD9, WDR24, LAMTOR3, ATP6V1E2, FNIP1, TTI1"
"Natural killer cell mediated cytotoxicity",0.001,0.01,0.135,124,46,"SH2D1B, RAET1E, FCGR3A, GZMB, HLA-A, HLA-C, HLA-E, HRAS, ICAM2, IFNA1, IFNA4, IFNA5, IFNA6, IFNA10, IFNAR1, IFNAR2, IFNG, IFNGR2, ITGB2, ARAF, KLRC1, KLRC3, KLRD1, MICB, NFATC1, NFATC2, NRAS, PAK1, PIK3CB, PIK3CD, PLCG2, PPP3CB, PPP3R1, PRKCA, PRKCB, MAP2K2, RAC1, RAC3, VAV1, ZAP70, ULBP3, ULBP2, TNFSF10, TNFRSF10B, CD247, CD48"
"Axon guidance",0.001,0.01,0.141,172,60,"PLXNC1, SEMA6C, SEMA6B, SEMA4D, GDF7, DCC, EFNA1, EFNA3, EFNA5, EFNB1, EPHA7, EPHA8, EPHB2, EPHB3, FES, NTNG1, ARHGEF12, ABL1, RND1, RHOD, HRAS, ILK, LIMK1, NCK1, NFATC2, NFATC3, NRAS, PAK1, PAK3, PIK3CB, PIK3CD, PLCG2, WNT4, PPP3CB, PPP3R1, PRKCA, DPYSL5, PAK5, PTK2, SEMA6A, SEMA4G, RAC1, RAC3, ROBO1, CXCL12, SEMA4A, SLIT3, SRC, TRPC1, TRPC4, SEMA3B, FZD3, SEMA6D, WNT5B, CAMK2D, CAMK2G, NCK2, BOC, NTN1, SRGAP3"
"cAMP signaling pathway",0.001,0.01,0.155,197,67,"HCN4, ABCC4, ADCY2, ADCY3, ADCY5, ADCY6, ADCY7, ADCY8, ADCY9, CNGA2, CNGA3, ADORA1, GPR119, CREB3L4, ADRB1, AKT1, F2R, RRAS2, FOS, FSHR, GABBR1, GHSR, HCAR1, GLI1, GLI3, GRIA1, GRIA2, GRIA4, GRIN1, GRIN2B, HTR1D, HTR1E, LIPE, PPP1R12A, ATP1A2, NFATC1, NFKBIA, ATP1A4, ATP2B1, PAK1, PDE3A, PDE4B, PIK3CB, PIK3CD, PLD2, PPP1CA, PPP1CB, ADCY10, MAPK9, MAPK10, MAP2K2, SUCNR1, RAC1, RAC3, HCN2, CREB3L2, SOX9, SSTR2, TIAM1, TSHR, VAV1, CALML3, CAMK2D, CAMK2G, PPP1R1B, HCAR3, GABBR2"
"Aldosterone synthesis and secretion",0.001,0.01,0.157,82,33,"ADCY2, ADCY3, ADCY5, ADCY6, ADCY7, ADCY8, ADCY9, CREB3L4, CYP11A1, CYP11B2, PLCB1, PRKD3, PRKD2, HSD3B1, ITPR2, KCNK3, LIPE, ATF1, ATF4, NR4A2, PDE2A, PRKCA, PRKCB, PRKCE, CREB3L2, STAR, DAGLA, CALML3, CAMK2D, CAMK2G, CACNA1H, CACNA1G, SCARB1"
"Endocrine resistance",0.001,0.01,0.16,95,37,"CDKN2C, CARM1, DLL3, ADCY2, ADCY3, ADCY5, ADCY6, ADCY7, ADCY8, ADCY9, MAPK14, CYP2D6, E2F1, ERBB2, AKT1, ESR1, ESR2, FOS, MTOR, HRAS, ARAF, MDM2, MMP2, NRAS, PIK3CB, PIK3CD, MAPK11, MAPK9, MAPK10, MAP2K2, PTK2, CCND1, BCL2, RPS6KB1, RPS6KB2, SRC, NCOR1"
"Insulin resistance",0.001,0.012,0.207,106,40,"MGEA5, SLC27A4, SLC27A3, CPT1A, CREB3L4, CRTC2, AKT1, FOXO1, MTOR, SLC27A6, SLC27A1, NFKBIA, PCK1, PIK3CB, PIK3CD, PPP1CA, PPP1CB, PPP1R3A, PTPA, PRKAA1, PRKAA2, PRKCB, PRKCD, PRKCE, MAPK9, MAPK10, PTPN1, PYGB, PYGL, RPS6KA2, RPS6KA3, RPS6KB1, RPS6KB2, CREB3L2, STAT3, NR1H2, PPP1R3B, IRS2, G6PC3, GFPT2"
"Th17 cell differentiation",0.001,0.014,0.256,107,40,"IL17F, MAPK14, FOS, MTOR, TBX21, HIF1A, HLA-DMB, HLA-DPA1, HLA-DQA1, HSP90AA1, IFNG, IFNGR2, IL2RA, IL2RG, IL4R, IL6ST, JAK2, JAK3, SMAD2, NFATC1, NFATC2, NFATC3, NFKBIA, FOXP3, IL23A, IL17D, PPP3CB, PPP3R1, MAPK11, MAPK9, MAPK10, RORC, STAT3, STAT5A, STAT6, TGFB1, TGFBR2, ZAP70, CD3E, CD247"
"PI3K-Akt signaling pathway",0.001,0.016,0.299,336,104,"CDK2, LAMC3, GNB5, CDC37, PIK3AP1, COL4A1, COL4A4, COL6A2, COL9A2, COMP, CSF3R, CSH2, CREB3L4, EFNA1, EFNA3, EFNA5, CRTC2, EPOR, AKT1, F2R, FGF2, FGF5, FGFR2, VEGFD, LAMB4, PHLPP2, FOXO3, FN1, MTOR, GHR, FGF22, GNB1, GNGT1, PPP2R3B, ANGPT1, HGF, HRAS, HSP90AA1, IFNA1, IFNA4, IFNA5, IFNA6, IFNA10, IFNAR1, IFNAR2, IL2RA, IL2RG, IL4R, ITGA6, ITGA3, ITGA7, ITGB4, JAK2, JAK3, KDR, LAMB1, LAMB2, MDM2, MTCP1, MYC, ATF4, NRAS, OSM, PCK1, ANGPT4, PIK3CB, PIK3CD, GNG2, DDIT4, PPP2CA, PPP2R1A, PPP2R1B, PPP2R2A, PPP2R2C, PPP2R5C, PPP2R5D, PRKAA1, PRKAA2, PRKCA, GNG12, MAP2K2, PRLR, PTK2, RAC1, RBL2, CCND1, BCL2, RPS6, RPS6KB1, RPS6KB2, MLST8, CREB3L2, BRCA1, THBS1, VEGFA, YWHAE, TCL1A, CASP9, ITGA10, FGF18, FGF16, LPAR2, OSMR, G6PC3"
"Adrenergic signaling in cardiomyocytes",0.001,0.019,0.372,143,50,"ADCY2, ADCY3, ADCY5, ADCY6, ADCY7, ADCY8, ADCY9, MAPK14, ADRA1D, ADRA1B, CREB3L4, ADRB1, AGTR2, AKT1, PLCB1, CACNG5, PPP2R3B, MYH7, ATF4, ATP1A2, ATP1A4, ATP2B1, PPP1CA, PPP1CB, PPP1R1A, PPP2CA, PPP2R1A, PPP2R1B, PPP2R2A, PPP2R2C, PPP2R5C, PPP2R5D, PRKCA, MAPK11, CACNG7, CACNG6, BCL2, SCN1B, CREB3L2, SLC8A1, ACTC1, TNNC1, TPM1, CACNB1, CACNB2, CALML3, CAMK2D, CAMK2G, RPS6KA5, CACNA2D4"
"Cytokine-cytokine receptor interaction",0.002,0.022,0.459,266,84,"CCL27, IL24, IL17F, IL22RA2, CCR1, CCR7, IL17RE, CSF3R, IFNLR1, EPOR, VEGFD, CLCF1, GHR, TNFRSF21, CCR10, IFNL2, CXCL1, HGF, IFNE, IFNA1, IFNA4, IFNA5, IFNA6, IFNA10, IFNAR1, IFNAR2, IFNG, IFNGR2, IL2RA, IL2RG, IL4R, IL5, IL5RA, IL6ST, CXCR1, IL9R, IL13RA1, KDR, CCL4L1, LTBR, MPL, TNFRSF11B, OSM, IL23A, PF4V1, IL17D, PPBP, PRLR, IFNK, IL22RA1, EDA2R, CCL1, CCL8, CCL14, CCL16, CCL19, CCL20, CCL25, CXCL6, CXCL5, CXCL12, CRLF2, BMP2, BMPR1A, TGFB1, TGFB3, TGFBR2, TNFSF4, VEGFA, IL1R2, GDF5, RELT, TNFSF11, TNFRSF25, TNFSF14, TNFSF13, TNFSF10, TNFSF9, TNFRSF6B, TNFRSF10B, IL18RAP, OSMR, CD40, CD70"
"Oocyte meiosis",0.002,0.023,0.527,114,41,"CDK2, ADCY2, ADCY3, ADCY5, ADCY6, ADCY7, ADCY8, ADCY9, CPEB3, CDC26, FBXO5, SPDYE1, ANAPC2, ITPR2, MAD2L1, PGR, PPP1CA, PPP1CB, PPP2CA, PPP2R1A, PPP2R1B, PPP2R5C, PPP2R5D, PPP3CB, PPP3R1, RPS6KA2, RPS6KA3, CPEB1, BUB1, YWHAE, CPEB4, CALML3, CAMK2D, CAMK2G, SMC1A, CDC23, BTRC, SMC3, ESPL1, CDC20, RBX1"
"VEGF signaling pathway",0.002,0.023,0.535,58,24,"MAPK14, AKT1, HRAS, HSPB1, KDR, NFATC2, NRAS, PIK3CB, PIK3CD, PLCG2, PPP3CB, PPP3R1, PRKCA, PRKCB, MAPK11, MAP2K2, PTK2, RAC1, RAC3, SRC, VEGFA, CASP9, PLA2G4C, SH2D2A"
"Apelin signaling pathway",0.002,0.023,0.562,135,47,"GNB5, ADCY2, ADCY3, ADCY5, ADCY6, ADCY7, GABARAP, ADCY8, ADCY9, APLNR, AKT1, RRAS2, PLCB1, GABARAPL1, MTOR, GNB1, GNGT1, HRAS, ITPR2, LIPE, SMAD2, MEF2A, NOS1, NRAS, NRF1, SERPINE1, PIK3C3, GNG2, PRKAA1, PRKAA2, PRKCE, ADCY10, GNG12, MAP2K2, CCND1, RPS6, RPS6KB1, RPS6KB2, RYR3, SLC8A1, SLC8A3, TFAM, CALML3, BECN1, APLN, MYLK3, CDH1"
"Signaling pathways regulating pluripotency of stem cells",0.003,0.027,0.665,136,47,"APC2, PCGF3, FZD10, MAPK14, DVL2, DVL3, AKT1, ESRRB, FGF2, FGFR2, ONECUT1, HRAS, ID1, ID3, IL6ST, JAK2, JAK3, SMAD2, MYC, NODAL, NRAS, PIK3CB, PIK3CD, WNT4, MAPK11, MAP2K2, SMARCAD1, REST, BMPR1A, SOX2, STAT3, WNT1, WNT3, WNT6, WNT7A, WNT8A, WNT2B, ZIC3, FZD3, KAT6A, WNT5B, AXIN2, FZD1, FZD6, FZD9, PCGF1, HESX1"
"Relaxin signaling pathway",0.003,0.029,0.782,130,45,"GNB5, ADCY2, ADCY3, ADCY5, ADCY6, ADCY7, ADCY8, ADCY9, COL4A1, COL4A4, MAPK14, CREB3L4, AKT1, VEGFD, PLCB1, FOS, GNB1, GNGT1, HRAS, RXFP4, ARRB1, SMAD2, MMP2, MMP13, ATF4, NFKBIA, NOS1, NRAS, PIK3CB, PIK3CD, GNG2, PRKCA, GNG12, MAPK11, MAPK9, MAPK10, MAP2K2, MAP2K7, RLN1, MAP2K4, CREB3L2, SRC, TGFB1, TGFBR2, VEGFA"
"Progesterone-mediated oocyte maturation",0.003,0.029,0.792,89,33,"CDK2, ADCY2, ADCY3, ADCY5, ADCY6, ADCY7, ADCY8, ADCY9, MAPK14, AKT1, CPEB3, CDC26, SPDYE1, ANAPC2, HSP90AA1, ARAF, MAD2L1, FZR1, PGR, PIK3CB, PIK3CD, MAPK11, MAPK9, MAPK10, RPS6KA2, RPS6KA3, CPEB1, STK10, BUB1, CPEB4, MAD1L1, CDC23, CDC25A"
"Jak-STAT signaling pathway",0.003,0.029,0.835,155,52,"IL24, CISH, IL22RA2, CSF3R, CSH2, IFNLR1, EPOR, AKT1, MTOR, GHR, IFNL2, HRAS, IFNE, IFNA1, IFNA4, IFNA5, IFNA6, IFNA10, IFNAR1, IFNAR2, IFNG, IFNGR2, IL2RA, IL2RG, IL4R, IL5, IL5RA, IL6ST, IL9R, IL13RA1, JAK2, JAK3, MPL, MYC, OSM, IL23A, PIK3CB, PIM1, PIK3CD, IL17D, PRLR, IFNK, IL22RA1, CCND1, BCL2, CRLF2, STAT3, STAT5A, STAT6, STAM, OSMR, SOCS6"
"Inflammatory mediator regulation of TRP channels",0.003,0.029,0.835,96,35,"ADCY2, ADCY3, ADCY5, ADCY6, ADCY7, ADCY8, ADCY9, MAPK14, TRPV3, F2RL1, PLCB1, HRH1, HTR2B, ITPR2, PIK3CB, PIK3CD, PLCG2, PPP1CA, PPP1CB, PRKCA, PRKCB, PRKCD, PRKCE, PRKCH, MAPK11, MAPK9, MAPK10, PTGER4, TRPV4, SRC, TRPV1, CALML3, CAMK2D, CAMK2G, PLA2G4C"
"Rap1 signaling pathway",0.003,0.029,0.855,209,67,"RASGRP2, RGS14, ADCY2, ADCY3, ADCY5, ADCY6, ADCY7, ADCY8, ADCY9, CNR1, ADORA2B, CRK, MAPK14, EFNA1, EFNA3, EFNA5, AKT1, F2R, FGF2, FGF5, FGFR2, VEGFD, PLCB1, FPR1, PRKD3, RASGRP3, PRKD2, MAGI3, FGF22, ANGPT1, RAPGEF1, GRIN1, GRIN2B, HGF, HRAS, ID1, ITGB2, PFN4, KDR, NRAS, P2RY1, ANGPT4, RAPGEF6, PIK3CB, PIK3CD, APBB1IP, PRKCA, PRKCB, MAPK11, MAP2K2, RAC1, RAC3, RAP1GAP, SRC, THBS1, TIAM1, VASP, VEGFA, CALML3, RASSF5, FGF18, FGF16, KRIT1, LPAR2, BCAR1, FARP2, CDH1"
"GnRH signaling pathway",0.005,0.038,1,91,33,"ADCY2, ADCY3, ADCY5, ADCY6, ADCY7, ADCY8, ADCY9, MAPK14, ELK1, PLCB1, GNRH1, GNRHR, HRAS, ITPR2, MAP3K4, MMP2, ATF4, NRAS, PLD2, PRKCA, PRKCB, PRKCD, MAPK11, MAPK9, MAPK10, MAP2K2, MAP2K7, MAP2K4, SRC, CALML3, CAMK2D, CAMK2G, PLA2G4C"
"Purine metabolism",0.005,0.039,1,169,55,"POLR3F, POLR3C, ADCY2, ADCY3, ADCY5, ADCY6, ADCY7, ADCY8, ADCY9, NT5C3B, ADSSL1, NUDT16, ADK, AK8, AK1, AK9, PRPS1L1, POLR1A, AK5, AMPD3, GUCY1A2, GUCY2C, GUCY2F, GUK1, ENTPD8, ATIC, PNP, NPR2, RRM2B, PDE11A, PDE1C, PDE2A, PDE3A, PDE4B, PDE6G, PDE8A, PKM, NUDT9, POLD2, POLE2, POLR2E, PPAT, PRIM1, POLR3B, POLR3E, ADCY10, ALLC, PRPS2, POLE4, POLR3D, PAPSS2, NT5C1B, ENTPD1, POLR1C, ENTPD6"
"Fc gamma R-mediated phagocytosis",0.005,0.039,1,88,32,"ARPC5, ARPC4, WASF2, WASF3, CRK, DNM2, AKT1, FCGR1A, FCGR2A, FCGR3A, GSN, HCK, INPPL1, LIMK1, MARCKS, PAK1, PIK3CB, PIK3CD, PLCG2, PLD2, PRKCA, PRKCB, PRKCD, PRKCE, RAC1, RPS6KB1, RPS6KB2, VASP, VAV1, PIP5K1A, PLPP2, WASF1"
"Cholinergic synapse",0.005,0.039,1,112,39,"GNB5, ADCY2, ADCY3, CHAT, ADCY5, ADCY6, ADCY7, CHRM4, CHRM5, ADCY8, CHRNB2, ADCY9, CREB3L4, AKT1, PLCB1, FOS, GNB1, GNGT1, HRAS, ITPR2, JAK2, KCNJ14, KCNQ3, ACHE, ATF4, NRAS, PIK3CB, PIK3CD, GNG2, PRKCA, PRKCB, GNG12, BCL2, CREB3L2, CACNA1A, CAMK2D, CAMK2G, CHRNA6, KCNQ4"
"cGMP-PKG signaling pathway",0.006,0.039,1,162,53,"PPIF, MRVI1, ADCY2, ADCY3, ADCY5, ADCY6, ADCY7, ADCY8, ADCY9, ADORA1, ADRA1D, ADRA1B, CREB3L4, ADRA2A, ADRA2C, ADRB1, AKT1, PLCB1, KCNMB3, KCNMB4, SLC25A5, SLC25A6, GUCY1A2, ITPR2, KCNJ8, MEF2A, MYH7, PPP1R12A, ATF4, ATP1A2, NFATC1, NFATC2, NFATC3, ATP1A4, NPPB, NPR2, ATP2B1, PDE2A, PDE3A, PPP1CA, PPP1CB, PPP3CB, PPP3R1, PRKCE, MAP2K2, CREB3L2, SLC8A1, SLC8A3, VASP, VDAC1, CALML3, IRS2, MYLK3"
"Th1 and Th2 cell differentiation",0.006,0.04,1,92,33,"DLL3, RBPJL, MAPK14, FOS, TBX21, HLA-DMB, HLA-DPA1, HLA-DQA1, IFNG, IFNGR2, IL2RA, IL2RG, IL4R, IL5, JAK2, JAK3, MAF, NFATC1, NFATC2, NFATC3, NFKBIA, PPP3CB, PPP3R1, MAML3, MAPK11, MAPK9, MAPK10, STAT5A, STAT6, ZAP70, RUNX3, CD3E, CD247"
"Circadian entrainment",0.006,0.043,1,96,34,"GNB5, ADCY2, ADCY3, ADCY5, ADCY6, ADCY7, ADCY8, ADCY9, PLCB1, FOS, GNB1, GNGT1, GRIA1, GRIA2, GRIA4, GRIN1, GRIN2B, GUCY1A2, KCNJ5, NOS1, PER1, GNG2, PRKCA, PRKCB, ADCY10, GNG12, RYR3, CALML3, CAMK2D, CAMK2G, PER3, CACNA1H, CACNA1G, RPS6KA5"
"Chemokine signaling pathway",0.007,0.047,1,182,58,"RASGRP2, GNB5, ADCY2, CCL27, ADCY3, ADCY5, ADCY6, ADCY7, ADCY8, ADCY9, CCR1, CCR7, CRK, AKT1, FGR, FOXO3, PLCB1, GNB1, GNGT1, CCR10, GRK5, CXCL1, HCK, HRAS, CXCR1, JAK2, JAK3, CCL4L1, ARRB1, NFKBIA, NRAS, PAK1, PF4V1, PIK3CB, PIK3CD, GNG2, PPBP, PRKCB, PRKCD, GNG12, PTK2, PREX1, RAC1, CCL1, CCL8, CCL14, CCL16, CCL19, CCL20, CCL25, CXCL6, CXCL5, CXCL12, SRC, STAT3, TIAM1, VAV1, BCAR1"
"B cell receptor signaling pathway",0.008,0.05,1,70,26,"PIK3AP1, CR2, AKT1, FOS, RASGRP3, HRAS, INPPL1, NFATC1, NFATC2, NFATC3, NFKBIA, NRAS, PIK3CB, PIK3CD, PLCG2, PPP3CB, PPP3R1, PRKCB, MAP2K2, RAC1, RAC3, VAV1, CD22, CD79A, CD79B, CD81"
"Prolactin signaling pathway",0.008,0.05,1,70,26,"CISH, MAPK14, AKT1, ESR1, ESR2, FOXO3, FOS, GCK, HRAS, JAK2, LHCGR, NRAS, PIK3CB, PIK3CD, MAPK11, MAPK9, MAPK10, MAP2K2, PRLR, CCND1, SRC, STAT3, STAT5A, TH, TNFSF11, SOCS6"
"HIF-1 signaling pathway",0.009,0.052,1,98,34,"EGLN3, ERBB2, AKT1, MTOR, ANGPT1, HIF1A, IFNG, IFNGR2, LDHA, LTBR, SERPINE1, ANGPT4, PDHB, PFKL, PIK3CB, PIK3CD, PLCG2, EGLN1, PRKCA, PRKCB, MAP2K2, BCL2, RPS6, RPS6KB1, RPS6KB2, STAT3, TCEB2, TIMP1, VEGFA, HKDC1, CAMK2D, CAMK2G, MKNK1, RBX1"
"NOD-like receptor signaling pathway",0.009,0.052,1,166,53,"TANK, NOD1, RBCK1, RIPK3, GABARAP, CARD16, GBP5, MAPK14, PYDC2, CYBA, NLRP6, GPRC6A, PLCB1, GABARAPL1, PYCARD, CXCL1, BIRC2, BIRC3, HSP90AA1, IFI16, IFNA1, IFNA4, IFNA5, IFNA6, IFNA10, IFNAR1, IFNAR2, IRF3, IRF7, ITPR2, GBP7, NFKBIA, OAS1, OAS2, TRPM7, PRKCD, MAPK11, MAPK9, MAPK10, MAVS, CARD18, BCL2, RNASEL, NOD2, TRPM2, VDAC1, CASP4, CASR, RIPK2, PSTPIP1, ATG12, AIM2, IKBKE"
"Regulation of actin cytoskeleton",0.009,0.052,1,210,65,"ARPC5, ARPC4, ABI2, WASF2, APC2, BAIAP2, MYL12A, NCKAP1, IQGAP2, CHRM4, CHRM5, CRK, F2, F2R, FGF2, FGF5, FGFR2, RRAS2, CYFIP1, FN1, ARHGEF12, FGF22, GSN, NCKAP1L, HRAS, ITGA6, ITGA3, ITGA7, ITGB2, ARAF, ITGB4, PFN4, LIMK1, MYH10, PPP1R12A, NRAS, PAK1, PAK3, ARHGEF4, PIK3CB, PIK3CD, PIP4K2A, PPP1CA, PPP1CB, BRK1, GNG12, MAP2K2, PAK5, PTK2, RAC1, RAC3, SRC, TIAM1, VAV1, PIP4K2C, PIP5K1A, ITGA10, FGF18, FGF16, WASF1, TMSB4Y, ARHGEF1, MYLK3, MYL10, BCAR1"
"Neuroactive ligand-receptor interaction",0.009,0.052,1,273,82,"CALCRL, NPFFR2, CHRM4, CHRM5, CHRNB2, CNR1, CNR2, ADORA1, ADORA2B, CSH2, ADRA1D, ADRA1B, ADRA2A, ADRA2C, ADRB1, GPR156, AGTR2, APLNR, S1PR3, F2, F2R, F2RL1, FPR1, FSHR, GABBR1, GABRG2, GALR1, GCGR, GHR, GHRHR, GHSR, P2RY10, GNRHR, GPR35, GRIA1, GRIA2, GRIA4, GRID2, GRIK1, GRIK2, GRIK4, GRIN1, GRIN2B, NR3C1, GRM3, GRM4, GRM7, GZMA, HCRTR1, HRH1, HTR1D, HTR1E, HTR2B, RXFP4, LHCGR, MAS1, NPY2R, OPRK1, P2RX3, P2RX5, P2RY1, PLG, AVPR2, NPY4R, PRLR, PTGDR, PTGER1, PTGER4, PTH1R, SCTR, NPFFR1, SSTR2, C3AR1, TSHR, TRPV1, TAAR8, S1PR4, CCKBR, CHRNA6, P2RX6, LPAR2, GABBR2"
"Longevity regulating pathway",0.01,0.052,1,88,31,"ADCY2, ADCY3, ADCY5, ADCY6, ADCY7, ADCY8, ADCY9, CREB3L4, AKT1, FOXO1, FOXO3, SIRT1, MTOR, APPL1, SESN1, HRAS, ATF4, NRAS, ADIPOR1, PIK3CB, PIK3CD, PPARG, PRKAA1, PRKAA2, ATG101, RPS6KB1, RPS6KB2, CREB3L2, CAT, IRS2, ADIPOQ"
"Alanine, aspartate and glutamate metabolism",0.01,0.052,1,35,15,"ADSSL1, CPS1, GAD1, GLS2, GLS, GLUL, GOT1, ASPA, ASS1, PPAT, NIT2, RIMKLB, CAD, DDO, GFPT2"
"Arginine biosynthesis",0.01,0.052,1,20,10,"CPS1, NAGS, GLS2, GLS, GLUL, GOT1, ARG1, ARG2, ASS1, NOS1"
"EGFR tyrosine kinase inhibitor resistance",0.01,0.054,1,78,28,"ERBB2, ERBB3, AKT1, FGF2, FGFR2, FOXO3, MTOR, HGF, NRG1, HRAS, ARAF, JAK2, KDR, NRAS, PIK3CB, PIK3CD, PLCG2, PRKCA, PRKCB, AXL, MAP2K2, BCL2, RPS6, RPS6KB1, RPS6KB2, SRC, STAT3, VEGFA"
"Phosphatidylinositol signaling system",0.011,0.055,1,99,34,"CDS1, IP6K3, DGKA, INPP5F, SACM1L, PLCB1, IPMK, INPP5B, INPPL1, ITPKB, ITPR2, IP6K2, PIK3C3, PIK3CB, PIK3CD, PI4KA, PIP4K2A, PLCD1, PLCG2, IMPAD1, PI4K2A, TMEM55A, PRKCA, PRKCB, PIP4K2C, CALML3, PIP5K1A, DGKD, CDS2, MTMR1, SYNJ2, MTMR3, TMEM55B, MTMR6"
"Gastric acid secretion",0.011,0.056,1,75,27,"ADCY2, ADCY3, ADCY5, ADCY6, ADCY7, ADCY8, ADCY9, SLC26A7, PLCB1, ITPR2, KCNJ1, KCNJ10, KCNK2, ATP1A2, ATP1A4, ATP4B, PRKCA, PRKCB, SLC4A2, SST, SSTR2, CA2, CALML3, CAMK2D, CAMK2G, CCKBR, MYLK3"
"Longevity regulating pathway - multiple species",0.013,0.061,1,62,23,"ADCY2, ADCY3, ADCY5, ADCY6, ADCY7, ADCY8, ADCY9, AKT1, FOXO1, FOXO3, SIRT1, MTOR, HRAS, HSPA1A, NRAS, PIK3CB, PIK3CD, PRKAA1, PRKAA2, RPS6KB1, RPS6KB2, CAT, IRS2"
"Melanogenesis",0.013,0.061,1,100,34,"ADCY2, ADCY3, ADCY5, ADCY6, FZD10, ADCY7, ADCY8, ADCY9, CREB3L4, DVL2, DVL3, PLCB1, HRAS, NRAS, WNT4, POMC, PRKCA, PRKCB, MAP2K2, CREB3L2, WNT1, WNT3, WNT6, WNT7A, WNT8A, WNT2B, FZD3, CALML3, WNT5B, CAMK2D, CAMK2G, FZD1, FZD6, FZD9"
"FoxO signaling pathway",0.014,0.065,1,129,42,"CDK2, CDKN2D, PLK2, GABARAP, AGAP2, MAPK14, GADD45A, AKT1, FOXO1, FOXO3, SIRT1, GABARAPL1, FBXO25, HRAS, ARAF, SMAD2, MDM2, GADD45B, NRAS, PCK1, PIK3CB, PIK3CD, PRKAA1, PRKAA2, MAPK11, MAPK9, MAPK10, MAP2K2, RAG2, RBL2, CCND1, STAT3, TGFB1, TGFB3, TGFBR2, CAT, IRS2, S1PR4, TNFSF10, ATG12, G6PC3, HOMER1"
"Oxytocin signaling pathway",0.014,0.065,1,151,48,"ADCY2, ADCY3, ADCY5, ADCY6, ADCY7, ADCY8, ADCY9, EEF2, ELK1, PLCB1, FOS, CACNG5, GUCY1A2, HRAS, ITPR2, KCNJ5, KCNJ14, PPP1R12A, NFATC1, NFATC2, NFATC3, NPR2, NRAS, PPP1CA, PPP1CB, PPP3CB, PPP3R1, PRKAA1, PRKAA2, PRKCA, PRKCB, MAP2K2, MAP2K5, CACNG7, CACNG6, CCND1, RYR3, SRC, TRPM2, CACNB1, CACNB2, CALML3, CAMK2D, CAMK2G, PLA2G4C, MYLK3, CACNA2D4, CD38"
"Hedgehog signaling pathway",0.014,0.065,1,46,18,"KIF3A, CSNK1A1L, CSNK1D, CSNK1G3, GPR161, GLI1, GLI2, GLI3, IHH, ARRB1, DHH, CDON, SMURF1, CCND1, BCL2, CUL3, BTRC, BOC"
"Calcium signaling pathway",0.015,0.067,1,181,56,"PPIF, ADCY2, ADCY3, ADCY7, CHRM5, ADCY8, ADCY9, ADORA2B, ADRA1D, ADRA1B, ADRB1, ERBB2, ERBB3, F2R, PLCB1, GNAL, GRIN1, SLC25A5, SLC25A6, HRH1, HTR2B, ITPKB, ITPR2, LHCGR, NOS1, ATP2B1, P2RX3, P2RX5, PDE1C, PHKA2, PHKG2, PLCD1, PLCG2, PPP3CB, PPP3R1, PRKCA, PRKCB, PTGER1, RYR3, SLC8A1, SLC8A3, STIM1, TNNC1, VDAC1, CACNA1A, CACNA1E, ORAI2, CALML3, CAMK2D, CAMK2G, CCKBR, CACNA1H, CACNA1G, P2RX6, MYLK3, CD38"
"Mitophagy - animal",0.015,0.067,1,63,23,"GABARAP, FUNDC1, CSNK2B, E2F1, RRAS2, FOXO3, GABARAPL1, BCL2L13, HIF1A, HRAS, RAB7B, ATF4, NRAS, FIS1, RHOT1, AMBRA1, MAPK9, MAPK10, SRC, TFEB, BECN1, SQSTM1, RHOT2"
"T cell receptor signaling pathway",0.017,0.073,1,102,34,"RASGRP1, MAPK14, AKT1, FOS, CBLC, HRAS, IFNG, IL5, NCK1, NFATC1, NFATC2, NFATC3, NFKBIA, NRAS, PAK1, PAK3, PDCD1, PIK3CB, PIK3CD, PPP3CB, PPP3R1, MAPK11, MAPK9, MAP2K2, MAP2K7, PAK5, VAV1, ZAP70, NCK2, CBL, CD3E, CD247, CD8A, CD8B"
"Long-term potentiation",0.017,0.073,1,67,24,"ADCY8, PLCB1, GRIA1, GRIA2, GRIN1, GRIN2B, HRAS, ARAF, ITPR2, ATF4, NRAS, PPP1CA, PPP1CB, PPP1R1A, PPP3CB, PPP3R1, PRKCA, PRKCB, MAP2K2, RPS6KA2, RPS6KA3, CALML3, CAMK2D, CAMK2G"
"Taste transduction",0.018,0.073,1,81,28,"HCN4, ADCY6, ADCY8, GABBR1, CALHM1, TAS2R39, TAS2R43, TAS2R31, TAS2R46, TAS2R20, GRM4, HTR1D, HTR1E, TAS2R42, P2RX3, P2RY1, TAS2R3, TAS2R16, TAS2R9, TAS2R8, TAS2R13, TAS2R14, PDE1C, TAS2R5, SCN9A, CACNA1A, KCNK5, GABBR2"
"GABAergic synapse",0.018,0.073,1,88,30,"GPHN, GNB5, ADCY2, ADCY3, ADCY5, ADCY6, ADCY7, GABARAP, ADCY8, ADCY9, GABARAPL1, GABBR1, GABRG2, GAD1, GLS2, GLS, GLUL, GNB1, GNGT1, GNG2, SLC38A2, PRKCA, PRKCB, GNG12, SLC12A5, SLC6A11, TRAK2, SRC, CACNA1A, GABBR2"
"Autophagy - animal",0.021,0.085,1,125,40,"GABARAP, CTSL, AKT1, ERN1, RRAS2, ATG4B, GABARAPL1, MTOR, HIF1A, HRAS, RAB7B, LAMP2, NRAS, PIK3C3, PIK3CB, PIK3CD, DDIT4, PPP2CA, SUPT20H, PRKAA1, AMBRA1, PRKAA2, PRKCD, MAPK9, MAPK10, MAP2K2, RRAGD, BCL2, ATG101, RPS6KB1, RPS6KB2, RRAGC, MLST8, DEPTOR, ATG4D, IRS2, BECN1, MTMR3, ATG12, SNAP29"
"Neurotrophin signaling pathway",0.025,0.098,1,119,38,"SH2B2, PRDM4, CRK, MAPK14, AKT1, FOXO3, ABL1, SH2B1, RAPGEF1, HRAS, ATF4, NFKBIA, NRAS, NTF4, NTRK2, NTRK3, PIK3CB, PIK3CD, PLCG2, PRKCD, MAPK11, MAPK9, MAPK10, MAP2K2, MAP2K5, MAP2K7, PSEN1, RAC1, BCL2, RPS6KA2, RPS6KA3, TP73, YWHAE, CALML3, CAMK2D, CAMK2G, RIPK2, RPS6KA5"
"Vascular smooth muscle contraction",0.025,0.098,1,119,38,"CALCRL, MRVI1, ADCY2, ADCY3, ADCY5, ADCY6, ADCY7, ADCY8, ADCY9, ADORA2B, ADRA1D, ADRA1B, CYP4A11, PLCB1, ARHGEF12, KCNMB3, KCNMB4, CYP4A22, GUCY1A2, ARAF, ITPR2, PPP1R12A, NPR2, PLA2G3, PPP1CA, PPP1CB, PRKCA, PRKCB, PRKCD, PRKCE, PRKCH, MAP2K2, ACTG2, CALML3, PLA2G4C, ARHGEF1, MYLK3, ARHGEF11"
"AMPK signaling pathway",0.029,0.11,1,120,38,"RAB10, CPT1A, CREB3L4, EEF2, CRTC2, AKT1, FOXO1, FOXO3, TBC1D1, SIRT1, MTOR, PPP2R3B, LIPE, PCK1, ADIPOR1, PFKFB1, PFKFB2, PFKL, PIK3CB, PIK3CD, PPARG, PPP2CA, PPP2R1A, PPP2R1B, PPP2R2A, PPP2R2C, PPP2R5C, PPP2R5D, PRKAA1, PRKAA2, CCND1, RPS6KB1, RPS6KB2, CREB3L2, IRS2, RAB11B, G6PC3, ADIPOQ"
"Glucagon signaling pathway",0.029,0.11,1,102,33,"ADCY2, CPT1A, CREB3L4, CRTC2, AKT1, FOXO1, PLCB1, SIRT1, GCG, GCGR, GCK, ITPR2, LDHA, ATF4, PCK1, PDHB, PFKFB1, PFKL, PGAM1, PHKA2, PHKG2, PKM, PPP3CB, PPP3R1, PRKAA1, PRKAA2, PYGB, PYGL, CREB3L2, CALML3, CAMK2D, CAMK2G, G6PC3"
"Cytosolic DNA-sensing pathway",0.03,0.11,1,63,22,"POLR3F, POLR3C, RIPK3, PYCARD, IFNA1, IFNA4, IFNA5, IFNA6, IFNA10, IRF3, IRF7, CCL4L1, NFKBIA, POLR2E, POLR3B, POLR3E, MAVS, POLR3D, ZBP1, AIM2, POLR1C, IKBKE"
"Insulin signaling pathway",0.033,0.121,1,136,42,"SH2B2, CRK, ELK1, AKT1, FOXO1, CBLC, MTOR, GCK, RAPGEF1, HRAS, INPPL1, ARAF, LIPE, NRAS, PCK1, PHKA2, PHKG2, PIK3CB, PIK3CD, PPP1CA, PPP1CB, PPP1R3A, PRKAA1, PRKAA2, PRKAR1B, MAPK9, MAPK10, MAP2K2, PTPN1, PYGB, PYGL, RPS6, RPS6KB1, RPS6KB2, PPP1R3B, HKDC1, CALML3, MKNK1, IRS2, CBL, G6PC3, TRIP10"
"Focal adhesion",0.034,0.121,1,196,58,"LAMC3, MYL12A, COL4A1, COL4A4, COL6A2, COL9A2, COMP, CRK, ELK1, ERBB2, AKT1, VEGFD, LAMB4, FLNA, FLNB, FLNC, FN1, RAPGEF1, PARVB, HGF, HRAS, BIRC2, BIRC3, ILK, ITGA6, ITGA3, ITGA7, ITGB4, KDR, LAMB1, LAMB2, PPP1R12A, PAK1, PAK3, PIK3CB, PIK3CD, PPP1CA, PPP1CB, PARVA, PRKCA, PRKCB, MAPK9, MAPK10, PAK5, PTK2, RAC1, RAC3, CCND1, BCL2, SRC, THBS1, VASP, VAV1, VEGFA, ITGA10, MYLK3, MYL10, BCAR1"
"Sphingolipid signaling pathway",0.035,0.126,1,118,37,"ADORA1, MAPK14, SGMS2, S1PR3, AKT1, FCER1A, MS4A2, PLCB1, CERS6, PPP2R3B, HRAS, ABCC1, NRAS, PIK3CB, PIK3CD, PLD2, PPP2CA, PPP2R1A, PPP2R1B, PPP2R2A, PPP2R2C, PPP2R5C, PPP2R5D, SPTLC3, PRKCA, PRKCB, PRKCE, MAPK11, MAPK9, MAPK10, MAP2K2, RAC1, RAC3, BCL2, CERS4, SGPP1, S1PR4"
