"","Pathway","pVal","pValFDR","pValBonferroni","Genes","HitGenes","HighScoreGenes","HighScoreGenesNames","MedScoreGenesNames","EnrichScore"
"1","Endocytosis",0,0,0,238,102,81,"Ldlrap1, Arap3, Vps37c, Arrb1, Ap2a2, Arf1, Arf3, Arf5, Capza1, Capza2, Cdc42, Cxcr4, Ccr5, Epn1, Epn2, Acap3, Grk4, H2-D1, H2-K1, H2-L, H2-M3, H2-Q4, H2-T10, H2-T23, H2-T24, Il2ra, Il2rg, Kif5a, Kif5b, Kif5c, Smad3, Mdm2, Rab8a, Pip5k1c, Prkci, Pld1, Pml, Rab10, Rab22a, Rab5b, Rab5c, Hspa1a, Src, Cblb, Arfgef1, Asap2, Agap3, Rab11fip3, Psd4, Arrb2, Tgfbr1, Snx32, Asap3, Iqsec1, Iqsec2, Ehd2, Grk6, Rab5a, Fam21, Bin1, A230046K03Rik, Agap1, Sh3glb1, Sh3kbp1, Vta1, Smurf2, 2610002M06Rik, Chmp1b, Arpc5, Snx2, Chmp2a, Vps26b, Ap2b1, Ist1, Mvb12b, Rab11fip2, Chmp4b, Rab11fip1, Chmp5, Rbsn, Ehd4","Ap2a1, Rhoa, Grk5, Pip5k1b, Pld2, Cyth1, Sh3glb2, Zfyve9, Git2, Snf8, Zfyve27, Vps37b, Pard6a, Pard6b, Ccdc53, Rnf41, Stambp, Snx6, Wasl, Arpc2, Arfgef2",0.611
"2","RIG-I-like receptor signaling pathway",0,0,0,52,33,24,"Isg15, Casp8, Cxcl10, Nfkb1, Nfkbia, Nfkbib, Tank, Trim25, Tnf, Traf2, Ddx58, Map3k1, Mapk14, Mapk9, Nlrx1, Azi2, Irf7, Otud5, Tbk1, Sike1, Ifih1, Tbkbp1, Cyld, Dhx58","Atg5, Fadd, Rela, Traf3, Mavs, Map3k7, Mapk8, Irf3, Ikbke",0.681
"3","Osteoclast differentiation",0,0,0,119,56,42,"Akt2, Socs3, Socs1, Csf1, Fcgr1, Fyn, Lilrb4a, Ifnar1, Ifnar2, Ifngr1, Irf9, Junb, Lck, Lcp2, Mitf, Nfatc2, Nfkb1, Nfkbia, Pik3ca, Pik3cd, Pik3r2, Pirb, Ppp3cb, Sirpa, Stat1, Stat2, Tgfbr1, Tnf, Tnfrsf11a, Tnfrsf1a, Traf2, Akt3, Fcgr4, Map2k1, Map2k7, Mapk14, Mapk9, Map3k14, Tyk2, Tab1, Tab2, Cyld","Akt1, Btk, Itgb3, Jak1, Jun, Jund, Nfkb2, Pik3r1, Ppp3ca, Ppp3r1, Rela, Map3k7, Mapk8, Sirpb1b",0.61
"4","MAPK signaling pathway",0,0,0,211,99,74,"Arrb1, Raf1, Akt2, Cacna1a, Cacnb1, Cacnb2, Casp3, Cdc25b, Cdc42, Crk, Crkl, Daxx, Gadd45a, Dusp2, Fas, Gna12, Gng12, Kras, Mapkapk2, Max, Mef2c, Mknk2, Mras, Gadd45b, Nfkb1, Nlk, Nras, Prkaca, Pla2g4a, Ppm1b, Ppp3cb, Dusp1, Hspa1a, Rps6ka1, Sos1, Rap1b, Arrb2, Tgfbr1, Tnf, Tnfrsf1a, Traf2, Map4k3, Akt3, Gadd45g, Mapk7, Rasgrp3, Dusp5, Map2k1, Map2k4, Map2k7, Map3k1, Map3k12, Map3k2, Map3k3, Map3k4, Map3k8, Map4k2, Mapk14, Mapk9, Flnb, Cacna2d4, Ptpn7, Taok3, Map3k6, Map3k14, Dusp10, Zak, Tab1, Tab2, Dusp16, Dusp3, Rps6ka5, Dusp9, Rapgef2","Akt1, Egf, Elk1, Jun, Jund, Rac3, Nfatc3, Nfkb2, Ppp3ca, Ppp3r1, Ppp5c, Mapk8ip1, Rasgrp2, Rela, Rras, Sos2, Rasa1, Map3k11, Map3k7, Mapk8, Ecsit, Mapk8ip3, Stk3, Dusp6, Flnc",0.608
"5","Chemokine signaling pathway",0,0,0,155,70,54,"Arrb1, Raf1, Adcy7, Adcy9, Akt2, Cdc42, Cxcr3, Cxcr4, Ccr5, Crk, Crkl, Elmo1, Ptk2, Gnb4, Gnb5, Gng12, Grk4, Hck, Cxcl10, Jak2, Kras, Lyn, Cxcl9, Nfkb1, Nfkbia, Nfkbib, Nras, Pik3ca, Pik3cd, Pik3r2, Prkaca, Plcb3, Ptk2b, Rock1, Rock2, Ccl12, Ccl3, Ccl4, Ccl5, Ccl9, Shc1, Sos1, Src, Stat1, Stat2, Stat3, Rap1b, Arrb2, Tiam1, Vav2, Akt3, Grk6, Map2k1, Foxo3","Akt1, Rhoa, Ccr1, Ccr1l1, Ccr7, Gnb1, Grk5, Pik3r1, Rasgrp2, Rela, Ccl7, Ccl8, Sos2, Stat5b, Wasl, Cxcr6",0.612
"6","Autophagy - animal",0,0,0,122,72,52,"Atg14, Raf1, Akt2, Bcl2, Bnip3, Cflar, Dapk3, Eif2ak3, Itpr1, Kras, Lamp2, Mras, Nras, Igbp1, Pdpk1, Pik3ca, Pik3cd, Pik3r2, Prkaca, Pten, Camkk2, Atg9b, Ulk1, Vamp8, Pik3c3, Ambra1, Atg4d, Akt3, Atg4c, Map2k1, Mapk9, Eif2ak4, Ulk2, Atg2a, Atg13, Rragd, Rragc, Sh3glb1, Mlst8, Supt20, Tsc1, Akt1s1, Trp53inp2, Dapk1, Atg7, Wipi2, Atg2b, Atg16l1, Uvrag, Ern1, Mtmr14, Deptor","Akt1, Atg5, Rb1cc1, Hif1a, Mtmr4, Pik3r1, Ppp2ca, Rras, Stk11, Zfyve1, Map3k7, Mapk8, Wipi1, Becn1, Gabarapl1, Snap29, Stx17, Atg3, Atg101, Atg16l2",0.656
"7","Cellular senescence",0,0,0,159,76,62,"Traf3ip2, Fbxw11, Raf1, Akt2, Atm, Zfp36l1, Zfp36l2, Ccnd2, Ccne2, Cdk2, Cdkn1a, Cdkn2b, Gadd45a, E2f1, Foxm1, H2-D1, H2-K1, H2-L, H2-M3, H2-Q4, H2-T10, H2-T23, H2-T24, Hus1, Itpr1, Itpr2, Kras, Smad3, Mapkapk2, Mdm2, Mras, Gadd45b, Nfatc2, Nfkb1, Nras, Pik3ca, Pik3cd, Pik3r2, Serpine1, Ppp1cc, Ppp3cb, Pten, Rad1, Rad50, Rb1, Rbl1, Rbl2, Mcu, Lin52, Tgfbr1, Vdac3, Akt3, Ets1, Gadd45g, E2f2, Map2k1, Mapk14, Chek2, Foxo1, Foxo3, Tsc1, Sirt1","Akt1, Capn2, Ccna2, Cdc25a, E2f5, Il6, Nfatc3, Pik3r1, Ppp3ca, Ppp3r1, Rad9a, Rela, Rras, Ppid",0.647
"8","AMPK signaling pathway",0,0,0,108,53,39,"Prkag2, Akt2, Cab39, Cpt1a, Eef2k, Fasn, Gys1, Insr, Lipe, Pfkfb3, Rab8a, Pdpk1, Pfkfb2, Pik3ca, Pik3cd, Pik3r2, Prkag1, Rab10, Scd2, Camkk2, Creb3l2, Ppp2r5d, Ulk1, Ppp2r5a, Creb5, Akt3, Pfkfb4, Ppp2r1a, Pfkp, Foxo1, Foxo3, Tbc1d1, Tsc1, Akt1s1, Adipor2, Cab39l, Ppp2r2a, Adipor1, Sirt1","Prkab2, Akt1, Ccna2, Creb3, Pfkl, Pfkm, Pik3r1, Ppp2ca, Prkab1, Stk11, Stradb, Map3k7, Mlycd, Pck2",0.613
"9","Mitophagy - animal",0,0,0,61,38,26,"Bnip3, Bnip3l, Csnk2b, E2f1, Eif2ak3, Usp15, Kras, Mitf, Mras, Cited2, Nbr1, Nras, Sp1, Src, Atg9b, Tfeb, Rhot2, Ulk1, Ambra1, Tbc1d17, Mapk9, Tax1bp1, Tbk1, Foxo3, Rhot1, Optn","Usp30, Atg5, Csnk2a1, Hif1a, Jun, Rela, Rras, Mapk8, Becn1, Gabarapl1, Fis1, Pink1",0.654
"10","Phosphatidylinositol signaling system",0,0,0,90,48,38,"Inpp5f, Synj1, Dgkz, Pip4k2b, Pip4k2c, Dgka, Inpp1, Inpp5b, Inpp5d, Itpr1, Itpr2, Mtm1, Pik3c2a, Pik3ca, Pik3cd, Pik3r2, Pikfyve, Pip5k1c, Plcb3, Plcg1, Inpp5k, Pten, Synj2, Inpp5a, Tmem55b, Mtmr6, Pik3c3, Ppip5k2, Itpkb, Ppip5k1, Dgkh, Inpp5e, Pi4k2b, Tmem55a, Cds1, Ippk, Pi4k2a, Mtmr14","Mtmr4, Pik3r1, Pip5k1b, Itpk1, Dgkd, Ip6k1, Ipmk, Plcd3, Ip6k2, Sacm1l",0.662
"11","NOD-like receptor signaling pathway",0,0,0,148,80,64,"Nod1, Birc3, Birc2, Xiap, Bcl2, Casp1, Casp4, Casp8, Gbp2, Ifi204, Ifnar1, Ifnar2, Il18, Irf9, Itpr1, Itpr2, Myd88, Naip5, Naip6, Nfkb1, Nfkbia, Nfkbib, P2rx7, Plcb3, Ripk2, Ccl12, Ccl5, Stat1, Stat2, Tank, Mcu, Dhx33, Tnf, Tnfaip3, Traf2, Txn1, Vdac3, Gbp5, Gbp7, Oas1b, Oas3, Oas1a, Nod2, Mapk14, Mapk9, Irak4, Rnf31, Nlrc4, Nlrx1, Trp53bp1, Card9, Aim2, Irf7, Tyk2, Gbp3, Panx1, Tbk1, Nampt, Nek7, Tab1, Tab2, Gsdmd, Dnm1l, Atg16l1","Atg5, Rhoa, Cybb, Fadd, Il6, Jak1, Jun, Rela, Traf3, Mavs, Map3k7, Mapk8, Irf3, Ikbke, Gabarapl1, Pycard",0.67
"12","Prolactin signaling pathway",0,0,0,56,35,28,"Raf1, Akt2, Ccnd2, Socs3, Socs1, Galt, Irf1, Jak2, Kras, Nfkb1, Nras, Pik3ca, Pik3cd, Pik3r2, Socs7, Shc1, Sos1, Src, Stat1, Stat3, Stat5a, Tnfrsf11a, Akt3, Map2k1, Mapk14, Mapk9, Socs5, Foxo3","Akt1, Pik3r1, Rela, Sos2, Stat5b, Mapk8, Socs6",0.712
"13","Necroptosis",0,0,0,131,62,49,"Camk2d, Birc3, Birc2, Xiap, Bcl2, Bid, Camk2g, Casp1, Casp8, Cflar, Fas, Tlr3, Glul, H2afx, Ifnar1, Ifnar2, Ifngr1, Irf9, Jak2, Pla2g4a, Eif2ak2, Stat1, Stat2, Stat3, Stat5a, Stat6, Tnf, Tnfaip3, Tnfrsf1a, Traf2, Tnfsf10, Vdac3, Ticam2, Parp3, Mapk9, Rnf31, H2afy, Hist3h2a, Parp4, Tyk2, Zbp1, 2610002M06Rik, Chmp1b, Chmp2a, Dnm1l, Cyld, Mlkl, Chmp4b, Chmp5","Pygl, Parp1, Capn2, Cybb, Fadd, Jak1, Stat5b, Tnfrsf10b, Mapk8, H2afz, Pycard, Ppid, Il33",0.632
"14","FoxO signaling pathway",0,0,0,120,66,52,"Prkag2, Raf1, Akt2, Atm, Bcl6, Bnip3, Ccnd2, Cdk2, Cdkn1a, Cdkn1b, Cdkn2b, Cdkn2d, Gadd45a, S1pr1, Il10, Insr, Kras, Sgk3, Smad3, Smad4, Mdm2, Gadd45b, Nlk, Nras, Pdpk1, Pik3ca, Pik3cd, Pik3r2, Plk1, Prkag1, Pten, Rbl2, Sod2, Sos1, Stat3, Tgfbr1, Tnfsf10, Akt3, Gadd45g, Usp7, Map2k1, Mapk14, Mapk9, Homer1, Homer3, Skp2, Foxo4, Foxo1, Foxo3, Fbxo32, Setd7, Sirt1","Prkab2, Akt1, Ccng2, Plk3, Egf, Il6, Il7r, Pik3r1, Prkab1, Sos2, Stk11, Mapk8, Gabarapl1, Pck2",0.669
"15","Toll-like receptor signaling pathway",0,0,0,85,50,39,"Akt2, Casp8, Cd86, Tlr3, Cxcl10, Ifnar1, Ifnar2, Tlr7, Tlr8, Cxcl9, Myd88, Nfkb1, Nfkbia, Pik3ca, Pik3cd, Pik3r2, Ccl3, Ccl4, Ccl5, Stat1, Tlr1, Tlr6, Tnf, Cd40, Ticam2, Akt3, Map2k1, Map2k4, Map2k7, Map3k8, Mapk14, Mapk9, Irak4, Irf5, Irf7, Tbk1, Tab1, Tab2, Tlr9","Akt1, Fadd, Il6, Jun, Pik3r1, Rela, Traf3, Map3k7, Mapk8, Irf3, Ikbke",0.684
"16","Neurotrophin signaling pathway",0,0,0,107,55,43,"Camk2d, Irak2, Raf1, Abl1, Akt2, Bcl2, Camk2g, Cdc42, Crk, Crkl, Kras, Sh2b3, Zfp369, Mapkapk2, Nfkb1, Nfkbia, Nfkbib, Nras, Pdpk1, Pik3ca, Pik3cd, Pik3r2, Plcg1, Psen1, Ripk2, Rps6ka1, Shc1, Sort1, Sos1, Rap1b, Ywhae, Akt3, Mapk7, Map2k1, Map2k7, Map3k1, Map3k3, Mapk14, Mapk9, Irak4, Foxo3, Zfp110, Rps6ka5","Akt1, Rhoa, Gab1, Jun, Pik3r1, Arhgdia, Rela, Sh2b1, Sos2, Mapk8, Frs2, Prdm4",0.648
"17","T cell receptor signaling pathway",0,0,0,94,46,33,"Raf1, Akt2, Cdc42, Fyn, Il10, Kras, Lck, Lcp2, Nck2, Nfatc2, Nfkb1, Nfkbia, Nfkbib, Nras, Pdpk1, Pik3ca, Pik3cd, Pik3r2, Plcg1, Ppp3cb, Ptprc, Sos1, Cblb, Tnf, Vav2, Akt3, Malt1, Map2k1, Map2k7, Map3k8, Mapk14, Mapk9, Map3k14","Akt1, Rhoa, Dlg1, Jun, Nfatc3, Pdcd1, Pik3r1, Ppp3ca, Ppp3r1, Rela, Sos2, Map3k7, Pak4",0.603
"18","Apoptosis",0,0,0,125,69,52,"Raf1, Actb, Actg1, Akt2, Apaf1, Birc3, Birc2, Xiap, Atm, Bak1, Bcl2, Bcl2a1d, Bid, Casp2, Casp3, Casp7, Casp8, Casp9, Cflar, Ctsc, Cycs, Daxx, Gadd45a, Eif2ak3, Fas, Itpr1, Itpr2, Kras, Mcl1, Gadd45b, Nfkb1, Nfkbia, Nras, Pdpk1, Pik3ca, Pik3cd, Pik3r2, Tnf, Tnfrsf1a, Traf2, Tnfsf10, Parp3, Akt3, Gadd45g, Map2k1, Mapk9, Parp4, Map3k14, Pmaip1, Ctsz, Dab2ip, Ern1","Parp1, Akt1, Bcl2a1b, Capn2, Ctsh, Ctss, Dffa, Endog, Fadd, Il3ra, Jun, Lmnb2, Pik3r1, Rela, Spta1, Tnfrsf10b, Mapk8",0.653
"19","TNF signaling pathway",0,0,0,106,59,48,"Akt2, Birc3, Birc2, Bcl3, Casp3, Casp7, Casp8, Cflar, Socs3, Csf1, Edn1, Fas, Cxcl10, Ifi47, Il15, Junb, Nfkb1, Nfkbia, Pik3ca, Pik3cd, Pik3r2, Ptgs2, Ccl12, Ccl5, Creb3l2, Tnf, Tnfaip3, Tnfrsf1a, Tnfrsf1b, Traf2, Creb5, Akt3, Nod2, Map2k1, Map2k4, Map2k7, Map3k8, Mapk14, Mapk9, Gm5431, Map3k14, Tab1, Bag4, Tab2, Dab2ip, Rps6ka5, Dnm1l, Mlkl","Akt1, Creb3, Fadd, Il6, Jun, Mmp14, Pik3r1, Rela, Traf3, Map3k7, Mapk8",0.685
"20","Cytosolic DNA-sensing pathway",0,0,0,48,31,22,"Casp1, Cxcl10, Il18, Nfkb1, Nfkbia, Nfkbib, Ccl4, Ccl5, Mb21d1, Trex1, Ddx58, Polr3e, Aim2, Irf7, Adar, Tbk1, Zbp1, Polr2e, Polr3d, Polr3g, Polr3c, Polr3h","Il6, Rela, Mavs, Polr2h, Irf3, Ikbke, Pycard, Polr3k, Il33",0.678
"21","Inositol phosphate metabolism",0,0,0.001,66,35,28,"Inpp5f, Synj1, Pip4k2b, Pip4k2c, Inpp1, Inpp5b, Inpp5d, Minpp1, Mtm1, Pik3c2a, Pik3ca, Pik3cd, Pikfyve, Pip5k1c, Plcb3, Plcg1, Inpp5k, Pten, Synj2, Inpp5a, Mtmr6, Pik3c3, Itpkb, Inpp5e, Pi4k2b, Ippk, Pi4k2a, Mtmr14","Mtmr4, Pip5k1b, Itpk1, Ipmk, Isyna1, Plcd3, Sacm1l",0.665
"22","Longevity regulating pathway",0,0,0.001,81,41,31,"Prkag2, Adcy7, Adcy9, Akt2, Sesn1, Insr, Kras, Nfkb1, Nras, Pik3ca, Pik3cd, Pik3r2, Prkaca, Prkag1, Sod2, Camkk2, Creb3l2, Ulk1, Sesn2, Creb5, Akt3, Atg13, Foxo1, Foxo3, Tsc1, Akt1s1, Adipor2, Adipor1, Sesn3, Ehmt1, Sirt1","Prkab2, Akt1, Atg5, Rb1cc1, Creb3, Pik3r1, Prkab1, Rela, Stk11, Atg101",0.631
"23","Thyroid hormone signaling pathway",0,0,0.001,100,47,40,"Raf1, Actb, Actg1, Akt2, Atp1b3, Casp9, Kras, Mdm2, Ncoa1, Ncoa2, Notch1, Notch2, Nras, Kat2b, Pdpk1, Pfkfb2, Pik3ca, Pik3cd, Pik3r2, Prkaca, Plcb3, Plcg1, Med1, Rxra, Rxrb, Sin3a, Slc9a1, Src, Stat1, Tbc1d4, Thra, Akt3, Map2k1, Med13, Med12l, Hdac1, Rcan1, Pfkp, Foxo1, Med13l","Akt1, Hif1a, Itgb3, Ncoa3, Pik3r1, Med27, Plcd3",0.661
"24","Cell cycle",0,0,0.002,120,54,48,"Cdc20, Abl1, Atm, Bub1b, Ccnd2, Ccne2, Cdc25b, Cdc7, Cdk2, Cdk7, Cdkn1a, Cdkn1b, Cdkn2b, Cdkn2c, Cdkn2d, Smc3, Gadd45a, E2f1, Smad3, Smad4, Mcm6, Mdm2, Gadd45b, Orc2, Plk1, Prkdc, Rb1, Rbl1, Rbl2, Stag2, Tfdp2, Cdc14b, Ywhae, Ywhaz, Cdc6, Gadd45g, E2f2, Orc5, Dbf4, Skp2, Pttg1, Hdac1, Chek2, Cdc23, Anapc5, Ccnh, Anapc10, Mad2l2","Ccna2, Cdc25a, E2f5, Orc1, Ywhag, Orc4",0.669
"25","Sphingolipid signaling pathway",0,0,0.002,107,49,39,"Raf1, Akt2, Bcl2, Bid, S1pr1, Fyn, Gna12, Gna13, S1pr2, Kras, Nfkb1, Nras, Nsmaf, Pdpk1, Pik3ca, Pik3cd, Pik3r2, Plcb3, Pld1, Pten, Rock1, Rock2, Smpd2, Sptlc2, Ppp2r5d, Tnf, Tnfrsf1a, Traf2, Ppp2r5a, Akt3, Cers6, Map2k1, Mapk14, Mapk9, Ppp2r1a, Asah2, Cers4, Cers5, Ppp2r2a","Akt1, Rhoa, Fcer1g, Rac3, Pik3r1, Pld2, Ppp2ca, Rela, Acer2, Mapk8",0.627
"26","Autophagy - other",0,0,0.002,31,20,13,"Igbp1, Atg9b, Pik3c3, Atg4d, Atg4c, Ulk2, Atg2a, Atg13, Mlst8, Atg7, Wipi2, Atg2b, Atg16l1","Atg5, Ppp2ca, Wipi1, Becn1, Gabarapl1, Atg3, Atg101",0.648
"27","B cell receptor signaling pathway",0,0,0.003,69,35,23,"Raf1, Akt2, Inpp5d, Kras, Lyn, Nfatc2, Nfkb1, Nfkbia, Nfkbib, Nras, Pik3ca, Pik3cd, Pik3r2, Pirb, Ppp3cb, Sos1, Vav2, Akt3, Rasgrp3, Malt1, Map2k1, Ifitm1, Pik3ap1","Akt1, Btk, Cr2, Cd79b, Jun, Rac3, Nfatc3, Pik3r1, Ppp3ca, Ppp3r1, Rela, Sos2",0.582
"28","Adipocytokine signaling pathway",0,0,0.004,59,31,24,"Prkag2, Npy, Akt2, Socs3, Cpt1a, Acsl1, Jak2, Nfkb1, Nfkbia, Nfkbib, Prkag1, Rxra, Rxrb, Camkk2, Stat3, Tnf, Tnfrsf1a, Tnfrsf1b, Traf2, Akt3, Mapk9, Adipor2, Adipor1, Acsl3","Prkab2, Akt1, Prkab1, Rela, Stk11, Mapk8, Pck2",0.65
"29","Ras signaling pathway",0,0,0.005,178,72,51,"Raf1, Abl1, Angpt1, Angpt2, Akt2, Cdc42, Csf1, Flt1, Gnb4, Gnb5, Gng12, Insr, Kdr, Kras, Ksr1, Mras, Nfkb1, Nras, Pik3ca, Pik3cd, Pik3r2, Prkaca, Pla2g4a, Plcg1, Pld1, Rab5b, Rab5c, Rel, Rgl1, Rgl2, Ralbp1, Shc1, Sos1, Rap1b, Tiam1, Pla2g16, Akt3, Ets1, Ets2, Rasgrp3, Map2k1, Mapk9, Rab5a, Ksr2, Pla2g6, Rasa4, Foxo4, Shoc2, Tbk1, Exoc2, Brap","Akt1, Rhoa, Egf, Elk1, Flt4, Gab1, Gnb1, Htr7, Rac3, Met, Kitl, Pik3r1, Pld2, Rasgrp2, Rela, Rras, Sos2, Rasa1, Mapk8, Rasal3, Pak4",0.556
"30","Platinum drug resistance",0,0,0.005,73,36,32,"Akt2, Apaf1, Birc3, Birc2, Xiap, Atm, Atp7a, Bak1, Bcl2, Bid, Brca1, Casp3, Casp8, Casp9, Cdkn1a, Cycs, Fas, Mdm2, Mlh1, Msh2, Msh3, Msh6, Pdpk1, Pik3ca, Pik3cd, Pik3r2, Rev3l, Mgst2, Top2b, Akt3, Pmaip1, Polh","Akt1, Fadd, Pik3r1, Slc31a1",0.691
"31","Jak-STAT signaling pathway",0,0,0.007,122,53,41,"Raf1, Akt2, Bcl2, Ccnd2, Cdkn1a, Socs3, Socs1, Csf3r, Ifnar1, Ifnar2, Ifngr1, Il10, Il10ra, Il10rb, Il13ra1, Il15, Il15ra, Il2ra, Il2rg, Il4ra, Irf9, Jak2, Mcl1, Osm, Pik3ca, Pik3cd, Pik3r2, Pim1, Socs7, Ptpn2, Sos1, Stat1, Stat2, Stat3, Stat5a, Stat6, Pias3, Akt3, Tyk2, Socs5, Pias1","Akt1, Il12rb1, Il3ra, Il6, Il6st, Il7, Il7r, Jak1, Pik3r1, Sos2, Stat5b, Socs6",0.604
"32","Apoptosis - multiple species",0,0,0.007,28,18,15,"Apaf1, Birc3, Birc2, Xiap, Bak1, Bcl2, Bid, Casp3, Casp7, Casp8, Casp9, Cycs, Tnfrsf1a, Mapk9, Pmaip1","Fadd, Mapk8, Becn1",0.738
"33","ErbB signaling pathway",0,0,0.008,77,37,27,"Camk2d, Raf1, Abl1, Akt2, Camk2g, Cdkn1a, Cdkn1b, Crk, Crkl, Ptk2, Kras, Nck2, Nras, Pik3ca, Pik3cd, Pik3r2, Plcg1, Shc1, Sos1, Src, Stat5a, Cblb, Akt3, Map2k1, Map2k4, Map2k7, Mapk9","Akt1, Egf, Elk1, Gab1, Jun, Pik3r1, Sos2, Stat5b, Mapk8, Pak4",0.605
"34","Fc epsilon RI signaling pathway",0,0.001,0.017,60,30,23,"Raf1, Akt2, Fyn, Inpp5d, Kras, Lcp2, Lyn, Nras, Pdpk1, Pik3ca, Pik3cd, Pik3r2, Pla2g4a, Plcg1, Sos1, Tnf, Vav2, Akt3, Map2k1, Map2k4, Map2k7, Mapk14, Mapk9","Akt1, Btk, Fcer1g, Rac3, Pik3r1, Sos2, Mapk8",0.633
"35","Platelet activation",0,0.001,0.023,106,46,34,"Pik3r6, Fermt3, Orai1, Actb, Actg1, Adcy7, Adcy9, Akt2, Fyn, Gna13, Itpr1, Itpr2, Arhgef1, Lcp2, Lyn, Ppp1r12a, P2ry1, Pik3ca, Pik3cd, Pik3r2, Prkaca, Prkci, Pla2g4a, Plcb3, Ppp1cc, Rock1, Rock2, Src, Rap1b, Vamp8, Akt3, Mapk14, Apbb1ip, P2ry12","Akt1, Rhoa, Btk, Fcer1g, Itgb3, Pik3r1, Rasgrp2, Snap23, Stim1, Pik3r5, Myl12a, Arhgef12",0.587
"36","GnRH signaling pathway",0,0.001,0.027,75,35,28,"Camk2d, Raf1, Adcy7, Adcy9, Camk2g, Cdc42, Gna11, Itpr1, Itpr2, Kras, Nras, Prkaca, Pla2g4a, Plcb3, Pld1, Ptk2b, Sos1, Src, Mapk7, Map2k1, Map2k4, Map2k7, Map3k1, Map3k2, Map3k3, Map3k4, Mapk14, Mapk9","Elk1, Jun, Mmp14, Mmp2, Pld2, Sos2, Mapk8",0.633
"37","Ubiquitin mediated proteolysis",0,0.001,0.039,132,54,47,"Ube3c, Fbxw11, Nhlrc1, Fbxo4, Cdc20, Birc3, Birc2, Xiap, Brca1, Socs3, Socs1, Trip12, Mdm2, Mid1, Pml, Cblb, Ube2d1, Ube2o, Ube2e1, Ube2l3, Uba1, Pias3, Uba6, Herc1, AA414768, Map3k1, Cul3, Ube2z, Skp2, Fbxw7, Keap1, Cdc23, Pias1, Ube2l6, Anapc5, Ube4b, Ube2d3, Smurf2, Cul7, Ube2r2, Rchy1, Trim37, Anapc10, Trim32, Cul2, Syvn1, Uba7","Mgrn1, Cdc34, Ube2m, Ube2g2, Ube2h, Ube2k, Cul4a",0.64
"38","NF-kappa B signaling pathway",0,0.001,0.045,88,39,31,"Birc3, Birc2, Xiap, Atm, Bcl2, Bcl2a1d, Cflar, Csnk2b, Lck, Lyn, Gadd45b, Myd88, Nfkb1, Nfkbia, Plcg1, Ptgs2, Ccl4, Trim25, Tnf, Tnfaip3, Tnfrsf11a, Tnfrsf1a, Cd40, Traf2, Ticam2, Ddx58, Malt1, Irak4, Map3k14, Tab1, Tab2","Parp1, Bcl2a1b, Btk, Csnk2a1, Nfkb2, Rela, Traf3, Map3k7",0.619
"39","AGE-RAGE signaling pathway in diabetic complications",0,0.001,0.046,91,40,30,"Akt2, Bcl2, Casp3, Cdc42, Cdkn1b, Edn1, Jak2, Kras, Smad3, Smad4, Nfkb1, Nras, Pik3ca, Pik3cd, Pik3r2, Pim1, Serpine1, Plcb3, Plcg1, Ccl12, Stat1, Stat3, Stat5a, Tgfbr1, Thbd, Tnf, Akt3, Mapk14, Mapk9, Foxo1","Akt1, Cybb, Il6, Jun, Mmp2, Pik3r1, Rela, Stat5b, Mapk8, Plcd3",0.595
"40","Fc gamma R-mediated phagocytosis",0,0.001,0.055,80,36,28,"Raf1, Akt2, Cdc42, Cfl2, Crk, Crkl, Fcgr1, Hck, Inpp5d, Limk1, Lyn, Marcks, Pik3ca, Pik3cd, Pik3r2, Pip5k1c, Pla2g4a, Plcg1, Pld1, Ptprc, Asap2, Vav2, Asap3, Akt3, Map2k1, Bin1, Pla2g6, Arpc5","Akt1, Cfl1, Limk2, Pik3r1, Pip5k1b, Pld2, Wasl, Arpc2",0.614
"41","Endocrine resistance",0,0.001,0.059,86,38,31,"Raf1, Adcy7, Adcy9, Akt2, Bcl2, Cdkn1a, Cdkn1b, Cdkn2c, Dll1, E2f1, Ptk2, Kras, Mdm2, Notch1, Notch2, Nras, Pik3ca, Pik3cd, Pik3r2, Prkaca, Med1, Rb1, Shc1, Sos1, Sp1, Src, Akt3, E2f2, Map2k1, Mapk14, Mapk9","Akt1, Jun, Mmp2, Ncoa3, Pik3r1, Sos2, Mapk8",0.629
"42","Insulin resistance",0,0.001,0.063,95,41,28,"Ppp1r3e, Prkag2, Akt2, Socs3, Cpt1a, Gys1, Insr, Nfkb1, Nfkbia, Pdpk1, Pik3ca, Pik3cd, Pik3r2, Ppp1cc, Prkag1, Pten, Rps6ka1, Mlxip, Stat3, Creb3l2, Tbc1d4, Tnf, Tnfrsf1a, Creb5, Akt3, Mapk9, Slc27a4, Foxo1","Prkab2, Ogt, Pygl, Akt1, Creb3, Il6, Pik3r1, Prkab1, Ptprf, Rela, Ppp1r3b, Mapk8, Pck2",0.557
"43","Notch signaling pathway",0,0.002,0.08,45,23,21,"Maml1, Ctbp2, Dll1, Dvl2, Lfng, Mfng, Notch1, Notch2, Numbl, Kat2b, Psen1, Ncor2, Dtx4, Aph1b, Dtx3l, Hdac1, Ncstn, Snw1, Aph1c, Dtx2, Dtx3","Dvl1, Rfng",0.712
"44","Oxytocin signaling pathway",0,0.002,0.083,117,48,38,"Pik3r6, Camk2d, Prkag2, Raf1, Actb, Actg1, Adcy7, Adcy9, Cacnb1, Cacnb2, Camk2g, Cdkn1a, Eef2k, Itpr1, Itpr2, Kcnj2, Kras, Mef2c, Ppp1r12a, Nfatc2, Npr1, Nras, Prkaca, Pla2g4a, Plcb3, Ppp1cc, Ppp3cb, Prkag1, Ptgs2, Rgs2, Rock1, Rock2, Camkk2, Src, Mapk7, Map2k1, Cacna2d4, Rcan1","Prkab2, Rhoa, Elk1, Jun, Nfatc3, Ppp3ca, Ppp3r1, Prkab1, Ppp1r12c, Pik3r5",0.601
"45","Pyrimidine metabolism",0,0.002,0.105,91,39,24,"Nt5c3, Entpd6, Dck, Pnp, Pole2, Polr1b, Rrm2, Cmpk2, Umps, Upp1, Polr3e, Twistnb, Ctps, Dhodh, Polr1e, Polr2e, Pnp2, Polr3d, Polr3g, Pold3, Pnpt1, Polr3c, Nt5c2, Polr3h","Nt5m, Entpd5, Nme2, Pola1, Pold1, Polr1a, Polr2c, Uck1, Polr2h, Dctd, Nt5c, Tk2, Znrd1, Polr3k, Polr2d",0.522
"46","Natural killer cell mediated cytotoxicity",0,0.002,0.105,91,39,32,"Raf1, Bid, Casp3, Cd48, Fas, Fyn, H2-D1, H2-K1, H2-T23, Ifnar1, Ifnar2, Ifngr1, Kras, Lck, Lcp2, Nfatc2, Nras, Pik3ca, Pik3cd, Pik3r2, Plcg1, Ppp3cb, Ptk2b, Shc1, Sos1, Tnf, Tnfsf10, Vav2, Sh3bp2, Fcgr4, Map2k1, Klrk1","Fcer1g, Rac3, Pik3r1, Ppp3ca, Ppp3r1, Sos2, Tnfrsf10b",0.625
"47","mTOR signaling pathway",0,0.003,0.122,134,53,44,"Raf1, Akt2, Cab39, Dvl2, Lpin1, Fzd1, Fzd5, Insr, Kras, Lrp5, Lrp6, Slc3a2, Nras, Pdpk1, Pik3ca, Pik3cd, Pik3r2, Pten, Rps6ka1, Sos1, Flcn, Tnf, Tnfrsf1a, Ulk1, Sesn2, Akt3, Mios, Map2k1, Skp2, Depdc5, Ulk2, Wdr59, Fnip2, Rragd, Rragc, Mlst8, Tsc1, Akt1s1, Cab39l, Seh1l, Atp6v1d, Eif4b, Rictor, Deptor","Sec13, Akt1, Rhoa, Atp6v1e1, Dvl1, Pik3r1, Sos2, Stk11, Stradb",0.613
"48","Regulation of actin cytoskeleton",0.001,0.003,0.129,175,66,44,"Pip4k2b, Raf1, Actb, Actg1, Pip4k2c, Apc, Cdc42, Cfl2, Crk, Crkl, Ptk2, Gna12, Gna13, Gng12, Itga4, Itga6, Kras, Arhgef1, Limk1, Mras, Msn, Ppp1r12a, Nras, Pik3ca, Pik3cd, Pik3r2, Pikfyve, Pip5k1c, Ppp1cc, Rock1, Rock2, Cyfip1, Slc9a1, Sos1, Src, Tiam1, Spata13, Vav2, Ezr, Arhgef4, Map2k1, Itgb8, Abi2, Arpc5","Nckap1l, Rhoa, Cfl1, Egf, Itgb3, Limk2, Rac3, Myh9, Pik3r1, Pip5k1b, Rdx, Rras, Sos2, Ppp1r12c, Apc2, Iqgap1, Arhgef7, Myl12a, Arhgef12, Pak4, Wasl, Arpc2",0.522
"49","VEGF signaling pathway",0.001,0.003,0.16,55,26,21,"Raf1, Akt2, Casp9, Cdc42, Ptk2, Kdr, Kras, Mapkapk2, Nfatc2, Nras, Pik3ca, Pik3cd, Pik3r2, Pla2g4a, Plcg1, Ppp3cb, Ptgs2, Src, Akt3, Map2k1, Mapk14","Akt1, Rac3, Pik3r1, Ppp3ca, Ppp3r1",0.64
"50","Longevity regulating pathway - multiple species",0.001,0.003,0.16,55,26,21,"Prkag2, Adcy7, Adcy9, Akt2, Eif4ebp2, Insr, Kras, Nras, Pik3ca, Pik3cd, Pik3r2, Prkaca, Prkag1, Hspa1a, Sod2, Akt3, Hdac1, Foxo1, Foxo3, Akt1s1, Sirt1","Prkab2, Akt1, Atg5, Pik3r1, Prkab1",0.64
"51","IL-17 signaling pathway",0.001,0.003,0.166,78,34,21,"Traf3ip2, Srsf1, Casp3, Casp8, Cxcl10, Mmp13, Nfkb1, Nfkbia, Ptgs2, Ccl12, Tnf, Tnfaip3, Traf2, Mapk7, Mapk14, Mapk9, Usp25, Mapk6, Tbk1, Anapc5, Tab2","Fadd, Il17ra, Il6, Jun, Jund, Lcn2, Rela, Ccl7, Traf3, Traf4, Map3k7, Mapk8, Ikbke",0.527
"52","Tight junction",0.001,0.004,0.198,127,50,31,"Scrib, Prkag2, Actb, Actg1, Cdc42, Llgl1, Rab8a, Msn, Prkaca, Prkci, Prkag1, Rapgef6, Rock1, Rock2, Src, Tiam1, Tjp2, Ezr, Rab8b, Map2k7, Map3k1, Mapk9, Tjp3, Whamm, Ppp2r1a, Actr2, Arhgap17, Ppp2r2a, Rap2c, Actr3, Rapgef2","Prkab2, Rhoa, Dlg1, Jun, Arhgef2, Myh9, Ppp2ca, Prkab1, Rdx, Stk11, Marveld2, Mapk8, Amot, Pard6a, Pard6b, Myl12a, Sympk, Wasl, Amotl1",0.507
"53","Insulin signaling pathway",0.001,0.004,0.205,121,48,37,"Ppp1r3e, Trip10, Prkag2, Raf1, Akt2, Socs3, Socs1, Crk, Crkl, Fasn, Gys1, Hk1, Insr, Kras, Lipe, Mknk2, Nras, Pde3b, Pdpk1, Pik3ca, Pik3cd, Pik3r2, Prkaca, Prkci, Ppp1cc, Inpp5k, Prkag1, Prkar2a, Shc1, Sos1, Cblb, Hk3, Akt3, Map2k1, Mapk9, Foxo1, Tsc1","Prkab2, Pygl, Akt1, Elk1, Pik3r1, Prkab1, Ptprf, Sos2, Ppp1r3b, Mapk8, Pck2",0.584
"54","Phospholipase D signaling pathway",0.001,0.004,0.205,121,48,33,"Dgkz, Pik3r6, Raf1, Adcy7, Adcy9, Akt2, Arf1, Dgka, Fyn, Gna12, Gna13, Lpar1, Insr, Kras, Mras, Nras, Pik3ca, Pik3cd, Pik3r2, Pip5k1c, Pla2g4a, Plcb3, Plcg1, Pld1, Ptk2b, Shc1, Sos1, Akt3, Map2k1, Dgkh, Lpar5, Tsc1, Lpar6","Akt1, Rhoa, Egf, Fcer1g, Gab1, Kitl, Pik3r1, Pip5k1b, Pld2, Cyth1, Rras, Sos2, Rapgef3, Dgkd, Pik3r5",0.542
"55","p53 signaling pathway",0.001,0.005,0.259,65,29,28,"Apaf1, Atm, Bid, Casp3, Casp8, Casp9, Ccnd2, Ccne2, Cdk2, Cdkn1a, Cycs, Gadd45a, Sesn1, Fas, Mdm2, Gadd45b, Serpine1, Pten, Rrm2, Zmat3, Sesn2, Gadd45g, Chek2, Ppm1d, Pmaip1, Shisa5, Rchy1, Sesn3","Ccng2",0.706
"56","Rap1 signaling pathway",0.001,0.005,0.28,173,64,47,"Prkd2, Arap3, Raf1, Actb, Actg1, Adcy7, Adcy9, Adora2b, Angpt1, Angpt2, Akt2, Cdc42, Crk, Crkl, Csf1, Flt1, Lpar1, Insr, Kdr, Kras, Lcp2, Mras, Nras, P2ry1, Pik3ca, Pik3cd, Pik3r2, Prkci, Plcb3, Plcg1, Rapgef6, Sipa1, Src, Rap1b, Sipa1l1, Tiam1, Akt3, Rasgrp3, Sipa1l2, Map2k1, Mapk14, Lpar5, Rgs14, Apbb1ip, Sipa1l3, Rapgef2, Krit1","Akt1, Rhoa, Egf, Flt4, Itgb3, Rac3, Met, Kitl, Pik3r1, Rasgrp2, Rras, Rapgef3, Farp2, Dock4, Magi2, Pard6a, Pard6b",0.552
"57","HIF-1 signaling pathway",0.001,0.005,0.288,95,39,29,"Camk2d, Egln1, Egln3, Angpt1, Angpt2, Akt2, Bcl2, Camk2g, Cdkn1a, Cdkn1b, Edn1, Flt1, Hk1, Ifngr1, Insr, Pfkfb3, Mknk2, Nfkb1, Nos2, Pik3ca, Pik3cd, Pik3r2, Serpine1, Plcg1, Stat3, Hk3, Akt3, Map2k1, Cul2","Akt1, Cybb, Egf, Eno2, Hif1a, Il6, Pfkl, Pik3r1, Rela, Timp1",0.577
"58","Th17 cell differentiation",0.001,0.006,0.368,93,38,26,"Ifngr1, Il1rap, Il2ra, Il2rg, Il4ra, Jak2, Lck, Smad3, Smad4, Nfatc2, Nfkb1, Nfkbia, Nfkbib, Plcg1, Ppp3cb, Rora, Rxra, Rxrb, Stat1, Stat3, Stat5a, Stat6, Tgfbr1, Mapk14, Mapk9, Tyk2","Hif1a, Il12rb1, Il6, Il6st, Jak1, Jun, Nfatc3, Ppp3ca, Ppp3r1, Rela, Stat5b, Mapk8",0.546
"59","RNA polymerase",0.002,0.008,0.479,28,15,9,"Polr1b, Polr3e, Twistnb, Polr1e, Polr2e, Polr3d, Polr3g, Polr3c, Polr3h","Polr1a, Polr2c, Polr2h, Znrd1, Polr3k, Polr2d",0.568
"60","PI3K-Akt signaling pathway",0.002,0.008,0.51,269,92,69,"Pik3r6, Pkn2, Raf1, Angpt1, Angpt2, Akt2, Bcl2, Brca1, Casp9, Ccnd2, Ccne2, Cdk2, Cdkn1a, Cdkn1b, Csf1, Csf3r, Ptk2, Flt1, Gnb4, Gnb5, Gng12, Lpar1, Gys1, Ifnar1, Ifnar2, Il2ra, Il2rg, Il4ra, Insr, Itga4, Itga6, Jak2, Kdr, Kras, Sgk3, Mcl1, Mdm2, Nfkb1, Nras, Osm, Pdpk1, Pik3ca, Pik3cd, Pik3r2, Pten, Rbl2, Rxra, Sos1, Creb3l2, Ppp2r5d, Tnc, Ywhae, Ywhaz, Ppp2r5a, Creb5, Akt3, Phlpp2, Map2k1, Itgb8, Lpar5, Ppp2r1a, Foxo3, Mlst8, Tsc1, Lpar6, Ppp2r2a, Eif4b, Pik3ap1, Phlpp1","Akt1, Creb3, Egf, Flt4, Gnb1, Il3ra, Il6, Il7, Il7r, Itgb3, Jak1, Met, Kitl, Mtcp1, Pik3r1, Ppp2ca, Rela, Sos2, Stk11, Ywhag, Pkn3, Pik3r5, Pck2",0.546
"61","Relaxin signaling pathway",0.002,0.008,0.516,113,44,35,"Arrb1, Raf1, Adcy7, Adcy9, Akt2, Edn1, Gna15, Gnb4, Gnb5, Gng12, Kras, Smad3, Mmp13, Nfkb1, Nfkbia, Nos2, Nras, Pik3ca, Pik3cd, Pik3r2, Prkaca, Plcb3, Shc1, Sos1, Src, Creb3l2, Arrb2, Tgfbr1, Creb5, Akt3, Map2k1, Map2k4, Map2k7, Mapk14, Mapk9","Akt1, Creb3, Gnb1, Jun, Mmp2, Pik3r1, Rela, Sos2, Mapk8",0.592
"62","Progesterone-mediated oocyte maturation",0.002,0.01,0.614,77,32,27,"Kif22, Raf1, Adcy7, Adcy9, Akt2, Cdc25b, Cdk2, Cpeb1, Kras, Pde3b, Pik3ca, Pik3cd, Pik3r2, Prkaca, Plk1, Rps6ka1, Stk10, Cpeb3, Akt3, Map2k1, Mapk14, Mapk9, Cdc23, Anapc5, Cpeb4, Anapc10, Mad2l2","Akt1, Ccna2, Cdc25a, Pik3r1, Mapk8",0.63
"63","Proteasome",0.003,0.01,0.635,45,21,16,"Psme4, Psmb9, Psmb8, Psma2, Psma3, Psmb10, Psmb6, Psmb7, Psme1, Psme2, Psma4, Psma5, Psma6, Psmb2, Psme2b, Pomp","Psmd2, Psmc4, Psmb3, Psmd8, Psmd11",0.614
"64","Fructose and mannose metabolism",0.003,0.013,0.861,32,16,9,"Mpi, Hk1, Pfkfb3, Pfkfb2, Hk3, Fuk, Pfkfb4, Gmppb, Pfkp","Pfkl, Pfkm, Sord, Gmds, Pmm1, Tigar, Pmm2",0.531
"65","Purine metabolism",0.004,0.014,0.934,148,54,36,"Nt5c3, Atic, Ampd2, Adcy7, Adcy9, Ampd3, Entpd6, Dck, Npr1, Pde1b, Pde3b, Pde4b, Pde6b, Pnp, Pole2, Polr1b, Rrm2, Xdh, Enpp4, Ppat, Pfas, Polr3e, Twistnb, Pde7b, Polr1e, Polr2e, Pgm1, Pnp2, Polr3d, Polr3g, Pold3, Pnpt1, Nudt9, Polr3c, Nt5c2, Polr3h","Nt5m, Entpd5, Nme2, Pde1c, Pde7a, Pola1, Pold1, Polr1a, Polr2c, Polr2h, Nt5c, Znrd1, Gmpr, Adprm, Ntpcr, Polr3k, Hddc3, Polr2d",0.516
"66","Th1 and Th2 cell differentiation",0.004,0.015,0.992,79,32,23,"Maml1, Dll1, Ifngr1, Il2ra, Il2rg, Il4ra, Jak2, Lck, Maf, Nfatc2, Nfkb1, Nfkbia, Nfkbib, Notch1, Notch2, Plcg1, Ppp3cb, Stat1, Stat5a, Stat6, Mapk14, Mapk9, Tyk2","Il12rb1, Jak1, Jun, Nfatc3, Ppp3ca, Ppp3r1, Rela, Stat5b, Mapk8",0.562
"67","Mismatch repair",0.005,0.017,1,22,12,9,"Mlh1, Msh2, Msh3, Msh6, Pms2, Mlh3, Exo1, Pold3, Rfc3","Pold1, Rfc1, Rfc5",0.648
