"","Pathway","pVal","pValFDR","pValBonferroni","Genes","HitGenes","HighScoreGenes","HighScoreGenesNames","MedScoreGenesNames","EnrichScore"
"68","cAMP signaling pathway",0.005,0.019,1,137,50,39,"Arap3, Camk2d, Orai1, Npy, Raf1, Acox1, Adcy7, Adcy9, Adrb2, Akt2, Atp1b3, Camk2g, Lipe, Ppp1r12a, Nfkb1, Nfkbia, Npr1, Pde3b, Pde4b, Pik3ca, Pik3cd, Pik3r2, Prkaca, Pld1, Ppp1cc, Ptger2, Rock1, Rock2, Slc9a1, Creb3l2, Rap1b, Tiam1, Vav2, Creb5, Akt3, Map2k1, Mapk9, Hcar2, Acox3","Akt1, Rhoa, Creb3, Jun, Rac3, Pik3r1, Pld2, Rela, Rras, Rapgef3, Mapk8",0.572
"69","Signaling pathways regulating pluripotency of stem cells",0.005,0.019,1,102,39,31,"Raf1, Acvr1, Acvr2b, Akt2, Apc, Zfhx3, Dvl2, Smarcad1, Fzd1, Fzd5, Jak2, Jarid2, Kras, Smad3, Smad4, Smad5, Nras, Pik3ca, Pik3cd, Pik3r2, Stat3, Tcf3, Pcgf2, Akt3, Kat6a, Map2k1, Mapk14, Pcgf6, Dusp9, Pcgf5, Setdb1","Akt1, Dvl1, Il6st, Jak1, Klf4, Meis1, Pik3r1, Apc2",0.589
"70","Wnt signaling pathway",0.006,0.02,1,115,43,31,"Fbxw11, Camk2d, Apc, Cacybp, Camk2g, Ccnd2, Csnk2b, Ctbp2, Dvl2, Frat1, Fzd1, Fzd5, Invs, Lrp5, Lrp6, Smad3, Smad4, Nfatc2, Nlk, Prkaca, Plcb3, Ppard, Ppp3cb, Psen1, Rock2, Daam1, Frat2, Mapk9, Ctnnbip1, Tbl1xr1, Csnk1a1","Rhoa, Csnk2a1, Dvl1, Jun, Rac3, Nfatc3, Ppp3ca, Ppp3r1, Apc2, Map3k7, Mapk8, Peg12",0.547
"71","Circadian rhythm",0.006,0.021,1,28,14,10,"Fbxw11, Prkag2, Clock, Npas2, Per1, Per2, Per3, Prkag1, Rora, Bhlhe40","Csnk1d, Prkab2, Prkab1, Bhlhe41",0.607
"72","Cytokine-cytokine receptor interaction",0.006,0.021,1,197,68,48,"Acvr1, Acvr2b, Cxcr3, Cxcr4, Ccr5, Csf1, Csf3r, Fas, Flt1, Flt3l, Cxcl10, Ifnar1, Ifnar2, Ifngr1, Il10, Il10ra, Il10rb, Il13ra1, Il15, Il15ra, Il18, Il1rap, Il2ra, Il2rg, Il4ra, Kdr, Cxcl9, Osm, Ccl12, Ccl3, Ccl4, Ccl5, Ccl9, Tgfbr1, Tnf, Tnfrsf11a, Tnfrsf1a, Tnfrsf1b, Cd40, Tnfsf8, Tnfsf10, Tnfsf4, Tnfrsf14, Tnfsf18, Tnfrsf12a, Tnfsf15, Tnfrsf13b, Tnfrsf21","Ccr1, Ccr1l1, Ccr7, Egf, Flt4, Il12rb1, Il17ra, Il18rap, Il3ra, Il6, Il6st, Il7, Il7r, Met, Kitl, Ccl7, Ccl8, Tnfrsf10b, Tnfrsf8, Cxcr6",0.526
"73","Oocyte meiosis",0.007,0.023,1,97,37,32,"Fbxw11, Cdc20, Camk2d, Adcy7, Adcy9, Camk2g, Ccne2, Cdk2, Cpeb1, Smc3, Itpr1, Itpr2, Prkaca, Plk1, Ppp1cc, Ppp3cb, Rps6ka1, Cpeb3, Ppp2r5d, Ywhae, Ywhaz, Ppp2r5a, Map2k1, Pttg1, Ppp2r1a, Cdc23, Anapc5, Fbxo5, Cpeb4, Anapc10, Mad2l2, Sgol1","Ppp2ca, Ppp3ca, Ppp3r1, Slk, Ywhag",0.623
"74","Apelin signaling pathway",0.011,0.037,1,119,43,35,"Pik3r6, Prkag2, Raf1, Adcy7, Adcy9, Akt2, Gna13, Gnb4, Gnb5, Gng12, Hdac5, Itpr1, Itpr2, Kras, Lipe, Smad3, Smad4, Mef2c, Mef2d, Mras, Nos2, Nras, Pde3b, Prkaca, Serpine1, Plcb3, Prkag1, Slc8a1, Slc9a1, Hdac4, Tfam, Tgfbr1, Pik3c3, Akt3, Map2k1","Prkab2, Akt1, Gnb1, Prkab1, Rras, Pik3r5, Becn1, Gabarapl1",0.588
"75","Cholinergic synapse",0.011,0.037,1,87,33,28,"Pik3r6, Camk2d, Adcy7, Adcy9, Akt2, Bcl2, Cacna1a, Camk2g, Fyn, Gna11, Gnb4, Gnb5, Gng12, Itpr1, Itpr2, Jak2, Kcnj2, Kras, Nras, Pik3ca, Pik3cd, Pik3r2, Prkaca, Plcb3, Creb3l2, Creb5, Akt3, Map2k1","Akt1, Creb3, Gnb1, Pik3r1, Pik3r5",0.614
"76","Focal adhesion",0.011,0.037,1,172,59,42,"Raf1, Actb, Actg1, Akt2, Birc3, Birc2, Xiap, Arhgap5, Bcl2, Ccnd2, Cdc42, Crk, Crkl, Ptk2, Flt1, Fyn, Ilk, Itga4, Itga6, Kdr, Ppp1r12a, Pdpk1, Pik3ca, Pik3cd, Pik3r2, Pip5k1c, Ppp1cc, Pten, Rock1, Rock2, Shc1, Sos1, Src, Rap1b, Tnc, Vav2, Zyx, Akt3, Map2k1, Mapk9, Flnb, Itgb8","Akt1, Rhoa, Capn2, Egf, Elk1, Flt4, Itgb3, Jun, Rac3, Met, Pik3r1, Sos2, Ppp1r12c, Mapk8, Myl12a, Flnc, Pak4",0.527
"77","Glycosaminoglycan biosynthesis - heparan sulfate / heparin",0.013,0.042,1,19,10,10,"B3galt6, Ext1, Hs3st1, Ndst1, Ndst2, B4galt7, Xylt1, Hs6st1, Extl3, Glce","",0.763
"78","Vasopressin-regulated water reabsorption",0.014,0.046,1,39,17,15,"Adcy9, Dync1h1, Dync1i2, Prkaca, Rab5b, Rab5c, Creb3l2, Stx4a, Vamp2, Creb5, Dync1li2, Rab5a, Dynll1, Dctn4, Dynll2","Creb3, Arhgdia",0.659
"79","Regulation of lipolysis in adipocytes",0.015,0.046,1,42,18,16,"Npy, Adcy7, Adcy9, Adrb2, Akt2, Insr, Lipe, Npr1, Pde3b, Pik3ca, Pik3cd, Pik3r2, Prkaca, Ptgs2, Pla2g16, Akt3","Akt1, Pik3r1",0.659
"80","Hedgehog signaling pathway",0.019,0.058,1,34,15,11,"Csnk1g2, Fbxw11, Arrb1, Bcl2, Ccnd2, Prkaca, Spop, Arrb2, Cul3, Smurf2, Csnk1a1","Csnk1d, Csnk1g1, Sufu, Spopl",0.587
"81","EGFR tyrosine kinase inhibitor resistance",0.019,0.059,1,74,28,20,"Raf1, Akt2, Bcl2, Jak2, Kdr, Kras, Nras, Pik3ca, Pik3cd, Pik3r2, Plcg1, Pten, Shc1, Sos1, Src, Stat3, Akt3, Axl, Map2k1, Foxo3","Akt1, Egf, Gab1, Il6, Jak1, Met, Pik3r1, Sos2",0.546
"82","Axon guidance",0.02,0.059,1,146,50,32,"Camk2d, Raf1, Abl1, Rhod, Camk2g, Cdc42, Cfl2, Cxcr4, Dpysl2, Ptk2, Srgap2, Fyn, Ilk, Kras, Limk1, Nck2, Nfatc2, Nras, Nrp1, Pik3ca, Pik3cd, Pik3r2, Plcg1, Plxna2, Plxna3, Ppp3cb, Rock1, Rock2, Sema4c, Sema4d, Sema6b, Src","Rhoa, Cfl1, Efnb1, Limk2, Rac3, Met, Nfatc3, Pik3r1, Ppp3ca, Ppp3r1, Robo3, Rras, Rasa1, Plxnc1, Pard6a, Pard6b, Arhgef12, Pak4",0.491
"83","Glucagon signaling pathway",0.025,0.074,1,85,31,19,"Camk2d, Prkag2, Akt2, Camk2g, Cpt1a, Gys1, Itpr1, Itpr2, Pde3b, Prkaca, Plcb3, Ppp3cb, Prkag1, Creb3l2, Creb5, Sik2, Akt3, Foxo1, Sirt1","Smek2, Prkab2, Pygl, Akt1, Creb3, Pfkl, Ppp3ca, Ppp3r1, Prkab1, Ppp4c, Smek1, Pck2",0.489
"84","Non-homologous end-joining",0.032,0.094,1,13,7,5,"Fen1, Prkdc, Rad50, Dclre1c, Lig4","Xrcc4, Poll",0.626
