"Pathway","pVal","pValFDR","pValBonferroni","Genes","HitGenes","HitGeneNames"
"Chemokine signaling pathway",0,0,0.004,186,124,"Adcy4, Adcy3, Arrb1, Braf, Rap1a, Raf1, Adcy6, Adcy7, Adcy9, Akt1, Akt2, Rhoa, Cxcr5, Ccr6, Cdc42, Chuk, Cxcr3, Cxcr4, Ccr1, Ccr9, Ccr2, Ccr5, Ccr7, Bcar1, Crk, Crkl, Cx3cr1, Elmo1, Ptk2, Fgr, Gnai1, Gnai2, Gnai3, Gnb1, Gnb2, Gnb5, Gng10, Gng12, Gng2, Gng5, Gngt2, Grb2, Cxcl1, Hck, Cxcl10, Ikbkb, Ikbkg, Itk, Jak2, Jak3, Kras, Xcl1, Lyn, Cxcl9, Ncf1, Nfkb1, Nfkbia, Nfkbib, Nras, Pak1, Pik3ca, Pik3cd, Pik3r1, Pik3r2, Pik3r3, Prkaca, Prkacb, Prkcb, Prkcd, Plcb1, Plcb2, Plcb3, Plcb4, Ptk2b, Pxn, Rac1, Rac2, Rasgrp2, Rela, Rock1, Rock2, Ccl2, Ccl25, Ccl27a, Ccl3, Ccl4, Ccl5, Ccl6, Ccl9, Cxcl12, Shc1, Sos1, Sos2, Stat1, Stat2, Stat3, Stat5b, Rap1b, Arrb2, Tiam1, Vav1, Vav2, Was, Adcy5, Cxcr1, Akt3, Map2k1, Mapk1, Mapk3, Prex1, Cxcl13, Cxcl11, Foxo3, Gsk3b, Pf4, Vav3, Gsk3a, Gng11, Cxcl16, Wasl, Pik3cb, Cxcr6, Pard3, Dock2"
"Pyruvate metabolism",0,0,0.006,38,32,"Acacb, Me2, Acaca, Glo1, Acat1, Acat2, Aldh7a1, Aldh2, Aldh3a2, Dld, Fh1, Hagh, Ldha, Ldhb, Me1, Mdh2, Mdh1, Pck1, Pcx, Pdha1, Pklr, Dlat, Ldhd, Aldh9a1, Acss2, Acyp1, Pdhb, Acss1, Aldh1b1, Acot12, Pck2, Grhpr"
"Rap1 signaling pathway",0,0,0.006,213,139,"Prkd2, Adcy4, Adcy3, Arap3, Rapgef1, Braf, Rap1a, Raf1, Actb, Actg1, Adcy6, Adcy7, Adcy9, Adora2a, Adora2b, Angpt2, Akt1, Akt2, Rhoa, Calm2, Calm3, Ctnnb1, Ctnnd1, Cdc42, Cdh1, Bcar1, Crk, Crkl, Csf1, Csf1r, Efna1, Egfr, Epha2, F2r, Fgf1, Fgf11, Fgf14, Fgfr1, Fgfr2, Fgfr3, Flt1, Flt4, Fpr1, Gnai1, Gnai2, Gnai3, Gnao1, Gnaq, Gnas, Lpar1, Magi1, Hgf, Id1, Igf1, Igf1r, Insr, Itga2b, Itgal, Itgam, Itgb1, Itgb2, Itgb3, Kit, Kras, Lat, Lcp2, Met, Kitl, Mras, Nras, P2ry1, Pdgfa, Pdgfb, Pdgfra, Pdgfrb, Pfn1, Pik3ca, Pik3cd, Pik3r1, Pik3r2, Pik3r3, Prkcb, Prkci, Plcb1, Plcb2, Plcb3, Plcb4, Plcg1, Mapk11, Rapgef6, Rac1, Rac2, Rasgrp2, Ralgds, Rras, Sipa1, Rap1b, Tek, Sipa1l1, Rapgef5, Tiam1, Tln1, Vasp, Vegfa, Vegfb, Vegfc, Rapgef3, Adcy5, Akt3, Dock4, Fyb, Rasgrp3, Sipa1l2, Map2k1, Map2k2, Map2k3, Map2k6, Mapk1, Mapk14, Mapk3, Mapk12, Lpar2, Rassf5, Apbb1ip, Rala, Rapgef4, Pard6a, Ralb, Pdgfd, Pik3cb, Prkd3, Calml4, Rapgef2, Lpar4, Skap1, Krit1, Pard6g, Pard3, Magi3"
"Wnt signaling pathway",0,0,0.006,145,99,"Fbxw11, Prickle1, Camk2d, Apc, Rhoa, Axin1, Axin2, Btrc, Cacybp, Camk2g, Ctnnb1, Ccnd1, Ccnd2, Ccnd3, Crebbp, Csnk2a1, Csnk2a2, Csnk2b, Ctbp1, Ctbp2, Dvl1, Dvl2, Dvl3, Fzd1, Fzd4, Fzd5, Fzd6, Fzd7, Fzd8, Gpc4, Invs, Jun, Lef1, Lrp5, Lrp6, Smad3, Smad4, Myc, Nfatc1, Nfatc2, Nfatc3, Nlk, Prkaca, Prkacb, Prkcb, Plcb1, Plcb2, Plcb3, Plcb4, Ppard, Ppp3ca, Ppp3cb, Ppp3cc, Ppp3r1, Psen1, Rac1, Rac2, Rock2, Serpinf1, Siah1a, Siah1b, Daam1, Frat2, Tbl1x, Skp1a, Tcf7, Tcf7l1, Tcf7l2, Trp53, Wnt11, Wnt9b, Wnt2, Wnt4, Wnt5a, Wnt5b, Prickle2, Map3k7, Mapk10, Mapk8, Mapk9, Cul1, Csnk1e, Peg12, Cxxc4, Ep300, Porcn, Rbx1, Ruvbl1, Gsk3b, Dkk2, Fzd2, Chd8, Bambi, Nkd2, Senp2, Tbl1xr1, Csnk1a1, Vangl2, Nkd1"
"Relaxin signaling pathway",0,0,0.008,129,89,"Adcy4, Adcy3, Arrb1, Raf1, Adcy6, Adcy7, Adcy9, Akt1, Akt2, Atf2, Atf4, Col3a1, Col4a1, Col4a2, Col4a3, Col1a1, Col1a2, Creb1, Creb3, Atf6b, Edn1, Ednrb, Egfr, Fos, Gna15, Gnai1, Gnai2, Gnai3, Gnao1, Gnas, Gnb1, Gnb2, Gnb5, Gng10, Gng12, Gng2, Gng5, Gngt2, Grb2, Jun, Kras, Smad2, Smad3, Mmp9, Nfkb1, Nfkbia, Nos3, Nras, Pik3ca, Pik3cd, Pik3r1, Pik3r2, Pik3r3, Prkaca, Prkacb, Plcb1, Plcb2, Plcb3, Plcb4, Mapk11, Rela, Shc1, Sos1, Sos2, Creb3l2, Creb3l3, Arrb2, Tgfb1, Tgfbr1, Tgfbr2, Vegfa, Vegfb, Vegfc, Adcy5, Akt3, Map2k1, Map2k2, Map2k4, Map2k7, Mapk1, Mapk10, Mapk14, Mapk3, Mapk8, Mapk9, Creb3l1, Mapk12, Gng11, Pik3cb"
"Ferroptosis",0,0,0.01,40,33,"Atg5, Cp, Cybb, Acsl1, Fth1, Ftl1, Gclc, Gclm, Lpcat3, Gss, Hmox1, Slc3a2, Slc11a2, Pcbp2, Prnp, Sat1, Trf, Tfrc, Trp53, Vdac2, Vdac3, Pcbp1, Slc7a11, Ncoa4, Acsl5, Acsl4, Slc40a1, Gpx4, Map1lc3a, Map1lc3b, Sat2, Acsl3, Atg7"
"Adipocytokine signaling pathway",0,0,0.012,71,53,"Acacb, Prkaa1, Prkaa2, Prkab2, Prkag2, Akt1, Akt2, Cd36, Chuk, Socs3, Cpt1a, Cpt1b, Acsl1, G6pc, Ikbkb, Ikbkg, Irs1, Jak2, Lepr, Nfkb1, Nfkbia, Nfkbib, Nfkbie, Pck1, Prkcq, Ppara, Ppargc1a, Prkab1, Prkag1, Ptpn11, Rela, Rxra, Rxrb, Camkk2, Stat3, Stk11, Tnfrsf1a, Tnfrsf1b, Traf2, Akt3, Mapk10, Mapk8, Mapk9, Irs2, Acsl5, Acsl4, Mtor, G6pc3, Adipor2, Tradd, Adipor1, Acsl3, Pck2"
"Antifolate resistance",0,0,0.013,30,26,"Shmt2, Atic, Alox12, Alox12e, Chuk, Abcc2, Dhfr, Folr2, Fpgs, Gart, Ggh, Ikbkb, Ikbkg, Il1b, Abcc1, Mthfr, Nfkb1, Rela, Shmt1, Slc19a1, Tyms, Abcc4, Abcg2, Abcc5, Slc46a1, Abcc3"
"Ras signaling pathway",0,0,0.014,226,145,"Rap1a, Raf1, Abl1, Abl2, Rasa2, Angpt2, Akt1, Akt2, Arf6, Rhoa, Bad, Bcl2l1, Calm2, Calm3, Cdc42, Chuk, Csf1, Csf1r, Efna1, Egfr, Elk1, Epha2, Fasl, Fgf1, Fgf11, Fgf14, Fgfr1, Fgfr2, Fgfr3, Flt1, Flt4, Gab1, Gab2, Gnb1, Gnb2, Gnb5, Gng10, Gng12, Gng2, Gng5, Gngt2, Grb2, Hgf, Igf1, Igf1r, Ikbkb, Ikbkg, Insr, Kit, Kras, Ksr1, Lat, Met, Kitl, Mras, Nf1, Nfkb1, Nras, Pak1, Pak3, Pdgfa, Pdgfb, Pdgfra, Pdgfrb, Pik3ca, Pik3cd, Pik3r1, Pik3r2, Pik3r3, Prkaca, Prkacb, Prkcb, Pla2g1b, Pla2g4a, Plcg1, Pld1, Pld2, Ptpn11, Rab5b, Rab5c, Rac1, Rac2, Rasgrp2, Rasa3, Rasal1, Rasgrf2, Rasgrp1, Rel, Rela, Ralgds, Rgl1, Rgl2, Ralbp1, Rras, Shc1, Sos1, Sos2, Pla2g4b, Rap1b, Tek, Rapgef5, Rasa1, Tiam1, Vegfa, Vegfb, Vegfc, Pak2, Pla2g16, Rin1, Zap70, Rasal2, Plcg2, Akt3, Ets1, Ets2, Rasgrp3, Map2k1, Map2k2, Mapk1, Mapk10, Mapk3, Mapk8, Mapk9, Rab5a, Rasal3, Pla2g6, Rasa4, Rassf5, Foxo4, Rala, Rassf1, Shoc2, Tbk1, Stk4, Ralb, Gng11, Pla2g12a, Exoc2, Rras2, Pak4, Pdgfd, Brap, Pik3cb, Calml4, Pla1a"
"Apelin signaling pathway",0,0,0.014,137,93,"Adcy4, Adcy3, Pik3r6, Prkaa1, Mylk, Prkaa2, Prkab2, Prkag2, Raf1, Adcy6, Adcy7, Adcy9, Agtr1a, Akt1, Akt2, Calm2, Calm3, Camk4, Ccnd1, Cdh1, Egr1, Gna13, Gnai1, Gnai2, Gnai3, Gnaq, Gnb1, Gnb2, Gnb5, Gng10, Gng12, Gng2, Gng5, Gngt2, Hdac5, Itpr1, Itpr2, Itpr3, Jag1, Klf2, Kras, Lipe, Smad2, Smad3, Smad4, Mef2a, Mef2c, Mef2d, Mras, Nos3, Nras, Nrf1, Pde3b, Prkaca, Prkacb, Prkce, Plcb1, Plcb2, Plcb3, Plcb4, Ppargc1a, Prkab1, Prkag1, Rps6, Rras, Ryr1, Ryr3, Slc9a1, Mylk3, Tfam, Tgfbr1, Adcy5, Pik3c3, Akt3, Map2k1, Map2k2, Mapk1, Mapk3, Adcy10, Pik3cg, Pik3r5, Becn1, Gabarap, Sphk2, Mtor, Gabarapl1, Rps6kb2, Gng11, Rras2, Rps6kb1, Calml4, Pik3r4, Gabarapl2"
"Hippo signaling pathway",0,0,0.02,153,102,"Wtip, Fbxw11, Csnk1d, Scrib, Actb, Actg1, Apc, Birc2, Birc5, Axin1, Axin2, Bmp2, Bmp5, Bmpr1a, Bmpr2, Btrc, Ctnna1, Ctnnb1, Ccnd1, Ccnd2, Ccnd3, Cdh1, Dlg1, Dlg4, Dvl1, Dvl2, Dvl3, Fgf1, Fzd1, Fzd4, Fzd5, Fzd6, Fzd7, Fzd8, Id1, Id2, Itgb2, Lats1, Lef1, Llgl1, Bbc3, Smad1, Smad2, Smad3, Smad4, Smad7, Myc, Nf2, Prkci, Ppp1ca, Ppp1cb, Ppp1cc, Ppp2ca, Ppp2cb, Snai2, Trp53bp2, Wwc1, Tcf7, Tcf7l1, Tcf7l2, Tead1, Tead2, Tead4, Llgl2, Tgfb1, Tgfb2, Tgfbr1, Tgfbr2, Wnt11, Wnt9b, Wnt2, Wnt4, Wnt5a, Wnt5b, Yap1, Ywhae, Ywhag, Ywhah, Ywhaq, Ywhaz, Mob1a, Csnk1e, Amot, Limd1, Lats2, Ppp2r1a, Ppp2r2d, Ywhab, Mpp5, Stk3, Rassf1, Pard6a, Gsk3b, Fzd2, Sav1, Mob1b, Ppp2r2a, Ppp2r1b, Pard6g, Pard3, Nkd1, Wwtr1"
"Glyoxylate and dicarboxylate metabolism",0,0,0.023,29,25,"Shmt2, Acat1, Acat2, Pcca, Aco1, Aco2, Agxt, Cat, Cs, Dld, Glul, Hao1, Mdh2, Mdh1, Mut, Shmt1, Glyctk, Pccb, Pgp, Hoga1, Hyi, Afmid, Csl, Mcee, Grhpr"
"Mitophagy - animal",0,0,0.033,63,47,"Atg5, Atf4, Bcl2l1, Bnip3, Csnk2a1, Csnk2a2, Csnk2b, E2f1, Eif2ak3, Usp15, Hif1a, Jun, Kras, Mfn2, Mitf, Mras, Cited2, Nbr1, Nras, Sqstm1, Rab7, Rela, Rras, Sp1, Atg9b, Trp53, Ubb, Ulk1, Ambra1, Atg9a, Mapk10, Mapk8, Mapk9, Tax1bp1, Becn1, Tbk1, Foxo3, Gabarap, Gabarapl1, Rras2, Mfn1, Pink1, Optn, Fundc1, Pgam5, Usp8, Gabarapl2"
"Fatty acid metabolism",0,0,0.033,52,40,"Tecr, Acaca, Acat1, Acat2, Pecr, Acadl, Acadm, Acadvl, Acaa1a, Acads, Acox1, Cpt1a, Cpt1b, Cpt2, Acsl1, Fasn, Hadh, Elovl6, Ppt1, Scd1, Scd2, Mcat, Hadhb, Acaa1b, Mecr, Acsl5, Acsl4, Acaa2, Elovl2, Ppt2, Hsd17b12, Fads2, Acadsb, Elovl5, Ehhadh, Acsl3, Fads1, Acox3, Echs1, Hadha"
"Phospholipase D signaling pathway",0,0,0.036,146,97,"Dnm3, Adcy4, Adcy3, Dgkz, Pik3r6, Raf1, Dgkq, Adcy6, Adcy7, Adcy9, Agtr1a, Akt1, Akt2, Arf1, Arf6, Rhoa, Dgka, Dnm2, Egfr, F2r, Fcer1g, Fyn, Gab1, Gab2, Gna12, Gna13, Gnas, Lpar1, Grb2, Insr, Kit, Kras, Kitl, Mras, Nras, Pdgfa, Pdgfb, Pdgfra, Pdgfrb, Pik3ca, Pik3cd, Pik3r1, Pik3r2, Pik3r3, Pip5k1c, Pip5k1a, Pla2g4a, Plcb1, Plcb2, Plcb3, Plcb4, Plcg1, Pld1, Pld2, Cyth2, Ptk2b, Ptpn11, Ralgds, Rheb, Rras, Shc1, Sos1, Sos2, Pla2g4b, Tsc2, Rapgef3, Adcy5, Cxcr1, Dgkd, Plcg2, Akt3, Avpr1b, Map2k1, Map2k2, Mapk1, Mapk3, Agpat3, Pik3cg, Pik3r5, Dgkh, Agpat5, Lpar2, Agpat1, Rala, Dgke, Rapgef4, Sphk2, Mtor, Ralb, Tsc1, Rras2, Lpar6, Agpat2, Agpat4, Pdgfd, Pik3cb, Lpar4"
"Prolactin signaling pathway",0,0.001,0.059,72,52,"Gck, Raf1, Akt1, Akt2, Ccnd1, Ccnd2, Cish, Socs3, Socs1, Csn2, Fos, Galt, Grb2, Irf1, Jak2, Kras, Nfkb1, Nras, Pik3ca, Pik3cd, Pik3r1, Pik3r2, Pik3r3, Mapk11, Prlr, Socs7, Rela, Shc1, Slc2a2, Sos1, Sos2, Stat1, Stat3, Stat5a, Stat5b, Socs2, Akt3, Map2k1, Map2k2, Mapk1, Mapk10, Mapk14, Mapk3, Mapk8, Mapk9, Mapk12, Socs6, Socs5, Foxo3, Gsk3b, Socs4, Pik3cb"
"Base excision repair",0,0.001,0.071,33,27,"Parp1, Parp2, Apex1, Fen1, Hmgb1, Lig1, Lig3, Mbd4, Ogg1, Pcna, Polb, Pold1, Pold2, Ung, Xrcc1, Neil3, Parp3, Mpg, Parp4, Poll, Pole3, Pole4, Pold3, Pold4, Smug1, Neil1, Apex2"
"Fc epsilon RI signaling pathway",0,0.001,0.078,66,48,"Raf1, Akt1, Akt2, Alox5ap, Fcer1g, Fyn, Gab2, Grb2, Il4, Inpp5d, Kras, Lat, Lcp2, Lyn, Nras, Pdpk1, Pik3ca, Pik3cd, Pik3r1, Pik3r2, Pik3r3, Pla2g4a, Plcg1, Mapk11, Rac1, Rac2, Sos1, Sos2, Pla2g4b, Vav1, Vav2, Plcg2, Akt3, Map2k1, Map2k2, Map2k3, Map2k4, Map2k6, Map2k7, Mapk1, Mapk10, Mapk14, Mapk3, Mapk8, Mapk9, Mapk12, Vav3, Pik3cb"
"GnRH signaling pathway",0,0.001,0.082,89,62,"Adcy4, Adcy3, Camk2d, Raf1, Adcy6, Adcy7, Adcy9, Atf4, Calm2, Calm3, Camk2g, Cdc42, Egfr, Elk1, Gna11, Gnaq, Gnas, Grb2, Hbegf, Itpr1, Itpr2, Itpr3, Jun, Kras, Mmp14, Nras, Prkaca, Prkacb, Prkcb, Prkcd, Pla2g4a, Plcb1, Plcb2, Plcb3, Plcb4, Pld1, Pld2, Mapk11, Ptk2b, Sos1, Sos2, Pla2g4b, Adcy5, Mapk7, Map2k1, Map2k2, Map2k3, Map2k4, Map2k6, Map2k7, Map3k1, Map3k2, Map3k3, Map3k4, Mapk1, Mapk10, Mapk14, Mapk3, Mapk8, Mapk9, Mapk12, Calml4"
"Natural killer cell mediated cytotoxicity",0,0.001,0.105,113,76,"Braf, Raf1, Araf, Bid, Cd48, Fas, Fasl, Fcer1g, Fyn, Grb2, Gzmb, Ptpn6, Icam1, Icam2, Ifnar1, Ifnar2, Ifng, Ifngr1, Ifngr2, Itgal, Itgb2, Klra1, Klra3, Klra4, Klra7, Klra8, Klra9, Klrd1, Kras, Lat, Lck, Lcp2, Klrb1c, Ncr1, Nfatc1, Nfatc2, Nras, Pak1, Prf1, Pik3ca, Pik3cd, Pik3r1, Pik3r2, Pik3r3, Prkcb, Plcg1, Ppp3ca, Ppp3cb, Ppp3cc, Ppp3r1, Ptk2b, Ptpn11, Rac1, Rac2, Sh2d1a, Shc1, Sos1, Sos2, Tnfsf10, Tyrobp, Vav1, Vav2, Zap70, Plcg2, Hcst, Sh3bp2, Fcgr4, Map2k1, Map2k2, Mapk1, Mapk3, Sh2d1b1, Klrk1, Raet1d, Vav3, Pik3cb"
"Hippo signaling pathway - multiple species",0,0.001,0.108,26,22,"Wtip, Lats1, Nf2, Pak1, Wwc1, Rassf4, Rassf2, Tead1, Tead2, Tead4, Yap1, Mob1a, Dchs1, Csnk1e, Limd1, Fat4, Lats2, Stk3, Rassf1, Sav1, Mob1b, Wwtr1"
"Apoptosis - multiple species",0,0.001,0.114,32,26,"Apaf1, Birc3, Birc2, Xiap, Birc5, Bak1, Bax, Bcl2, Bcl2l1, Bid, Bcl2l11, Birc6, Casp7, Casp8, Casp9, Cycs, Fadd, Bbc3, Tnfrsf1a, Mapk10, Mapk8, Mapk9, Becn1, Pmaip1, Htra2, Diablo"
"Vasopressin-regulated water reabsorption",0.001,0.001,0.139,43,33,"Adcy3, Dync2h1, Adcy6, Adcy9, Arhgdib, Creb1, Creb3, Dctn1, Dync1h1, Dync1i2, Gnas, Nsf, Prkaca, Prkacb, Arhgdia, Rab11b, Rab5b, Rab5c, Creb3l2, Creb3l3, Stx4a, Vamp2, Dctn6, Dync1li2, Dync1li1, Creb3l1, Rab5a, Rab11a, Dynll1, Dctn5, Dctn4, Dynll2, Dctn2"
"Glycine, serine and threonine metabolism",0.001,0.002,0.152,40,31,"Psph, Psat1, Cth, Shmt2, Maob, Aldh7a1, Agxt, Alas1, Alas2, Bhmt, Bpgm, Cbs, Dld, Gamt, Gnmt, Pgam1, Pipox, Sardh, Shmt1, Chdh, Sds, Glyctk, Aoc2, Sdsl, Agxt2, Gcat, Srr, Gatm, Tha1, Dmgdh, Grhpr"
"Ubiquinone and other terpenoid-quinone biosynthesis",0.001,0.002,0.163,11,11,"Coq7, Hpd, Nqo1, Coq6, Coq3, Tat, Vkorc1, Coq5, Ggcx, Vkorc1l1, Coq2"
"VEGF signaling pathway",0.001,0.002,0.214,58,42,"Raf1, Akt1, Akt2, Bad, Casp9, Cdc42, Ptk2, Hspb1, Kras, Mapkapk2, Nfatc2, Nos3, Nras, Pik3ca, Pik3cd, Pik3r1, Pik3r2, Pik3r3, Prkcb, Pla2g4a, Plcg1, Ppp3ca, Ppp3cb, Ppp3cc, Ppp3r1, Mapk11, Pxn, Rac1, Rac2, Pla2g4b, Vegfa, Plcg2, Akt3, Map2k1, Map2k2, Mapk1, Mapk14, Mapk3, Sh2d2a, Mapk12, Sphk2, Pik3cb"
"Protein processing in endoplasmic reticulum",0.001,0.002,0.223,165,105,"Dnajc3, Rpn1, Txndc5, Sec13, Atxn3, Atf4, Bag1, Bak1, Bax, Bcl2, Hyou1, Pdia4, Calr, Canx, Capn1, Capn2, Casp12, Atf6b, Cryab, Dnajc5, Dad1, Ddit3, Ddost, Dnajc1, Eif2s1, Eif2ak3, Ube2j2, Ganab, Pdia3, Hspa5, Eif2ak1, Hsph1, Hspa1b, Hspa2, Hsp90ab1, Hsp90aa1, Stt3a, Man1a, Man1a2, Ppp1r15a, Nfe2l2, P4hb, Prkcsh, Eif2ak2, Rad23a, Rad23b, Hspa1a, Rpn2, Sar1a, Sec23a, Sel1l, Skp1a, Ube2d1, Nploc4, Sec24c, Hsp90b1, Traf2, Ube2g2, Wfs1, Xbp1, Atf6, Man1b1, Man1c1, Amfr, Map2k7, Map3k5, Mapk10, Mapk8, Mapk9, Vcp, Cul1, Sec23b, Bcap31, Mbtps2, Eif2ak4, Ero1l, Fbxo6, Preb, Sec61a1, Rnf5, Ubqln2, Ube2j1, Stub1, Rbx1, Mbtps1, Mogs, Ngly1, Ube4b, Herpud1, Ube2d3, Sar1b, Dnajc10, Ube2g1, Derl1, Stt3b, Sec31a, Sec24d, Lman1, Pdia6, Syvn1, Sec24a, Ern1, Tusc3, Dnajb1, Sec24b"
"Other glycan degradation",0.001,0.002,0.238,18,16,"Manba, Aga, Glb1, Gba, Hexa, Hexb, Man2b1, Man2b2, Neu1, Engase, Gba2, Hexdc, Neu3, Fuca2, Fuca1, Man2c1"
"Glutathione metabolism",0.001,0.003,0.265,60,43,"Gstt3, Ggct, Pgd, G6pdx, Gclc, Gclm, Gpx1, Gpx3, Gsr, Gss, Gsta2, Gsta3, Gsta4, Gstm1, Gstm2, Gstm3, Gstm4, Gstm5, Gstm6, Gstp1, Gstt1, Gstt2, Gsto1, Idh1, Anpep, Odc1, Rrm1, Rrm2, Sms, Srm, Idh2, Rrm2b, Hpgds, Mgst1, Gpx4, Txndc12, Mgst3, Lap3, Gpx7, Gstm7, Gpx8, Oplah, Gstk1"
"Glycolysis / Gluconeogenesis",0.001,0.003,0.278,65,46,"Gck, Aldh7a1, Adh1, Adh5, Aldh2, Aldh3a2, Aldoa, Aldoc, Bpgm, Dld, Eno1, Eno3, Fbp1, G6pc, Gapdh, Gpi1, Hk1, Hk2, Ldha, Ldhb, Minpp1, Pck1, Pdha1, Pfkl, Pfkm, Pgam1, Pgk1, Pklr, Tpi1, Aldob, Dlat, Adh4, Galm, Pfkp, Aldh9a1, Aldh1a3, Acss2, Pgm1, Aldh3b1, Pdhb, G6pc3, Acss1, Adpgk, Pgm2, Aldh1b1, Pck2"
"Porphyrin and chlorophyll metabolism",0.001,0.003,0.318,41,31,"Ugt2b34, Eprs, Blvra, Gusb, Alas1, Alas2, Cp, Cpox, Fech, Fxn, Hccs, Heph, Hmbs, Hmox1, Hmox2, Alad, Ppox, Ugt2b5, Urod, Uros, Cox15, Ugt2b36, Blvrb, Ugt2b35, Ugt1a1, Ears2, Cox10, Ugt2b1, Ugt2a3, Mmab, Ugt1a6a"
"Pentose phosphate pathway",0.002,0.004,0.426,32,25,"H6pd, Pgd, Prps2, Aldoa, Aldoc, Fbp1, G6pdx, Gpi1, Pfkl, Pfkm, Prps1, Rgn, Rpia, Taldo1, Tkt, Aldob, Dera, Glyctk, Prps1l3, Pfkp, Pgls, Rpe, Pgm1, Rbks, Pgm2"
"Gap junction",0.002,0.004,0.442,86,58,"Adcy4, Adcy3, Csnk1d, Raf1, Adcy6, Adcy7, Adcy9, Adrb1, Cdk1, Egfr, Gja1, Gna11, Gnai1, Gnai2, Gnai3, Gnaq, Gnas, Lpar1, Grb2, Itpr1, Itpr2, Itpr3, Kras, Nras, Pdgfa, Pdgfb, Pdgfra, Pdgfrb, Prkaca, Prkacb, Prkcb, Plcb1, Plcb2, Plcb3, Plcb4, Prkg1, Prkg2, Sos1, Sos2, Tjp1, Tuba1a, Tuba1b, Tuba4a, Tuba1c, Tubb2a, Tubb5, Adcy5, Gucy1a2, Map2k5, Mapk7, Map2k1, Map2k2, Map3k2, Mapk1, Mapk3, Tuba8, Tubb6, Pdgfd"
"Oxytocin signaling pathway",0.002,0.005,0.516,152,96,"Adcy4, Adcy3, Pik3r6, Prkaa1, Mylk, Camk2d, Prkaa2, Prkab2, Prkag2, Raf1, Actb, Actg1, Adcy6, Adcy7, Adcy9, Rhoa, Cacna2d3, Cacnb2, Calm2, Calm3, Camk2g, Camk4, Ccnd1, Cd38, Cdkn1a, Eef2, Eef2k, Egfr, Elk1, Fos, Gnai1, Gnai2, Gnai3, Gnao1, Gnaq, Gnas, Itpr1, Itpr2, Itpr3, Jun, Kcnj5, Kras, Mef2c, Myl6, Ppp1r12a, Nfatc1, Nfatc2, Nfatc3, Nos3, Npr1, Nras, Oxt, Prkaca, Prkacb, Prkcb, Pla2g4a, Plcb1, Plcb2, Plcb3, Plcb4, Ppp1ca, Ppp1cb, Ppp1cc, Ppp3ca, Ppp3cb, Ppp3cc, Ppp3r1, Prkab1, Prkag1, Rgs2, Rock1, Rock2, Ryr1, Ryr3, Camkk2, Pla2g4b, Mylk3, Adcy5, Camk1d, Npr2, Ppp1r12c, Gucy1a2, Map2k5, Mapk7, Map2k1, Map2k2, Mapk1, Mapk3, Trpm2, Pik3cg, Pik3r5, Ppp1r12b, Camk1, Rcan1, Calml4, Myl9"
"Melanogenesis",0.002,0.005,0.518,100,66,"Adcy4, Adcy3, Camk2d, Raf1, Adcy6, Adcy7, Adcy9, Calm2, Calm3, Camk2g, Ctnnb1, Creb1, Creb3, Crebbp, Dvl1, Dvl2, Dvl3, Edn1, Ednrb, Fzd1, Fzd4, Fzd5, Fzd6, Fzd7, Fzd8, Gnai1, Gnai2, Gnai3, Gnao1, Gnaq, Gnas, Kit, Kras, Lef1, Mc1r, Kitl, Mitf, Nras, Prkaca, Prkacb, Prkcb, Plcb1, Plcb2, Plcb3, Plcb4, Creb3l2, Creb3l3, Tcf7, Tcf7l1, Tcf7l2, Wnt11, Wnt9b, Adcy5, Wnt2, Wnt4, Wnt5a, Wnt5b, Map2k1, Map2k2, Mapk1, Mapk3, Creb3l1, Ep300, Gsk3b, Fzd2, Calml4"
"Leukocyte transendothelial migration",0.002,0.005,0.567,114,74,"Actn1, Rap1a, Actb, Actg1, Rhoa, Arhgap5, Ctnna1, Ctnnb1, Ctnnd1, Cdc42, Cdh5, Cxcr4, Bcar1, Cyba, Cybb, Ptk2, Gnai1, Gnai2, Gnai3, Icam1, Itga4, Itgal, Itgam, Itgb1, Itgb2, Itk, F11r, Mmp9, Msn, Mylpf, Ncf1, Ncf2, Ncf4, Pecam1, Pik3ca, Pik3cd, Pik3r1, Pik3r2, Pik3r3, Prkcb, Plcg1, Mapk11, Ptk2b, Ptpn11, Pxn, Rac1, Rac2, Rock1, Rock2, Cxcl12, Sipa1, Rap1b, Thy1, Txk, Vasp, Vav1, Vav2, Vcam1, Vcl, Ezr, Rapgef3, Plcg2, Mapk14, Mapk12, Rassf5, Rapgef4, Vav3, Actn4, Jam2, Myl12b, Rhoh, Pik3cb, Jam3, Myl9"
"cGMP-PKG signaling pathway",0.003,0.006,0.673,167,104,"Adcy4, Adcy3, Pik3r6, Ppif, Mylk, Raf1, Adcy6, Adcy7, Adcy9, Adora1, Adra1b, Adra1a, Adrb1, Adrb2, Agtr1a, Akt1, Akt2, Slc25a4, Slc25a5, Rhoa, Atf2, Atf4, Atp1a1, Atp1b1, Atp1b3, Bad, Calm2, Calm3, Creb1, Creb3, Atf6b, Ednra, Ednrb, Gata4, Gna11, Gna12, Gna13, Gnai1, Gnai2, Gnai3, Gnaq, Gtf2i, Insr, Irs1, Itpr1, Itpr2, Itpr3, Mef2a, Mef2c, Mef2d, Mrvi1, Ppp1r12a, Nfatc1, Nfatc2, Nfatc3, Nos3, Npr1, Pde3b, Prkce, Plcb1, Plcb2, Plcb3, Plcb4, Ppp1ca, Ppp1cb, Ppp1cc, Ppp3ca, Ppp3cb, Ppp3cc, Ppp3r1, Prkg1, Prkg2, Rgs2, Rock1, Rock2, Pde2a, Srf, Creb3l2, Creb3l3, Mylk3, Vasp, Vdac1, Vdac2, Vdac3, Adcy5, Npr2, Gucy1a2, Akt3, Pde5a, Map2k1, Map2k2, Mapk1, Mapk3, Creb3l1, Pik3cg, Pik3r5, Atp2b4, Irs2, Gtf2ird1, Kcnmb4, Atp1b4, Atp2b1, Calml4, Myl9"
"ABC transporters",0.003,0.006,0.679,47,34,"Abca1, Abca2, Abcb7, Abcg1, Abcd1, Abcc2, Abcc1, Abcb1b, Abcb4, Abcb1a, Abcd3, Abcd4, Abcc9, Tap1, Tap2, Abca8a, Abca5, Abcc10, Abcc4, Abcg2, Abcd2, Abca7, Abca8b, Abcg3, Abcg5, Abca3, Abcb11, Abcc5, Abcc6, Abcb10, Abcb9, Abcb6, Abcb8, Abcc3"
"Vascular smooth muscle contraction",0.003,0.007,0.754,127,81,"Adcy4, Adcy3, Mylk, Cald1, Braf, Raf1, Adcy6, Adcy7, Adcy9, Adora2a, Adora2b, Adra1b, Adra1a, Agtr1a, Araf, Rhoa, Calm2, Calm3, Cyp4a10, Cyp4a12b, Cyp4a14, Ednra, Gna11, Gna12, Gna13, Gnaq, Gnas, Itpr1, Itpr2, Itpr3, Arhgef1, Mrvi1, Myh11, Myl6, Ppp1r12a, Npr1, Prkaca, Prkacb, Prkcb, Prkcd, Prkce, Prkch, Prkcq, Pla2g1b, Pla2g4a, Plcb1, Plcb2, Plcb3, Plcb4, Ppp1ca, Ppp1cb, Ppp1cc, Prkg1, Rock1, Rock2, Pla2g4b, Mylk3, Arhgef11, Adcy5, Npr2, Ppp1r12c, Gucy1a2, Avpr1b, Map2k1, Map2k2, Mapk1, Mapk3, Cyp4a12a, Ppp1r12b, Ramp1, Pla2g6, Ramp2, Calcrl, Ramp3, Kcnmb4, Pla2g12a, Cyp4a31, Ppp1r14a, Arhgef12, Calml4, Myl9"
"2-Oxocarboxylic acid metabolism",0.003,0.007,0.786,19,16,"Gpt2, Aco1, Aco2, Bcat2, Cs, Got1, Got2, Idh1, Idh3g, Idh3b, Nags, Aadat, Idh2, Idh3a, Csl, Gpt"
"Hematopoietic cell lineage",0.004,0.009,1,90,59,"Itga1, Cd19, Cd1d1, Cd2, Ms4a1, Cd22, Cd24a, Cd34, Cd36, Cd37, Cd38, Cd3d, Cd3e, Cd3g, Cd4, Cd44, Cd5, Cd59a, Cd7, Cd8a, Cd8b1, Cd9, Cr2, Csf1, Csf1r, Csf2ra, Csf3r, Cd55, Epor, Fcer2a, Fcgr1, Flt3l, Gp1ba, Il11ra1, Il1a, Il1b, Il1r1, Il1r2, Il2ra, Il3ra, Il4, Il4ra, Il6ra, Il7r, Itga2, Itga2b, Itga3, Itga4, Itga5, Itga6, Itgam, Itgb3, Kit, Anpep, Kitl, Thpo, Tfrc, Siglech, Cd59b"
"Glycerophospholipid metabolism",0.006,0.012,1,96,62,"Dgkz, Pld4, Dgkq, Cds2, Chkb, Chka, Pcyt1a, Dgka, Lpin1, Gpd1, Gpd2, Gnpat, Gpam, Lpcat3, Lcat, Pemt, Lypla1, Pla2g1b, Pla2g4a, Pld1, Pld2, Pld3, Ptdss1, Pla2g15, Lpcat1, Pla2g4b, Chpt1, Etnk2, Lclat1, Pla2g16, Lpgat1, Dgkd, Phospho1, Pnpla7, Lypla2, Lpcat2, Ptdss2, Agpat3, Pisd, Gpd1l, Dgkh, Pnpla6, Agpat5, Cdipt, Pla2g6, Agpat1, Dgke, Lpin2, Lpin3, Pla2g12a, Crls1, Taz, Mboat2, Agpat2, Agpat4, Pcyt2, Gpcpd1, Pgs1, Etnk1, Mboat7, Lpcat4, Cept1"
"Regulation of lipolysis in adipocytes",0.006,0.012,1,55,38,"Adcy4, Adcy3, Adcy6, Adcy7, Adcy9, Adora1, Adrb1, Adrb2, Akt1, Akt2, Fabp4, Gnai1, Gnai2, Gnai3, Gnas, Insr, Irs1, Lipe, Npr1, Pde3b, Pik3ca, Pik3cd, Pik3r1, Pik3r2, Pik3r3, Prkaca, Prkacb, Prkg1, Prkg2, Ptgs1, Adcy5, Pla2g16, Akt3, Mgll, Irs2, Pnpla2, Abhd5, Pik3cb"
"TGF-beta signaling pathway",0.006,0.013,1,84,55,"E2f4, Acvr1, Acvr2a, Acvr2b, Rhoa, Bmp2, Bmp5, Bmpr1a, Bmpr2, Cdkn2b, Crebbp, Dcn, E2f5, Lefty1, Id1, Id2, Id4, Ifng, Inhbb, Inhbc, Smad1, Smad2, Smad3, Smad4, Smad5, Smad6, Smad7, Myc, Ppp2ca, Ppp2cb, Rbl1, Rock1, Sp1, Skp1a, Tgfb1, Tgfb2, Tgfbr1, Tgfbr2, Tgif1, Zfyve16, Tgif2, Zfyve9, Mapk1, Mapk3, Cul1, Ep300, Ppp2r1a, Smad9, Rbx1, Rps6kb2, Smurf2, Bambi, Rps6kb1, Ppp2r1b, Smurf1"
"Terpenoid backbone biosynthesis",0.008,0.016,1,23,18,"Fdps, Acat1, Acat2, Fntb, Fnta, Ggps1, Hmgcr, Hmgcs2, Mvk, Mvd, Rce1, Zmpste24, Nus1, Icmt, Pcyox1, Dhdds, Pmvk, Pdss2"
"Selenocompound metabolism",0.009,0.018,1,17,14,"Cth, Sephs1, Sephs2, Sepsecs, Mars2, Pstk, Mars, Inmt, Mtr, Papss1, Papss2, Txnrd2, Txnrd1, Scly"
"RIG-I-like receptor signaling pathway",0.009,0.019,1,68,45,"Isg15, Atg5, Casp8, Chuk, Ddx3x, Fadd, Cxcl10, Ikbkb, Ikbkg, Il12b, Nfkb1, Nfkbia, Nfkbib, Mapk11, Rela, Ripk1, Tank, Trim25, Traf2, Traf3, Traf6, Mavs, Ddx58, Pin1, Map3k1, Map3k7, Mapk10, Mapk14, Mapk8, Mapk9, Nlrx1, Azi2, Mapk12, Irf7, Irf3, Otud5, Tbk1, Atg12, Rnf125, Ifih1, Tradd, Tmem173, Tbkbp1, Cyld, Dhx58"
"Glycosylphosphatidylinositol (GPI)-anchor biosynthesis",0.011,0.021,1,25,19,"Pigh, Dpm2, Gpaa1, Pigq, Gpld1, Pigf, Pigu, Pigv, Pgap1, Pigs, Pigl, Pigk, Pigg, Pigp, Pigyl, Pigc, Pigm, Pigx, Pigt"
"Long-term depression",0.012,0.023,1,60,40,"Braf, Raf1, Araf, Gna11, Gna12, Gna13, Gnai1, Gnai2, Gnai3, Gnao1, Gnaq, Gnas, Gnaz, Igf1, Igf1r, Itpr1, Itpr2, Itpr3, Kras, Lyn, Nras, Prkcb, Pla2g4a, Plcb1, Plcb2, Plcb3, Plcb4, Ppp2ca, Ppp2cb, Prkg1, Prkg2, Ryr1, Pla2g4b, Gucy1a2, Map2k1, Map2k2, Mapk1, Mapk3, Ppp2r1a, Ppp2r1b"
"Jak-STAT signaling pathway",0.013,0.025,1,157,95,"Raf1, Akt1, Akt2, Aox1, Bcl2, Bcl2l1, Ccnd1, Ccnd2, Ccnd3, Cdkn1a, Cish, Socs3, Socs1, Cntfr, Crebbp, Csf2ra, Csf2rb, Csf2rb2, Csf3r, Epor, Fhl1, Ghr, Grb2, Ptpn6, Ifnar1, Ifnar2, Ifng, Ifngr1, Ifngr2, Il10ra, Il10rb, Il11ra1, Il12b, Il12rb1, Il13ra1, Il13ra2, Il15, Il15ra, Il2ra, Il2rb, Il2rg, Il3ra, Il4, Il4ra, Il6ra, Il7r, Irf9, Jak1, Jak2, Jak3, Lepr, Lifr, Mcl1, Pias2, Myc, Osmr, Pik3ca, Pik3cd, Pik3r1, Pik3r2, Pik3r3, Prlr, Socs7, Ptpn11, Ptpn2, Sos1, Sos2, Stam, Stat1, Stat2, Stat3, Stat4, Stat5a, Stat5b, Stat6, Il20rb, Socs2, Thpo, Pias3, Akt3, Ep300, Il27ra, Socs6, Tyk2, Stam2, Socs5, Pias1, Mtor, Crlf2, Pias4, Il21r, Socs4, Aox3, Pik3cb, Il23a"
"Arginine biosynthesis",0.013,0.025,1,19,15,"Gpt2, Asl, Arg1, Ass1, Glul, Gls, Glud1, Got1, Got2, Nos3, Otc, Gls2, Nags, Cps1, Gpt"
"Steroid biosynthesis",0.013,0.025,1,19,15,"Cel, Cyp51, Dhcr7, Ebp, Fdft1, Hsd17b7, Lipa, Lss, Nsdhl, Soat1, Sqle, Sc5d, Cyp2r1, Tm7sf2, Dhcr24"
"Primary bile acid biosynthesis",0.014,0.027,1,16,13,"Hsd3b7, Cyp27a1, Baat, Cyp7a1, Cyp7b1, Cyp8b1, Hsd17b4, Acot8, Amacr, Scp2, Akr1d1, Slc27a5, Acox2"
"Non-homologous end-joining",0.014,0.028,1,13,11,"Xrcc4, Fen1, Xrcc6, Mre11a, Prkdc, Rad50, Xrcc5, Lig4, Polm, Poll, Nhej1"
"Galactose metabolism",0.015,0.028,1,32,23,"Gck, Gla, Glb1, Akr1b8, G6pc, Gaa, Galt, B4galt1, Galk1, Hk1, Hk2, Pfkl, Pfkm, Ugp2, Mgam, Galm, Pfkp, Pgm1, Akr1b10, G6pc3, Pgm2, Gale, Ganc"
"Alanine, aspartate and glutamate metabolism",0.015,0.029,1,37,26,"Gpt2, Asl, Aspa, Adsl, Adssl1, Adss, Agxt, Ass1, Gfpt1, Gfpt2, Glul, Gls, Glud1, Got1, Got2, Aldh4a1, Aldh5a1, Gls2, Cps1, Ppat, Agxt2, Abat, Asns, Nit2, Cad, Gpt"
"Cytosolic DNA-sensing pathway",0.017,0.033,1,61,40,"Casp1, Chuk, Cxcl10, Ikbkb, Ikbkg, Il18, Il1b, Nfkb1, Nfkbia, Nfkbib, Rela, Ripk1, Polr1c, Polr1d, Ccl4, Ccl5, Polr3a, Mavs, Ddx58, Polr2h, Polr3e, Irf7, Irf3, Adar, Tbk1, Ripk3, Zbp1, Polr2e, Polr2l, Pycard, Polr3k, Polr3d, Polr3g, Polr2f, Polr3gl, Polr3f, Polr3b, Tmem173, Polr3c, Il33"
"Glycosaminoglycan degradation",0.018,0.034,1,21,16,"Hyal3, Gusb, Arsb, Glb1, Hexa, Hexb, Hpse, Hyal1, Hyal2, Ids, Idua, Sgsh, Naglu, Galns, Hgsnat, Gns"
"Fanconi anemia pathway",0.019,0.036,1,51,34,"Fancf, Fancm, Rad51c, Ercc1, Fancc, Hes1, Mlh1, Pms2, Rev3l, Rpa2, Fanci, Top3a, Top3b, Usp1, Palb2, Atrip, Atr, Poli, Polk, Ercc4, Slx4, Rev1, Fancg, Fancl, Ube2t, Wdr48, Rpa3, Rpa1, Mus81, Telo2, Fance, Rmi1, Slx1b, Polh"
"Pantothenate and CoA biosynthesis",0.02,0.037,1,18,14,"Upb1, Ppcs, Bcat2, Enpp1, Pank3, Vnn1, Pank4, Dpys, Ppcdc, Aasdhppt, Coasy, Pank2, Pank1, Dpyd"
"Biosynthesis of unsaturated fatty acids",0.025,0.046,1,28,20,"Tecr, Pecr, Acaa1a, Acox1, Baat, Elovl6, Acot2, Acot3, Acot4, Scd1, Scd2, Acaa1b, Acot1, Elovl2, Hsd17b12, Fads2, Elovl5, Fads1, Acox3, Hadha"
"Signaling pathways regulating pluripotency of stem cells",0.027,0.05,1,137,82,"Raf1, Acvr1, Acvr2a, Acvr2b, Akt1, Akt2, Apc, Axin1, Axin2, Bmi1, Bmpr1a, Bmpr2, Ctnnb1, Dvl1, Dvl2, Dvl3, Fgfr1, Fgfr2, Fgfr3, Fzd1, Fzd4, Fzd5, Fzd6, Fzd7, Fzd8, Grb2, Id1, Id2, Id4, Igf1, Igf1r, Inhbb, Inhbc, Jak1, Jak2, Jak3, Jarid2, Klf4, Kras, Lifr, Smad1, Smad2, Smad3, Smad4, Smad5, Myc, Nras, Pik3ca, Pik3cd, Pik3r1, Pik3r2, Pik3r3, Mapk11, Skil, Stat3, Tbx3, Hnf1a, Tcf3, Wnt11, Wnt9b, Wnt2, Wnt4, Wnt5a, Wnt5b, Pcgf2, Akt3, Esrrb, Map2k1, Map2k2, Mapk1, Mapk14, Mapk3, Mapk12, Smad9, Gsk3b, Fzd2, Pcgf3, Pcgf1, Pcgf6, Pik3cb, Pcgf5, Setdb1"
"Long-term potentiation",0.03,0.053,1,66,42,"Camk2d, Braf, Rap1a, Raf1, Rps6ka3, Araf, Atf4, Calm2, Calm3, Camk2g, Camk4, Crebbp, Gnaq, Itpr1, Itpr2, Itpr3, Kras, Nras, Prkaca, Prkacb, Prkcb, Plcb1, Plcb2, Plcb3, Plcb4, Ppp1ca, Ppp1cb, Ppp1cc, Ppp3ca, Ppp3cb, Ppp3cc, Ppp3r1, Rps6ka1, Rps6ka2, Rap1b, Rapgef3, Map2k1, Map2k2, Mapk1, Mapk3, Ep300, Calml4"
"Fructose and mannose metabolism",0.03,0.053,1,35,24,"Mpi, Aldoa, Aldoc, Fbp1, Akr1b8, Hk1, Hk2, Khk, Pfkfb3, Pfkfb2, Pfkl, Pfkm, Sord, Gmds, Tpi1, Tsta3, Aldob, Pmm1, Gmppb, Pmm2, Pfkp, Akr1b10, Gmppa, Fpgt"
"beta-Alanine metabolism",0.035,0.063,1,32,22,"Upb1, Aldh6a1, Aldh7a1, Acadm, Aldh2, Aldh3a2, Sms, Srm, Hibch, Aoc2, Abat, Mlycd, Aldh9a1, Aldh1a3, Dpys, Cndp2, Aldh3b1, Aldh1b1, Ehhadh, Echs1, Hadha, Dpyd"
"Fatty acid elongation",0.036,0.063,1,27,19,"Tecr, Elovl3, Hadh, Elovl6, Acot2, Acot3, Acot4, Ppt1, Hadhb, Acot1, Mecr, Acaa2, Elovl1, Elovl2, Ppt2, Hsd17b12, Elovl5, Echs1, Hadha"
