"Pathway","pVal","pValFDR","pValBonferroni","Genes","HitGenes","HitGeneNames"
"Ribosome biogenesis in eukaryotes",0,0,0,78,64,"Mdn1, Imp3, Xpo1, Rexo2, Utp15, Pwp2, Pop5, Csnk2a1, Csnk2a2, Csnk2b, Drosha, Fbl, Emg1, Eif6, Ran, Utp14b, Tbl3, Bms1, Tcof1, Utp6, Utp18, Heatr1, Lsg1, Wdr36, Rpp38, Nol6, Gnl2, Nxt2, Gnl3l, Xrn1, Xrn2, Dkc1, Wdr3, Imp4, Gnl3, Nhp2, Nxf1, Rpp30, Nop58, Nxt1, Spata5, Rcl1, Pop4, Nop10, Sbds, Rexo1, Riok2, Nop56, Nvl, Nob1, Pop1, Mphosph10, Gar1, Rbm28, Gtpbp4, Riok1, Wdr43, Utp14a, Wdr75, Fcf1, Pop7, Rrp7a, Nmd3, Nat10"
"Osteoclast differentiation",0,0,0,124,101,"Acp5, Akt1, Akt2, Calcr, Camk4, Chuk, Socs3, Socs1, Creb1, Csf1, Csf1r, Ctsk, Cyba, Fcgr1, Fcgr2b, Fcgr3, Fhl2, Fos, Fosb, Fosl2, Fyn, Gab2, Grb2, Ifnar1, Ifnar2, Ifng, Ifngr1, Ifngr2, Ikbkb, Ikbkg, Il1a, Il1b, Il1r1, Irf9, Itgb3, Jak1, Jun, Junb, Jund, Lck, Lcp2, Blnk, Mitf, Ncf1, Ncf2, Ncf4, Nfatc1, Nfatc2, Nfkb1, Nfkb2, Nfkbia, Sqstm1, Pik3ca, Pik3cd, Pik3r1, Pik3r2, Pik3r3, Pira2, Lilra6, Pparg, Ppp3ca, Ppp3cb, Ppp3cc, Ppp3r1, Mapk11, Sirpa, Rac1, Rela, Relb, Stat1, Stat2, Tec, Tgfb1, Tgfb2, Tgfbr1, Tgfbr2, Tnfrsf1a, Traf2, Traf6, Tyrobp, Lilra5, Plcg2, Akt3, Fcgr4, Map2k1, Map2k6, Map2k7, Map3k7, Mapk1, Mapk10, Mapk14, Mapk3, Mapk8, Mapk9, Mapk12, Map3k14, Tyk2, Tab1, Tab2, Cyld, Pik3cb"
"Metabolic pathways",0,0,0,1307,932,"Pafah2, H6pd, Psph, Acacb, Ugt2b34, Chpf2, Inpp5f, Hsd3b7, Xylb, Alg9, Rdh9, Upb1, Mgat4b, Pnpo, Nt5m, Rpn1, Gck, Synj1, Cyp27a1, Acly, Ndufb11, Ces1d, Dgkz, Pld4, Aldh6a1, Adi1, Thtpa, Ppcs, Cyp2c50, Psat1, Acaca, Eprs, Nt5c3, Pi4kb, Uap1, Haao, Cth, Mthfs, Mgat5, Shmt2, B3gnt5, Atic, Galnt2, Galnt7, Mthfd1, Mat2b, Atp6v1h, Gpt2, Sephs1, Ampd2, Hyal3, Maob, Blvra, Cbr3, Asl, Gusb, Dut, Pygb, Pygl, Mpi, Fdps, Pgd, Cox6b1, Qdpr, Pigh, Acat1, Acat2, Dgkq, Prps2, Aldh7a1, Pcca, Cds2, Hlcs, Acadl, Acadm, Acadvl, Acaa1a, Acads, Atp6v0b, Slc33a1, Aco1, Aco2, Acox1, Acp1, Acp2, Acp5, Impa2, Aspa, Ada, Adh1, Adh5, Adk, Adsl, Adssl1, Adss, Agxt, Gm4737, Ak1, Ak2, Ak4, Alpl, Alas1, Alas2, Aldh1a1, Aldh2, Aldh3a2, Aldoa, Aldoc, Alox12, Alox12e, Pnpla3, Acsm1, Ampd3, Mat1a, Amy1, Prdx6, Aox1, Aprt, Arg1, Arsb, Asah1, Ass1, Atp5a1, Atp5b, Atp5c1, Atp5f1, Atp5g1, Atp5j, Atp5k, Atp6v1a, Atp6v1b2, Atp6v0d1, Atp6v1e1, Atp6v0e, Atp6v0a1, Atp6v0c, Auh, Baat, Bcat2, Bckdha, Bckdhb, Glb1, Bhmt, Bst1, Bpgm, Cbr1, Cbs, Cd38, Cdo1, Cel, Chkb, Chka, Ckb, Cmas, Comt, Coq7, Cox17, Cox4i1, Cox5a, Cox5b, Cox6a1, Cox6c, Cox7c, Cox8a, Cpox, Cs, Pcyt1a, Cycs, Cyp1a2, Cyp2a12, Cyp2a4, Cyp2a5, Cyp2b10, Cyp2c29, Cyp2c37, Cyp2c38, Cyp2e1, Cyp2j5, Cyp2j6, Cyp3a11, Cyp3a13, Cyp4a10, Cyp4a12b, Cyp4a14, Cyp51, Cyp7a1, Cyp8b1, Dad1, Dgka, Dbt, Dck, Ddost, Degs1, Dgat1, Dhcr7, Dhfr, Dld, Dnmt1, Dnmt3a, Dnmt3b, Dpagt1, Dpm1, Dpm2, Ebp, Eno1, Eno3, Ephx2, Ces1c, Ces1e, Ext1, Ext2, Man2a2, Acsl1, Fah, Fasn, Fbp1, Fdft1, Fech, Akr1b8, Fh1, Lpin1, Fpgs, Ftcd, Fut1, Ganab, G6pc, G6pdx, Gaa, Galc, B4galnt1, Galnt1, Galnt4, Galt, Gamt, Gapdh, Gart, Gba, Gch1, Gcnt2, Gda, Gfpt1, Gfpt2, Ggps1, B4galt1, Gclc, Gclm, Galk1, Glul, Gls, Glud1, Got1, Got2, Gpaa1, Gpam, Gpi1, Pigq, Gss, Gstz1, Guk1, Gys1, Hadh, Hsd17b10, Hal, Hao1, Hdc, Hexa, Hexb, Hgd, Hk1, Hk2, Hmbs, Hmgcl, Hmgcr, Hmgcs2, Hmox1, Hmox2, Hpse, Hpd, Lipc, Hprt, Hsd11b1, Hsd17b2, Hsd17b4, Hsd17b7, Hsd3b5, Ndst1, Hyal1, Hyal2, Idh1, Idh3g, Ids, Idua, Inpp1, Inpp5b, Stt3a, Itpa, Khk, Lama3, Lama5, Anpep, Ldha, Ldhb, Lipg, Lss, Lta4h, Ltc4s, Alad, Cyp4f13, Idh3b, Mtmr4, Acot8, Acer1, Amacr, Acot2, Galnt10, Acot3, Acot4, Man1a, Man1a2, Nme7, Man2a1, Rdh11, Mgat1, Minpp1, Ndst2, Mocs2, Me1, Mdh2, Mdh1, Mthfr, Mtm1, Mut, Mvk, Ndufa2, Ndufa4, Ndufs4, Ndufv1, Nfs1, Nme1, Nme2, Nnmt, Nnt, Nos3, Nsdhl, Oat, Odc1, Ogdh, Otc, P4ha1, P4ha2, Pafah1b1, Pafah1b2, Pafah1b3, Pah, Pck1, Pcx, Pdha1, Enpp1, Pemt, Pfkl, Pfkm, Pgam1, Pgk1, Pigf, Pik3c2a, Pip5k1c, Pip5k1a, Pklr, Pla2g1b, Pla2g4a, Plcb1, Plcb2, Plcb3, Plcb4, Plcd1, Plcg1, Pld1, Pld2, Pld3, Pnp, Pola1, Pola2, Pold1, Pold2, Polg, Ppox, Inpp5k, Ppt1, Prim1, Prim2, Prodh, Prps1, Pipox, Ptdss1, Mvd, Sardh, Nadk, Ptgs1, Pts, Rdh16, Rev3l, Rgn, Rpia, Rpn2, Polr1c, Polr1b, Polr1d, Polr1a, Polr2a, Polr2c, Polr2j, Rrm1, Rrm2, Dhrs3, Acsm3, Sat1, Scp2, Sord, Sgpl1, Shmt1, St6gal1, St3gal3, St3gal1, St3gal4, St3gal2, St6galnac4, St3gal5, Smpd1, Smpd2, Sms, Spr, Sephs2, Sptlc2, Sqle, Galnt6, Alg11, Srm, Alg1, Sgms1, Alg3, Akr1d1, Sucla2, Suclg2, Ido2, Synj2, Lpcat1, Pank3, Suox, Pla2g4b, Ado, Inpp5a, Aldh4a1, Chpt1, Dse, Taldo1, Etnk2, Aldh5a1, Pdxk, Gls2, Ugp2, Xylt2, Nags, Mgat2, Coq6, Pomt2, Itpk1, Gmds, B4galt7, Atp6v0a2, Tk1, Tkt, Polr3a, Chdh, Mtmr6, Dtymk, Tpi1, Tst, Tsta3, Cmpk2, Tyms, Ugcg, Ugdh, Ugt2b5, Uck1, Umps, Uox, Upp1, Uqcrq, Uqcrc1, Urod, Uros, Mcat, Alg12, Pi4ka, Xdh, Lclat1, Pik3c3, Pla2g16, Ndufs8, Cyp2c70, Cox15, Nmnat2, Ndufs2, Hibch, Ndufs1, Cps1, Dgkd, Man1b1, Uap1l1, Dolk, Atp5g3, Agps, Pigu, Gmps, Ahcyl1, Coq3, Ndufb6, Gba2, Aldob, Acer2, Pigv, Man1c1, Galnt11, Hadhb, Ppat, Ugt2b36, Sds, Mat2a, Cyp26b1, Gys2, Mgam, Itpkc, Blvrb, Csgalnact1, Inpp4b, Tat, Plcg2, Sc5d, Dlat, Glyctk, Acaa1b, Pfas, Phospho1, Aoc2, Hexdc, Bpnt1, Mtr, Impdh1, Impdh2, Aadat, Mgll, Nt5e, Papss1, Papss2, Pik3c2b, Pgap1, Dhrs9, Impad1, Ugt2b35, Uroc1, Fkrp, Cyp2r1, Polr2h, Fktn, Mpst, Csad, Sdsl, Aldh1a7, Btd, Gnpda1, Slc27a5, Gphn, Sptlc1, Gulo, Adh4, B3galt1, B3galt2, Agxt2, Abat, Acot1, Inpp4a, Mgat4a, Mecr, Ahcy, Pank4, Chsy1, Idh2, Gcdh, Lpcat2, Sgsh, Asns, Tcirg1, Mthfd1l, Galnt13, Pla2g7, Acsm5, Gyg, Srr, Dguok, Ptdss2, Hsd17b6, Pdhx, Naglu, Atp5l, Pigs, Cyp4a12a, B3gat2, Twistnb, Atp5o, Agpat3, Dhrs4, Tpk1, Pmm1, Aass, Galm, Flad1, Glt28d2, Itpkb, Alg6, Ocrl, Pisd, Pigl, Prps1l3, Pigk, Gmppb, Uprt, Cox6b2, Dgkh, Alg10b, Alg8, Rrm2b, Gatc, Ugt1a1, Cyp2c54, Ndufs6, Ndufa4l2, Cyp2c68, Acsl5, Nt5c, Polg2, Acsl4, Gne, Scly, Galns, St6galnac6, Ctps, Coq5, Hgsnat, Agpat5, Acaa2, Cdipt, Mtmr1, Pla2g6, Fut8, B3gnt2, Pmm2, B3galt4, Nme6, Rfk, Ppt2, Ndufa1, Atp6ap1, Asah2, Hpgds, St3gal6, Extl3, Ctps2, Agpat1, Impa1, Dgke, Nagk, Pigp, Prodh2, Hsd17b12, Ptges3, Ivd, Apip, B4galt4, B4galt6, Cyp3a25, Pfkp, Suclg1, Sphk2, Mlycd, Tdo2, Alg2, Mocs1, Dhodh, Aldh9a1, Aldh1a3, B4galt3, Mogs, Atp5j2, Tk2, Extl2, Hibadh, Pole3, Nampt, C1galt1c1, Ndufs5, Acss2, Cyp4f14, Polr1e, Inpp5e, Dpys, Lpin2, Lpin3, Bhmt2, Atp5d, Ndufb5, Sdhc, Cndp2, Ndufa3, Ndufa9, Znrd1, Cox7b, Atp6v1f, Uqcr10, Pgls, Pycrl, Ndufb9, Atp6v1g2, Alg5, Pigyl, Atp6v1g1, Atp6v1c1, Pla2g12a, Ndufc1, Ndufa12, Ndufa7, Polr2e, Dctpp1, Cyc1, Nmnat1, Polr2l, Ndufb3, Ntpcr, Uqcrh, Crls1, Cmpk1, Uqcr11, Cyp4a31, Rpe, Pgm1, Uqcrfs1, Pnp2, Alg14, Ppcdc, Pnpla2, Acadsb, Mtap, Pccb, Ndufb7, Sdhd, Sdha, Acad8, Trit1, Pole4, Lap3, Uqcrc2, Polr3k, Paics, Polr3d, Pi4k2b, Pgp, Gatm, Atp5e, Ndufa6, Ndufa13, Mboat2, Ndufb8, Ndufa10, Pigc, Qprt, Ears2, Hoga1, Polr3g, Agpat2, Uqcrb, Pigm, Alg13, Sdhb, Aldh3b1, Polr2g, Dgat2, Idh3a, Akr1b10, Enoph1, Mri1, Dcxr, Uxs1, Atp5g2, Pold3, Gnpda2, Nudt12, Hyi, Ndufb4, Ndufc2, Ndufb2, Ndufa5, Agpat4, Pdhb, Pomgnt1, Stt3b, Ndufb10, Ndufs3, Ndufa8, G6pc3, Uckl1, Dpm3, Pmvk, Cryl1, Fahd1, Pcyt2, Acss1, Ak8, Pycr2, Gmppa, Sat2, Polr2d, Cmbl, Ipmk, Cad, Pold4, Bdh2, Cox11, Polr2f, Polr3gl, Ndufa11, Cyp2c66, Polr2i, Agk, Degs2, Ndufab1, Cox10, Polr3f, Polr3b, Kdsr, Kynu, Trak2, Afmid, Atp5h, Galnt14, Aox3, Coasy, Amdhd1, Ugt2b1, Tha1, Csl, Coq2, Mccc1, Cyp4f18, Pigx, Ugt2a3, Adpgk, Pgm2, Cda, B3gnt3, Plcd3, Aldh1b1, B3gat3, Ndufv2, Tm7sf2, Phospho2, Mcee, Atp6v1d, Nmnat3, Dmgdh, Ehhadh, Gbe1, Acsl3, Chpf, Gale, Mtmr3, Ahcyl2, Polr3c, Sgms2, Pank2, Pgs1, Cyp2j9, Pck2, Dhcr24, Etnk1, Ndufs7, Fpgt, Gns, Ippk, Pank1, Ispd, Agmat, Ganc, Grhpr, Atp6v0e2, Gpt, Qrsl1, Upp2, Nt5c2, Mtmr2, Agl, Smpd4, Mmab, Mccc2, Cox7b2, Ndufv3, Csgalnact2, Nadsyn1, Dlst, Pigt, Nme3, Lias, Tusc3, Acox3, Uck2, Sacm1l, Pi4k2a, Glce, Acox2, Echs1, Nans, C1galt1, Ugt1a6a, Ptges2, Hadha, Mtmr14, Qars, B3galnt2, Kmo, Rdh10, Lpcat4, Pomt1, Dpyd, Cept1"
"mRNA surveillance pathway",0,0,0,93,73,"Smg6, Pelo, Cstf2, Gspt1, Magoh, Msi1, Pabpc1, Papola, Pnn, Ppp1ca, Ppp1cb, Ppp1cc, Ppp2ca, Ppp2cb, Casc3, Eif4a3, Upf1, Rnps1, Sap18, Papolg, Ppp2r5d, Etf1, Ppp2r5b, Smg7, Ppp2r5a, Cstf3, Smg5, Pabpc4, Smg1, Ppp2r3a, Nxt2, Rngtt, Pabpc4l, Cpsf7, Ppp2r5c, Ppp2r5e, Upf2, Cpsf6, Ncbp1, Cpsf2, Ppp2r1a, Srrm1, Ppp2r2d, Nxf1, Ddx39b, Cpsf4, Pabpn1, Cpsf3, Acin1, Hbs1l, Nxt1, Ppp2r3c, Rbm8a, Magohb, Fip1l1, Upf3a, Cstf1, Rnmt, Ncbp2, Upf3b, Sympk, Nudt21, Ssu72, Dazap1, Ppp2r2a, Ppp2r1b, Wdr33, Pcf11, Msi2, Wdr82, Cstf2t, Cpsf1, Clp1"
"Sphingolipid signaling pathway",0,0,0,121,92,"Raf1, Adora1, Akt1, Akt2, Rhoa, Asah1, Bax, Bcl2, Bid, Ctsd, Degs1, S1pr1, S1pr3, Fcer1g, Fyn, Gab2, Gna12, Gna13, Gnai1, Gnai2, Gnai3, Gnaq, S1pr2, Kras, Acer1, Abcc1, Nfkb1, Nos3, Nras, Nsmaf, Pdpk1, Pik3ca, Pik3cd, Pik3r1, Pik3r2, Pik3r3, Prkcb, Prkce, Plcb1, Plcb2, Plcb3, Plcb4, Pld1, Pld2, Ppp2ca, Ppp2cb, Mapk11, Pten, Rac1, Rac2, Rela, Rock1, Rock2, Sgpl1, Smpd1, Smpd2, Sptlc2, Sgms1, Ppp2r5d, Tnfrsf1a, Traf2, Trp53, Ppp2r5b, Ppp2r5a, Acer2, Ppp2r3a, Akt3, Map2k1, Map2k2, Map3k5, Mapk1, Mapk10, Mapk14, Mapk3, Mapk8, Mapk9, Sptlc1, Ppp2r5c, Ppp2r5e, Mapk12, Ppp2r1a, Ppp2r2d, Asah2, Sphk2, Ppp2r3c, Degs2, Tradd, Ppp2r2a, Ppp2r1b, Sgms2, Pik3cb, Sgpp1"
"PI3K-Akt signaling pathway",0,0,0,342,224,"Itga9, Pik3r6, Prkaa1, Prkaa2, Pkn2, Itga1, Raf1, Angpt2, Akt1, Akt2, Atf2, Atf4, Bad, Bcl2, Bcl2l1, Bcl2l11, Casp9, Ccnd1, Ccnd2, Ccnd3, Ccne1, Ccne2, Cd19, Cdc37, Cdk2, Cdk4, Cdk6, Cdkn1a, Cdkn1b, Chuk, Col4a1, Col4a2, Col4a3, Col6a1, Col6a2, Col6a3, Col1a1, Col1a2, Creb1, Creb3, Atf6b, Csf1, Csf1r, Csf3r, Efna1, Egfr, Eif4e, Eif4ebp1, Epha2, Epor, F2r, Ptk2, Fasl, Fgf1, Fgf11, Fgf14, Fgfr1, Fgfr2, Fgfr3, Flt1, Flt4, Fn1, G6pc, Ghr, Gnb1, Gnb2, Gnb5, Gng10, Gng12, Gng2, Gng5, Gngt2, Lpar1, Grb2, Gys1, Hgf, Nr4a1, Hsp90ab1, Hsp90aa1, Ifnar1, Ifnar2, Igf1, Igf1r, Ikbkb, Ikbkg, Il2ra, Il2rb, Il2rg, Il3ra, Il4, Il4ra, Il6ra, Il7r, Insr, Irs1, Itga2, Itga2b, Itga3, Itga4, Itga5, Itga6, Itgav, Itgb1, Itgb3, Itgb5, Itgb7, Jak1, Jak2, Jak3, Kit, Kras, Lama3, Lama4, Lama5, Lamb1, Lamb2, Lamb3, Sgk3, Mcl1, Mdm2, Met, Kitl, Mtcp1, Myc, Nfkb1, Nos3, Nras, Osmr, Pck1, Pdgfa, Pdgfb, Pdgfra, Pdgfrb, Pdpk1, Pik3ca, Pik3cd, Pik3r1, Pik3r2, Pik3r3, Ppp2ca, Ppp2cb, Prlr, Pten, Rac1, Rbl2, Rela, Reln, Rheb, Rps6, Rxra, Sgk1, Sos1, Sos2, Creb3l2, Creb3l3, Stk11, Tek, Ppp2r5d, Thbs2, Tlr4, Hsp90b1, Trp53, Tsc2, Vegfa, Vegfb, Vegfc, Vtn, Ppp2r5b, Ywhae, Ywhag, Ywhah, Ywhaq, Ywhaz, Lamc1, Ppp2r5a, Gys2, Ppp2r3a, Akt3, Tlr2, Itga8, Phlpp2, Pkn3, Map2k1, Map2k2, Mapk1, Mapk3, Creb3l1, Ppp2r5c, Ppp2r5e, Eif4e2, Sgk2, Pik3cg, Itga11, Pik3r5, Pkn1, Ppp2r1a, Ppp2r2d, Lpar2, Ywhab, Foxo3, Gsk3b, Mlst8, Mtor, Rps6kb2, Ppp2r3c, Tsc1, Gng11, Lpar6, G6pc3, Pdgfd, Ppp2r2a, Rps6kb1, Ppp2r1b, Crtc2, Rptor, Pck2, Ddit4, Pik3cb, Eif4b, Them4, Lpar4, Tnxb, Pik3ap1, Phlpp1"
"AMPK signaling pathway",0,0,0,125,102,"Acacb, Prkaa1, Acaca, Prkaa2, Prkab2, Prkag2, Adra1a, Akt1, Akt2, Cab39, Ccna2, Ccnd1, Cd36, Cpt1a, Cpt1b, Creb1, Creb3, Eef2, Eef2k, Eif4ebp1, Fasn, Fbp1, G6pc, Gys1, Hmgcr, Hnf4a, Elavl1, Igf1, Igf1r, Insr, Irs1, Lepr, Lipe, Pfkfb3, Rab8a, Pck1, Pdpk1, Pfkfb2, Pfkl, Pfkm, Pik3ca, Pik3cd, Pik3r1, Pik3r2, Pik3r3, Pparg, Ppargc1a, Ppp2ca, Ppp2cb, Prkab1, Prkag1, Rab10, Rab11b, Rheb, Scd1, Scd2, Camkk2, Srebf1, Creb3l2, Creb3l3, Stk11, Ppp2r5d, Tsc2, Ulk1, Ppp2r5b, Ppp2r5a, Stradb, Gys2, Ppp2r3a, Akt3, Map3k7, Creb3l1, Ppp2r5c, Ppp2r5e, Irs2, Ppp2r1a, Ppp2r2d, Pfkp, Foxo1, Foxo3, Mlycd, Mtor, Tbc1d1, Rps6kb2, Rab2a, Ppp2r3c, Tsc1, Akt1s1, Rab14, G6pc3, Adipor2, Cab39l, Ppp2r2a, Strada, Rps6kb1, Adipor1, Ppp2r1b, Crtc2, Rptor, Pck2, Pik3cb, Sirt1"
"NF-kappa B signaling pathway",0,0,0,97,74,"Card10, Ticam1, Card11, Erc1, Parp1, Tirap, Birc3, Birc2, Xiap, Atm, Bcl10, Bcl2, Bcl2a1a, Bcl2a1b, Bcl2l1, Cflar, Chuk, Csnk2a1, Csnk2a2, Csnk2b, Icam1, Ikbkb, Ikbkg, Il1b, Il1r1, Irak1, Lat, Lbp, Lck, Ltb, Ltbr, Blnk, Ly96, Lyn, Gadd45b, Myd88, Nfkb1, Nfkb2, Nfkbia, Prkcb, Prkcq, Plcg1, Rela, Relb, Ripk1, Ccl4, Cxcl12, Trim25, Tlr4, Tnfaip3, Tnfrsf1a, Cd40, Cd40lg, Traf1, Traf2, Traf3, Traf6, Ube2i, Vcam1, Ticam2, Zap70, Ddx58, Plcg2, Malt1, Map3k7, Irak4, Tnfsf14, Map3k14, Pias4, Tab1, Tab3, Tab2, Tradd, Tnfrsf13c"
"RNA transport",0,0,0,166,134,"Nup107, Xpo1, Thoc5, Pom121, Eif2b3, Eif4ebp3, Tpr, Sec13, Elac1, Tgs1, Pop5, Clns1a, Eef1a1, Eif1a, Eif2s1, Eif2b4, Eif3a, Eif4a1, Eif4a2, Eif4e, Eif4ebp1, Eif4ebp2, Eif4g2, Fmr1, Fxr1, Kpnb1, Eif3e, Nup155, Sumo2, Magoh, Nup50, Nup62, Pabpc1, Pnn, Nup88, Casc3, Eif4a3, Ran, Ranbp2, Rangap1, Upf1, Rnps1, Sap18, Cyfip1, Smn1, Sumo3, Eif4g1, Strap, Eif1, Eif2b1, Tacc3, Gemin5, Eif2b2, Eif5, Nup153, Paip1, Ube2i, Sumo1, Aaas, Eif2b5, Thoc1, Eif5b, Rpp38, Nup188, Nup214, Pabpc4, Eif4g3, Nupl2, Nup133, Nxt2, Gemin8, Fxr2, Pabpc4l, Eif2s3x, Eif2s3y, Nup54, Eif4e2, Nup98, Prmt5, Gemin4, Eif3b, Upf2, Thoc2, Ncbp1, Nup85, Srrm1, Nxf1, Eif3g, Ddx39b, Ddx20, Rpp30, Nup210, Eif3i, Eif3d, Acin1, Eif3c, Nxt1, Phax, Nup160, Rbm8a, Snupn, Eif3f, Pop4, Thoc7, Eif1ax, Magohb, Rae1, Upf3a, Rpp14, Eif2s2, Rpp21, Pop1, Ncbp2, Upf3b, Eif3h, Elac2, Eif1b, Nup35, Gemin7, Nup37, Nup43, Trnt1, Nup205, Nup93, Nupl1, Seh1l, Xpo5, Xpot, Thoc3, Pop7, Eif4b, Senp2, Cyfip2, Nmd3"
"EGFR tyrosine kinase inhibitor resistance",0,0,0,79,63,"Braf, Raf1, Akt1, Akt2, Araf, Bad, Bax, Bcl2, Bcl2l1, Bcl2l11, Egfr, Eif4e, Eif4ebp1, Erbb2, Erbb3, Fgfr2, Fgfr3, Gab1, Gas6, Grb2, Hgf, Igf1, Igf1r, Il6ra, Jak1, Jak2, Kras, Met, Nf1, Nras, Pdgfa, Pdgfb, Pdgfra, Pdgfrb, Pik3ca, Pik3cd, Pik3r1, Pik3r2, Pik3r3, Prkcb, Plcg1, Pten, Rps6, Shc1, Sos1, Sos2, Stat3, Vegfa, Plcg2, Akt3, Axl, Map2k1, Map2k2, Mapk1, Mapk3, Eif4e2, Foxo3, Gsk3b, Mtor, Rps6kb2, Pdgfd, Rps6kb1, Pik3cb"
"Ubiquitin mediated proteolysis",0,0,0,138,121,"Gm10705, Ube3c, Fbxw11, Fbxo4, Wwp1, Ddb2, Cdc20, Ube2q2, Ube3b, Birc3, Birc2, Xiap, Birc6, Btrc, Cbl, Socs3, Socs1, Ddb1, Ube2j2, Ubox5, Ube4a, Trip12, Herc2, Itch, Anapc1, Mgrn1, Mdm2, Mid1, Pias2, Nedd4, Pml, Rnf7, Siah1a, Siah1b, Cblb, Skp1a, Ube2d1, Cdc34, Cdc27, Ube2o, Ube2e2, Traf6, Ube2m, Ube2e3, Ube2e1, Ube2l3, Ube2i, Uba3, Uba1, Ube2a, Ube2b, Ube2g2, Ube2h, Ube3a, Vhl, Pias3, Uba6, Fbxw8, Herc1, Klhl9, Rhobtb2, Map3k1, Cul3, Ube2z, Cul1, Prpf19, Fbxw7, Keap1, Uba2, Anapc4, Cdc23, Ube2k, Ube2j1, Anapc7, Fzr1, Stub1, Rbx1, Sae1, Pias1, Ube2l6, Pias4, Anapc5, Huwe1, Ube4b, Ppil2, Ube2d3, Anapc11, Smurf2, Cdc26, Cul7, Ube2w, Wwp2, Fancl, Ube2g1, Herc4, Klhl13, Ube2r2, Ube2f, Rchy1, Ube2c, Trim37, Anapc10, Anapc13, Rhobtb1, Trim32, Cdc16, Ube2q1, Ubr5, Cul2, Ercc8, Cul4b, Herc3, Syvn1, Uba7, Cul5, Smurf1, Ube2s, Nedd4l, Ube2n, Anapc2, Cul4a"
"Oxidative phosphorylation",0,0,0,132,102,"Ndufb11, Atp6v1h, Cox6b1, Atp6v0b, Atp5a1, Atp5b, Atp5c1, Atp5f1, Atp5g1, Atp5j, Atp5k, Atp6v1a, Atp6v1b2, Atp6v0d1, Atp6v1e1, Atp6v0e, Atp6v0a1, Atp6v0c, Cox17, Cox4i1, Cox5a, Cox5b, Cox6a1, Cox6c, Cox7c, Cox8a, Ndufa2, Ndufa4, Ndufs4, Ndufv1, Atp6v0a2, Uqcrq, Uqcrc1, Ndufs8, Cox15, Ndufs2, Ndufs1, Atp5g3, Ndufb6, Tcirg1, Atp5l, Atp5o, Cox6b2, Ndufs6, Ndufa4l2, Ndufa1, Atp6ap1, Atp5j2, Ndufs5, Atp5d, Ndufb5, Sdhc, Ndufa3, Ndufa9, Cox7b, Atp6v1f, Uqcr10, Ndufb9, Atp6v1g2, Atp6v1g1, Atp6v1c1, Ndufc1, Ndufa12, Ndufa7, Cyc1, Ndufb3, Uqcrh, Uqcr11, Uqcrfs1, Ndufb7, Sdhd, Sdha, Uqcrc2, Atp5e, Ndufa6, Ndufa13, Ndufb8, Ndufa10, Uqcrb, Sdhb, Ppa1, Atp5g2, Ndufb4, Ndufc2, Ndufb2, Ndufa5, Ndufb10, Ndufs3, Ndufa8, Cox11, Ndufa11, Ndufab1, Cox10, Atp5h, Ndufv2, Atp6v1d, Ppa2, Ndufs7, Atp6v0e2, Lhpp, Cox7b2, Ndufv3"
"Non-alcoholic fatty liver disease (NAFLD)",0,0,0,149,128,"Ndufb11, Prkaa1, Prkaa2, Prkab2, Prkag2, Cox6b1, Akt1, Akt2, Atf4, Bax, Bid, Bcl2l11, Casp7, Casp8, Cdc42, Cebpa, Socs3, Cox4i1, Cox5a, Cox5b, Cox6a1, Cox6c, Cox7c, Cox8a, Cycs, Cyp2e1, Ddit3, Eif2s1, Eif2ak3, Fas, Fasl, Ikbkb, Il1a, Il1b, Il6ra, Insr, Irs1, Itch, Jun, Lepr, Ndufa2, Ndufa4, Ndufs4, Ndufv1, Nfkb1, Pik3ca, Pik3cd, Pik3r1, Pik3r2, Pik3r3, Pklr, Ppara, Prkab1, Prkag1, Rac1, Rela, Rxra, Srebf1, Mlxip, Mlx, Tgfb1, Tnfrsf1a, Traf2, Nr1h3, Uqcrq, Uqcrc1, Xbp1, Ndufs8, Ndufs2, Ndufs1, Ndufb6, Akt3, Map3k11, Map3k5, Mapk10, Mapk8, Mapk9, Cox6b2, Irs2, Ndufs6, Ndufa4l2, Ndufa1, Gsk3b, Mlxipl, Ndufs5, Gsk3a, Ndufb5, Sdhc, Ndufa3, Ndufa9, Cox7b, Uqcr10, Ndufb9, Ndufc1, Ndufa12, Ndufa7, Cyc1, Ndufb3, Uqcrh, Uqcr11, Uqcrfs1, Ndufb7, Sdhd, Sdha, Uqcrc2, Ndufa6, Ndufa13, Ndufb8, Ndufa10, Uqcrb, Sdhb, Ndufb4, Ndufc2, Ndufb2, Ndufa5, Ndufb10, Ndufs3, Ndufa8, Adipor2, Ndufa11, Ndufab1, Adipor1, Ndufv2, Pik3cb, Ndufs7, Cox7b2, Ndufv3, Ern1"
"Spliceosome",0,0,0,130,118,"Tra2a, Sf3b3, Snrpd2, Sf3b4, Srsf9, U2af1, Srsf1, Aqr, Dhx15, Ddx5, Srsf10, Hnrnpc, Hnrnpa1, Hnrnpk, Hspa1b, Hspa2, Magoh, Prpf8, Eif4a3, Slu7, Hspa1a, Rbmx, Sf3a2, Sart1, Srsf2, Srsf3, Srsf5, Tra2b, Eftud2, Snrpc, Snrnp70, Snrpb, Snrpb2, Snrpd1, Snrpe, Ddx46, Dhx8, U2af2, Srsf7, Thoc1, Hnrnpa3, Prpf38a, Bud31, U2af1l4, Pcbp1, Txnl4a, Lsm2, Cherp, Prpf19, Usp39, Sf3b2, Snrnp200, Thoc2, Ncbp1, Lsm4, Hnrnpu, Plrg1, Snrpa, Ddx39b, Prpf40b, Pqbp1, Rp9, Ppie, Tcerg1, Prpf40a, Acin1, Srsf4, Isy1, Wbp11, Rbm8a, Dhx38, Cwc15, Lsm7, Ppih, Sf3b5, Snw1, Lsm5, Magohb, Zmat2, Snrnp40, Snrnp27, Ctnnbl1, Rbm22, Crnkl1, Prpf38b, Rbm25, Prpf18, Snrpd3, Xab2, Sf3a1, Lsm3, Puf60, Srsf6, Snrpg, Ncbp2, Bcas2, Phf5a, Syf2, Ppil1, Prpf6, Snrpa1, Prpf31, Dhx16, Snrpf, Prpf4, Prpf3, Cdc5l, Cdc40, Ddx42, Ccdc12, Thoc3, Ddx23, Sf3a3, Smndc1, Hnrnpm, Rbm17, Lsm6, Sf3b1"
"Carbon metabolism",0,0,0,118,94,"H6pd, Psph, Gck, Aldh6a1, Me2, Psat1, Shmt2, Gpt2, Pgd, Acat1, Acat2, Prps2, Pcca, Acadm, Acads, Aco1, Aco2, Adh5, Agxt, Aldoa, Aldoc, Cat, Cs, Dld, Eno1, Eno3, Esd, Fbp1, Fh1, G6pdx, Gapdh, Glud1, Got1, Got2, Gpi1, Hao1, Hk1, Hk2, Idh1, Idh3g, Idh3b, Me1, Mdh2, Mdh1, Mthfr, Mut, Ogdh, Pcx, Pdha1, Pfkl, Pfkm, Pgam1, Pgk1, Pklr, Prps1, Rgn, Rpia, Shmt1, Sucla2, Suclg2, Taldo1, Tkt, Tpi1, Hibch, Cps1, Aldob, Sds, Dlat, Glyctk, Sdsl, Idh2, Prps1l3, Pfkp, Suclg1, Acss2, Sdhc, Pgls, Rpe, Pccb, Sdhd, Sdha, Pgp, Sdhb, Idh3a, Pdhb, Acss1, Csl, Adpgk, Mcee, Ehhadh, Gpt, Dlst, Echs1, Hadha"
"Autophagy - animal",0,0,0,129,116,"Atg14, Prkaa1, Prkaa2, Raf1, Akt1, Akt2, Atg5, Bad, Bcl2, Bcl2l1, Bnip3, Rb1cc1, Cflar, Ctsb, Ctsd, Ctsl, Dapk2, Dapk3, Eif2s1, Eif2ak3, Hif1a, Hmgb1, Igf1r, Irs1, Itpr1, Kras, Lamp1, Lamp2, Mtmr4, Mras, Nras, Igbp1, Pdpk1, Pik3ca, Pik3cd, Pik3r1, Pik3r2, Pik3r3, Prkaca, Prkacb, Prkcd, Prkcq, Ppp2ca, Ppp2cb, Pten, Rab33b, Rab7, Rheb, Rras, Camkk2, Stk11, Atg9b, Zfyve1, Traf6, Tsc2, Ulk1, Vamp8, Pik3c3, Ambra1, Atg4d, Akt3, Atg4c, Atg9a, Map2k1, Map2k2, Map3k7, Mapk1, Mapk10, Mapk3, Mapk8, Mapk9, Eif2ak4, Ulk2, Atg2a, Irs2, Atg13, Rragd, Wipi1, Rragc, Sh3glb1, Becn1, Gabarap, Mlst8, Mtor, Gabarapl1, Rps6kb2, Nrbf2, Tsc1, Atg4b, Atg4a, Rras2, Snap29, Atg12, Akt1s1, Stx17, Atg3, Rraga, Trp53inp2, Dapk1, Rps6kb1, Atg16l2, Atg7, Mtmr3, Rptor, Ddit4, Pik3cb, Wipi2, Pik3r4, Vmp1, Atg2b, Atg16l1, Uvrag, Ern1, Gabarapl2, Mtmr14, Deptor"
"Cellular senescence",0,0,0,175,121,"Traf3ip2, Fbxw11, E2f4, Raf1, Akt1, Akt2, Slc25a4, Slc25a5, Atm, Zfp36l1, Btrc, Calm2, Calm3, Capn1, Capn2, Ccna2, Ccnb2, Ccnd1, Ccnd2, Ccnd3, Ccne1, Ccne2, Cdc25a, Cdk1, Cdk2, Cdk4, Cdk6, Cdkn1a, Cdkn2a, Cdkn2b, Gadd45a, E2f1, E2f3, E2f5, Eif4ebp1, Gata4, Hipk1, Hipk2, Hipk3, Hus1, Igfbp3, Il1a, Itpr1, Itpr2, Itpr3, Kras, Smad2, Smad3, Mapkapk2, Mdm2, Mras, Mre11a, Myc, Gadd45b, Nfatc1, Nfatc2, Nfatc3, Nfkb1, Nras, Sqstm1, Pik3ca, Pik3cd, Pik3r1, Pik3r2, Pik3r3, Ppp1ca, Ppp1cb, Ppp1cc, Ppp3ca, Ppp3cb, Ppp3cc, Ppp3r1, Mapk11, Pten, Rad50, Rb1, Rbbp4, Rbl1, Rbl2, Rela, Rheb, Rras, Lin52, Tgfb1, Tgfb2, Tgfbr1, Tgfbr2, Trp53, Tsc2, Vdac1, Vdac2, Vdac3, Lin54, Rad9b, Akt3, Ets1, Gadd45g, E2f2, Atr, Map2k1, Map2k2, Map2k3, Map2k6, Mapk1, Mapk14, Mapk3, Ccnb1, Nbn, Mapk12, Chek2, Rassf5, Foxo1, Foxo3, Mtor, Trpm7, Tsc1, Rras2, Pik3cb, Calml4, Lin37, Sirt1"
"Biosynthesis of amino acids",0,0,0,75,59,"Psph, Psat1, Cth, Shmt2, Mat2b, Gpt2, Asl, Prps2, Aco1, Aco2, Aldoa, Aldoc, Mat1a, Arg1, Ass1, Bcat2, Cbs, Cs, Eno1, Eno3, Gapdh, Glul, Got1, Got2, Idh1, Idh3g, Idh3b, Otc, Pah, Pcx, Pfkl, Pfkm, Pgam1, Pgk1, Pklr, Prps1, Rpia, Shmt1, Taldo1, Nags, Tkt, Tpi1, Cps1, Aldob, Sds, Mat2a, Tat, Mtr, Sdsl, Idh2, Prps1l3, Pfkp, Pycrl, Rpe, Idh3a, Pycr2, Tha1, Csl, Gpt"
"Insulin signaling pathway",0,0,0,139,111,"Acacb, Phkb, Gck, Rhoq, Ppp1r3e, Prkaa1, Trip10, Acaca, Rapgef1, Prkaa2, Prkab2, Prkag2, Braf, Pygb, Pygl, Raf1, Akt1, Akt2, Araf, Bad, Calm2, Calm3, Cbl, Socs3, Socs1, Crk, Crkl, Eif4e, Eif4ebp1, Elk1, Fasn, Fbp1, Flot1, Flot2, G6pc, Grb2, Gys1, Hk1, Hk2, Ikbkb, Inppl1, Insr, Irs1, Kras, Lipe, Mknk1, Mknk2, Nras, Pck1, Pde3b, Pdpk1, Phkg1, Pik3ca, Pik3cd, Pik3r1, Pik3r2, Pik3r3, Prkaca, Prkacb, Prkci, Pklr, Ppargc1a, Ppp1ca, Ppp1cb, Ppp1cc, Inpp5k, Prkab1, Prkag1, Prkar1a, Prkar2a, Prkar2b, Ptpn1, Ptprf, Rheb, Rps6, Sorbs1, Shc1, Sos1, Sos2, Srebf1, Cblb, Socs2, Tsc2, Ppp1r3d, Gys2, Akt3, Sh2b2, Ppp1r3b, Map2k1, Map2k2, Mapk1, Mapk10, Mapk3, Mapk8, Mapk9, Eif4e2, Irs2, Exoc7, Foxo1, Gsk3b, Mtor, Rps6kb2, Tsc1, Socs4, G6pc3, Phkg2, Rps6kb1, Rptor, Pck2, Pik3cb, Calml4"
"Insulin resistance",0,0,0,108,91,"Acacb, Ppp1r3e, Prkaa1, Prkaa2, Prkab2, Prkag2, Ogt, Pygb, Pygl, Rps6ka3, Akt1, Akt2, Cd36, Socs3, Cpt1a, Cpt1b, Creb1, Creb3, G6pc, Gfpt1, Gfpt2, Gys1, Ikbkb, Insr, Irs1, Ppargc1b, Nfkb1, Nfkbia, Nos3, Pck1, Pdpk1, Pik3ca, Pik3cd, Pik3r1, Pik3r2, Pik3r3, Prkcb, Prkcd, Prkce, Prkcq, Ppara, Ppargc1a, Ppp1ca, Ppp1cb, Ppp1cc, Prkab1, Prkag1, Pten, Ptpn1, Ptpn11, Ptprf, Rela, Rps6ka1, Rps6ka2, Slc2a2, Srebf1, Mlxip, Stat3, Creb3l2, Creb3l3, Tbc1d4, Mlx, Tnfrsf1a, Nr1h3, Nr1h2, Trib3, Ppp1r3d, Gys2, Akt3, Ppp1r3b, Mapk10, Mapk8, Mapk9, Creb3l1, Slc27a1, Slc27a2, Slc27a5, Slc27a3, Slc27a4, Irs2, Foxo1, Gsk3b, Mtor, Mlxipl, Rps6kb2, G6pc3, Rps6kb1, Crtc2, Pck2, Pik3cb, Mgea5"
"Purine metabolism",0,0,0,176,127,"Nt5m, Adcy4, Adcy3, Gmpr2, Nt5c3, Atic, Ampd2, Pde4c, Prps2, Ada, Adcy6, Adcy7, Adcy9, Adk, Adsl, Adssl1, Adss, Ak1, Ak2, Ak4, Ampd3, Aprt, Entpd1, Entpd6, Entpd5, Dck, Gart, Gda, Guk1, Hprt, Itpa, Nme7, Nme1, Nme2, Npr1, Pde1c, Pde3b, Pde4a, Pde4b, Pde6d, Pde7a, Pde8a, Enpp1, Pklr, Pnp, Pola1, Pola2, Pold1, Pold2, Prim1, Prim2, Prps1, Polr1c, Polr1b, Polr1d, Polr1a, Polr2a, Polr2c, Polr2j, Rrm1, Rrm2, Pde2a, Polr3a, Uox, Adcy5, Xdh, Enpp4, Gmps, Npr2, Ppat, Gucy1a2, Pfas, Pde4d, Impdh1, Impdh2, Nt5e, Papss1, Papss2, Pde10a, Pde11a, Pde5a, Polr2h, Polr3e, Adcy10, Dguok, Twistnb, Pde7b, Prps1l3, Rrm2b, Nt5c, Nudt5, Nme6, Ak3, Pole3, Polr1e, Znrd1, Gmpr, Nudt2, Polr2e, Polr2l, Ntpcr, Pgm1, Pnp2, Pole4, Polr3k, Paics, Polr3d, Entpd4, Polr3g, Polr2g, Pold3, Ak8, Polr2d, Pold4, Polr2f, Polr3gl, Polr2i, Polr3f, Polr3b, Pnpt1, Pgm2, Nudt9, Polr3c, Nudt16, Cant1, Nt5c2, Nme3"
"Pyrimidine metabolism",0,0,0,99,83,"Upb1, Nt5m, Nt5c3, Dut, Entpd1, Entpd6, Entpd5, Dck, Nme7, Nme1, Nme2, Enpp1, Pnp, Pola1, Pola2, Pold1, Pold2, Prim1, Prim2, Polr1c, Polr1b, Polr1d, Polr1a, Polr2a, Polr2c, Polr2j, Rrm1, Rrm2, Tk1, Polr3a, Dtymk, Cmpk2, Tyms, Uck1, Umps, Upp1, Nt5e, Polr2h, Polr3e, Twistnb, Uprt, Rrm2b, Nt5c, Ctps, Nme6, Ctps2, Dhodh, Tk2, Pole3, Polr1e, Dpys, Znrd1, Nudt2, Polr2e, Dctpp1, Polr2l, Cmpk1, Pnp2, Pole4, Polr3k, Polr3d, Entpd4, Polr3g, Polr2g, Pold3, Uckl1, Polr2d, Cad, Pold4, Polr2f, Polr3gl, Polr2i, Polr3f, Polr3b, Pnpt1, Cda, Polr3c, Cant1, Upp2, Nt5c2, Nme3, Uck2, Dpyd"
"Lysosome",0,0,0,124,114,"Gga1, Ap4e1, Ap1s2, Atp6v1h, Gusb, Manba, Abca2, Laptm4b, Atp6v0b, Acp2, Acp5, Aga, Gla, Ap1b1, Ap1g1, Ap1g2, Ap1m1, Ap1s1, Ap3b1, Ap3d1, Ap3s1, Ap3s2, Ap4m1, Ap4s1, Arsb, Arsa, Asah1, Atp6v0d1, Atp6v0a1, Atp6v0c, Glb1, Scarb2, Cd63, Cd68, Tpp1, Cln3, Clta, Ctsb, Ctsc, Ctsd, Ctse, Ctsh, Ctsk, Ctsl, Ctss, Ctsw, Dnase2a, Gaa, Galc, Gba, Gm2a, Hexa, Hexb, Hyal1, Ids, Idua, Igf2r, Napsa, Lamp1, Lamp2, Laptm5, Lipa, M6pr, Man2b1, Laptm4a, Naga, Neu1, Npc1, Slc11a1, Slc11a2, Ctsa, Ppt1, Lgmn, Psap, Pla2g15, Smpd1, Sort1, Cln5, Gnptg, Atp6v0a2, Ctso, Slc17a5, Lamp3, Ap1s3, Gga3, Sgsh, Tcirg1, Naglu, Nagpa, Gnptab, Galns, Hgsnat, Cd164, Ppt2, Atp6ap1, Ap3m1, Abcb9, Ctsf, Litaf, Sumf1, Ctsz, Ap3m2, Cltc, Entpd4, Ap4b1, Npc2, Fuca1, Mfsd8, Arsg, Gga2, Cltb, Gns, Ctns, Mcoln1"
"Inositol phosphate metabolism",0,0,0,72,59,"Inpp5f, Synj1, Aldh6a1, Pi4kb, Pip4k2b, Impa2, Pip4k2c, Inpp1, Inpp5b, Inpp5d, Inppl1, Mtmr4, Minpp1, Mtm1, Pik3c2a, Pik3ca, Pik3cd, Pikfyve, Pip5k1c, Pip4k2a, Pip5k1a, Plcb1, Plcb2, Plcb3, Plcb4, Plcd1, Plcg1, Inpp5k, Pten, Synj2, Inpp5a, Itpk1, Mtmr6, Tpi1, Pi4ka, Pik3c3, Itpkc, Inpp4b, Plcg2, Pik3c2b, Impad1, Inpp4a, Pik3cg, Itpkb, Ocrl, Cdipt, Mtmr1, Impa1, Inpp5e, Pi4k2b, Ipmk, Plcd3, Mtmr3, Pik3cb, Ippk, Mtmr2, Sacm1l, Pi4k2a, Mtmr14"
"Phosphatidylinositol signaling system",0,0,0,98,76,"Inpp5f, Synj1, Dgkz, Pi4kb, Pip4k2b, Dgkq, Cds2, Impa2, Pip4k2c, Calm2, Calm3, Dgka, Inpp1, Inpp5b, Inpp5d, Inppl1, Itpr1, Itpr2, Itpr3, Mtmr4, Mtm1, Pik3c2a, Pik3ca, Pik3cd, Pik3r1, Pik3r2, Pik3r3, Pikfyve, Pip5k1c, Pip4k2a, Pip5k1a, Prkcb, Plcb1, Plcb2, Plcb3, Plcb4, Plcd1, Plcg1, Inpp5k, Pten, Synj2, Inpp5a, Itpk1, Mtmr6, Pi4ka, Pik3c3, Dgkd, Ppip5k2, Itpkc, Inpp4b, Plcg2, Pik3c2b, Impad1, Inpp4a, Ip6k1, Itpkb, Ocrl, Ppip5k1, Dgkh, Cdipt, Mtmr1, Impa1, Dgke, Inpp5e, Pi4k2b, Ipmk, Plcd3, Mtmr3, Pik3cb, Calml4, Ippk, Ip6k2, Mtmr2, Sacm1l, Pi4k2a, Mtmr14"
"NOD-like receptor signaling pathway",0,0,0,167,127,"Sharpin, Ticam1, Nod1, Atg5, Birc3, Birc2, Xiap, Rhoa, Bcl2, Bcl2l1, Casp1, Casp4, Casp12, Casp8, Chuk, Camp, Ctsb, Cyba, Cybb, Fadd, Gbp2, Cxcl1, Hsp90ab1, Hsp90aa1, Ifi204, Ifnar1, Ifnar2, Ikbkb, Ikbkg, Il18, Il1b, Irf9, Itpr1, Itpr2, Itpr3, Jak1, Jun, Mfn2, Myd88, Naip2, Naip5, Naip6, Nfkb1, Nfkbia, Nfkbib, P2rx7, Prkcd, Plcb1, Plcb2, Plcb3, Plcb4, Mapk11, Pstpip1, Ripk2, Rela, Ripk1, Ccl2, Ccl5, Stat1, Stat2, Brcc3, Tank, Dhx33, Tlr4, Tnfaip3, Traf2, Traf3, Traf6, Trip6, Txn1, Vdac1, Vdac2, Vdac3, Trpv2, Mavs, Gbp5, Gbp7, Card6, Oas1b, Rnasel, Rbck1, Oas3, Oas2, Oas1a, Map3k7, Mapk1, Mapk10, Mapk14, Mapk3, Mapk8, Mapk9, Irak4, Rnf31, Nlrc4, Nlrx1, Trp53bp1, Trpm2, Mapk12, Nlrp12, Irf7, Irf3, Mefv, Tyk2, Gbp3, Panx1, Tbk1, Gabarap, Ripk3, Txn2, Gabarapl1, Trpm7, Nampt, Nek7, Tab1, Tab3, Pycard, Mfn1, Atg12, Sugt1, Tab2, Gsdmd, Antxr1, Antxr2, Tmem173, Dnm1l, Atg16l1, Gabarapl2"
