"Pathway","pVal","pValFDR","pValBonferroni","Genes","HitGenes","HitGeneNames"
"Metabolic pathways",0,0,0,1307,662,"Pafah2, H6pd, Psph, Acacb, Ugt2b34, Chpf2, Inpp5f, Xylb, Alg9, Rdh9, Upb1, Pnpo, Nt5m, Gck, Cyp27a1, Dgkz, Pld4, Aldh6a1, Adi1, Thtpa, Ppcs, Cyp2c50, Psat1, Acaca, Pi4kb, Uap1, Haao, Cth, Mthfs, Mgat5, Shmt2, B3gnt5, Atic, Galnt7, Mthfd1, Mat2b, Atp6v1h, Gpt2, Sephs1, Ampd2, Hyal3, Maob, Blvra, Cbr3, Dut, Pygb, Pygl, Mpi, Fdps, Pgd, Qdpr, Pigh, Acat2, Dgkq, Prps2, Aldh7a1, Pcca, Hlcs, Acadvl, Acads, Slc33a1, Aco1, Acp2, Acp5, Impa2, Aspa, Ada, Adsl, Adssl1, Gm4737, Ak1, Ak4, Alpl, Alas2, Aldh3a2, Aldoc, Alox12, Alox12e, Pnpla3, Acsm1, Ampd3, Amy1, Aox1, Aprt, Arsb, Atp5g1, Atp6v1a, Atp6v1b2, Baat, Bcat2, Bckdha, Bckdhb, Glb1, Bst1, Bpgm, Cbr1, Cbs, Cdo1, Cel, Chkb, Chka, Ckb, Cmas, Coq7, Cox17, Cox7c, Cpox, Cs, Pcyt1a, Cycs, Cyp1a2, Cyp2a12, Cyp2a4, Cyp2b10, Cyp2c29, Cyp2c37, Cyp2c38, Cyp2j5, Cyp2j6, Cyp3a13, Cyp4a10, Cyp4a12b, Cyp4a14, Cyp51, Cyp7a1, Cyp8b1, Dbt, Dck, Dgat1, Dhcr7, Dhfr, Dld, Dnmt1, Dnmt3a, Dnmt3b, Dpm1, Dpm2, Eno1, Eno3, Ephx2, Ces1e, Ext1, Man2a2, Fah, Fasn, Fdft1, Fech, Fpgs, Ftcd, Fut1, G6pdx, Galc, B4galnt1, Galnt1, Galnt4, Galt, Gapdh, Gart, Gba, Gch1, Gcnt2, Gda, Gfpt1, Gfpt2, Ggps1, Gclc, Galk1, Got1, Gpaa1, Gpam, Pigq, Gss, Guk1, Gys1, Hal, Hao1, Hexb, Hgd, Hk2, Hmbs, Hmgcl, Hmgcr, Hmox1, Lipc, Hsd17b2, Hsd17b7, Hsd3b5, Hyal1, Ids, Idua, Inpp1, Inpp5b, Itpa, Lama3, Lama5, Anpep, Lipg, Lss, Lta4h, Cyp4f13, Mtmr4, Acot8, Acer1, Amacr, Acot2, Galnt10, Acot3, Acot4, Nme7, Rdh11, Minpp1, Ndst2, Mocs2, Me1, Mthfr, Mtm1, Mvk, Ndufv1, Nfs1, Nme1, Nnmt, Nnt, Nsdhl, Odc1, P4ha2, Pafah1b3, Pah, Pcx, Pdha1, Enpp1, Pemt, Pfkl, Pfkm, Pigf, Pik3c2a, Pip5k1a, Pklr, Pla2g1b, Pla2g4a, Plcb1, Plcb2, Plcb3, Plcd1, Plcg1, Pld1, Pld2, Pld3, Pola1, Pola2, Pold1, Pold2, Polg, Ppox, Inpp5k, Prim1, Prim2, Prodh, Prps1, Pipox, Ptdss1, Mvd, Pts, Rdh16, Rev3l, Rpia, Polr1c, Polr1b, Polr1a, Polr2c, Polr2j, Rrm1, Rrm2, Acsm3, Sat1, Shmt1, St6gal1, St3gal3, St3gal1, St3gal2, St6galnac4, Smpd1, Smpd2, Sms, Spr, Sephs2, Sqle, Galnt6, Alg11, Srm, Alg1, Alg3, Akr1d1, Sucla2, Suclg2, Ido2, Synj2, Lpcat1, Pank3, Suox, Pla2g4b, Ado, Aldh4a1, Chpt1, Etnk2, Aldh5a1, Pdxk, Gls2, Xylt2, Nags, Coq6, Pomt2, Itpk1, Gmds, B4galt7, Tk1, Polr3a, Chdh, Mtmr6, Dtymk, Tst, Tsta3, Cmpk2, Tyms, Ugdh, Uck1, Umps, Upp1, Urod, Uros, Mcat, Alg12, Pi4ka, Lclat1, Pik3c3, Pla2g16, Ndufs8, Cyp2c70, Cox15, Nmnat2, Hibch, Ndufs1, Dgkd, Uap1l1, Dolk, Agps, Pigu, Gmps, Coq3, Gba2, Pigv, Galnt11, Ppat, Ugt2b36, Sds, Gys2, Mgam, Itpkc, Blvrb, Csgalnact1, Inpp4b, Plcg2, Sc5d, Dlat, Glyctk, Pfas, Phospho1, Aoc2, Hexdc, Bpnt1, Mtr, Impdh1, Impdh2, Aadat, Nt5e, Papss1, Papss2, Pik3c2b, Pgap1, Dhrs9, Impad1, Ugt2b35, Uroc1, Fkrp, Cyp2r1, Polr2h, Fktn, Mpst, Csad, Sdsl, Aldh1a7, Btd, Gphn, Sptlc1, Gulo, Adh4, B3galt1, B3galt2, Agxt2, Abat, Acot1, Inpp4a, Mgat4a, Mecr, Pank4, Chsy1, Idh2, Lpcat2, Sgsh, Asns, Mthfd1l, Galnt13, Pla2g7, Acsm5, Gyg, Srr, Dguok, Ptdss2, Hsd17b6, Pdhx, Atp5l, Pigs, Cyp4a12a, B3gat2, Dhrs4, Tpk1, Pmm1, Galm, Flad1, Glt28d2, Alg6, Ocrl, Pigl, Prps1l3, Gmppb, Uprt, Cox6b2, Dgkh, Alg10b, Alg8, Rrm2b, Cyp2c54, Ndufs6, Ndufa4l2, Cyp2c68, Nt5c, Polg2, Acsl4, Gne, Galns, St6galnac6, Ctps, Coq5, Hgsnat, Mtmr1, Pla2g6, Fut8, Pmm2, B3galt4, Nme6, Ppt2, Asah2, Hpgds, Extl3, Ctps2, Agpat1, Impa1, Dgke, Nagk, Pigp, Prodh2, Ivd, Apip, B4galt4, B4galt6, Cyp3a25, Pfkp, Suclg1, Sphk2, Mlycd, Alg2, Mocs1, Dhodh, Aldh9a1, Aldh1a3, B4galt3, Mogs, Tk2, Extl2, Pole3, Nampt, C1galt1c1, Ndufs5, Acss2, Cyp4f14, Polr1e, Inpp5e, Dpys, Lpin2, Lpin3, Bhmt2, Ndufb5, Cndp2, Ndufa9, Znrd1, Pycrl, Atp6v1g2, Alg5, Pigyl, Atp6v1c1, Pla2g12a, Polr2e, Dctpp1, Cyc1, Nmnat1, Polr2l, Ntpcr, Crls1, Cyp4a31, Rpe, Pgm1, Pnp2, Alg14, Ppcdc, Mtap, Sdhd, Acad8, Trit1, Pole4, Polr3k, Polr3d, Pi4k2b, Pgp, Mboat2, Qprt, Ears2, Hoga1, Polr3g, Agpat2, Pigm, Alg13, Aldh3b1, Polr2g, Idh3a, Akr1b10, Enoph1, Mri1, Dcxr, Uxs1, Atp5g2, Gnpda2, Nudt12, Hyi, Ndufb2, Ndufa5, Agpat4, Pdhb, Pomgnt1, G6pc3, Uckl1, Pmvk, Cryl1, Fahd1, Pcyt2, Acss1, Ak8, Pycr2, Gmppa, Sat2, Polr2d, Cmbl, Cad, Bdh2, Cox11, Polr2f, Polr3gl, Cyp2c66, Polr2i, Agk, Degs2, Cox10, Polr3f, Polr3b, Kdsr, Kynu, Trak2, Afmid, Galnt14, Coasy, Amdhd1, Ugt2b1, Tha1, Csl, Coq2, Mccc1, Cyp4f18, Pigx, Ugt2a3, Adpgk, Pgm2, Cda, B3gnt3, Plcd3, Aldh1b1, B3gat3, Tm7sf2, Phospho2, Nmnat3, Dmgdh, Ehhadh, Gbe1, Acsl3, Chpf, Gale, Ahcyl2, Polr3c, Sgms2, Pank2, Pgs1, Cyp2j9, Pck2, Etnk1, Ndufs7, Fpgt, Ippk, Ispd, Agmat, Ganc, Grhpr, Atp6v0e2, Gpt, Qrsl1, Upp2, Nt5c2, Mtmr2, Agl, Smpd4, Mmab, Mccc2, Cox7b2, Csgalnact2, Nadsyn1, Pigt, Nme3, Lias, Tusc3, Acox3, Uck2, Sacm1l, Pi4k2a, Glce, Acox2, Echs1, C1galt1, Ugt1a6a, Ptges2, Qars, B3galnt2, Kmo, Rdh10, Lpcat4, Pomt1, Dpyd"
"Ubiquitin mediated proteolysis",0,0,0,138,83,"Gm10705, Ube3c, Fbxo4, Ddb2, Cdc20, Ube2q2, Ube3b, Birc2, Btrc, Socs3, Socs1, Ubox5, Ube4a, Herc2, Anapc1, Mgrn1, Mdm2, Mid1, Pias2, Pml, Siah1a, Siah1b, Cblb, Ube2d1, Cdc34, Cdc27, Ube2o, Ube2e2, Traf6, Ube2e3, Ube2i, Uba3, Ube2a, Ube2b, Ube2g2, Ube3a, Vhl, Pias3, Uba6, Fbxw8, Herc1, Rhobtb2, Map3k1, Ube2z, Cul1, Fbxw7, Keap1, Uba2, Anapc4, Cdc23, Ube2k, Anapc7, Fzr1, Stub1, Ube2l6, Pias4, Ppil2, Cul7, Ube2w, Wwp2, Fancl, Ube2g1, Herc4, Klhl13, Ube2f, Ube2c, Trim37, Anapc10, Anapc13, Rhobtb1, Trim32, Cdc16, Cul2, Ercc8, Cul4b, Herc3, Syvn1, Uba7, Cul5, Ube2s, Nedd4l, Ube2n, Cul4a"
"Purine metabolism",0,0,0,176,105,"Nt5m, Adcy4, Adcy3, Gmpr2, Atic, Ampd2, Pde4c, Prps2, Ada, Adcy7, Adcy9, Adsl, Adssl1, Ak1, Ak4, Ampd3, Aprt, Entpd1, Entpd6, Entpd5, Dck, Gart, Gda, Guk1, Itpa, Nme7, Nme1, Pde1c, Pde3b, Pde4a, Pde4b, Pde7a, Pde8a, Enpp1, Pklr, Pola1, Pola2, Pold1, Pold2, Prim1, Prim2, Prps1, Polr1c, Polr1b, Polr1a, Polr2c, Polr2j, Rrm1, Rrm2, Polr3a, Adcy5, Gmps, Npr2, Ppat, Gucy1a2, Pfas, Pde4d, Impdh1, Impdh2, Nt5e, Papss1, Papss2, Pde10a, Pde11a, Pde5a, Polr2h, Polr3e, Adcy10, Dguok, Pde7b, Prps1l3, Rrm2b, Nt5c, Nudt5, Nme6, Ak3, Pole3, Polr1e, Znrd1, Nudt2, Polr2e, Polr2l, Ntpcr, Pgm1, Pnp2, Pole4, Polr3k, Polr3d, Polr3g, Polr2g, Ak8, Polr2d, Polr2f, Polr3gl, Polr2i, Polr3f, Polr3b, Pnpt1, Pgm2, Nudt9, Polr3c, Nudt16, Cant1, Nt5c2, Nme3"
"Pyrimidine metabolism",0,0,0,99,73,"Upb1, Nt5m, Dut, Entpd1, Entpd6, Entpd5, Dck, Nme7, Nme1, Enpp1, Pola1, Pola2, Pold1, Pold2, Prim1, Prim2, Polr1c, Polr1b, Polr1a, Polr2c, Polr2j, Rrm1, Rrm2, Tk1, Polr3a, Dtymk, Cmpk2, Tyms, Uck1, Umps, Upp1, Nt5e, Polr2h, Polr3e, Uprt, Rrm2b, Nt5c, Ctps, Nme6, Ctps2, Dhodh, Tk2, Pole3, Polr1e, Dpys, Znrd1, Nudt2, Polr2e, Dctpp1, Polr2l, Pnp2, Pole4, Polr3k, Polr3d, Polr3g, Polr2g, Uckl1, Polr2d, Cad, Polr2f, Polr3gl, Polr2i, Polr3f, Polr3b, Pnpt1, Cda, Polr3c, Cant1, Upp2, Nt5c2, Nme3, Uck2, Dpyd"
"Basal transcription factors",0,0,0,43,38,"Taf5l, Taf9, Cdk7, Ercc2, Ercc3, Gtf2h1, Gtf2h4, Mnat1, Gtf2h3, Taf3, Taf6, Tbp, Taf6l, Taf5, Tbpl2, Gtf2b, Gtf2a2, Tbpl1, Gtf2h2, Taf7, Taf1, Taf2, Taf9b, Gtf2ird1, Taf8, Taf12, Gtf2h5, Ccnh, Gtf2e2, Gtf2f2, Taf11, Taf15, Taf4b, Gtf2e1, Taf7l, Gtf2a1, Gtf2f1, Taf13"
"Platinum drug resistance",0,0,0,76,54,"Gstt3, Akt2, Birc2, Birc5, Atm, Atp7a, Bad, Bak1, Bcl2, Bcl2l1, Bid, Casp8, Casp9, Cdkn2a, Abcc2, Cycs, Erbb2, Ercc1, Fadd, Fas, Fasl, Gsta2, Gsta4, Gstm2, Gstm3, Gstm4, Gstm5, Gstm6, Gstp1, Gstt1, Gstt2, Gsto1, Bbc3, Mdm2, Mlh1, Msh2, Msh3, Msh6, Pdpk1, Pik3cd, Pik3r1, Pik3r2, Pik3r3, Rev3l, Top2a, Trp53, Xpa, Akt3, Map3k5, Pmaip1, Mgst3, Gstm7, Pik3cb, Polh"
"Cell cycle",0,0,0,123,76,"E2f4, Cdc20, Atm, Bub1b, Ccna2, Ccnb2, Ccne1, Ccne2, Cdc25a, Cdc25b, Cdk1, Cdc45, Cdk2, Cdk6, Cdk7, Cdkn1b, Cdkn1c, Cdkn2a, Cdkn2b, Cdkn2c, Cdkn2d, Gadd45a, E2f1, E2f3, E2f5, Mad1l1, Smad2, Smad4, Mcm2, Mcm4, Mcm5, Mcm6, Mcm7, Anapc1, Mdm2, Myc, Gadd45b, Orc1, Orc2, Prkdc, Rb1, Rbl1, Tfdp2, Cdc27, Tgfb1, Tgfb2, Cdc14b, Trp53, Wee1, Ywhag, Ywhah, Zbtb17, Cdc14a, E2f2, Atr, Orc4, Orc5, Ccnb1, Pkmyt1, Cul1, Dbf4, Pttg1, Orc3, Chek2, Anapc4, Cdc23, Sfn, Mad2l1, Anapc7, Fzr1, Orc6, Ccnh, Anapc10, Anapc13, Cdc16, Mad2l2"
"Ribosome biogenesis in eukaryotes",0,0,0.001,78,51,"Mdn1, Utp15, Pwp2, Pop5, Fbl, Emg1, Eif6, Utp14b, Tbl3, Bms1, Tcof1, Utp6, Utp18, Heatr1, Lsg1, Wdr36, Rpp38, Nol6, Gnl2, Nxt2, Gnl3l, Xrn1, Dkc1, Wdr3, Imp4, Gnl3, Nhp2, Rpp30, Nop58, Nxt1, Spata5, Rcl1, Pop4, Nop10, Rexo1, Riok2, Nop56, Nvl, Nob1, Pop1, Mphosph10, Gar1, Riok1, Wdr43, Utp14a, Wdr75, Fcf1, Pop7, Rrp7a, Nmd3, Nat10"
"Amino sugar and nucleotide sugar metabolism",0,0,0.001,49,35,"Gck, Uap1, Mpi, Cmah, Cmas, Galt, Gfpt1, Gfpt2, Galk1, Hexb, Hk2, Renbp, Gmds, Tsta3, Ugdh, Uap1l1, Cyb5rl, Amdhd2, Cyb5r4, Pmm1, Cyb5r2, Gmppb, Gne, Pmm2, Gnpnat1, Nagk, Pgm1, Uxs1, Gnpda2, Gmppa, Cyb5r1, Pgm2, Npl, Gale, Fpgt"
"Nucleotide excision repair",0,0,0.001,43,32,"Rfc4, Ddb2, Cdk7, Ercc1, Ercc2, Ercc3, Gtf2h1, Gtf2h4, Lig1, Mnat1, Pold1, Pold2, Rad23a, Rfc2, Rpa2, Gtf2h3, Xpa, Ercc5, Gtf2h2, Cetn2, Ercc6, Ercc4, Pole3, Gtf2h5, Ccnh, Pole4, Rpa3, Rfc3, Ercc8, Rfc5, Cul4b, Cul4a"
"Apoptosis",0,0,0.001,136,80,"Raf1, Actg1, Parp2, Akt2, Birc2, Birc5, Atm, Bad, Bak1, Bcl2, Bcl2a1a, Bcl2a1b, Bcl2l1, Bid, Bcl2l11, Capn1, Casp12, Casp2, Casp6, Casp7, Casp8, Casp9, Chuk, Csf2rb, Csf2rb2, Ctsh, Ctsk, Ctsw, Cycs, Daxx, Gadd45a, Ddit3, Dffa, Dffb, Eif2s1, Eif2ak3, Endog, Fadd, Fas, Fasl, Gzmb, Ikbkb, Ikbkg, Il3ra, Itpr1, Itpr3, Lmna, Lmnb1, Lmnb2, Bbc3, Gadd45b, Pdpk1, Prf1, Pik3cd, Pik3r1, Pik3r2, Pik3r3, Ptpn13, Ripk1, Traf1, Traf2, Trp53, Tuba4a, Tuba1c, Ctso, Parp3, Akt3, Map2k1, Map3k5, Mapk10, Mapk8, Aifm1, Tuba8, Map3k14, Ctsf, Pmaip1, Htra2, Tradd, Pik3cb, Ern1"
"RNA polymerase",0,0,0.001,28,23,"Polr1c, Polr1b, Polr1a, Polr2c, Polr2j, Polr3a, Polr2h, Polr3e, Polr1e, Znrd1, Polr2e, Polr2l, Polr3k, Polr3d, Polr3g, Polr2g, Polr2d, Polr2f, Polr3gl, Polr2i, Polr3f, Polr3b, Polr3c"
"Phosphatidylinositol signaling system",0,0,0.002,98,60,"Inpp5f, Dgkz, Pi4kb, Pip4k2b, Dgkq, Impa2, Pip4k2c, Calm3, Inpp1, Inpp5b, Inpp5d, Inppl1, Itpr1, Itpr3, Mtmr4, Mtm1, Pik3c2a, Pik3cd, Pik3r1, Pik3r2, Pik3r3, Pikfyve, Pip5k1a, Prkcb, Plcb1, Plcb2, Plcb3, Plcd1, Plcg1, Inpp5k, Synj2, Itpk1, Mtmr6, Pi4ka, Pik3c3, Dgkd, Ppip5k2, Itpkc, Inpp4b, Plcg2, Pik3c2b, Impad1, Inpp4a, Ip6k1, Ocrl, Ppip5k1, Dgkh, Mtmr1, Impa1, Dgke, Inpp5e, Pi4k2b, Plcd3, Pik3cb, Calml4, Ippk, Ip6k2, Mtmr2, Sacm1l, Pi4k2a"
"Inositol phosphate metabolism",0,0,0.005,72,46,"Inpp5f, Aldh6a1, Pi4kb, Pip4k2b, Impa2, Pip4k2c, Inpp1, Inpp5b, Inpp5d, Inppl1, Mtmr4, Minpp1, Mtm1, Pik3c2a, Pik3cd, Pikfyve, Pip5k1a, Plcb1, Plcb2, Plcb3, Plcd1, Plcg1, Inpp5k, Synj2, Itpk1, Mtmr6, Pi4ka, Pik3c3, Itpkc, Inpp4b, Plcg2, Pik3c2b, Impad1, Inpp4a, Pik3cg, Ocrl, Mtmr1, Impa1, Inpp5e, Pi4k2b, Plcd3, Pik3cb, Ippk, Mtmr2, Sacm1l, Pi4k2a"
"Aminoacyl-tRNA biosynthesis",0,0,0.007,44,31,"Iars, Lars, Yars, Rars2, Hars, Sepsecs, Mars2, Pstk, Mars, Vars, Aars2, Dars, Dars2, Farsb, Nars2, Cars, Gars, Iars2, Farsa, Ears2, Vars2, Mtfmt, Fars2, Yars2, Wars2, Hars2, Tars2, Cars2, Sars2, Qrsl1, Qars"
"DNA replication",0,0,0.007,35,26,"Rfc4, Fen1, Lig1, Mcm2, Mcm4, Mcm5, Mcm6, Mcm7, Pola1, Pola2, Pold1, Pold2, Prim1, Prim2, Rfc2, Rnaseh1, Rpa2, Ssbp1, Pole3, Pole4, Rnaseh2b, Rnaseh2c, Rpa3, Rfc3, Rnaseh2a, Rfc5"
"Antifolate resistance",0,0.001,0.009,30,23,"Shmt2, Atic, Alox12, Alox12e, Chuk, Abcc2, Dhfr, Folr2, Fpgs, Gart, Ggh, Ikbkb, Ikbkg, Il1b, Abcc1, Mthfr, Shmt1, Slc19a1, Tyms, Abcg2, Abcc5, Slc46a1, Abcc3"
"Autophagy - animal",0,0.001,0.013,129,73,"Atg14, Prkaa1, Prkaa2, Raf1, Akt2, Atg5, Bad, Bcl2, Bcl2l1, Rb1cc1, Eif2s1, Eif2ak3, Hif1a, Igf1r, Irs1, Itpr1, Mtmr4, Mras, Pdpk1, Pik3cd, Pik3r1, Pik3r2, Pik3r3, Prkcq, Rab33b, Camkk2, Stk11, Atg9b, Zfyve1, Traf6, Vamp8, Pik3c3, Ambra1, Atg4d, Akt3, Atg4c, Atg9a, Map2k1, Map3k7, Mapk10, Mapk8, Eif2ak4, Ulk2, Atg2a, Irs2, Atg13, Rragd, Wipi1, Rragc, Mlst8, Mtor, Rps6kb2, Nrbf2, Atg4b, Atg4a, Rras2, Snap29, Atg12, Akt1s1, Stx17, Rraga, Dapk1, Atg16l2, Atg7, Rptor, Pik3cb, Wipi2, Pik3r4, Vmp1, Atg2b, Atg16l1, Ern1, Deptor"
"Insulin signaling pathway",0,0.001,0.021,139,77,"Acacb, Phkb, Gck, Ppp1r3e, Prkaa1, Trip10, Acaca, Prkaa2, Prkab2, Prkag2, Braf, Pygb, Pygl, Raf1, Akt2, Araf, Bad, Calm3, Socs3, Socs1, Crkl, Eif4e, Elk1, Fasn, Flot1, Flot2, Gys1, Hk2, Ikbkb, Inppl1, Irs1, Lipe, Mknk1, Pde3b, Pdpk1, Phkg1, Pik3cd, Pik3r1, Pik3r2, Pik3r3, Prkci, Pklr, Ppargc1a, Ppp1cc, Inpp5k, Prkab1, Prkag1, Prkar2a, Prkar2b, Ptprf, Rps6, Sorbs1, Shc1, Sos1, Sos2, Srebf1, Cblb, Socs2, Ppp1r3d, Gys2, Akt3, Sh2b2, Ppp1r3b, Map2k1, Mapk10, Mapk8, Irs2, Exoc7, Mtor, Rps6kb2, Socs4, G6pc3, Phkg2, Rptor, Pck2, Pik3cb, Calml4"
"RNA degradation",0,0.001,0.023,79,48,"Pan2, Skiv2l, Btg1, Btg3, Eno1, Eno3, Hspd1, Pfkl, Pfkm, Dis3l, Ttc37, Tob1, Patl1, Exosc2, Edc4, Xrn1, Pabpc4l, Lsm2, Exosc5, Dcp1b, Zcchc7, Edc3, Lsm4, Exosc10, Pfkp, C1d, Lsm7, Exosc3, Lsm5, Exosc7, Exosc1, Lsm1, Lsm3, Mphosph6, Cnot8, Dcps, Exosc8, Dcp2, Pnpt1, Cnot2, Dhx36, Pan3, Dis3, Parn, Nudt16, Dcp1a, Lsm6, Cnot10"
"Lysosome",0,0.002,0.041,124,69,"Gga1, Ap4e1, Atp6v1h, Abca2, Laptm4b, Acp2, Acp5, Aga, Gla, Ap1g1, Ap1g2, Ap1m1, Ap1s1, Ap3b1, Ap3s1, Ap3s2, Ap4m1, Ap4s1, Arsb, Glb1, Cd63, Cd68, Cln3, Ctse, Ctsh, Ctsk, Ctsw, Dnase2a, Galc, Gba, Hexb, Hyal1, Ids, Idua, Igf2r, Napsa, Naga, Neu1, Npc1, Slc11a1, Slc11a2, Pla2g15, Smpd1, Sort1, Cln5, Gnptg, Ctso, Slc17a5, Lamp3, Ap1s3, Gga3, Sgsh, Gnptab, Galns, Hgsnat, Ppt2, Ap3m1, Abcb9, Ctsf, Litaf, Sumf1, Ap3m2, Ap4b1, Mfsd8, Arsg, Gga2, Cltb, Ctns, Mcoln1"
"Peroxisome",0,0.002,0.054,83,49,"Pex12, Nudt19, Pecr, Abcd1, Baat, Crat, Ephx2, Gnpat, Hao1, Hmgcl, Acot8, Amacr, Mpv17, Mvk, Pex11a, Pex11b, Pex16, Pex7, Pipox, Abcd3, Abcd4, Pxmp2, Pex5, Slc25a17, Paox, Pex6, Agps, Mpv17l2, Eci2, Abcd2, Idh2, Dhrs4, Acsl4, Pex14, Pex3, Mlycd, Hacl1, Pxmp4, Pex10, Nudt7, Nudt12, Pmvk, Pex1, Pex13, Pex26, Ehhadh, Acsl3, Acox3, Acox2"
"Insulin resistance",0,0.002,0.055,108,61,"Acacb, Ppp1r3e, Prkaa1, Prkaa2, Prkab2, Prkag2, Pygb, Pygl, Rps6ka3, Akt2, Socs3, Cpt1b, Creb3, Gfpt1, Gfpt2, Gys1, Ikbkb, Irs1, Ppargc1b, Pdpk1, Pik3cd, Pik3r1, Pik3r2, Pik3r3, Prkcb, Prkcq, Ppara, Ppargc1a, Ppp1cc, Prkab1, Prkag1, Ptpn11, Ptprf, Rps6ka2, Slc2a2, Srebf1, Creb3l2, Creb3l3, Tbc1d4, Mlx, Nr1h3, Nr1h2, Trib3, Ppp1r3d, Gys2, Akt3, Ppp1r3b, Mapk10, Mapk8, Creb3l1, Slc27a1, Slc27a3, Slc27a4, Irs2, Mtor, Mlxipl, Rps6kb2, G6pc3, Pck2, Pik3cb, Mgea5"
"Osteoclast differentiation",0,0.003,0.081,124,68,"Acp5, Akt2, Calcr, Camk4, Chuk, Socs3, Socs1, Csf1r, Ctsk, Fcgr1, Fcgr3, Fhl2, Fosb, Fosl2, Gab2, Ifnar1, Ifng, Ifngr2, Ikbkb, Ikbkg, Il1a, Il1b, Il1r1, Itgb3, Lck, Lcp2, Blnk, Mitf, Ncf1, Ncf2, Ncf4, Nfatc2, Nfkb2, Pik3cd, Pik3r1, Pik3r2, Pik3r3, Pira2, Lilra6, Pparg, Ppp3cb, Ppp3cc, Ppp3r1, Mapk11, Relb, Stat2, Tec, Tgfb1, Tgfb2, Tgfbr1, Traf2, Traf6, Lilra5, Plcg2, Akt3, Fcgr4, Map2k1, Map2k6, Map2k7, Map3k7, Mapk10, Mapk14, Mapk8, Map3k14, Tyk2, Tab1, Cyld, Pik3cb"
"T cell receptor signaling pathway",0,0.003,0.087,103,58,"Card11, Raf1, Akt2, Bcl10, Cd28, Cd3d, Cd3e, Cd3g, Cd4, Cd8a, Cd8b1, Chuk, Ptpn6, Ifng, Ikbkb, Ikbkg, Il4, Itk, Lat, Lck, Lcp2, Nck2, Nfatc2, Nfkbib, Nfkbie, Pak1, Pak3, Pdpk1, Pik3cd, Pik3r1, Pik3r2, Pik3r3, Prkcq, Plcg1, Ppp3cb, Ppp3cc, Ppp3r1, Mapk11, Rasgrp1, Sos1, Sos2, Cblb, Tec, Cd40lg, Vav1, Vav2, Zap70, Akt3, Malt1, Map2k1, Map2k7, Map3k7, Map3k8, Mapk14, Map3k14, Icos, Pak4, Pik3cb"
"Fanconi anemia pathway",0.001,0.006,0.152,51,32,"Fancf, Fancm, Rad51c, Ercc1, Fancc, Mlh1, Pms2, Rev3l, Rpa2, Fanci, Top3a, Top3b, Usp1, Palb2, Atrip, Atr, Poli, Polk, Ercc4, Slx4, Rev1, Fancg, Fancl, Ube2t, Wdr48, Rpa3, Mus81, Telo2, Fance, Rmi1, Slx1b, Polh"
"NF-kappa B signaling pathway",0.001,0.007,0.2,97,54,"Ticam1, Card11, Erc1, Tirap, Birc2, Atm, Bcl10, Bcl2, Bcl2a1a, Bcl2a1b, Bcl2l1, Chuk, Icam1, Ikbkb, Ikbkg, Il1b, Il1r1, Lat, Lck, Ltb, Blnk, Ly96, Gadd45b, Myd88, Nfkb2, Prkcb, Prkcq, Plcg1, Relb, Ripk1, Ccl4, Cxcl12, Tlr4, Tnfaip3, Cd40, Cd40lg, Traf1, Traf2, Traf3, Traf6, Ube2i, Ticam2, Zap70, Plcg2, Malt1, Map3k7, Irak4, Tnfsf14, Map3k14, Pias4, Tab1, Tab3, Tradd, Tnfrsf13c"
"FoxO signaling pathway",0.001,0.008,0.236,132,70,"Prkaa1, Prkaa2, Prkab2, Prkag2, Braf, Raf1, Akt2, Araf, Atm, Bcl6, Bcl2l11, Ccnb2, Ccng2, Cdk2, Cdkn1b, Cdkn2b, Cdkn2d, Chuk, Plk3, Gadd45a, Egfr, Fasl, Prmt1, Igf1r, Ikbkb, Il7r, Irs1, Sgk3, Smad2, Smad4, Mdm2, Gadd45b, Pdpk1, Pik3cd, Pik3r1, Pik3r2, Pik3r3, Prkab1, Prkag1, Mapk11, Rag1, Sos1, Sos2, Stk11, Plk4, Agap2, Tgfb1, Tgfb2, Tgfbr1, Akt3, Map2k1, Mapk10, Mapk14, Mapk8, Homer1, Homer2, Homer3, Ccnb1, Sgk2, Irs2, Foxo4, Foxo3, Stk4, Fbxo25, Atg12, Fbxo32, G6pc3, Pck2, Pik3cb, Sirt1"
"mTOR signaling pathway",0.001,0.009,0.253,152,79,"Prkaa1, Prkaa2, Atp6v1h, Braf, Raf1, Rps6ka3, Akt2, Atp6v1a, Atp6v1b2, Chuk, Dvl1, Dvl2, Dvl3, Eif4e, Fzd1, Fzd4, Fzd5, Fzd6, Fzd7, Fzd8, Grb10, Igf1r, Ikbkb, Irs1, Nprl3, Pdpk1, Pik3cd, Pik3r1, Pik3r2, Pik3r3, Prkcb, Rps6, Rps6ka2, Slc7a5, Sos1, Sos2, Stk11, Fnip1, Flcn, Wnt11, Wnt9b, Wnt4, Wnt5a, Wnt5b, Stradb, Mapkap1, Sesn2, Akt3, Mios, Map2k1, Slc38a9, Wdr24, Depdc5, Ulk2, Wdr59, Rnf152, Fnip2, Rragd, Rragc, Nprl2, Lamtor3, Mlst8, Mtor, Fzd2, Rps6kb2, Atp6v1g2, Atp6v1c1, Tbc1d7, Akt1s1, Rraga, Telo2, Seh1l, Strada, Rptor, Pik3cb, Tti1, Rictor, Lamtor2, Deptor"
"Glycerophospholipid metabolism",0.001,0.01,0.289,96,53,"Dgkz, Pld4, Dgkq, Chkb, Chka, Pcyt1a, Gpd1, Gpd2, Gnpat, Gpam, Lcat, Pemt, Lypla1, Pla2g1b, Pla2g4a, Pld1, Pld2, Pld3, Ptdss1, Pla2g15, Lpcat1, Pla2g4b, Chpt1, Etnk2, Lclat1, Pla2g16, Lpgat1, Dgkd, Phospho1, Pnpla7, Lypla2, Lpcat2, Ptdss2, Gpd1l, Dgkh, Pnpla6, Pla2g6, Agpat1, Dgke, Lpin2, Lpin3, Pla2g12a, Crls1, Taz, Mboat2, Agpat2, Agpat4, Pcyt2, Gpcpd1, Pgs1, Etnk1, Mboat7, Lpcat4"
"RNA transport",0.001,0.01,0.301,166,85,"Nup107, Thoc5, Pom121, Eif2b3, Eif4ebp3, Elac1, Tgs1, Pop5, Eif1a, Eif2s1, Eif2b4, Eif4e, Nup155, Sumo2, Nup50, Nup62, Pnn, Nup88, Casc3, Eif4a3, Ranbp2, Upf1, Rnps1, Sap18, Smn1, Strap, Eif2b1, Tacc3, Gemin5, Eif2b2, Nup153, Paip1, Ube2i, Aaas, Eif2b5, Thoc1, Rpp38, Nup188, Nup214, Eif4g3, Nupl2, Nup133, Nxt2, Gemin8, Fxr2, Pabpc4l, Eif2s3x, Eif2s3y, Nup54, Nup98, Prmt5, Gemin4, Upf2, Nup85, Ddx20, Rpp30, Nup210, Eif3d, Nxt1, Nup160, Rbm8a, Snupn, Pop4, Magohb, Rae1, Rpp14, Rpp21, Pop1, Ncbp2, Elac2, Nup35, Nup37, Nup43, Trnt1, Nup205, Nup93, Nupl1, Seh1l, Xpo5, Xpot, Thoc3, Pop7, Senp2, Cyfip2, Nmd3"
"Progesterone-mediated oocyte maturation",0.001,0.01,0.328,90,50,"Adcy4, Adcy3, Braf, Raf1, Rps6ka3, Adcy7, Adcy9, Akt2, Araf, Ccna2, Ccnb2, Cdc25a, Cdc25b, Cdk1, Cdk2, Cpeb1, Gnai1, Gnai3, Igf1r, Mad1l1, Anapc1, Pde3b, Pik3cd, Pik3r1, Pik3r2, Pik3r3, Mapk11, Rps6ka2, Stk10, Cpeb3, Cdc27, Adcy5, Cpeb2, Akt3, Map2k1, Mapk10, Mapk14, Mapk8, Ccnb1, Pkmyt1, Anapc4, Cdc23, Mad2l1, Anapc7, Fzr1, Anapc10, Anapc13, Cdc16, Mad2l2, Pik3cb"
"Mismatch repair",0.002,0.012,0.392,22,16,"Rfc4, Lig1, Mlh1, Msh2, Msh3, Msh6, Pms2, Pold1, Pold2, Rfc2, Rpa2, Mlh3, Ssbp1, Rpa3, Rfc3, Rfc5"
"Spliceosome",0.002,0.013,0.445,130,68,"Tra2a, Sf3b3, Sf3b4, Srsf9, U2af1, Aqr, Hnrnpa1, Hspa1b, Hspa2, Eif4a3, Hspa1a, Rbmx, Sf3a2, Eftud2, Snrpc, Snrpb2, Snrpd1, Ddx46, Dhx8, U2af2, Srsf7, Thoc1, Hnrnpa3, Prpf38a, U2af1l4, Txnl4a, Lsm2, Usp39, Lsm4, Plrg1, Snrpa, Prpf40b, Ppie, Tcerg1, Srsf4, Isy1, Rbm8a, Dhx38, Lsm7, Ppih, Lsm5, Magohb, Snrnp40, Ctnnbl1, Crnkl1, Rbm25, Prpf18, Snrpd3, Xab2, Sf3a1, Lsm3, Snrpg, Ncbp2, Bcas2, Phf5a, Ppil1, Snrpa1, Prpf31, Snrpf, Prpf4, Prpf3, Cdc5l, Cdc40, Ddx42, Thoc3, Ddx23, Hnrnpm, Lsm6"
"Hippo signaling pathway - multiple species",0.002,0.014,0.493,26,18,"Wtip, Lats1, Nf2, Pak1, Wwc1, Rassf4, Rassf2, Tead1, Tead2, Tead4, Yap1, Dchs1, Limd1, Fat4, Lats2, Stk3, Rassf1, Mob1b"
"Selenocompound metabolism",0.002,0.015,0.53,17,13,"Cth, Sephs1, Sephs2, Sepsecs, Mars2, Pstk, Mars, Inmt, Mtr, Papss1, Papss2, Txnrd2, Txnrd1"
"EGFR tyrosine kinase inhibitor resistance",0.002,0.015,0.584,79,44,"Braf, Raf1, Akt2, Araf, Bad, Bcl2, Bcl2l1, Bcl2l11, Egfr, Eif4e, Erbb2, Erbb3, Fgfr2, Fgfr3, Gab1, Hgf, Igf1r, Il6ra, Jak2, Met, Nf1, Pdgfa, Pdgfb, Pdgfra, Pdgfrb, Pik3cd, Pik3r1, Pik3r2, Pik3r3, Prkcb, Plcg1, Rps6, Shc1, Sos1, Sos2, Vegfa, Plcg2, Akt3, Map2k1, Foxo3, Mtor, Rps6kb2, Pdgfd, Pik3cb"
"Autophagy - other",0.002,0.015,0.592,32,21,"Atg5, Atg9b, Pik3c3, Atg4d, Atg4c, Atg9a, Ulk2, Atg2a, Atg13, Wipi1, Mlst8, Mtor, Atg4b, Atg4a, Atg12, Atg7, Rptor, Wipi2, Pik3r4, Atg2b, Atg16l1"
"SNARE interactions in vesicular transport",0.002,0.015,0.592,32,21,"Bet1, Sec22b, Stx1a, Stx3, Vamp1, Vamp2, Vamp8, Bnip1, Stx16, Vamp4, Gosr1, Vti1a, Vti1b, Bet1l, Stx8, Ykt6, Stx6, Snap29, Stx17, Stx18, Stx11"
"One carbon pool by folate",0.003,0.016,0.64,19,14,"Aldh1l1, Mthfs, Shmt2, Atic, Mthfd1, Dhfr, Ftcd, Gart, Mthfr, Shmt1, Tyms, Mtr, Mthfd1l, Mtfmt"
"Hematopoietic cell lineage",0.003,0.016,0.646,90,49,"Cd19, Cd1d1, Cd2, Ms4a1, Cd22, Cd24a, Cd34, Cd37, Cd3d, Cd3e, Cd3g, Cd4, Cd5, Cd7, Cd8a, Cd8b1, Cr2, Csf1r, Csf2ra, Csf3r, Epor, Fcer2a, Fcgr1, Flt3l, Gp1ba, Il11ra1, Il1a, Il1b, Il1r1, Il1r2, Il2ra, Il3ra, Il4, Il4ra, Il6ra, Il7r, Itga2, Itga2b, Itga3, Itga4, Itga5, Itga6, Itgam, Itgb3, Anpep, Thpo, Tfrc, Siglech, Cd59b"
"AMPK signaling pathway",0.003,0.016,0.67,125,65,"Acacb, Prkaa1, Acaca, Prkaa2, Prkab2, Prkag2, Adra1a, Akt2, Ccna2, Cpt1b, Creb3, Eef2k, Fasn, Gys1, Hmgcr, Hnf4a, Elavl1, Igf1r, Irs1, Lepr, Lipe, Pfkfb3, Pdpk1, Pfkfb2, Pfkl, Pfkm, Pik3cd, Pik3r1, Pik3r2, Pik3r3, Pparg, Ppargc1a, Prkab1, Prkag1, Camkk2, Srebf1, Creb3l2, Creb3l3, Stk11, Ppp2r5d, Ppp2r5b, Stradb, Gys2, Ppp2r3a, Akt3, Map3k7, Creb3l1, Irs2, Ppp2r2d, Pfkp, Foxo3, Mlycd, Mtor, Tbc1d1, Rps6kb2, Ppp2r3c, Akt1s1, G6pc3, Ppp2r2a, Strada, Ppp2r1b, Rptor, Pck2, Pik3cb, Sirt1"
"Th17 cell differentiation",0.003,0.016,0.684,101,54,"Ahr, Runx1, Cd3d, Cd3e, Cd3g, Cd4, Chuk, Gata3, Hif1a, Ifng, Ifngr2, Ikbkb, Ikbkg, Il12rb1, Il1b, Il1r1, Il1rap, Il2ra, Il2rb, Il4, Il4ra, Il6ra, Irf4, Jak2, Jak3, Lat, Lck, Smad2, Smad4, Nfatc2, Nfkbib, Nfkbie, Prkcq, Plcg1, Ppp3cb, Ppp3cc, Ppp3r1, Mapk11, Rara, Rorc, Foxp3, Stat5a, Tgfb1, Tgfbr1, Zap70, Mapk10, Mapk14, Mapk8, Il27ra, Tyk2, Mtor, Tbx21, Il21r, Il23a"
"Neurotrophin signaling pathway",0.003,0.017,0.743,121,63,"Irak2, Braf, Raf1, Rps6ka3, Akt2, Bad, Bcl2, Bdnf, Calm3, Camk2g, Camk4, Crkl, Fasl, Gab1, Ikbkb, Irs1, Sh2b3, Zfp369, Mapkapk2, Nfkbib, Nfkbie, Ntrk3, Pdpk1, Pik3cd, Pik3r1, Pik3r2, Pik3r3, Plcg1, Mapk11, Psen1, Ptpn11, Ripk2, Rps6ka2, Sh2b1, Shc1, Sort1, Sos1, Sos2, Traf6, Trp53, Plcg2, Akt3, Sh2b2, Map2k5, Mapk7, Map2k1, Map2k7, Map3k1, Map3k3, Map3k5, Mapk10, Mapk14, Mapk8, Irak4, Frs2, Foxo3, Zfp110, Prdm4, Irak3, Pik3cb, Calml4, Kidins220, Maged1"
"Glycosylphosphatidylinositol (GPI)-anchor biosynthesis",0.004,0.02,0.884,25,17,"Pigh, Dpm2, Gpaa1, Pigq, Gpld1, Pigf, Pigu, Pigv, Pgap1, Pigs, Pigl, Pigg, Pigp, Pigyl, Pigm, Pigx, Pigt"
"Propanoate metabolism",0.004,0.021,1,31,20,"Acacb, Aldh6a1, Acaca, Acat2, Pcca, Bckdha, Bckdhb, Dbt, Dld, Sucla2, Suclg2, Hibch, Abat, Echdc1, Suclg1, Mlycd, Acss2, Acss1, Ehhadh, Echs1"
"NOD-like receptor signaling pathway",0.004,0.021,1,167,83,"Sharpin, Ticam1, Nod1, Atg5, Birc2, Bcl2, Bcl2l1, Casp1, Casp12, Casp8, Chuk, Camp, Cybb, Fadd, Cxcl1, Ifnar1, Ikbkb, Ikbkg, Il18, Il1b, Itpr1, Itpr3, Mfn2, Myd88, Naip2, Naip5, Naip6, Nfkbib, Plcb1, Plcb2, Plcb3, Mapk11, Pstpip1, Ripk2, Ripk1, Ccl2, Stat2, Brcc3, Tank, Dhx33, Tlr4, Tnfaip3, Traf2, Traf3, Traf6, Trip6, Trpv2, Gbp5, Card6, Oas1b, Oas3, Oas2, Oas1a, Map3k7, Mapk10, Mapk14, Mapk8, Irak4, Rnf31, Nlrc4, Nlrx1, Trp53bp1, Trpm2, Nlrp12, Irf3, Mefv, Tyk2, Gbp3, Panx1, Tbk1, Ripk3, Nampt, Tab1, Tab3, Pycard, Mfn1, Atg12, Sugt1, Gsdmd, Antxr1, Antxr2, Tmem173, Atg16l1"
"B cell receptor signaling pathway",0.004,0.021,1,70,39,"Card11, Raf1, Akt2, Bcl10, Cd19, Cd22, Cd72, Chuk, Cr2, Ptpn6, Cd79b, Ikbkb, Ikbkg, Inpp5d, Inppl1, Blnk, Nfatc2, Nfkbib, Nfkbie, Pik3cd, Pik3r1, Pik3r2, Pik3r3, Prkcb, Ppp3cb, Ppp3cc, Ppp3r1, Sos1, Sos2, Vav1, Vav2, Plcg2, Akt3, Malt1, Dapp1, Map2k1, Ifitm1, Pik3cb, Pik3ap1"
"Base excision repair",0.004,0.021,1,33,21,"Parp2, Apex1, Fen1, Lig1, Lig3, Mbd4, Ogg1, Polb, Pold1, Pold2, Ung, Xrcc1, Neil3, Parp3, Mpg, Poll, Pole3, Pole4, Smug1, Neil1, Apex2"
"Pantothenate and CoA biosynthesis",0.005,0.024,1,18,13,"Upb1, Ppcs, Bcat2, Enpp1, Pank3, Vnn1, Pank4, Dpys, Ppcdc, Aasdhppt, Coasy, Pank2, Dpyd"
"Sulfur metabolism",0.005,0.026,1,11,9,"Cycs, Suox, Tst, Bpnt1, Papss1, Papss2, Impad1, Mpst, Ethe1"
"TNF signaling pathway",0.006,0.027,1,108,56,"Akt2, Birc2, Bcl3, Casp7, Casp8, Chuk, Socs3, Creb3, Atf6b, Edn1, Fadd, Fas, Cxcl1, Icam1, Ikbkb, Ikbkg, Il15, Il1b, Jag1, Mmp9, Pik3cd, Pik3r1, Pik3r2, Pik3r3, Mapk11, Ripk1, Ccl2, Creb3l2, Creb3l3, Tnfaip3, Tnfrsf1b, Traf1, Traf2, Traf3, Akt3, Map2k1, Map2k4, Map2k6, Map2k7, Map3k5, Map3k7, Map3k8, Mapk10, Mapk14, Mapk8, Creb3l1, Gm5431, Map3k14, Ripk3, Rps6ka4, Tab1, Tab3, Tradd, Pgam5, Mlkl, Pik3cb"
"p53 signaling pathway",0.006,0.029,1,67,37,"Ddb2, Atm, Bid, Casp8, Casp9, Ccnb2, Ccne1, Ccne2, Ccng2, Cdk1, Cdk2, Cdk6, Cdkn2a, Cycs, Gadd45a, Fas, Igfbp3, Bbc3, Mdm2, Mdm4, Gadd45b, Rrm2, Siah1a, Siah1b, Trp53, Zmat3, Sesn2, Atr, Ccnb1, Rrm2b, Chek2, Ppm1d, Sfn, Pmaip1, Perp, Sesn3, Gorab"
"Folate biosynthesis",0.007,0.03,1,26,17,"Qdpr, Alpl, Cbr1, Pcbd1, Dhfr, Fpgs, Gch1, Ggh, Mocs2, Pah, Pts, Spr, Gphn, Mocs1, Akr1b10, Mocos, Pcbd2"
"Non-homologous end-joining",0.007,0.031,1,13,10,"Xrcc4, Fen1, Xrcc6, Mre11a, Prkdc, Xrcc5, Lig4, Polm, Poll, Nhej1"
"Sulfur relay system",0.008,0.034,1,8,7,"Mocs2, Nfs1, Tst, Mpst, Ctu2, Urm1, Mocs3"
"Cysteine and methionine metabolism",0.009,0.039,1,47,27,"Adi1, Cth, Mat2b, Gm4737, Bcat2, Cbs, Cdo1, Dnmt1, Dnmt3a, Dnmt3b, Gclc, Got1, Gss, Sms, Srm, Tst, Sds, Mtr, Mpst, Sdsl, Agxt2, Apip, Bhmt2, Mtap, Enoph1, Mri1, Ahcyl2"
"ABC transporters",0.009,0.039,1,47,27,"Abca2, Abcb7, Abcd1, Abcc2, Abcc1, Abcb1b, Abcb4, Abcb1a, Abcd3, Abcd4, Abcc9, Abca8a, Abca5, Abcc10, Abcg2, Abcd2, Abca8b, Abcg3, Abcg5, Abcb11, Abcc5, Abcc6, Abcb10, Abcb9, Abcb6, Abcb8, Abcc3"
