"Pathway","pVal","pValFDR","pValBonferroni","Genes","HitGenes","HitGeneNames"
"Proteasome",0,0,0,45,29,"POMP, PSMA1, PSMA2, PSMA3, PSMA4, PSMA5, PSMA6, PSMA7, PSMB1, PSMB2, PSMB3, PSMB4, PSMB5, PSMB9, PSMC1, PSMC2, PSMC3, PSMC4, PSMC5, PSMC6, PSMD1, PSMD2, PSMD3, PSMD7, PSMD8, PSMD11, PSMD12, PSMF1, PSMD6"
"RNA transport",0,0,0.001,166,41,"EIF1, SRRM1, SAP18, TACC3, NXF1, RPP40, RPP25L, PABPC5, EIF2S1, EIF2S3, EIF4A1, EIF4B, EIF4G1, EIF4G2, ACIN1, NUP188, CYFIP2, NXT1, PABPC1L2A, NUP43, RPP25, ELAC1, THOC2, RANBP2, RANGAP1, SUMO3, RGPD2, UBE2I, THOC7, RAE1, EIF3A, EIF3B, EIF3I, EIF3J, PABPC4, EIF2B3, EIF2S2, NUP210L, NUP155, RBM8A, THOC1"
"NF-kappa B signaling pathway",0,0,0.001,94,28,"TIRAP, PARP1, CSNK2A2, TICAM1, ERC1, TAB2, LY96, TAB3, LAT, ICAM1, IKBKB, IL1B, CXCL8, IRAK1, MYD88, RELA, BCL2L1, CCL13, SYK, MAP3K7, TLR4, TNFRSF1A, UBE2I, CARD11, RIPK1, TNFRSF11A, CFLAR, CD14"
"Toll-like receptor signaling pathway",0,0.001,0.004,104,28,"TIRAP, MAP3K8, TICAM1, TAB2, LY96, IFNA13, IFNA14, IFNA16, IKBKB, IL1B, CXCL8, IL12A, IRAK1, JUN, MYD88, TOLLIP, MAPK13, MAP2K6, RELA, CCL3, CXCL11, STAT1, MAP3K7, TLR2, TLR4, PIK3R3, RIPK1, CD14"
"PI3K-Akt signaling pathway",0,0.001,0.006,340,66,"CREB3, CHRM2, COL1A2, COL4A2, COL4A3, COL6A1, CREB1, ATF6B, CSF1R, EFNA2, EGFR, EIF4B, EPO, FGF7, FGF8, FGF9, FGF10, FGF12, FGFR3, FLT4, G6PC, GH2, GNG3, GNG4, GNG10, LPAR4, GYS2, NR4A1, TNC, IFNA13, IFNA14, IFNA16, IKBKB, IL3, IL3RA, ITGA1, ITGA5, ITGAV, ITGB1, ITGB3, KRAS, LAMA4, LAMA5, NGFR, PDGFRA, PDGFRB, PDPK1, PPP2CB, PPP2R5A, PPP2R5E, PKN2, PRL, RELA, BCL2L1, TNN, SYK, TLR2, TLR4, HSP90B1, YWHAG, YWHAH, PIK3R3, CCND2, CCND3, CCNE1, CREB3L1"
"Spliceosome",0,0.005,0.029,132,31,"BCAS2, PPIH, PRPF8, SF3B2, LSM6, HNRNPA1L2, CCDC12, SNW1, ACIN1, SF3B1, LSM4, PRPF31, HNRNPC, HNRNPM, SNU13, SF3B6, PLRG1, XAB2, THOC2, SRSF1, SRSF2, SRSF3, TRA2B, SNRPC, SNRPD3, PHF5A, PRPF38A, EFTUD2, CDC5L, RBM8A, THOC1"
"Regulation of actin cytoskeleton",0,0.007,0.052,211,43,"ARPC1B, CFL1, CFL2, CHRM2, DIAPH1, EGFR, SPATA13, FGF7, FGF8, FGF9, FGF10, FGF12, FGFR3, MRAS, PIP5K1C, CYFIP2, GIT1, MYLPF, PFN3, ITGA1, ITGA5, ITGAM, ITGAV, ITGB1, ITGB3, KRAS, MOS, PDGFRA, PDGFRB, PFN1, SSH3, PXN, MYL7, BDKRB1, BDKRB2, BRAF, VCL, MYH14, PIK3R3, MYLK2, CD14, ARHGEF6, CDC42"
"Cytokine-cytokine receptor interaction",0,0.007,0.053,270,52,"CXCL13, EDAR, CCR8, CNTFR, CSF1R, CSF2, CX3CR1, EDA, EGFR, EPO, FLT4, GH2, CXCR3, IL19, IFNA13, IFNA14, IFNA16, IL1A, IL1B, IL3, IL3RA, CXCL8, IL12A, IL12RB2, TNFRSF9, IL17A, NGFR, IL21R, IL22, PDGFRA, PDGFRB, PF4, PRL, TNFRSF17, CCL3, CCL7, CCL13, CCL15, CCL18, CXCL11, CXCR5, BMP7, BMPR1B, XCL2, TGFB2, THPO, TNFRSF1A, TNFRSF4, CXCR4, PLEKHO2, TNFRSF11A, TNFRSF8"
"Thyroid hormone synthesis",0,0.007,0.066,74,20,"CREB3, CGA, CREB1, ATF6B, ATP1B4, GPX1, GPX3, HSPA5, ITPR3, ASGR1, ATP1A3, ATP1B2, ATP1B3, SLC26A4, PLCB4, SLC5A5, HSP90B1, TTR, CREB3L1, PDIA4"
"MAPK signaling pathway",0.001,0.015,0.158,255,48,"DUSP10, MAP3K8, DUSP5, DUSP6, DUSP7, EGFR, ELK4, FGF7, FGF8, FGF9, FGF10, FGF12, FGFR3, MRAS, TAB2, PLA2G4D, NR4A1, IKBKB, IL1A, IL1B, JUN, KRAS, STMN1, MAX, MAP3K3, MOS, TAOK3, PDGFRA, PDGFRB, PLA2G4A, PPP3R2, MAPK13, MAP2K6, RAP1A, RELA, BRAF, MAP3K7, TGFB2, TNFRSF1A, CACNA1C, CACNA2D1, CACNB4, MAPKAPK3, JMJD7-PLA2G4B, CACNA2D2, CD14, CDC25B, CDC42"
"TNF signaling pathway",0.001,0.015,0.162,108,25,"DNM1L, CREB3, MAP3K8, CREB1, ATF6B, CSF2, JAG1, EDN1, PGAM5, TAB2, TAB3, ICAM1, IKBKB, IL1B, JUN, MAPK13, MAP2K6, RELA, BCL3, MAP3K7, TNFRSF1A, PIK3R3, RIPK1, CFLAR, CREB3L1"
"Rap1 signaling pathway",0.001,0.015,0.183,210,41,"RAPGEF3, CSF1R, CTNND1, DRD2, EFNA2, EGFR, FGF7, FGF8, FGF9, FGF10, FGF12, FGFR3, MRAS, FLT4, LAT, GNAI3, GNAO1, LPAR4, PFN3, ITGAM, ITGB1, ITGB3, KRAS, NGFR, PLCE1, PDGFRA, PDGFRB, PFN1, PLCB4, PRKD1, MAPK13, MAP2K6, PARD3, RAP1A, BRAF, TLN2, PARD6G, PIK3R3, SKAP1, RAPGEF5, CDC42"
"NOD-like receptor signaling pathway",0.001,0.02,0.266,168,34,"DNM1L, NAMPT, IRF9, TXNIP, GABARAPL2, ANTXR2, TICAM1, TAB2, TAB3, PYDC1, GBP2, IFNA13, IFNA14, IFNA16, IKBKB, IL1B, CXCL8, ITPR3, JUN, MEFV, MYD88, NFKBIB, PLCB4, MAPK13, NLRC4, RELA, BCL2L1, STAT1, MAP3K7, TLR4, NLRX1, GSDMD, RIPK1, NLRP12"
"Leukocyte transendothelial migration",0.001,0.02,0.284,112,25,"CDH5, RAPGEF3, CLDN19, CTNND1, PTK2B, CLDN14, CLDN15, GNAI3, MYLPF, ICAM1, ITGAM, ITGB1, ARHGAP5, CLDN11, MAPK13, PXN, MYL7, RAP1A, VCL, CXCR4, JAM3, PIK3R3, CLDN6, CLDN2, CDC42"
"Osteoclast differentiation",0.002,0.025,0.399,127,27,"SIRPB1, IRF9, CREB1, CSF1R, CYLD, FHL2, TAB2, LILRA5, IKBKB, IL1A, IL1B, ITGB3, JUN, PPP3R2, MAPK13, MAP2K6, RELA, SPI1, STAT1, SYK, MAP3K7, TGFB2, TNFRSF1A, CALCR, PIK3R3, TNFRSF11A, GAB2"
"Chemokine signaling pathway",0.002,0.025,0.401,185,36,"CXCL13, CCR8, CX3CR1, GRK2, PTK2B, SHC2, GNAI3, GNG3, GNG4, GNG10, CXCR3, GRK4, GSK3A, IKBKB, CXCL8, KRAS, NFKBIB, PF4, PLCB4, PARD3, PXN, RAP1A, RELA, CCL3, CCL7, CCL13, CCL15, CCL18, CXCL11, CXCR5, BRAF, STAT1, XCL2, CXCR4, PIK3R3, CDC42"
"AGE-RAGE signaling pathway in diabetic complications",0.002,0.034,0.584,99,22,"COL1A2, COL4A2, COL4A3, DIAPH1, AGER, EDN1, EGR1, ICAM1, IL1A, IL1B, CXCL8, JUN, KRAS, SMAD4, PLCE1, PLCB4, MAPK13, RELA, STAT1, TGFB2, PIK3R3, CDC42"
"RIG-I-like receptor signaling pathway",0.003,0.037,0.666,70,17,"CYLD, DDX3X, IFNA13, IFNA14, IFNA16, IKBKB, CXCL8, IL12A, NFKBIB, OTUD5, MAPK13, RELA, IFIH1, MAP3K7, NLRX1, RIPK1, ISG15"
"Focal adhesion",0.003,0.038,0.729,198,37,"COL1A2, COL4A2, COL4A3, COL6A1, DIAPH1, EGFR, FLT4, PIP5K1C, SHC2, MYLPF, TNC, ITGA1, ITGA5, ITGAV, ITGB1, ITGB3, JUN, LAMA4, LAMA5, ARHGAP5, PDGFRA, PDGFRB, PDPK1, PXN, MYL7, RAP1A, TNN, BRAF, VCL, CAPN2, TLN2, PIK3R3, MYLK2, CAV3, CCND2, CCND3, CDC42"
"Vasopressin-regulated water reabsorption",0.004,0.05,1,44,12,"CREB3, CREB1, DYNC1H1, DYNC1I1, DYNC1I2, AQP4, ARHGDIB, DCTN4, DYNC2LI1, RAB5A, DYNLL1, CREB3L1"
"Relaxin signaling pathway",0.005,0.055,1,130,26,"CREB3, RLN3, COL1A2, COL4A2, COL4A3, CREB1, ATF6B, EDN1, EGFR, SHC2, GNA15, GNAI3, GNAO1, GNG3, GNG4, GNG10, INSL3, JUN, KRAS, PLCB4, MAPK13, ACTA2, RELA, RLN2, PIK3R3, CREB3L1"
"Ras signaling pathway",0.005,0.062,1,226,40,"RASA4, CSF1R, EFNA2, EGFR, FGF7, FGF8, FGF9, FGF10, FGF12, FGFR3, MRAS, RASA3, FLT4, SHC2, PLA2G2D, LAT, GNG3, GNG4, GNG10, KSR2, PLA2G4D, IKBKB, KRAS, NGFR, PLCE1, PDGFRA, PDGFRB, PLA2G4A, RAB5A, RAP1A, RELA, BCL2L1, BRAP, PLA2G6, PIK3R3, JMJD7-PLA2G4B, RASAL2, RAPGEF5, GAB2, CDC42"
"Protein processing in endoplasmic reticulum",0.006,0.067,1,166,31,"BCAP31, STUB1, SEC23B, HSPH1, SEC63, UBE2J2, ATF6B, DAD1, EIF2S1, SEC31B, PDIA3, SEC61A1, DNAJB2, DNAJA1, HSPA5, P4HB, PARK2, DERL2, YOD1, NSFL1C, EIF2AK2, UBQLN4, BAG1, DNAJC1, HSP90B1, VCP, LMAN1L, CALR, CAPN2, RNF185, PDIA4"
"Thyroid hormone signaling pathway",0.008,0.085,1,116,23,"RCAN2, SLC16A10, ATP1B4, SIN3A, HDAC2, ITGAV, ITGB3, KRAS, MYH6, ATP1A3, ATP1B2, ATP1B3, NOTCH4, PLCE1, PDPK1, PLCB4, SLCO1C1, SLC2A1, STAT1, PIK3R3, KAT2B, MED14, TBC1D4"
"Notch signaling pathway",0.009,0.085,1,48,12,"JAG1, DTX1, SNW1, NCSTN, HDAC2, RBPJ, MFNG, NOTCH4, APH1A, MAML2, KAT2B, NUMBL"
"Aldosterone-regulated sodium reabsorption",0.009,0.086,1,37,10,"ATP1B4, SFN, KRAS, ATP1A3, ATP1B2, ATP1B3, PDPK1, SCNN1A, SCNN1G, PIK3R3"
"Phagosome",0.01,0.092,1,151,28,"TCIRG1, DYNC1H1, DYNC1I1, DYNC1I2, SEC61A1, HLA-DQA2, ITGA5, ITGAM, ITGAV, ITGB1, ITGB3, LAMP1, MSR1, ATP6V0A4, ATP6V1B2, STX18, ATP6AP1, RAB5A, CLEC7A, TAP1, TLR2, TLR4, TUBA4A, TUBA1A, CALR, RILP, ATP6V0E1, CD14"
"Serotonergic synapse",0.011,0.097,1,112,22,"RAPGEF3, ALOX5, ALOX15, GABRB2, GABRB3, GNAI3, GNAO1, GNG3, GNG4, GNG10, PLA2G4D, HTR1A, HTR3A, HTR6, ITPR3, KRAS, PLA2G4A, PLCB4, SLC18A2, BRAF, CACNA1C, JMJD7-PLA2G4B"
"Ether lipid metabolism",0.014,0.118,1,45,11,"CEPT1, ENPP6, LPCAT4, PLA2G2D, PLA2G4D, PAFAH1B3, PAFAH2, PLA2G4A, PLA2G6, PLPP1, JMJD7-PLA2G4B"
"Hematopoietic cell lineage",0.016,0.133,1,96,19,"CSF1R, CSF2, DNTT, EPO, GP1BA, HLA-DQA2, IL1A, IL1B, IL3, IL3RA, ITGA1, ITGA5, ITGAM, ITGB3, MME, THPO, CD14, CD33, CD37"
"Protein digestion and absorption",0.017,0.136,1,90,18,"SLC7A9, SLC16A10, COL1A2, COL4A2, COL4A3, COL6A1, COL10A1, COL17A1, CTRB1, ATP1B4, KCNQ1, MEP1A, MME, ATP1A3, ATP1B2, ATP1B3, SLC3A2, SLC7A7"
"Mitophagy - animal",0.018,0.14,1,65,14,"GABARAPL2, CSNK2A2, PGAM5, MRAS, ATG9B, JUN, KRAS, PARK2, RELA, BCL2L1, TBC1D15, SP1, UBB, USP30"
"Insulin secretion",0.02,0.15,1,85,17,"CREB3, ADCYAP1R1, CREB1, ATF6B, ATP1B4, GNA11, ITPR3, KCNJ11, KCNN1, ATP1A3, ATP1B2, ATP1B3, PLCB4, SLC2A1, STX1A, CACNA1C, CREB3L1"
"Long-term depression",0.021,0.155,1,60,13,"GNA11, GNAI3, GNAO1, PLA2G4D, GRIA3, GUCY1B3, ITPR3, KRAS, PLA2G4A, PLCB4, PPP2CB, BRAF, JMJD7-PLA2G4B"
"Fc epsilon RI signaling pathway",0.023,0.164,1,67,14,"CSF2, ALOX5, LAT, PLA2G4D, IL3, KRAS, PDPK1, PLA2G4A, MAPK13, MAP2K6, SYK, PIK3R3, JMJD7-PLA2G4B, GAB2"
"Neuroactive ligand-receptor interaction",0.024,0.167,1,277,44,"CGA, CHRM2, CHRNA4, GRIN3A, GRIN3B, ADCYAP1R1, LTB4R, ADORA3, ADRB2, DRD2, DRD5, FPR3, GABRA2, GABRA5, GABRA6, GABRB2, GABRB3, GABRE, GH2, NPBWR2, LPAR4, MLNR, GRIA3, GRIN2D, HRH2, HTR1A, HTR6, MC2R, MTNR1B, OPRM1, AVPR1A, PRL, PARD3, NMUR2, PTGER2, PTGIR, BDKRB1, BDKRB2, SSTR4, TACR1, TACR3, VIPR1, CALCR, S1PR2"
"cAMP signaling pathway",0.025,0.171,1,198,33,"RAPGEF3, CREB3, CFTR, CHRM2, GRIN3A, GRIN3B, ADCYAP1R1, CREB1, ADRB2, DRD2, DRD5, ATP1B4, GNAI3, GRIA3, GRIN2D, HTR1A, HTR6, HCAR2, JUN, MC2R, ATP1A3, ATP1B2, ATP1B3, NPY, ATP2B3, PLCE1, PTGER2, RAP1A, RELA, BRAF, CACNA1C, PIK3R3, CREB3L1"
"T cell receptor signaling pathway",0.029,0.19,1,102,19,"MAP3K8, CSF2, LAT, IKBKB, JUN, KRAS, NFKBIB, NFKBIE, PDPK1, PPP3R2, MAPK13, PTPN6, PTPRC, RELA, MAP3K7, CARD11, PIK3R3, CD28, CDC42"
"Adrenergic signaling in cardiomyocytes",0.031,0.196,1,144,25,"RAPGEF3, CREB3, CREB1, ATF6B, ADRB2, ATP1B4, GNAI3, KCNE1, KCNQ1, MYH6, ATP1A3, ATP1B2, ATP1B3, ATP2B3, PLCB4, PPP2CB, PPP2R5A, PPP2R5E, MAPK13, TNNT2, CACNA1C, CACNA2D1, CACNB4, CREB3L1, CACNA2D2"
"Base excision repair",0.035,0.216,1,33,8,"POLD3, PARP1, LIG1, MUTYH, PCNA, POLB, POLE, POLD4"
"Sphingolipid signaling pathway",0.036,0.216,1,118,21,"SGPP2, ADORA3, CTSD, CERS3, GNAI3, KRAS, ASAH1, PDPK1, PLCB4, PPP2CB, PPP2R5A, PPP2R5E, MAPK13, RELA, BDKRB2, SMPD2, TNFRSF1A, PIK3R3, SGPL1, S1PR2, GAB2"
"GnRH signaling pathway",0.04,0.237,1,92,17,"CGA, EGFR, PTK2B, GNA11, GNRH2, PLA2G4D, ITPR3, JUN, KRAS, MAP3K3, PLA2G4A, PLCB4, MAPK13, MAP2K6, CACNA1C, JMJD7-PLA2G4B, CDC42"
"Lysine degradation",0.041,0.237,1,59,12,"EHMT2, EZH1, ALDH2, ALDH3A2, HADHA, KMT5B, ASH1L, SETMAR, SUV39H1, SUV39H2, EHMT1, PLOD3"
"Jak-STAT signaling pathway",0.044,0.245,1,156,26,"IRF9, CNTFR, CSF2, EPO, GH2, IL19, IFNA13, IFNA14, IFNA16, IL3, IL3RA, IL12A, IL12RB2, IL21R, IL22, PRL, PTPN2, PTPN6, BCL2L1, STAT1, THPO, PIK3R3, SOCS2, CCND2, CCND3, IL27RA"
"Endocrine and other factor-regulated calcium reabsorption",0.045,0.245,1,47,10,"CLTA, CLTC, DNM1, ATP1B4, ATP1A3, ATP1B2, ATP1B3, PLCB4, TRPV5, BDKRB2"
"Th17 cell differentiation",0.045,0.245,1,107,19,"GATA3, LAT, HLA-DQA2, IKBKB, IL1B, IL17A, JUN, SMAD4, NFKBIB, NFKBIE, IL21R, IL22, PPP3R2, MAPK13, RELA, RORA, STAT1, RUNX1, IL27RA"
"Protein export",0.047,0.247,1,23,6,"SEC63, SEC61A1, HSPA5, SRP54, SRP68, SEC11C"
"Dopaminergic synapse",0.052,0.27,1,130,22,"CREB3, CREB1, ATF6B, DRD2, DRD5, GNAI3, GNAO1, GNG3, GNG4, GNG10, GRIA3, GSK3A, ITPR3, PLCB4, PPP2CB, PPP2R5A, PPP2R5E, MAPK13, SLC6A3, SLC18A2, CACNA1C, CREB3L1"
"Apoptosis",0.055,0.27,1,138,23,"PARP1, CTSD, EIF2S1, ENDOG, BIRC5, IKBKB, IL3, IL3RA, ITPR3, JUN, KRAS, PDPK1, PMAIP1, DIABLO, RELA, BCL2L1, TNFRSF1A, TUBA4A, TUBA1A, CAPN2, PIK3R3, RIPK1, CFLAR"
"Cell cycle",0.056,0.27,1,124,21,"MAD2L2, PTTG2, E2F3, SFN, HDAC2, SMAD4, MCM3, PCNA, PLK1, ATR, RAD21, BUB1B, TGFB2, YWHAG, YWHAH, CCND2, CCND3, CCNE1, CCNB2, CDC25B, CDC25C"
"ECM-receptor interaction",0.056,0.27,1,82,15,"COL1A2, COL4A2, COL4A3, COL6A1, GP1BA, TNC, ITGA1, ITGA5, ITGAV, ITGB1, ITGB3, AGRN, LAMA4, LAMA5, TNN"
"Ribosome",0.056,0.27,1,131,22,"RPS4Y2, MRPS18C, MRPL4, RPL26L1, RPL3, RPL3L, RPL4, RPL19, RPL23A, RPL24, RPL27, RPL31, RPL32, RPL36AL, RPL37, RPLP2, MRPS12, RPS2, RPS8, RPS27A, MRPL36, RPL23"
"Fc gamma R-mediated phagocytosis",0.062,0.289,1,90,16,"ARPC1B, CFL1, CFL2, PIP5K1C, LAT, PLA2G4D, ASAP1, PLA2G4A, PTPRC, SYK, PLA2G6, PIK3R3, PLPP1, ASAP2, GAB2, CDC42"
"Th1 and Th2 cell differentiation",0.072,0.334,1,92,16,"JAG1, GATA3, LAT, HLA-DQA2, RBPJ, IKBKB, IL12A, IL12RB2, JUN, NFKBIB, NFKBIE, PPP3R2, MAPK13, RELA, STAT1, MAML2"
"Renin secretion",0.077,0.348,1,65,12,"ADCYAP1R1, CREB1, ADRB2, AGT, GNAI3, GUCY1B3, ITPR3, PDE1B, PLCB4, PPP3R2, PTGER2, CACNA1C"
"VEGF signaling pathway",0.083,0.369,1,59,11,"SHC2, PLA2G4D, KRAS, PLA2G4A, PPP3R2, MAPK13, PXN, MAPKAPK3, PIK3R3, JMJD7-PLA2G4B, CDC42"
"Platinum drug resistance",0.085,0.369,1,73,13,"GSTA1, GSTA3, GSTP1, BIRC5, MGST1, MSH2, PDPK1, PMAIP1, BCL2L1, TOP2A, XPA, PIK3R3, GSTO1"
"Phospholipase D signaling pathway",0.087,0.369,1,145,23,"RAPGEF3, DNM1, EGFR, PTK2B, MRAS, PIP5K1C, SHC2, PLA2G4D, LPAR4, CXCL8, KRAS, PDGFRA, PDGFRB, PLA2G4A, PLCB4, AVPR1A, SYK, PIK3R3, DGKZ, DGKE, PLPP1, JMJD7-PLA2G4B, GAB2"
"Apoptosis - multiple species",0.087,0.369,1,33,7,"BIRC8, BIRC5, NGFR, PMAIP1, DIABLO, BCL2L1, TNFRSF1A"
"GABAergic synapse",0.092,0.382,1,88,15,"GABARAPL2, ABAT, GABRA2, GABRA5, GABRA6, GABRB2, GABRB3, GABRE, GNAI3, GNAO1, GNG3, GNG4, GNG10, SLC6A1, CACNA1C"
"Glucagon signaling pathway",0.097,0.394,1,103,17,"CREB3, CREB1, FBP1, G6PC, GYS2, ACACB, ITPR3, LDHB, PDHA1, PGAM2, PHKB, PLCB4, PPP4C, PPP3R2, PYGM, SLC2A1, CREB3L1"
"Necroptosis",0.104,0.416,1,163,25,"DNM1L, IRF9, PARP1, TICAM1, CYLD, PGAM5, ALOX15, CHMP2A, PLA2G4D, IFNA13, IFNA14, IFNA16, IL1A, IL1B, PLA2G4A, H2AFY2, EIF2AK2, PYGM, STAT1, TLR4, TNFRSF1A, CAPN2, JMJD7-PLA2G4B, RIPK1, CFLAR"
"mRNA surveillance pathway",0.107,0.422,1,90,15,"SRRM1, SAP18, NXF1, PAPOLA, PABPC5, ACIN1, SSU72, NXT1, PABPC1L2A, PCF11, PPP2CB, PPP2R5A, PPP2R5E, PABPC4, RBM8A"
"Estrogen signaling pathway",0.113,0.438,1,98,16,"CREB3, CREB1, ATF6B, EGFR, SHC2, GNAI3, GNAO1, ITPR3, JUN, KRAS, OPRM1, PLCB4, SP1, HSP90B1, PIK3R3, CREB3L1"
"Linoleic acid metabolism",0.12,0.454,1,29,6,"ALOX15, PLA2G2D, PLA2G4D, PLA2G4A, PLA2G6, JMJD7-PLA2G4B"
"Calcium signaling pathway",0.12,0.454,1,181,27,"CHRM2, ADRB2, DRD5, EGFR, PTK2B, GNA11, GNA15, GRIN2D, HRH2, HTR6, ITPR3, ATP2A1, ATP2B3, PLCE1, PDE1B, PDGFRA, PDGFRB, PHKB, PLCB4, AVPR1A, PPP3R2, BDKRB1, BDKRB2, TACR1, TACR3, CACNA1C, MYLK2"
"Mismatch repair",0.128,0.474,1,23,5,"POLD3, LIG1, MSH2, PCNA, POLD4"
"IL-17 signaling pathway",0.131,0.481,1,93,15,"CSF2, TAB2, TAB3, IKBKB, IL1B, CXCL8, IL17A, JUN, MAPK13, RELA, S100A8, CCL7, SRSF1, MAP3K7, HSP90B1"
"Platelet activation",0.135,0.484,1,123,19,"COL1A2, FGA, GNAI3, GP1BA, PLA2G4D, GUCY1B3, ITGB1, ITGB3, ITPR3, PLA2G4A, PLCB4, MAPK13, PTGIR, RAP1A, SYK, TLN2, PIK3R3, MYLK2, JMJD7-PLA2G4B"
"Pentose phosphate pathway",0.136,0.484,1,30,6,"FBP1, ALDOA, DERA, PGD, PRPS1, TKTL2"
"Neurotrophin signaling pathway",0.164,0.574,1,119,18,"SHC2, BEX3, IKBKB, IRAK1, JUN, KRAS, ARHGDIB, MAP3K3, NFKBIB, NFKBIE, NGFR, PDPK1, MAPK13, RAP1A, RELA, BRAF, PIK3R3, CDC42"
"alpha-Linolenic acid metabolism",0.166,0.575,1,25,5,"PLA2G2D, PLA2G4D, PLA2G4A, PLA2G6, JMJD7-PLA2G4B"
"Cholinergic synapse",0.168,0.575,1,112,17,"CREB3, CHRM2, CHRNA4, CREB1, GNA11, GNAI3, GNAO1, GNG3, GNG4, GNG10, ITPR3, KCNQ1, KRAS, PLCB4, CACNA1C, PIK3R3, CREB3L1"
"Gastric acid secretion",0.171,0.576,1,75,12,"CFTR, ATP1B4, GNAI3, HRH2, ITPR3, KCNQ1, ATP1A3, ATP1B2, ATP1B3, PLCB4, MYLK2, KCNE2"
"Cellular senescence",0.179,0.595,1,159,23,"E2F3, MRAS, LIN9, IGFBP3, IL1A, CXCL8, ITPR3, KRAS, MYBL2, ATR, PPP3R2, MAPK13, MAP2K6, KIR2DL5A, RELA, TGFB2, CAPN2, PIK3R3, CCND2, CCND3, CCNE1, CCNB2, LIN52"
"Glutamatergic synapse",0.187,0.614,1,114,17,"GRIN3A, GRIN3B, GRK2, GNAI3, GNAO1, GNG3, GNG4, GNG10, PLA2G4D, GRIA3, GRIN2D, ITPR3, PLA2G4A, PLCB4, PPP3R2, CACNA1C, JMJD7-PLA2G4B"
"Arachidonic acid metabolism",0.193,0.623,1,62,10,"PTGES3, ALOX5, ALOX15, PLA2G2D, PLA2G4D, GPX1, GPX3, PLA2G4A, PLA2G6, JMJD7-PLA2G4B"
"B cell receptor signaling pathway",0.201,0.627,1,70,11,"IKBKB, JUN, KRAS, NFKBIB, NFKBIE, PPP3R2, PTPN6, RELA, SYK, CARD11, PIK3R3"
"Prolactin signaling pathway",0.201,0.627,1,70,11,"CGA, SHC2, KRAS, MAPK13, PRL, RELA, STAT1, PIK3R3, TNFRSF11A, SOCS2, CCND2"
"Valine, leucine and isoleucine degradation",0.202,0.627,1,48,8,"ABAT, ALDH2, ALDH3A2, HADHA, HMGCS1, HMGCS2, ACADSB, IVD"
"Tight junction",0.206,0.627,1,170,24,"ACTR2, CFTR, CLDN19, CLDN14, CLDN15, HCLS1, ITGB1, JUN, CLDN11, PCNA, PPP2CB, PARD3, RAP1A, TUBA4A, TUBA1A, MYH14, JAM3, PARD6G, YBX3, RUNX1, MPDZ, CLDN6, CLDN2, CDC42"
"Synaptic vesicle cycle",0.207,0.627,1,63,10,"TCIRG1, CLTA, CLTC, DNM1, ATP6V0A4, ATP6V1B2, SLC18A2, STX1A, SYT1, ATP6V0E1"
"cGMP-PKG signaling pathway",0.213,0.638,1,163,23,"CREB3, CREB1, ATF6B, ADORA3, ADRB2, ATP1B4, GNA11, GNAI3, GUCY1B3, ITPR3, ATP1A3, ATP1B2, ATP1B3, ATP2A1, ATP2B3, PLCB4, PPP3R2, BDKRB2, TRPC6, CACNA1C, MYLK2, PDE5A, CREB3L1"
"Circadian entrainment",0.242,0.717,1,96,14,"ADCYAP1R1, CREB1, GNAI3, GNAO1, GNG3, GNG4, GNG10, GRIA3, GRIN2D, GUCY1B3, ITPR3, MTNR1B, PLCB4, CACNA1C"
"DNA replication",0.249,0.728,1,36,6,"POLD3, LIG1, MCM3, PCNA, POLE, POLD4"
"Autophagy - animal",0.252,0.728,1,128,18,"RRAGA, GABARAPL2, CTSD, EIF2S1, MRAS, WIPI2, ATG9B, KRAS, LAMP1, SH3GLB1, PDPK1, STX17, PPP2CB, BCL2L1, MAP3K7, PIK3R3, CFLAR, ATG13"
"Terpenoid backbone biosynthesis",0.259,0.728,1,22,4,"FDPS, HMGCS1, HMGCS2, MVK"
"Other types of O-glycan biosynthesis",0.259,0.728,1,22,4,"POFUT1, MFNG, OGT, PLOD3"
"Aldosterone synthesis and secretion",0.26,0.728,1,82,12,"CREB3, CREB1, ATF6B, GNA11, NR4A1, ITPR3, LDLR, MC2R, PLCB4, PRKD1, CACNA1C, CREB3L1"
"p53 signaling pathway",0.281,0.761,1,68,10,"SFN, IGFBP3, MDM4, GTSE1, PMAIP1, ATR, CCND2, CCND3, CCNE1, CCNB2"
"Insulin resistance",0.282,0.761,1,107,15,"CREB3, CREB1, G6PC, GYS2, ACACB, IKBKB, PDPK1, PYGM, RELA, SLC2A1, TNFRSF1A, OGT, PIK3R3, CREB3L1, TBC1D4"
"Endocytosis",0.285,0.761,1,243,32,"ARPC1B, RAB35, CLTA, CLTC, WIPF2, GRK2, DNM1, EGFR, FGFR3, PIP5K1C, CHMP2A, GRK4, GIT1, EPN1, ARF5, LDLR, ASAP1, VPS36, SH3GLB1, PDGFRA, VPS37C, PARD3, SH3GLB2, RAB4A, RAB5A, TSG101, UBB, CXCR4, PARD6G, CAV3, ASAP2, CDC42"
"Proximal tubule bicarbonate reclamation",0.287,0.761,1,23,4,"ATP1B4, ATP1A3, ATP1B2, ATP1B3"
"Fanconi anemia pathway",0.287,0.761,1,53,8,"FANCE, FANCG, ATR, RAD51, BRCA2, USP1, PALB2, SLX4"
"Glutathione metabolism",0.305,0.8,1,54,8,"GPX1, GPX3, GSTA1, GSTA3, GSTP1, MGST1, PGD, GSTO1"
"Pyruvate metabolism",0.312,0.81,1,39,6,"ALDH2, ALDH3A2, ACACB, LDHB, PC, PDHA1"
"RNA degradation",0.315,0.81,1,78,11,"TOB1, LSM6, PABPC5, LSM4, PABPC1L2A, PARN, EXOSC10, EXOSC4, EXOSC5, WDR61, PABPC4"
"Cytosolic DNA-sensing pathway",0.327,0.814,1,63,9,"IFNA13, IFNA14, IFNA16, IKBKB, IL1B, NFKBIB, POLR2F, RELA, RIPK1"
"Autophagy - other",0.327,0.814,1,32,5,"GABARAPL2, WIPI2, ATG9B, PPP2CB, ATG13"
"Cell adhesion molecules (CAMs)",0.331,0.814,1,143,19,"CDH5, CLDN19, ALCAM, CLDN14, CADM1, CLDN15, HLA-DQA2, ICAM1, ITGAM, ITGAV, ITGB1, NCAM1, CLDN11, PTPRC, CNTN2, JAM3, CLDN6, CLDN2, CD28"
"Synthesis and degradation of ketone bodies",0.336,0.814,1,10,2,"HMGCS1, HMGCS2"
"AMPK signaling pathway",0.345,0.814,1,120,16,"CREB3, CFTR, CREB1, FBP1, G6PC, EEF2K, GYS2, ACACB, RAB14, PDPK1, PPP2CB, PPP2R5A, PPP2R5E, MAP3K7, PIK3R3, CREB3L1"
"Adherens junction",0.346,0.814,1,72,10,"CSNK2A2, CTNND1, EGFR, SMAD4, PARD3, PTPN6, MAP3K7, VCL, NECTIN4, CDC42"
"Biosynthesis of amino acids",0.346,0.814,1,72,10,"ALDOA, GAPDH, MAT2A, MTR, ACO2, PC, PGAM2, PRPS1, PYCRL, TKTL2"
"Pancreatic secretion",0.347,0.814,1,96,13,"CFTR, CTRB1, ATP1B4, PLA2G2D, ITPR3, KCNQ1, ATP1A3, ATP1B2, ATP1B3, ATP2A1, ATP2B3, PLCB4, RAP1A"
"Gap junction",0.347,0.814,1,88,12,"DRD2, EGFR, GNA11, GNAI3, GUCY1B3, ITPR3, KRAS, PDGFRA, PDGFRB, PLCB4, TUBA4A, TUBA1A"
"Homologous recombination",0.356,0.827,1,41,6,"POLD3, SYCP3, POLD4, RAD51, BRCA2, PALB2"
"Inflammatory mediator regulation of TRP channels",0.361,0.827,1,97,13,"PLA2G4D, IL1B, ITPR3, PLA2G4A, PLCB4, MAPK13, MAP2K6, PTGER2, BDKRB1, BDKRB2, PLA2G6, PIK3R3, JMJD7-PLA2G4B"
"Antigen processing and presentation",0.362,0.827,1,73,10,"CREB1, PDIA3, HLA-DQA2, HSPA5, NFYB, NFYC, KIR2DL5A, RFX5, TAP1, CALR"
"Retrograde endocannabinoid signaling",0.378,0.852,1,147,19,"GABRA2, GABRA5, GABRA6, GABRB2, GABRB3, GABRE, GNAI3, GNAO1, GNG3, GNG4, GNG10, GRIA3, ITPR3, NDUFA1, NDUFA2, NDUFS4, PLCB4, MAPK13, CACNA1C"
"Ovarian steroidogenesis",0.38,0.852,1,50,7,"CGA, ALOX5, GDF9, PLA2G4D, LDLR, PLA2G4A, JMJD7-PLA2G4B"
"Glycolysis / Gluconeogenesis",0.397,0.866,1,67,9,"ALDH2, FBP1, ALDH3A2, ALDOA, G6PC, GAPDH, LDHB, PDHA1, PGAM2"
"Long-term potentiation",0.397,0.866,1,67,9,"RAPGEF3, GRIN2D, ITPR3, KRAS, PLCB4, PPP3R2, RAP1A, BRAF, CACNA1C"
"Collecting duct acid secretion",0.399,0.866,1,27,4,"TCIRG1, ATP6V0A4, ATP6V1B2, ATP6V0E1"
"Mineral absorption",0.4,0.866,1,51,7,"CLCN2, ATP1B4, MT2A, ATP1A3, ATP1B2, ATP1B3, TF"
"Carbohydrate digestion and absorption",0.423,0.908,1,44,6,"ATP1B4, G6PC, ATP1A3, ATP1B2, ATP1B3, PIK3R3"
"Butanoate metabolism",0.427,0.91,1,28,4,"ABAT, HADHA, HMGCS1, HMGCS2"
"Adipocytokine signaling pathway",0.433,0.913,1,69,9,"G6PC, ACACB, IKBKB, NFKBIB, NFKBIE, NPY, RELA, SLC2A1, TNFRSF1A"
"Cardiac muscle contraction",0.445,0.932,1,78,10,"ATP1B4, MYH6, ATP1A3, ATP1B2, ATP1B3, TNNT2, CACNA1C, CACNA2D1, CACNB4, CACNA2D2"
"Apelin signaling pathway",0.457,0.939,1,137,17,"KLF2, GABARAPL2, CTGF, JAG1, EGR1, MRAS, GNAI3, GNG3, GNG4, GNG10, ITPR3, KRAS, SMAD4, PLCB4, ACTA2, MYLK2, HDAC4"
"Vascular smooth muscle contraction",0.466,0.939,1,121,15,"PLA2G2D, GNA11, PLA2G4D, GUCY1B3, ITPR3, PLA2G4A, PLCB4, AVPR1A, PTGIR, ACTA2, BRAF, CACNA1C, PLA2G6, MYLK2, JMJD7-PLA2G4B"
"Nucleotide excision repair",0.467,0.939,1,46,6,"POLD3, LIG1, PCNA, POLE, POLD4, XPA"
"Caffeine metabolism",0.468,0.939,1,5,1,"CYP2A6"
"Bile secretion",0.468,0.939,1,71,9,"CFTR, ATP1B4, AQP4, LDLR, ATP1A3, ATP1B2, ATP1B3, SLC2A1, NR0B2"
"FoxO signaling pathway",0.475,0.946,1,130,16,"KLF2, GABARAPL2, EGFR, G6PC, IKBKB, KRAS, SMAD4, PDPK1, PLK1, MAPK13, BCL6, BRAF, TGFB2, PIK3R3, CCND2, CCNB2"
"Circadian rhythm",0.482,0.953,1,30,4,"CREB1, RORA, BHLHE40, NR1D1"
"Sphingolipid metabolism",0.488,0.958,1,47,6,"SGPP2, CERS3, ASAH1, SMPD2, PLPP1, SGPL1"
"Lysosome",0.493,0.959,1,123,15,"TCIRG1, AP4B1, CLTA, CLTC, CTSD, ABCA2, LAMP3, SUMF1, LAMP1, ASAH1, ATP6V0A4, ATP6AP1, SLC11A1, CD164, AP3D1"
"Axon guidance",0.498,0.962,1,174,21,"CFL1, CFL2, DPYSL2, EFNA2, GNAI3, EPHA6, ITGB1, KRAS, PLXNA1, PLXNB1, SSH3, PPP3R2, PARD3, BMP7, BMPR1B, TRPC6, WNT5A, CXCR4, PARD6G, PIK3R3, CDC42"
"beta-Alanine metabolism",0.509,0.973,1,31,4,"ABAT, ALDH2, ALDH3A2, HADHA"
"HIF-1 signaling pathway",0.512,0.973,1,99,12,"EDN1, EGFR, EPO, ALDOA, GAPDH, ARNT, PDHA1, RELA, SLC2A1, TF, TLR4, PIK3R3"
"Taste transduction",0.528,0.992,1,83,10,"GABRA2, GABRA5, GABRA6, HTR1A, HTR3A, ITPR3, PDE1B, SCNN1A, SCNN1G, CACNA1C"
"Phosphonate and phosphinate metabolism",0.531,0.992,1,6,1,"CEPT1"
"Propanoate metabolism",0.535,0.992,1,32,4,"ABAT, HADHA, ACACB, LDHB"
"Oxytocin signaling pathway",0.538,0.992,1,152,18,"EGFR, GNAI3, GNAO1, PLA2G4D, GUCY1B3, EEF2K, ITPR3, JUN, KRAS, PLA2G4A, PLCB4, PPP3R2, CACNA1C, CACNA2D1, CACNB4, MYLK2, JMJD7-PLA2G4B, CACNA2D2"
"Natural killer cell mediated cytotoxicity",0.546,0.999,1,127,15,"CSF2, PTK2B, SHC2, LAT, ICAM1, IFNA13, IFNA14, IFNA16, KRAS, PPP3R2, KIR2DL5A, PTPN6, BRAF, SYK, PIK3R3"
"Hippo signaling pathway",0.55,0.999,1,153,18,"YAP1, CTGF, AFP, BIRC5, SMAD1, SMAD4, PPP2CB, PARD3, BMP7, BMPR1B, TGFB2, WNT5A, YWHAG, YWHAH, PARD6G, CCND2, CCND3, WNT3A"
"Ribosome biogenesis in eukaryotes",0.57,1,1,77,9,"NXF1, RPP40, RPP25L, CSNK2A2, MDN1, NXT1, GNL2, SNU13, RPP25"
"Insulin signaling pathway",0.576,1,1,138,16,"FBP1, EXOC7, G6PC, SHC2, GYS2, ACACB, IKBKB, KRAS, PDPK1, INPP5K, PHKB, PRKAR2B, PYGM, BRAF, PIK3R3, SOCS2"
"Endocrine resistance",0.58,1,1,95,11,"JAG1, E2F3, EGFR, SHC2, JUN, KRAS, NOTCH4, MAPK13, SP1, BRAF, PIK3R3"
"Oocyte meiosis",0.58,1,1,121,14,"MAD2L2, PTTG2, ITPR3, MOS, PLK1, PPP2CB, PPP2R5A, PPP2R5E, PPP3R2, YWHAG, YWHAH, CCNE1, CCNB2, CDC25C"
"SNARE interactions in vesicular transport",0.585,1,1,34,4,"STX18, STX17, STX1A, GOSR2"
"Type I diabetes mellitus",0.588,1,1,43,5,"HLA-DQA2, IL1A, IL1B, IL12A, CD28"
"Progesterone-mediated oocyte maturation",0.594,1,1,96,11,"MAD2L2, GNAI3, KRAS, MOS, PLK1, MAPK13, BRAF, PIK3R3, CCNB2, CDC25B, CDC25C"
"EGFR tyrosine kinase inhibitor resistance",0.602,1,1,79,9,"EGFR, FGFR3, SHC2, KRAS, PDGFRA, PDGFRB, BCL2L1, BRAF, PIK3R3"
"Glycerophospholipid metabolism",0.608,1,1,97,11,"CEPT1, LPCAT4, PLA2G2D, PLA2G4D, PNPLA7, PLA2G4A, PLA2G6, DGKZ, DGKE, PLPP1, JMJD7-PLA2G4B"
"Aminoacyl-tRNA biosynthesis",0.609,1,1,44,5,"TARSL2, HARS2, KARS, RARS, YARS"
"Ascorbate and aldarate metabolism",0.609,1,1,26,3,"ALDH2, ALDH3A2, UGDH"
"Longevity regulating pathway",0.62,1,1,89,10,"CREB3, EHMT2, CREB1, ATF6B, KRAS, RELA, EHMT1, PIK3R3, CREB3L1, ATG13"
"Basal transcription factors",0.63,1,1,45,5,"TBPL2, TAF1, TAF4, TAF11, TAF12"
"Riboflavin metabolism",0.635,1,1,8,1,"RFK"
"Phosphatidylinositol signaling system",0.636,1,1,99,11,"PIP5K1C, INPP5J, ITPR3, PLCE1, INPP5K, PIK3C2A, PLCB4, PIK3R3, DGKZ, DGKE, INPP4B"
"Hedgehog signaling pathway",0.649,1,1,46,5,"GRK2, SUFU, CSNK1G1, SPOP, CCND2"
"Type II diabetes mellitus",0.649,1,1,46,5,"IKBKB, KCNJ11, CACNA1C, PIK3R3, SOCS2"
"Phototransduction",0.661,1,1,28,3,"GNAT2, PDE6A, RGS9"
"TGF-beta signaling pathway",0.662,1,1,83,9,"BAMBI, SMAD1, SMAD4, SMAD6, PPP2CB, BMP7, BMPR1B, SP1, TGFB2"
"Melanogenesis",0.663,1,1,101,11,"CREB3, CREB1, EDN1, GNAI3, GNAO1, KRAS, ASIP, PLCB4, WNT5A, WNT3A, CREB3L1"
"Citrate cycle (TCA cycle)",0.707,1,1,30,3,"ACO2, PC, PDHA1"
"Ferroptosis",0.714,1,1,40,4,"ALOX15, PRNP, SLC3A2, TF"
"Antifolate resistance",0.728,1,1,31,3,"IKBKB, IL1B, RELA"
"RNA polymerase",0.728,1,1,31,3,"TWISTNB, POLR2F, POLR2J"
"Fat digestion and absorption",0.732,1,1,41,4,"PLA2G2D, APOB, DGAT2, PLPP1"
"Complement and coagulation cascades",0.733,1,1,79,8,"A2M, FGA, ITGAM, BDKRB1, BDKRB2, SERPING1, C2, C5"
