"Pathway","pVal","pValFDR","pValBonferroni","Genes","HitGenes","HitGeneNames"
"Apoptosis",0.011,0.038,1,136,37,"AKT3, TUBA1B, TUBA3E, CHUK, PARP1, CSF2RB, CTSB, CTSZ, AKT2, XIAP, BIRC5, IKBKB, FASLG, LMNA, MAP3K5, ATM, NFKB1, NGF, NTRK1, PDPK1, PIK3R2, MAPK1, MAPK8, MAP2K1, BAD, BAX, RAF1, RELA, TP53, TRAF2, TUBA4A, CASP6, CASP7, CASP8, TUBA1C, RIPK1, EIF2AK3"
"Fat digestion and absorption",0.012,0.041,1,40,14,"AGPAT2, PLA2G2D, PLA2G2E, APOA1, APOA4, APOB, PLA2G1B, PLA2G2A, PLA2G5, PNLIP, PLA2G2F, PLA2G12A, DGAT2, PLPP3"
"mTOR signaling pathway",0.014,0.048,1,147,39,"AKT3, CHUK, ATP6V1G3, DVL1, EIF4B, EIF4E, EIF4EBP1, AKT2, GRB10, GSK3B, IGF1, IGF1R, IKBKB, INS, IRS1, ATP6V1H, PDPK1, ATP6V1A, PIK3R2, PRKCG, MAPK1, MAP2K1, PTEN, RAF1, RHEB, RPS6KA1, SEC13, SGK1, SOS1, TSC2, WNT5A, FZD5, WDR59, SEH1L, WNT3A, ATP6V1F, EIF4E2, ATP6V1G1, DEPDC5"
"Cholinergic synapse",0.015,0.049,1,112,31,"AKT3, CREB3, ADCY1, CHRM2, AKT2, GNA11, GNAI1, GNAI2, GNAI3, GNAO1, GNG3, GNGT2, KCNJ2, KCNJ3, KCNQ1, PIK3CG, PIK3R2, PLCB2, PLCB3, PLCB4, PRKACB, PRKACG, PRKCG, MAPK1, MAP2K1, GNB4, CACNA1D, CACNA1S, CREB3L3, GNG8, CREB5"
"RIG-I-like receptor signaling pathway",0.017,0.055,1,70,21,"CHUK, IFNA2, IFNA7, IFNA8, IFNA13, IFNA14, IFNA16, IFNA17, IFNB1, IKBKB, CXCL8, CXCL10, NFKB1, MAPK8, MAPK13, RELA, MAPK12, TRAF2, CASP8, RIPK1, ISG15"
"Oocyte meiosis",0.019,0.062,1,114,31,"ADCY1, STAG3, IGF1, IGF1R, INS, CALML5, PLK1, PPP1CC, PPP2R5A, PPP2R5B, PPP3CA, PPP3CC, PPP3R2, PRKACB, PRKACG, MAPK1, MAP2K1, RPS6KA1, MAPK12, ANAPC1, SKP1, YWHAH, YWHAZ, CALM1, CALM2, CALM3, CUL1, CCNB1, CCNE1, CALML4, CDK1"
"Synaptic vesicle cycle",0.021,0.067,1,63,19,"TCIRG1, AP2M1, AP2S1, CLTA, CLTC, ATP6V1G3, SLC32A1, ATP6V0E2, AP2A1, DNM1, DNM3, NSF, ATP6V1H, ATP6V1A, ATP6V0C, ATP6V0B, ATP6V0A1, ATP6V1F, ATP6V1G1"
"Tight junction",0.022,0.068,1,160,41,"PATJ, TUBA1B, CFTR, TUBA3E, IGSF5, CTTN, HCLS1, ITGB1, LLGL1, MAP3K5, RAB8A, MYH2, MYH4, NEDD4, PARD6A, PCNA, ARHGAP17, PPP2R2B, PRKACB, PRKACG, PRKAG1, MAPK8, PARD3, ACTR3B, CGN, JAM2, ROCK1, MPP5, TJP1, TUBA4A, EZR, CACNA1D, ACTN4, JAM3, PARD6G, TUBA1C, YBX3, ACTN1, ARHGEF2, ROCK2, CDC42"
"Glucagon signaling pathway",0.022,0.069,1,102,28,"AKT3, CREB3, PPARGC1A, ATF2, CREBBP, EP300, AKT2, GNAS, PDE3B, CALML5, PGAM2, PHKB, PHKG1, PLCB2, PLCB3, PLCB4, PPP3CA, PPP3CC, PPP3R2, PRKACB, PRKACG, PRKAG1, CALM1, CALM2, CALM3, CREB3L3, CALML4, CREB5"
"Salivary secretion",0.023,0.069,1,89,25,"ADCY1, ADRB3, ATP1B4, GNAS, GUCY1A3, GUCY1B3, KCNMA1, ATP1A1, ATP1B2, FXYD2, ATP2B4, CALML5, PLCB2, PLCB3, PLCB4, PRKACB, PRKACG, PRKCG, PRKG1, PRKG2, SLC12A2, CALM1, CALM2, CALM3, CALML4"
"B cell receptor signaling pathway",0.033,0.098,1,70,20,"AKT3, CHUK, AKT2, DAPP1, GSK3B, IKBKB, INPP5D, NFKB1, PIK3R2, PPP3CA, PPP3CC, PPP3R2, MAPK1, MAP2K1, PTPN6, RAF1, RELA, SOS1, SYK, VAV2"
"Ovarian steroidogenesis",0.034,0.1,1,49,15,"ADCY1, PLA2G4E, CYP2J2, FSHB, PLA2G4F, GNAS, PLA2G4D, IGF1, IGF1R, INS, LDLR, PLA2G4A, PRKACB, PRKACG, PTGS2"
"Longevity regulating pathway - multiple species",0.036,0.105,1,62,18,"AKT3, ADCY1, EIF4EBP2, AKT2, HDAC1, HSPA1L, HSPA2, HSPA6, HSPA8, IGF1, IGF1R, INS, IRS1, PIK3R2, PRKACB, PRKACG, PRKAG1, IRS4"
"Progesterone-mediated oocyte maturation",0.04,0.116,1,89,24,"AKT3, ADCY1, AKT2, GNAI1, GNAI2, GNAI3, IGF1, IGF1R, INS, PDE3B, PIK3R2, PLK1, PRKACB, PRKACG, MAPK1, MAPK8, MAPK13, MAP2K1, RAF1, RPS6KA1, MAPK12, ANAPC1, CCNB1, CDK1"
"RNA degradation",0.041,0.118,1,76,21,"TOB1, PABPC5, DCP2, XRN2, LSM5, PAN3, LSM4, PABPC1, LSM1, LSM3, CNOT7, HSPD1, PABPC1L2A, PABPC3, PARN, EXOSC9, EXOSC10, XRN1, LSM2, PABPC1L2B, PABPC4"
"AGE-RAGE signaling pathway in diabetic complications",0.045,0.128,1,99,26,"AKT3, AGER, EDN1, AKT2, IL1A, IL6, CXCL8, NFKB1, NOS3, PIK3R2, PLCB2, PLCB3, PLCB4, PLCG1, MAPK1, MAPK8, MAPK13, BAX, RELA, MAPK12, CCL2, STAT5B, TGFB2, TGFBR1, PLCD4, CDC42"
"Osteoclast differentiation",0.075,0.207,1,127,31,"AKT3, TAB1, CHUK, CSF1, AKT2, IFNB1, IKBKB, IL1A, JUND, LCK, LCP2, MITF, NFKB1, PIK3R2, PPP3CA, PPP3CC, PPP3R2, MAPK1, MAPK8, MAPK13, MAP2K1, MAP2K6, RELA, MAPK12, SYK, TGFB2, TGFBR1, TRAF2, CALCR, SOCS1, GAB2"
"Cytosolic DNA-sensing pathway",0.075,0.207,1,63,17,"CHUK, IFNA2, IFNA7, IFNA8, IFNA13, IFNA14, IFNA16, IFNA17, IFNB1, IKBKB, IL6, CXCL10, NFKB1, POLR2K, POLR2L, RELA, RIPK1"
"Platinum drug resistance",0.076,0.207,1,72,19,"AKT3, CDKN1A, ERCC1, AKT2, XIAP, BIRC5, FASLG, MAP3K5, MSH2, ATM, PDPK1, PIK3R2, MAPK1, BAD, BAX, TOP2A, TOP2B, TP53, CASP8"
"Phagosome",0.082,0.223,1,147,35,"TCIRG1, TUBA1B, TUBB4A, SEC61B, TUBA3E, ATP6V1G3, ATP6V0E2, DYNC1H1, DYNC1I1, DYNC1I2, DYNC1LI2, HLA-DRB5, HLA-F, HLA-G, TUBB2B, ITGAV, ITGB1, LAMP1, DYNC1LI1, ATP6V1H, ATP6V1A, ATP6V0C, ATP6V0B, ATP6V0A1, RAB5A, TFRC, TUBA4A, RAB7A, DYNC2H1, CANX, TUBB6, TUBA1C, HGS, ATP6V1F, ATP6V1G1"
"Natural killer cell mediated cytotoxicity",0.086,0.231,1,124,30,"CSF2, SHC2, HLA-G, IFNA2, IFNA7, IFNA8, IFNA13, IFNA14, IFNA16, IFNA17, IFNB1, FASLG, LCK, LCP2, PIK3R2, PLCG1, SHC3, PPP3CA, PPP3CC, PPP3R2, PRKCG, MAPK1, MAP2K1, PTPN6, PTPN11, RAF1, SHC1, SOS1, SYK, VAV2"
"Insulin resistance",0.092,0.243,1,106,26,"AKT3, CREB3, PPARGC1A, AKT2, GSK3B, IKBKB, IL6, INS, IRS1, NFKB1, NOS3, PDPK1, PIK3R2, PPP1CC, PPP1R3C, PPP1R3D, PRKAG1, MAPK8, PTEN, PTPN11, RELA, RPS6KA1, SLC2A4, CREB3L3, CREB5, TBC1D4"
"Ribosome",0.094,0.246,1,125,30,"RPL36, RPSA, RPL10A, RPL26L1, RPL3, RPL4, RPL5, RPL11, RPL18, RPL18A, RPL19, RPL21, RPL23A, RPL27, RPL27A, RPL35A, RPL37, RPL38, RPS4Y1, RPS8, RPS10, RPS16, RPS19, RPS20, RPS21, RPS27A, RPS28, RPS29, UBA52, RPL14"
"Thyroid hormone synthesis",0.095,0.246,1,74,19,"CREB3, ADCY1, ATF2, ATP1B4, GNAS, ATP1A1, ATP1B2, FXYD2, PLCB2, PLCB3, PLCB4, PRKACB, PRKACG, PRKCG, TPO, TTF1, CANX, CREB3L3, CREB5"
"RNA polymerase",0.099,0.255,1,30,9,"TWISTNB, POLR2C, POLR2D, POLR2G, POLR2K, POLR2L, POLR2J3, POLR1E, POLR1B"
"Th17 cell differentiation",0.1,0.255,1,107,26,"CHUK, IL23R, HLA-DRB5, IKBKB, IL2, IL2RB, IL4, IL6, IL6R, LCK, NFKB1, IL21R, IL22, PLCG1, PPP3CA, PPP3CC, PPP3R2, MAPK1, MAPK8, MAPK13, RARA, RELA, MAPK12, STAT5B, TGFBR1, CD3D"
"Purine metabolism",0.102,0.257,1,169,39,"NME6, ADCY1, DCK, AK2, TWISTNB, NT5C2, GUCY1A3, GUCY1B3, NME7, GUCY2D, NT5C, HPRT1, APRT, NME2, NME3, NME4, NT5E, GMPR2, PDE3B, PDE4D, PDE6A, PDE6D, PDE7A, PDE9A, PDE1B, POLR2C, POLR2D, POLR2G, POLR2K, POLR2L, POLR2J3, POLR1E, NME1-NME2, POLR1B, NT5C1A, PDE8B, PDE5A, ENTPD3, ENTPD5"
"Cell cycle",0.108,0.269,1,122,29,"CDKN1A, STAG1, STAG2, CREBBP, E2F2, E2F3, EP300, SFN, GSK3B, HDAC1, MCM5, ATM, ORC1, PCNA, PLK1, RAD21, RBL1, ANAPC1, SKP1, BUB1B, TGFB2, TP53, YWHAH, YWHAZ, CUL1, CCNB1, CCNE1, CDK1, CDC6"
"Collecting duct acid secretion",0.123,0.304,1,27,8,"TCIRG1, ATP6V1G3, ATP6V0E2, ATP6V1A, ATP6V0C, ATP6V0A1, ATP6V1F, ATP6V1G1"
"Type II diabetes mellitus",0.131,0.319,1,45,12,"IKBKB, INS, IRS1, PIK3R2, MAPK1, MAPK8, SLC2A4, ABCC8, CACNA1D, IRS4, SOCS1, SOCS2"
"Retrograde endocannabinoid signaling",0.132,0.319,1,139,32,"ADCY1, SLC32A1, GABRA1, GABRA2, GABRA5, GABRA6, GNAI1, GNAI2, GNAI3, GNAO1, GNG3, GNGT2, GRM1, GRM5, KCNJ3, KCNJ9, NDUFA1, PLCB2, PLCB3, PLCB4, PRKACB, PRKACG, PRKCG, MAPK1, MAPK8, MAPK13, PTGS2, GNB4, MAPK12, CACNA1D, CACNA1S, GNG8"
"Th1 and Th2 cell differentiation",0.14,0.335,1,92,22,"CHUK, DLL1, HLA-DRB5, IKBKB, IL2, IL2RB, IL4, IL12RB2, LCK, NFKB1, NOTCH1, PLCG1, PPP3CA, PPP3CC, PPP3R2, MAPK1, MAPK8, MAPK13, RELA, MAPK12, STAT5B, CD3D"
"Adipocytokine signaling pathway",0.147,0.348,1,69,17,"AKT3, CAMKK2, PPARGC1A, CHUK, AKT2, IKBKB, IRS1, LEPR, NFKB1, NPY, PRKAG1, MAPK8, PTPN11, RELA, SLC2A4, TRAF2, IRS4"
"Leukocyte transendothelial migration",0.149,0.349,1,107,25,"CDH5, CTNNB1, GNAI1, GNAI2, GNAI3, ARHGAP35, ITGB1, RHOH, PIK3R2, PLCG1, PRKCG, MAPK13, PTPN11, JAM2, ROCK1, MAPK12, THY1, VAV2, VCL, EZR, ACTN4, JAM3, ACTN1, ROCK2, CDC42"
"NF-kappa B signaling pathway",0.152,0.354,1,93,22,"TAB1, CHUK, PARP1, CSNK2A1, CXCL2, XIAP, IKBKB, CXCL8, LCK, ATM, NFKB1, PIAS4, PLAU, PLCG1, PTGS2, RELA, CCL13, SYK, TRAF2, UBE2I, RIPK1, CD40LG"
"Intestinal immune network for IgA production",0.166,0.383,1,47,12,"CCR9, HLA-DRB5, IL2, IL4, IL6, IL10, IL15RA, ITGB7, CCL28, CD28, CD86, CD40LG"
"Pyrimidine metabolism",0.168,0.383,1,99,23,"NME6, DCK, TWISTNB, NT5C2, NME7, NT5C, NME2, NME3, NME4, NT5E, POLR2C, POLR2D, POLR2G, POLR2K, POLR2L, POLR2J3, POLR1E, NME1-NME2, TYMS, POLR1B, NT5C1A, ENTPD3, ENTPD5"
"IL-17 signaling pathway",0.176,0.398,1,90,21,"CHUK, CSF2, CXCL2, GSK3B, IKBKB, IL4, IL6, CXCL8, CXCL10, JUND, NFKB1, MAPK1, MAPK8, MAPK13, PTGS2, RELA, MAPK12, CCL2, CCL11, TRAF2, CASP8"
"AMPK signaling pathway",0.189,0.423,1,120,27,"AKT3, CREB3, CAMKK2, CFTR, PPARGC1A, EIF4EBP1, AKT2, FASN, IGF1, IGF1R, INS, IRS1, LEPR, RAB8A, RAB14, PDPK1, PIK3R2, PPP2R2B, PPP2R5A, PPP2R5B, PRKAG1, RHEB, SLC2A4, TSC2, CREB3L3, IRS4, CREB5"
"Autophagy - animal",0.19,0.423,1,125,28,"AKT3, CAMKK2, CTSB, DAPK1, AKT2, HMGB1, IGF1R, INS, IRS1, LAMP1, EIF2AK4, SH3GLB1, PDPK1, PIK3R2, PRKACB, PRKACG, MAPK1, MAPK8, MAP2K1, BAD, PTEN, RAF1, RHEB, MTMR14, TSC2, RAB7A, IRS4, EIF2AK3"
"Proteasome",0.2,0.44,1,44,11,"PSME3, PSME4, PSMA1, PSMA5, PSMB5, PSMB6, PSMC4, PSMD12, PSMD13, PSME1, PSMF1"
"p53 signaling pathway",0.206,0.451,1,68,16,"CDKN1A, SFN, IGF1, MDM4, ATM, GTSE1, PTEN, BAX, SIAH1, TP53, TSC2, CASP8, PPM1D, CCNB1, CCNE1, CDK1"
"GABAergic synapse",0.218,0.469,1,88,20,"ADCY1, SLC32A1, GABRA1, GABRA2, GABRA5, GABRA6, GNAI1, GNAI2, GNAI3, GNAO1, GNG3, GNGT2, NSF, PRKACB, PRKACG, PRKCG, GNB4, CACNA1D, CACNA1S, GNG8"
"Necroptosis",0.22,0.469,1,162,35,"PLA2G4E, PARP1, PGAM5, HIST1H2AA, ALOX15, PLA2G4F, CHMP2B, CHMP2A, PLA2G4D, HMGB1, XIAP, IFNA2, IFNA7, IFNA8, IFNA13, IFNA14, IFNA16, IFNA17, IFNB1, IL1A, FASLG, CHMP3, PLA2G4A, MAPK8, EIF2AK2, BAX, SMPD1, STAT5B, TRAF2, CHMP6, CASP8, RIPK1, CHMP7, CHMP4C, VPS4B"
"Axon guidance",0.221,0.469,1,172,37,"CDK5, PAK4, CFL2, DPYSL2, EFNA2, EPHA2, GNAI1, GNAI2, GNAI3, GSK3B, ITGB1, LIMK2, MET, NFATC4, PARD6A, PIK3R2, PLCG1, PLXNA2, PPP3CA, PPP3CC, PPP3R2, ENAH, MAPK1, PARD3, PAK6, SRGAP1, PTPN11, RAF1, RASA1, ROCK1, SMO, TRPC6, WNT5A, PARD6G, ROCK2, SEMA3E, CDC42"
"Antifolate resistance",0.222,0.469,1,31,8,"CHUK, FOLR1, FOLR3, IKBKB, IL6, NFKB1, RELA, TYMS"
"Carbohydrate digestion and absorption",0.264,0.551,1,42,10,"AKT3, AKT2, ATP1B4, ATP1A1, ATP1B2, FXYD2, PIK3R2, PLCB2, CACNA1D, TAS1R3"
"Taste transduction",0.266,0.551,1,81,18,"GABRA1, GABRA2, GABRA5, GABRA6, TAS2R40, GRM1, HTR1F, TAS2R60, TAS2R4, PDE1B, PLCB2, PRKACB, PRKACG, SCN2A, SCNN1A, SCNN1B, SCNN1G, TAS1R3"
"Sphingolipid metabolism",0.269,0.554,1,47,11,"ACER1, CERS3, SMPD4, ASAH2, SPHK2, GBA2, SMPD1, DEGS1, PLPP3, SPHK1, GAL3ST1"
"Type I diabetes mellitus",0.29,0.593,1,43,10,"HLA-DRB5, HLA-F, HLA-G, HSPD1, IL1A, IL2, FASLG, INS, CD28, CD86"
"Homologous recombination",0.314,0.636,1,39,9,"MRE11A, ATM, SYCP3, UIMC1, RAD52, RPA2, BLM, BRCC3, BRE"
"Hematopoietic cell lineage",0.322,0.646,1,94,20,"CSF1, CSF2, EPO, HLA-DRB5, IL1A, IL4, IL6, IL6R, IL7, IL7R, IL11, ITGA1, ITGA2B, KIT, KITLG, MME, TFRC, CD2, CD3D, CD44"
"Protein processing in endoplasmic reticulum",0.325,0.648,1,160,33,"SEC23A, SEC24A, SEC61B, SEC31B, DNAJB2, DNAJA1, HSPA1L, HSPA2, HSPA6, HSPA8, MAP3K5, EIF2AK4, PARK2, YOD1, SELENOS, MAPK8, EIF2AK2, ERO1B, UBQLN4, BAG1, BAX, SEC13, SKP1, TRAF2, UBE2D3, UBE2G2, DERL1, DNAJC5, CANX, CUL1, EIF2AK3, BAG2, SEC24C"
"Wnt signaling pathway",0.33,0.652,1,140,29,"CREBBP, CSNK1A1, CSNK1E, CSNK2A1, CTNNB1, DVL1, EP300, BAMBI, GSK3B, NFATC4, PLCB2, PLCB3, PLCB4, PPP3CA, PPP3CC, PPP3R2, PRKACB, PRKACG, PRKCG, MAPK8, SENP2, SIAH1, SKP1, TP53, WNT5A, FZD5, CUL1, WNT3A, ROCK2"
"Ribosome biogenesis in eukaryotes",0.367,0.719,1,71,15,"RPP30, RPP40, POP1, RPP25L, CSNK2A1, XRN2, NXT1, SNU13, NVL, POP5, XRN1, RIOK2, NXT2, NXF3, WDR75"
"Hedgehog signaling pathway",0.372,0.724,1,46,10,"CSNK1A1, CSNK1E, GRK2, GSK3B, ARRB2, PRKACB, PRKACG, SMURF2, SMO, CUL1"
"NOD-like receptor signaling pathway",0.413,0.797,1,166,33,"TAB1, SUGT1, CHUK, CTSB, PYDC1, CXCL2, XIAP, IFNA2, IFNA7, IFNA8, IFNA13, IFNA14, IFNA16, IFNA17, IFNB1, IKBKB, IL6, CXCL8, NFKB1, PLCB2, PLCB3, PLCB4, MAPK1, MAPK8, MAPK13, RELA, MAPK12, CCL2, TRAF2, BRCC3, CASP5, CASP8, RIPK1"
"Renin-angiotensin system",0.449,0.86,1,23,5,"CTSG, ACE, AGT, ENPEP, MME"
"Glycerolipid metabolism",0.496,0.943,1,61,12,"AGPAT2, PNLIPRP3, DGKB, DGKG, DGKQ, LPL, PNLIP, PNPLA3, DGAT2, DGKZ, DGKE, PLPP3"
"Cardiac muscle contraction",0.507,0.956,1,72,14,"CACNG3, CACNG2, ATP1B4, CACNG4, ATP1A1, ATP1B2, FXYD2, CACNA2D3, RYR2, TNNI3, UQCRFS1, CACNA1D, CACNA1S, CACNA2D2"
"Non-alcoholic fatty liver disease (NAFLD)",0.513,0.961,1,141,27,"AKT3, AKT2, GSK3B, IKBKB, IL1A, FASLG, IL6, IL6R, CXCL8, INS, IRS1, LEPR, MAP3K5, MAP3K11, NDUFA1, NFKB1, PIK3R2, PRKAG1, MAPK8, BAX, RELA, TRAF2, UQCRFS1, CASP7, CASP8, EIF2AK3, CDC42"
"Mitophagy - animal",0.545,1,1,63,12,"CALCOCO2, CSNK2A1, PGAM5, MITF, PARK2, MAPK8, RELA, TP53, RAB7A, TAX1BP1, EIF2AK3, USP15"
"Notch signaling pathway",0.547,1,1,47,9,"CREBBP, DVL1, EP300, DLL1, HDAC1, NOTCH1, ADAM17, CIR1, NCOR2"
"Ubiquitin mediated proteolysis",0.573,1,1,134,25,"MGRN1, PRPF19, UBE2K, XIAP, NEDD4, PARK2, UBR5, PIAS4, ANAPC1, SMURF2, SIAH1, SKP1, TCEB1, UBE2A, UBE2D3, UBE2E1, UBE2G2, UBE2I, CUL2, CUL1, PIAS1, SOCS1, CBLB, UBE2L6, RHOBTB1"
"Apoptosis - multiple species",0.584,1,1,32,6,"XIAP, BIRC5, MAPK8, BAX, CASP7, CASP8"
"Antigen processing and presentation",0.605,1,1,71,13,"PSME3, CTSB, HLA-DRB5, HLA-F, HLA-G, HSPA1L, HSPA2, HSPA6, HSPA8, B2M, PSME1, CANX, CD74"
"TGF-beta signaling pathway",0.608,1,1,82,15,"ACVR1C, CREBBP, DCN, EP300, BAMBI, SMAD6, SMAD9, MAPK1, RBL1, ROCK1, SMURF2, SKP1, TGFB2, TGFBR1, CUL1"
"Caffeine metabolism",0.651,1,1,5,1,"CYP2A6"
"Ferroptosis",0.657,1,1,40,7,"ALOX15, PCBP1, PCBP2, TF, TFRC, TP53, MAP1LC3A"
"ECM-receptor interaction",0.657,1,1,79,14,"DAG1, HSPG2, ITGA1, ITGA2B, ITGAV, ITGB1, ITGB6, ITGB7, LAMA2, LAMA5, LAMB3, LAMC1, RELN, CD44"
"Proximal tubule bicarbonate reclamation",0.66,1,1,23,4,"ATP1B4, ATP1A1, ATP1B2, FXYD2"
"Vitamin digestion and absorption",0.694,1,1,24,4,"APOA1, APOA4, APOB, PNLIP"
"Phosphonate and phosphinate metabolism",0.717,1,1,6,1,"CHPT1"
"Base excision repair",0.753,1,1,32,5,"PARP1, HMGB1, PCNA, POLB, TDG"
"Mismatch repair",0.79,1,1,21,3,"MSH2, PCNA, RPA2"
"Nicotinate and nicotinamide metabolism",0.806,1,1,28,4,"NT5C2, NT5C, NT5E, NT5C1A"
"Circadian rhythm",0.848,1,1,30,4,"CSNK1E, PRKAG1, SKP1, CUL1"
"Fanconi anemia pathway",0.876,1,1,51,7,"ERCC1, ERCC4, FANCC, CENPS, RPA2, BLM, USP1"
"Signaling pathways regulating pluripotency of stem cells",0.881,1,1,136,21,"AKT3, ACVR1C, CTNNB1, DVL1, AKT2, FGFR1, FGFR4, GSK3B, IGF1, IGF1R, SMAD9, PIK3R2, MAPK1, MAPK13, MAP2K1, RAF1, MAPK12, TCF3, WNT5A, FZD5, WNT3A"
"Bile secretion",0.89,1,1,71,10,"ADCY1, CFTR, ATP1B4, GNAS, LDLR, ATP1A1, ATP1B2, FXYD2, PRKACB, PRKACG"
"Lysosome",0.909,1,1,122,18,"TCIRG1, AP4B1, AP3S1, CLTA, CLTC, CTSB, CTSG, CTSZ, AP1B1, AP1G1, LAMP1, ATP6V1H, ATP6V0C, ATP6V0B, ATP6V0A1, SMPD1, AP3B1, AP1M1"
"Arginine biosynthesis",0.916,1,1,20,2,"NOS2, NOS3"
"Non-homologous end-joining",0.935,1,1,13,1,"MRE11A"
"Fatty acid biosynthesis",0.935,1,1,13,1,"FASN"
"Nucleotide excision repair",0.939,1,1,44,5,"ERCC1, ERCC4, GTF2H3, PCNA, RPA2"
"Protein export",0.94,1,1,22,2,"SEC61B, SRPRB"
"Hippo signaling pathway",0.957,1,1,150,21,"PATJ, YAP1, CSNK1E, CTNNB1, DVL1, GSK3B, BIRC5, LLGL1, PARD6A, PPP1CC, PPP2R2B, PARD3, MPP5, TGFB2, TGFBR1, WNT5A, YWHAH, YWHAZ, FZD5, PARD6G, WNT3A"
"Thiamine metabolism",0.958,1,1,15,1,"AK2"
"Glycosylphosphatidylinositol (GPI)-anchor biosynthesis",0.965,1,1,25,2,"GPLD1, PGAP1"
"Fatty acid elongation",0.965,1,1,25,2,"HADHA, HADHB"
"Maturity onset diabetes of the young",0.965,1,1,25,2,"IAPP, INS"
"DNA replication",0.969,1,1,34,3,"MCM5, PCNA, RPA2"
"Hippo signaling pathway - multiple species",0.97,1,1,26,2,"YAP1, CSNK1E"
"Cell adhesion molecules (CAMs)",0.974,1,1,137,18,"CDH5, CDH15, CTLA4, HLA-DRB5, HLA-F, HLA-G, ITGAV, ITGB1, ITGB7, NECTIN1, JAM2, SDC2, JAM3, CD2, CD28, CD86, CD40LG, SDC3"
"Mineral absorption",0.976,1,1,51,5,"ATP1B4, ATP1A1, ATP1B2, FXYD2, TF"
"Other glycan degradation",0.977,1,1,18,1,"GBA2"
"One carbon pool by folate",0.982,1,1,19,1,"TYMS"
"PPAR signaling pathway",0.988,1,1,71,7,"SORBS1, APOA1, APOC3, LPL, PDPK1, PLIN1, UBC"
"Biosynthesis of unsaturated fatty acids",0.992,1,1,23,1,"HADHA"
"Oxidative phosphorylation",0.996,1,1,116,12,"TCIRG1, ATP6V1G3, ATP6V0E2, NDUFA1, ATP6V1H, ATP6V1A, ATP6V0C, ATP6V0B, ATP6V0A1, UQCRFS1, ATP6V1F, ATP6V1G1"
"Folate biosynthesis",0.996,1,1,26,1,"SPR"
"Fatty acid metabolism",0.997,1,1,48,3,"FASN, HADHA, HADHB"
"Butanoate metabolism",0.997,1,1,28,1,"HADHA"
"Basal transcription factors",0.998,1,1,42,2,"GTF2F2, GTF2H3"
"Pentose and glucuronate interconversions",0.998,1,1,30,1,"XYLB"
"beta-Alanine metabolism",0.998,1,1,30,1,"HADHA"
"Drug metabolism - other enzymes",0.999,1,1,44,2,"CYP2A6, HPRT1"
"Protein digestion and absorption",0.999,1,1,89,7,"ATP1B4, KCNQ1, MME, ATP1A1, ATP1B2, FXYD2, SLC8A2"
"ABC transporters",0.999,1,1,44,2,"CFTR, ABCC8"
"SNARE interactions in vesicular transport",0.999,1,1,33,1,"GOSR2"
"Fatty acid degradation",0.999,1,1,44,2,"HADHA, HADHB"
"Complement and coagulation cascades",0.999,1,1,78,6,"F2RL2, PLAU, BDKRB1, C5, C5AR1, F2RL3"
"Tyrosine metabolism",0.999,1,1,34,1,"TPO"
"Propanoate metabolism",0.999,1,1,32,1,"HADHA"
"Metabolic pathways",1,1,1,1228,124,"NME6, TCIRG1, AGPAT2, PTGES3, PNLIPRP3, PLD4, PLA2G4E, ACER1, ATP6V1G3, CYP2A6, ATP6V0E2, CYP2C19, CYP2C8, CYP2J2, DGKB, DGKG, DGKQ, DCK, AK2, CERS3, FASN, TWISTNB, NT5C2, PIP5K1C, PLD3, PISD, ALOX15, PLA2G4F, GAPDH, PLA2G2D, PLA2G4D, NME7, HADHA, HADHB, PLA2G2E, NT5C, HPRT1, APRT, IMPA1, IMPA2, INPP1, INPP4A, INPP5A, ITPKA, LAMA5, CYP4F3, NDUFA1, NME2, NME3, NME4, NOS2, NOS3, NT5E, OCRL, PAFAH1B2, PAFAH1B3, PAFAH2, ATP6V1H, INPP5K, PGAM2, ATP6V1A, ATP6V0C, PIK3C2B, PLA2G1B, PLA2G2A, PLA2G4A, PLA2G5, ATP6V0B, PLCB2, PLCB3, PLCB4, PLCG1, PLD1, ATP6V0A1, PNLIP, POLR2C, POLR2D, POLR2G, POLR2K, POLR2L, POLR2J3, LPCAT2, SMPD4, INPP5E, ASAH2, SPHK2, CHPT1, PTGS2, GBA2, MTMR14, POLR1E, PLA2G2F, NME1-NME2, SMPD1, SPR, TPO, TYMS, UQCRFS1, PLA2G7, LPCAT1, PGAP1, PNPLA3, PTDSS2, PLA2G12A, PIP5K1B, PLA2G6, POLR1B, NT5C1A, DGAT2, PLCD4, DGKZ, DGKE, ALG2, DEGS1, PLPP3, INPP4B, SYNJ1, SPHK1, ATP6V1F, GAL3ST1, ATP6V1G1, MINPP1, PTDSS1, XYLB"
"Primary bile acid biosynthesis",1,1,1,16,0,""
"Peroxisome",1,1,1,80,2,"PRDX5, NOS2"
"Amino sugar and nucleotide sugar metabolism",1,1,1,48,0,""
"Aminoacyl-tRNA biosynthesis",1,1,1,44,0,""
"Glycosaminoglycan biosynthesis - chondroitin sulfate / dermatan sulfate",1,1,1,20,0,""
"Lysine degradation",1,1,1,58,1,"HADHA"
"Glycosaminoglycan biosynthesis - keratan sulfate",1,1,1,14,0,""
"Retinol metabolism",1,1,1,62,2,"CYP2A6, CYP2C8"
"N-Glycan biosynthesis",1,1,1,49,1,"ALG2"
"Ubiquinone and other terpenoid-quinone biosynthesis",1,1,1,11,0,""
"Phenylalanine metabolism",1,1,1,16,0,""
"Terpenoid backbone biosynthesis",1,1,1,22,0,""
"Glycosphingolipid biosynthesis - lacto and neolacto series",1,1,1,27,0,""
"Glycosphingolipid biosynthesis - globo and isoglobo series",1,1,1,15,0,""
"Glycolysis / Gluconeogenesis",1,1,1,67,3,"GAPDH, PGAM2, MINPP1"
"Mannose type O-glycan biosynthesis",1,1,1,22,0,""
"Cysteine and methionine metabolism",1,1,1,43,0,""
"Taurine and hypotaurine metabolism",1,1,1,10,0,""
"Sulfur metabolism",1,1,1,10,0,""
"Valine, leucine and isoleucine degradation",1,1,1,48,2,"HADHA, HADHB"
"Autophagy - other",1,1,1,30,0,""
"Steroid biosynthesis",1,1,1,20,0,""
"Other types of O-glycan biosynthesis",1,1,1,20,0,""
"Selenocompound metabolism",1,1,1,17,0,""
"Ascorbate and aldarate metabolism",1,1,1,25,0,""
"Steroid hormone biosynthesis",1,1,1,55,0,""
"Porphyrin and chlorophyll metabolism",1,1,1,40,0,""
"Metabolism of xenobiotics by cytochrome P450",1,1,1,70,1,"CYP2A6"
"Drug metabolism - cytochrome P450",1,1,1,66,3,"CYP2A6, CYP2C19, CYP2C8"
"Histidine metabolism",1,1,1,23,0,""
"Glycosaminoglycan degradation",1,1,1,18,0,""
"Pyruvate metabolism",1,1,1,39,0,""
"Carbon metabolism",1,1,1,114,3,"GAPDH, HADHA, PGAM2"
"Glycine, serine and threonine metabolism",1,1,1,39,1,"PGAM2"
"Valine, leucine and isoleucine biosynthesis",1,1,1,4,0,""
"Biosynthesis of amino acids",1,1,1,70,2,"GAPDH, PGAM2"
"Lipoic acid metabolism",1,1,1,2,0,""
"Starch and sucrose metabolism",1,1,1,35,0,""
"Tryptophan metabolism",1,1,1,39,1,"HADHA"
"Mucin type O-glycan biosynthesis",1,1,1,30,0,""
"Nitrogen metabolism",1,1,1,17,0,""
"Arginine and proline metabolism",1,1,1,48,2,"NOS2, NOS3"
"Glyoxylate and dicarboxylate metabolism",1,1,1,28,0,""
"Glycosaminoglycan biosynthesis - heparan sulfate / heparin",1,1,1,24,0,""
"Glutathione metabolism",1,1,1,52,0,""
"Alanine, aspartate and glutamate metabolism",1,1,1,35,0,""
"Galactose metabolism",1,1,1,30,0,""
"Pentose phosphate pathway",1,1,1,29,0,""
"Citrate cycle (TCA cycle)",1,1,1,30,0,""
"2-Oxocarboxylic acid metabolism",1,1,1,17,0,""
"D-Arginine and D-ornithine metabolism",1,1,1,1,0,""
"Pantothenate and CoA biosynthesis",1,1,1,18,0,""
"Fructose and mannose metabolism",1,1,1,33,0,""
"Glycosphingolipid biosynthesis - ganglio series",1,1,1,15,0,""
"Phenylalanine, tyrosine and tryptophan biosynthesis",1,1,1,5,0,""
"Neomycin, kanamycin and gentamicin biosynthesis",1,1,1,5,0,""
"D-Glutamine and D-glutamate metabolism",1,1,1,4,0,""
"Sulfur relay system",1,1,1,8,0,""
"Vitamin B6 metabolism",1,1,1,6,0,""
"Biotin metabolism",1,1,1,3,0,""
"Synthesis and degradation of ketone bodies",1,1,1,10,0,""
"Riboflavin metabolism",1,1,1,8,0,""
