"Pathway","pVal","pValFDR","pValBonferroni","Genes","HitGenes","HitGeneNames"
"PI3K-Akt signaling pathway",0,0,0,336,67,"CREB3, CHRM2, COL1A2, COL4A2, COL4A3, COL6A1, CREB1, ATF6B, CSF1R, EFNA2, EGFR, EIF4B, EPO, FGF7, FGF8, FGF9, FGF10, FGF12, FGFR3, FLT4, G6PC, GH2, GNG3, GNG4, GNG10, LPAR4, GYS2, NR4A1, TNC, IFNA13, IFNA14, IFNA16, IKBKB, IL3, IL3RA, IL6R, ITGA1, ITGA5, ITGAV, ITGB1, ITGB3, KRAS, LAMA4, LAMA5, NGFR, PDGFRA, PDGFRB, PDPK1, PPP2CB, PPP2R5A, PPP2R5E, PKN2, PRL, RELA, BCL2L1, TNN, SYK, TLR2, TLR4, HSP90B1, YWHAG, YWHAH, PIK3R3, CCND2, CCND3, CCNE1, CREB3L1"
"RNA transport",0,0,0,156,42,"EIF1, SRRM1, SAP18, TACC3, NXF1, RPP40, RPP25L, PABPC5, EIF2S1, EIF2S3, EIF4A1, EIF4B, EIF4G1, EIF4G2, ACIN1, NUP188, CYFIP2, NXT1, PABPC1L2A, NUP43, RPP25, ELAC1, THOC2, RANBP2, RANGAP1, SUMO3, RGPD2, UBE2I, THOC7, SEH1L, RAE1, EIF3A, EIF3B, EIF3I, EIF3J, PABPC4, EIF2B3, EIF2S2, NUP210L, NUP155, RBM8A, THOC1"
"Proteasome",0,0,0,44,29,"POMP, PSMA1, PSMA2, PSMA3, PSMA4, PSMA5, PSMA6, PSMA7, PSMB1, PSMB2, PSMB3, PSMB4, PSMB5, PSMB9, PSMC1, PSMC2, PSMC3, PSMC4, PSMC5, PSMC6, PSMD1, PSMD2, PSMD3, PSMD7, PSMD8, PSMD11, PSMD12, PSMF1, PSMD6"
"NF-kappa B signaling pathway",0,0,0,93,28,"TIRAP, PARP1, CSNK2A2, TICAM1, ERC1, TAB2, LY96, TAB3, LAT, ICAM1, IKBKB, IL1B, CXCL8, IRAK1, MYD88, RELA, BCL2L1, CCL13, SYK, MAP3K7, TLR4, TNFRSF1A, UBE2I, CARD11, RIPK1, TNFRSF11A, CFLAR, CD14"
"Toll-like receptor signaling pathway",0,0,0.001,104,29,"TIRAP, MAP3K8, TICAM1, TAB2, LY96, IFNA13, IFNA14, IFNA16, IKBKB, IL1B, CXCL8, IL12A, IRAK1, JUN, CXCL9, MYD88, TOLLIP, MAPK13, MAP2K6, RELA, CCL3, CXCL11, STAT1, MAP3K7, TLR2, TLR4, PIK3R3, RIPK1, CD14"
"Cytokine-cytokine receptor interaction",0,0,0.003,266,54,"CXCL13, EDAR, CCR8, CNTFR, CSF1R, CSF2, CX3CR1, EDA, EGFR, EPO, FLT4, GH2, CXCR3, IL19, IFNA13, IFNA14, IFNA16, IL1A, IL1B, IL3, IL3RA, IL6R, CXCL8, IL12A, IL12RB2, TNFRSF9, IL17A, CXCL9, NGFR, IL21R, IL22, PDGFRA, PDGFRB, PF4, PRL, TNFRSF17, CCL3, CCL7, CCL13, CCL15, CCL18, CXCL11, CXCR5, BMP7, BMPR1B, XCL2, TGFB2, THPO, TNFRSF1A, TNFRSF4, CXCR4, PLEKHO2, TNFRSF11A, TNFRSF8"
"Spliceosome",0,0.001,0.007,128,31,"BCAS2, PPIH, PRPF8, SF3B2, LSM6, HNRNPA1L2, CCDC12, SNW1, ACIN1, SF3B1, LSM4, PRPF31, HNRNPC, HNRNPM, SNU13, SF3B6, PLRG1, XAB2, THOC2, SRSF1, SRSF2, SRSF3, TRA2B, SNRPC, SNRPD3, PHF5A, PRPF38A, EFTUD2, CDC5L, RBM8A, THOC1"
"Regulation of actin cytoskeleton",0,0.002,0.018,210,43,"ARPC1B, CFL1, CFL2, CHRM2, DIAPH1, EGFR, SPATA13, FGF7, FGF8, FGF9, FGF10, FGF12, FGFR3, MRAS, PIP5K1C, CYFIP2, GIT1, MYLPF, PFN3, ITGA1, ITGA5, ITGAM, ITGAV, ITGB1, ITGB3, KRAS, MOS, PDGFRA, PDGFRB, PFN1, SSH3, PXN, MYL7, BDKRB1, BDKRB2, BRAF, VCL, MYH14, PIK3R3, MYLK2, CD14, ARHGEF6, CDC42"
"Thyroid hormone synthesis",0,0.004,0.037,74,20,"CREB3, CGA, CREB1, ATF6B, ATP1B4, GPX1, GPX3, HSPA5, ITPR3, ASGR1, ATP1A3, ATP1B2, ATP1B3, SLC26A4, PLCB4, SLC5A5, HSP90B1, TTR, CREB3L1, PDIA4"
"MAPK signaling pathway",0,0.005,0.045,252,48,"DUSP10, MAP3K8, DUSP5, DUSP6, DUSP7, EGFR, ELK4, FGF7, FGF8, FGF9, FGF10, FGF12, FGFR3, MRAS, TAB2, PLA2G4D, NR4A1, IKBKB, IL1A, IL1B, JUN, KRAS, STMN1, MAX, MAP3K3, MOS, TAOK3, PDGFRA, PDGFRB, PLA2G4A, PPP3R2, MAPK13, MAP2K6, RAP1A, RELA, BRAF, MAP3K7, TGFB2, TNFRSF1A, CACNA1C, CACNA2D1, CACNB4, MAPKAPK3, JMJD7-PLA2G4B, CACNA2D2, CD14, CDC25B, CDC42"
"Chemokine signaling pathway",0,0.006,0.066,182,37,"CXCL13, CCR8, CX3CR1, GRK2, PTK2B, SHC2, GNAI3, GNG3, GNG4, GNG10, CXCR3, GRK4, GSK3A, IKBKB, CXCL8, KRAS, CXCL9, NFKBIB, PF4, PLCB4, PARD3, PXN, RAP1A, RELA, CCL3, CCL7, CCL13, CCL15, CCL18, CXCL11, CXCR5, BRAF, STAT1, XCL2, CXCR4, PIK3R3, CDC42"
"Rap1 signaling pathway",0,0.006,0.07,209,41,"RAPGEF3, CSF1R, CTNND1, DRD2, EFNA2, EGFR, FGF7, FGF8, FGF9, FGF10, FGF12, FGFR3, MRAS, FLT4, LAT, GNAI3, GNAO1, LPAR4, PFN3, ITGAM, ITGB1, ITGB3, KRAS, NGFR, PLCE1, PDGFRA, PDGFRB, PFN1, PLCB4, PRKD1, MAPK13, MAP2K6, PARD3, RAP1A, BRAF, TLN2, PARD6G, PIK3R3, SKAP1, RAPGEF5, CDC42"
"Leukocyte transendothelial migration",0,0.006,0.074,107,25,"CDH5, RAPGEF3, CLDN19, CTNND1, PTK2B, CLDN14, CLDN15, GNAI3, MYLPF, ICAM1, ITGAM, ITGB1, ARHGAP5, CLDN11, MAPK13, PXN, MYL7, RAP1A, VCL, CXCR4, JAM3, PIK3R3, CLDN6, CLDN2, CDC42"
"TNF signaling pathway",0,0.006,0.087,108,25,"DNM1L, CREB3, MAP3K8, CREB1, ATF6B, CSF2, JAG1, EDN1, PGAM5, TAB2, TAB3, ICAM1, IKBKB, IL1B, JUN, MAPK13, MAP2K6, RELA, BCL3, MAP3K7, TNFRSF1A, PIK3R3, RIPK1, CFLAR, CREB3L1"
"NOD-like receptor signaling pathway",0,0.007,0.101,166,34,"DNM1L, NAMPT, IRF9, TXNIP, GABARAPL2, ANTXR2, TICAM1, TAB2, TAB3, PYDC1, GBP2, IFNA13, IFNA14, IFNA16, IKBKB, IL1B, CXCL8, ITPR3, JUN, MEFV, MYD88, NFKBIB, PLCB4, MAPK13, NLRC4, RELA, BCL2L1, STAT1, MAP3K7, TLR4, NLRX1, GSDMD, RIPK1, NLRP12"
"cAMP signaling pathway",0.001,0.01,0.163,197,38,"RAPGEF3, CREB3, CFTR, CHRM2, GRIN3A, GRIN3B, ADCYAP1R1, CNGA1, CREB1, ADRB2, DRD2, DRD5, ATP1B4, GNAI3, GRIA3, GRIN2D, HTR1A, HTR6, HCAR2, JUN, MC2R, ATP1A3, ATP1B2, ATP1B3, NPY, ATP2B3, PLCE1, PDE3B, PDE4C, GHRL, PTGER2, RAP1A, RELA, BRAF, CACNA1C, ORAI1, PIK3R3, CREB3L1"
"Neuroactive ligand-receptor interaction",0.001,0.01,0.165,273,49,"CGA, CHRM2, CHRNA4, CHRNA5, CHRNB4, CHRND, CHRNE, GRIN3A, GRIN3B, ADCYAP1R1, LTB4R, ADORA3, ADRB2, DRD2, DRD5, FPR3, GABRA2, GABRA5, GABRA6, GABRB2, GABRB3, GABRE, GH2, NPBWR2, LPAR4, MLNR, GRIA3, GRIN2D, HRH2, HTR1A, HTR6, MC2R, MTNR1B, OPRM1, P2RY11, AVPR1A, PRL, PARD3, NMUR2, PTGER2, PTGIR, BDKRB1, BDKRB2, SSTR4, TACR1, TACR3, VIPR1, CALCR, S1PR2"
"Osteoclast differentiation",0.001,0.012,0.214,127,27,"SIRPB1, IRF9, CREB1, CSF1R, CYLD, FHL2, TAB2, LILRA5, IKBKB, IL1A, IL1B, ITGB3, JUN, PPP3R2, MAPK13, MAP2K6, RELA, SPI1, STAT1, SYK, MAP3K7, TGFB2, TNFRSF1A, CALCR, PIK3R3, TNFRSF11A, GAB2"
"Focal adhesion",0.001,0.015,0.29,196,37,"COL1A2, COL4A2, COL4A3, COL6A1, DIAPH1, EGFR, FLT4, PIP5K1C, SHC2, MYLPF, TNC, ITGA1, ITGA5, ITGAV, ITGB1, ITGB3, JUN, LAMA4, LAMA5, ARHGAP5, PDGFRA, PDGFRB, PDPK1, PXN, MYL7, RAP1A, TNN, BRAF, VCL, CAPN2, TLN2, PIK3R3, MYLK2, CAV3, CCND2, CCND3, CDC42"
"AGE-RAGE signaling pathway in diabetic complications",0.001,0.017,0.344,99,22,"COL1A2, COL4A2, COL4A3, DIAPH1, AGER, EDN1, EGR1, ICAM1, IL1A, IL1B, CXCL8, JUN, KRAS, SMAD4, PLCE1, PLCB4, MAPK13, RELA, STAT1, TGFB2, PIK3R3, CDC42"
"RIG-I-like receptor signaling pathway",0.002,0.02,0.427,70,17,"CYLD, DDX3X, IFNA13, IFNA14, IFNA16, IKBKB, CXCL8, IL12A, NFKBIB, OTUD5, MAPK13, RELA, IFIH1, MAP3K7, NLRX1, RIPK1, ISG15"
"Ras signaling pathway",0.002,0.023,0.511,223,40,"RASA4, CSF1R, EFNA2, EGFR, FGF7, FGF8, FGF9, FGF10, FGF12, FGFR3, MRAS, RASA3, FLT4, SHC2, PLA2G2D, LAT, GNG3, GNG4, GNG10, KSR2, PLA2G4D, IKBKB, KRAS, NGFR, PLCE1, PDGFRA, PDGFRB, PLA2G4A, RAB5A, RAP1A, RELA, BCL2L1, BRAP, PLA2G6, PIK3R3, JMJD7-PLA2G4B, RASAL2, RAPGEF5, GAB2, CDC42"
"Relaxin signaling pathway",0.003,0.029,0.664,130,26,"CREB3, RLN3, COL1A2, COL4A2, COL4A3, CREB1, ATF6B, EDN1, EGFR, SHC2, GNA15, GNAI3, GNAO1, GNG3, GNG4, GNG10, INSL3, JUN, KRAS, PLCB4, MAPK13, ACTA2, RELA, RLN2, PIK3R3, CREB3L1"
"Vasopressin-regulated water reabsorption",0.003,0.03,0.712,44,12,"CREB3, CREB1, DYNC1H1, DYNC1I1, DYNC1I2, AQP4, ARHGDIB, DCTN4, DYNC2LI1, RAB5A, DYNLL1, CREB3L1"
"Hematopoietic cell lineage",0.004,0.036,0.954,94,20,"CSF1R, CSF2, DNTT, EPO, GP1BA, HLA-DQA2, IL1A, IL1B, IL3, IL3RA, IL6R, ITGA1, ITGA5, ITGAM, ITGB3, MME, THPO, CD14, CD33, CD37"
"Mitophagy - animal",0.004,0.036,0.959,63,15,"OPTN, GABARAPL2, CSNK2A2, PGAM5, MRAS, ATG9B, JUN, KRAS, PARK2, RELA, BCL2L1, TBC1D15, SP1, UBB, USP30"
"Phagosome",0.004,0.036,0.971,147,28,"TCIRG1, DYNC1H1, DYNC1I1, DYNC1I2, SEC61A1, HLA-DQA2, ITGA5, ITGAM, ITGAV, ITGB1, ITGB3, LAMP1, MSR1, ATP6V0A4, ATP6V1B2, STX18, ATP6AP1, RAB5A, CLEC7A, TAP1, TLR2, TLR4, TUBA4A, TUBA1A, CALR, RILP, ATP6V0E1, CD14"
"Thyroid hormone signaling pathway",0.005,0.044,1,116,23,"RCAN2, SLC16A10, ATP1B4, SIN3A, HDAC2, ITGAV, ITGB3, KRAS, MYH6, ATP1A3, ATP1B2, ATP1B3, NOTCH4, PLCE1, PDPK1, PLCB4, SLCO1C1, SLC2A1, STAT1, PIK3R3, KAT2B, MED14, TBC1D4"
"Notch signaling pathway",0.005,0.044,1,47,12,"JAG1, DTX1, SNW1, NCSTN, HDAC2, RBPJ, MFNG, NOTCH4, APH1A, MAML2, KAT2B, NUMBL"
"Renin secretion",0.005,0.044,1,65,15,"ADCYAP1R1, CREB1, ADRB2, ACE, AGT, GNAI3, GUCY1B3, ITPR3, PDE3B, PDE1B, PLCB4, PPP3R2, PTGER2, CACNA1C, ORAI1"
"Serotonergic synapse",0.006,0.049,1,111,22,"RAPGEF3, ALOX5, ALOX15, GABRB2, GABRB3, GNAI3, GNAO1, GNG3, GNG4, GNG10, PLA2G4D, HTR1A, HTR3A, HTR6, ITPR3, KRAS, PLA2G4A, PLCB4, SLC18A2, BRAF, CACNA1C, JMJD7-PLA2G4B"
"Tight junction",0.007,0.052,1,160,29,"ACTR2, CFTR, MYL6B, CLDN19, CLDN14, CLDN15, HCLS1, ITGB1, JUN, CLDN11, PCNA, AMOTL2, PPP2CB, PARD3, MYH7B, RAP2C, RAP1A, TUBA4A, TUBA1A, MYH14, JAM3, PARD6G, YBX3, RUNX1, MPDZ, CLDN6, CLDN2, CRB3, CDC42"
"Ether lipid metabolism",0.007,0.052,1,43,11,"CEPT1, ENPP6, LPCAT4, PLA2G2D, PLA2G4D, PAFAH1B3, PAFAH2, PLA2G4A, PLA2G6, PLPP1, JMJD7-PLA2G4B"
"Aldosterone-regulated sodium reabsorption",0.007,0.052,1,37,10,"ATP1B4, SFN, KRAS, ATP1A3, ATP1B2, ATP1B3, PDPK1, SCNN1A, SCNN1G, PIK3R3"
"Fc gamma R-mediated phagocytosis",0.009,0.064,1,88,18,"ARPC1B, CFL1, CFL2, PIP5K1C, LAT, PLA2G4D, ASAP1, PLA2G4A, ASAP3, PTPRC, MARCKSL1, SYK, PLA2G6, PIK3R3, PLPP1, ASAP2, GAB2, CDC42"
"Proximal tubule bicarbonate reclamation",0.011,0.079,1,23,7,"SLC38A3, SLC25A10, ATP1B4, ATP1A3, ATP1B2, ATP1B3, CA4"
"Insulin secretion",0.012,0.082,1,84,17,"CREB3, ADCYAP1R1, CREB1, ATF6B, ATP1B4, GNA11, ITPR3, KCNJ11, KCNN1, ATP1A3, ATP1B2, ATP1B3, PLCB4, SLC2A1, STX1A, CACNA1C, CREB3L1"
"Ribosome",0.013,0.084,1,125,23,"RPS4Y2, MRPS18C, MRPL4, RPL26L1, RPL3, RPL3L, RPL4, RPL19, RPL23A, RPL24, RPL27, RPL31, RPL32, RPL36AL, RPL37, RPLP2, MRPS12, RPS2, RPS8, RPS21, RPS27A, MRPL36, RPL23"
"Long-term depression",0.013,0.086,1,59,13,"GNA11, GNAI3, GNAO1, PLA2G4D, GRIA3, GUCY1B3, ITPR3, KRAS, PLA2G4A, PLCB4, PPP2CB, BRAF, JMJD7-PLA2G4B"
"Jak-STAT signaling pathway",0.015,0.091,1,155,27,"IRF9, CNTFR, CSF2, EPO, GH2, IL19, IFNA13, IFNA14, IFNA16, IL3, IL3RA, IL6R, IL12A, IL12RB2, IL21R, IL22, PRL, PTPN2, PTPN6, BCL2L1, STAT1, THPO, PIK3R3, SOCS2, CCND2, CCND3, IL27RA"
"Fc epsilon RI signaling pathway",0.015,0.091,1,66,14,"CSF2, ALOX5, LAT, PLA2G4D, IL3, KRAS, PDPK1, PLA2G4A, MAPK13, MAP2K6, SYK, PIK3R3, JMJD7-PLA2G4B, GAB2"
"Th17 cell differentiation",0.016,0.098,1,107,20,"GATA3, LAT, HLA-DQA2, IKBKB, IL1B, IL6R, IL17A, JUN, SMAD4, NFKBIB, NFKBIE, IL21R, IL22, PPP3R2, MAPK13, RELA, RORA, STAT1, RUNX1, IL27RA"
"Adrenergic signaling in cardiomyocytes",0.018,0.104,1,143,25,"RAPGEF3, CREB3, CREB1, ATF6B, ADRB2, ATP1B4, GNAI3, KCNE1, KCNQ1, MYH6, ATP1A3, ATP1B2, ATP1B3, ATP2B3, PLCB4, PPP2CB, PPP2R5A, PPP2R5E, MAPK13, TNNT2, CACNA1C, CACNA2D1, CACNB4, CREB3L1, CACNA2D2"
"T cell receptor signaling pathway",0.02,0.112,1,102,19,"MAP3K8, CSF2, LAT, IKBKB, JUN, KRAS, NFKBIB, NFKBIE, PDPK1, PPP3R2, MAPK13, PTPN6, PTPRC, RELA, MAP3K7, CARD11, PIK3R3, CD28, CDC42"
"Sphingolipid signaling pathway",0.024,0.129,1,118,21,"SGPP2, ADORA3, CTSD, CERS3, GNAI3, KRAS, ASAH1, PDPK1, PLCB4, PPP2CB, PPP2R5A, PPP2R5E, MAPK13, RELA, BDKRB2, SMPD2, TNFRSF1A, PIK3R3, SGPL1, S1PR2, GAB2"
"Base excision repair",0.024,0.129,1,32,8,"POLD3, PARP1, LIG1, MUTYH, PCNA, POLB, POLE, POLD4"
"GnRH signaling pathway",0.026,0.137,1,91,17,"CGA, EGFR, PTK2B, GNA11, GNRH2, PLA2G4D, ITPR3, JUN, KRAS, MAP3K3, PLA2G4A, PLCB4, MAPK13, MAP2K6, CACNA1C, JMJD7-PLA2G4B, CDC42"
"Platinum drug resistance",0.03,0.156,1,72,14,"SLC31A1, GSTA1, GSTA3, GSTP1, BIRC5, MGST1, MSH2, PDPK1, PMAIP1, BCL2L1, TOP2A, XPA, PIK3R3, GSTO1"
"ECM-receptor interaction",0.031,0.156,1,79,15,"COL1A2, COL4A2, COL4A3, COL6A1, GP1BA, TNC, ITGA1, ITGA5, ITGAV, ITGB1, ITGB3, AGRN, LAMA4, LAMA5, TNN"
"Apoptosis",0.032,0.157,1,136,23,"PARP1, CTSD, EIF2S1, ENDOG, BIRC5, IKBKB, IL3, IL3RA, ITPR3, JUN, KRAS, PDPK1, PMAIP1, DIABLO, RELA, BCL2L1, TNFRSF1A, TUBA4A, TUBA1A, CAPN2, PIK3R3, RIPK1, CFLAR"
"Protein export",0.032,0.157,1,22,6,"SEC63, SEC61A1, HSPA5, SRP54, SRP68, SEC11C"
"Cell cycle",0.033,0.159,1,122,21,"MAD2L2, PTTG2, E2F3, SFN, HDAC2, SMAD4, MCM3, PCNA, PLK1, ATR, RAD21, BUB1B, TGFB2, YWHAG, YWHAH, CCND2, CCND3, CCNE1, CCNB2, CDC25B, CDC25C"
"Phospholipase D signaling pathway",0.034,0.16,1,144,24,"RAPGEF3, DNM1, EGFR, PTK2B, MRAS, PIP5K1C, SHC2, PLA2G4D, LPAR4, CXCL8, KRAS, PDGFRA, PDGFRB, PLA2G4A, PLCB4, AVPR1A, SYK, PIK3R3, DGKZ, DGKE, PLPP1, JMJD7-PLA2G4B, CYTH1, GAB2"
"Dopaminergic synapse",0.035,0.161,1,130,22,"CREB3, CREB1, ATF6B, DRD2, DRD5, GNAI3, GNAO1, GNG3, GNG4, GNG10, GRIA3, GSK3A, ITPR3, PLCB4, PPP2CB, PPP2R5A, PPP2R5E, MAPK13, SLC6A3, SLC18A2, CACNA1C, CREB3L1"
"Endocrine and other factor-regulated calcium reabsorption",0.035,0.161,1,47,10,"CLTA, CLTC, DNM1, ATP1B4, ATP1A3, ATP1B2, ATP1B3, PLCB4, TRPV5, BDKRB2"
"Platelet activation",0.054,0.234,1,121,20,"COL1A2, FGA, GNAI3, GP1BA, PLA2G4D, GUCY1B3, ITGB1, ITGB3, ITPR3, PLA2G4A, PLCB4, MAPK13, PTGIR, RAP1A, SYK, TLN2, ORAI1, PIK3R3, MYLK2, JMJD7-PLA2G4B"
"Th1 and Th2 cell differentiation",0.054,0.234,1,92,16,"JAG1, GATA3, LAT, HLA-DQA2, RBPJ, IKBKB, IL12A, IL12RB2, JUN, NFKBIB, NFKBIE, PPP3R2, MAPK13, RELA, STAT1, MAML2"
"VEGF signaling pathway",0.059,0.25,1,58,11,"SHC2, PLA2G4D, KRAS, PLA2G4A, PPP3R2, MAPK13, PXN, MAPKAPK3, PIK3R3, JMJD7-PLA2G4B, CDC42"
"mRNA surveillance pathway",0.059,0.25,1,86,15,"SRRM1, SAP18, NXF1, PAPOLA, PABPC5, ACIN1, SSU72, NXT1, PABPC1L2A, PCF11, PPP2CB, PPP2R5A, PPP2R5E, PABPC4, RBM8A"
"Linoleic acid metabolism",0.078,0.322,1,27,6,"ALOX15, PLA2G2D, PLA2G4D, PLA2G4A, PLA2G6, JMJD7-PLA2G4B"
"Cholinergic synapse",0.081,0.322,1,112,18,"CREB3, CHRM2, CHRNA4, CHRNB4, CREB1, GNA11, GNAI3, GNAO1, GNG3, GNG4, GNG10, ITPR3, KCNQ1, KRAS, PLCB4, CACNA1C, PIK3R3, CREB3L1"
"IL-17 signaling pathway",0.082,0.322,1,90,15,"CSF2, TAB2, TAB3, IKBKB, IL1B, CXCL8, IL17A, JUN, MAPK13, RELA, S100A8, CCL7, SRSF1, MAP3K7, HSP90B1"
"Mismatch repair",0.082,0.322,1,21,5,"POLD3, LIG1, MSH2, PCNA, POLD4"
"Estrogen signaling pathway",0.086,0.33,1,98,16,"CREB3, CREB1, ATF6B, EGFR, SHC2, GNAI3, GNAO1, ITPR3, JUN, KRAS, OPRM1, PLCB4, SP1, HSP90B1, PIK3R3, CREB3L1"
"Glutamatergic synapse",0.086,0.33,1,113,18,"SLC38A3, GRIN3A, GRIN3B, GRK2, GNAI3, GNAO1, GNG3, GNG4, GNG10, PLA2G4D, GRIA3, GRIN2D, ITPR3, PLA2G4A, PLCB4, PPP3R2, CACNA1C, JMJD7-PLA2G4B"
"cGMP-PKG signaling pathway",0.104,0.386,1,162,24,"CREB3, CNGA1, CREB1, ATF6B, ADORA3, ADRB2, ATP1B4, GNA11, GNAI3, GUCY1B3, ITPR3, ATP1A3, ATP1B2, ATP1B3, ATP2B3, PDE3B, PLCB4, PPP3R2, BDKRB2, TRPC6, CACNA1C, MYLK2, PDE5A, CREB3L1"
"Necroptosis",0.104,0.386,1,162,24,"DNM1L, IRF9, PARP1, TICAM1, CYLD, PGAM5, ALOX15, CHMP2A, PLA2G4D, IFNA13, IFNA14, IFNA16, IL1A, IL1B, PLA2G4A, H2AFY2, EIF2AK2, STAT1, TLR4, TNFRSF1A, CAPN2, JMJD7-PLA2G4B, RIPK1, CFLAR"
"alpha-Linolenic acid metabolism",0.112,0.41,1,23,5,"PLA2G2D, PLA2G4D, PLA2G4A, PLA2G6, JMJD7-PLA2G4B"
"GABAergic synapse",0.121,0.436,1,88,14,"SLC38A3, GABARAPL2, GABRA2, GABRA5, GABRA6, GABRB2, GABRB3, GABRE, GNAI3, GNAO1, GNG3, GNG4, GNG10, CACNA1C"
"Calcium signaling pathway",0.123,0.436,1,181,26,"CHRM2, ADRB2, DRD5, EGFR, PTK2B, GNA11, GNA15, GRIN2D, HRH2, HTR6, ITPR3, ATP2B3, PLCE1, PDE1B, PDGFRA, PDGFRB, PLCB4, AVPR1A, PPP3R2, BDKRB1, BDKRB2, TACR1, TACR3, CACNA1C, ORAI1, MYLK2"
"Aldosterone synthesis and secretion",0.134,0.47,1,82,13,"CREB3, CREB1, ATF6B, GNA11, NR4A1, ITPR3, LDLR, MC2R, PLCB4, PRKD1, CACNA1C, ORAI1, CREB3L1"
"Protein processing in endoplasmic reticulum",0.139,0.474,1,160,23,"STUB1, HSPH1, SEC63, UBE2J2, ATF6B, DAD1, EIF2S1, PDIA3, SEC61A1, DNAJA1, HSPA5, P4HB, PARK2, YOD1, NSFL1C, EIF2AK2, UBQLN4, BAG1, HSP90B1, VCP, CALR, CAPN2, PDIA4"
"Gastric acid secretion",0.139,0.474,1,75,12,"CFTR, ATP1B4, GNAI3, HRH2, ITPR3, KCNQ1, ATP1A3, ATP1B2, ATP1B3, PLCB4, MYLK2, KCNE2"
"Purine metabolism",0.146,0.492,1,169,24,"POLD3, AK7, DCK, AK4, TWISTNB, AMPD1, GUCY1B3, GUCY2D, NT5C, HPRT1, ITPA, PDE3B, PDE4C, PDE6A, PDE6H, PDE1B, POLE, POLR2F, POLR2J, POLR2J3, NT5M, POLD4, PDE5A, ENTPD4"
"Apoptosis - multiple species",0.149,0.493,1,32,6,"BIRC5, NGFR, PMAIP1, DIABLO, BCL2L1, TNFRSF1A"
"B cell receptor signaling pathway",0.166,0.537,1,70,11,"IKBKB, JUN, KRAS, NFKBIB, NFKBIE, PPP3R2, PTPN6, RELA, SYK, CARD11, PIK3R3"
"Prolactin signaling pathway",0.166,0.537,1,70,11,"CGA, SHC2, KRAS, MAPK13, PRL, RELA, STAT1, PIK3R3, TNFRSF11A, SOCS2, CCND2"
"DNA replication",0.183,0.583,1,34,6,"POLD3, LIG1, MCM3, PCNA, POLE, POLD4"
"Neurotrophin signaling pathway",0.19,0.599,1,119,17,"SHC2, IKBKB, IRAK1, JUN, KRAS, ARHGDIB, MAP3K3, NFKBIB, NFKBIE, NGFR, PDPK1, MAPK13, RAP1A, RELA, BRAF, PIK3R3, CDC42"
"Circadian entrainment",0.197,0.614,1,96,14,"ADCYAP1R1, CREB1, GNAI3, GNAO1, GNG3, GNG4, GNG10, GRIA3, GRIN2D, GUCY1B3, ITPR3, MTNR1B, PLCB4, CACNA1C"
"Protein digestion and absorption",0.207,0.624,1,89,13,"SLC16A10, COL1A2, COL4A2, COL4A3, COL6A1, COL10A1, COL17A1, ATP1B4, KCNQ1, MME, ATP1A3, ATP1B2, ATP1B3"
"Phototransduction",0.207,0.624,1,28,5,"CNGA1, GNAT2, GUCY2D, PDE6A, RGS9"
"Arachidonic acid metabolism",0.208,0.624,1,58,9,"ALOX5, ALOX15, PLA2G2D, PLA2G4D, GPX1, GPX3, PLA2G4A, PLA2G6, JMJD7-PLA2G4B"
"Glutathione metabolism",0.234,0.693,1,52,8,"GPX1, GPX3, GPX4, GSTA1, GSTA3, GSTP1, MGST1, GSTO1"
"Endocytosis",0.248,0.726,1,240,31,"ARPC1B, CLTA, CLTC, WIPF2, GRK2, DNM1, EGFR, FGFR3, PIP5K1C, CHMP2A, GRK4, GIT1, EPN1, LDLR, ASAP1, VPS36, SH3GLB1, PDGFRA, VPS37C, ASAP3, PARD3, SH3GLB2, RAB5A, TSG101, UBB, CXCR4, PARD6G, CAV3, ASAP2, CYTH1, CDC42"
"Cellular senescence",0.254,0.728,1,158,21,"E2F3, MRAS, LIN9, IL1A, CXCL8, ITPR3, KRAS, MYBL2, ATR, PPP3R2, MAPK13, MAP2K6, RELA, TGFB2, CAPN2, PIK3R3, CCND2, CCND3, CCNE1, CCNB2, LIN52"
"Adherens junction",0.254,0.728,1,69,10,"CSNK2A2, CTNND1, EGFR, SMAD4, PARD3, PTPN6, MAP3K7, VCL, NECTIN4, CDC42"
"Glucagon signaling pathway",0.266,0.753,1,102,14,"CREB3, CREB1, FBP1, G6PC, GYS2, ACACB, ITPR3, PDE3B, PGAM2, PLCB4, PPP4C, PPP3R2, SLC2A1, CREB3L1"
"Vascular smooth muscle contraction",0.274,0.765,1,119,16,"MYL6B, PLA2G2D, GNA11, PLA2G4D, GUCY1B3, ITPR3, PLA2G4A, PLCB4, AVPR1A, PTGIR, ACTA2, BRAF, CACNA1C, PLA2G6, MYLK2, JMJD7-PLA2G4B"
"Gap junction",0.282,0.765,1,87,12,"DRD2, EGFR, GNA11, GNAI3, GUCY1B3, ITPR3, KRAS, PDGFRA, PDGFRB, PLCB4, TUBA4A, TUBA1A"
"Cytosolic DNA-sensing pathway",0.284,0.765,1,63,9,"IFNA13, IFNA14, IFNA16, IKBKB, IL1B, NFKBIB, POLR2F, RELA, RIPK1"
"Synaptic vesicle cycle",0.284,0.765,1,63,9,"TCIRG1, CLTA, CLTC, DNM1, ATP6V0A4, ATP6V1B2, SLC18A2, STX1A, ATP6V0E1"
"AMPK signaling pathway",0.286,0.765,1,120,16,"CREB3, CFTR, CREB1, FBP1, G6PC, EEF2K, GYS2, ACACB, RAB14, PDPK1, PPP2CB, PPP2R5A, PPP2R5E, MAP3K7, PIK3R3, CREB3L1"
"Inflammatory mediator regulation of TRP channels",0.293,0.776,1,96,13,"PLA2G4D, IL1B, ITPR3, PLA2G4A, PLCB4, MAPK13, MAP2K6, PTGER2, BDKRB1, BDKRB2, PLA2G6, PIK3R3, JMJD7-PLA2G4B"
"Cardiac muscle contraction",0.299,0.784,1,72,10,"ATP1B4, MYH6, ATP1A3, ATP1B2, ATP1B3, TNNT2, CACNA1C, CACNA2D1, CACNB4, CACNA2D2"
"Progesterone-mediated oocyte maturation",0.309,0.802,1,89,12,"MAD2L2, GNAI3, KRAS, MOS, PDE3B, PLK1, MAPK13, BRAF, PIK3R3, CCNB2, CDC25B, CDC25C"
"Insulin resistance",0.316,0.811,1,106,14,"CREB3, CREB1, G6PC, GYS2, ACACB, IKBKB, PDPK1, RELA, SLC2A1, TNFRSF1A, OGT, PIK3R3, CREB3L1, TBC1D4"
"Carbohydrate digestion and absorption",0.341,0.868,1,42,6,"ATP1B4, G6PC, ATP1A3, ATP1B2, ATP1B3, PIK3R3"
"Long-term potentiation",0.35,0.875,1,67,9,"RAPGEF3, GRIN2D, ITPR3, KRAS, PLCB4, PPP3R2, RAP1A, BRAF, CACNA1C"
"Oxytocin signaling pathway",0.354,0.875,1,151,19,"MYL6B, EGFR, GNAI3, GNAO1, PLA2G4D, GUCY1B3, EEF2K, ITPR3, JUN, KRAS, PLA2G4A, PLCB4, PPP3R2, CACNA1C, CACNA2D1, CACNB4, MYLK2, JMJD7-PLA2G4B, CACNA2D2"
"Mineral absorption",0.359,0.875,1,51,7,"SLC31A1, ATP1B4, MT2A, ATP1A3, ATP1B2, ATP1B3, TF"
"Fanconi anemia pathway",0.359,0.875,1,51,7,"FANCE, FANCG, POLK, ATR, RAD51, BRCA2, USP1"
"Apelin signaling pathway",0.364,0.875,1,135,17,"GABARAPL2, CTGF, JAG1, EGR1, MRAS, GNAI3, GNG3, GNG4, GNG10, ITPR3, KRAS, SMAD4, PDE3B, PLCB4, ACTA2, MYLK2, HDAC4"
"p53 signaling pathway",0.367,0.875,1,68,9,"SFN, MDM4, GTSE1, PMAIP1, ATR, CCND2, CCND3, CCNE1, CCNB2"
"Collecting duct acid secretion",0.369,0.875,1,27,4,"TCIRG1, ATP6V0A4, ATP6V1B2, ATP6V0E1"
"Adipocytokine signaling pathway",0.384,0.893,1,69,9,"G6PC, ACACB, IKBKB, NFKBIB, NFKBIE, NPY, RELA, SLC2A1, TNFRSF1A"
"Nucleotide excision repair",0.384,0.893,1,44,6,"POLD3, LIG1, PCNA, POLE, POLD4, XPA"
"Cell adhesion molecules (CAMs)",0.388,0.895,1,137,17,"CDH5, CLDN19, CLDN14, CLDN15, HLA-DQA2, ICAM1, ITGAM, ITGAV, ITGB1, NCAM1, CLDN11, PTPRC, CNTN2, JAM3, CLDN6, CLDN2, CD28"
"EGFR tyrosine kinase inhibitor resistance",0.393,0.899,1,78,10,"EGFR, FGFR3, SHC2, IL6R, KRAS, PDGFRA, PDGFRB, BCL2L1, BRAF, PIK3R3"
"Other types of O-glycan biosynthesis",0.401,0.908,1,20,3,"POFUT1, MFNG, OGT"
"Retrograde endocannabinoid signaling",0.412,0.923,1,139,17,"GABRA2, GABRA5, GABRA6, GABRB2, GABRB3, GABRE, GNAI3, GNAO1, GNG3, GNG4, GNG10, GRIA3, ITPR3, NDUFA1, PLCB4, MAPK13, CACNA1C"
"Bile secretion",0.418,0.923,1,71,9,"CFTR, ATP1B4, AQP4, LDLR, ATP1A3, ATP1B2, ATP1B3, SLC2A1, NR0B2"
"Oocyte meiosis",0.422,0.923,1,114,14,"MAD2L2, PTTG2, ITPR3, MOS, PLK1, PPP2CB, PPP2R5A, PPP2R5E, PPP3R2, YWHAG, YWHAH, CCNE1, CCNB2, CDC25C"
"Pentose phosphate pathway",0.423,0.923,1,29,4,"FBP1, ALDOA, DERA, TKTL2"
"HIF-1 signaling pathway",0.438,0.939,1,98,12,"EDN1, EGFR, EPO, ALDOA, GAPDH, IL6R, ARNT, RELA, SLC2A1, TF, TLR4, PIK3R3"
"Taste transduction",0.441,0.939,1,81,10,"GABRA2, GABRA5, GABRA6, HTR1A, HTR3A, ITPR3, PDE1B, SCNN1A, SCNN1G, CACNA1C"
"Hippo signaling pathway",0.441,0.939,1,150,18,"YAP1, CTGF, AFP, BIRC5, SMAD1, SMAD4, PPP2CB, PARD3, BMP7, BMPR1B, TGFB2, WNT5A, YWHAG, YWHAH, PARD6G, CCND2, CCND3, WNT3A"
"Sphingolipid metabolism",0.447,0.94,1,47,6,"SGPP2, CERS3, ASAH1, SMPD2, PLPP1, SGPL1"
"RNA polymerase",0.449,0.94,1,30,4,"TWISTNB, POLR2F, POLR2J, POLR2J3"
"Caffeine metabolism",0.453,0.94,1,5,1,"CYP2A6"
"Homologous recombination",0.46,0.947,1,39,5,"POLD3, SYCP3, POLD4, RAD51, BRCA2"
"Drug metabolism - cytochrome P450",0.48,0.98,1,66,8,"ADH4, CYP2A6, CYP3A5, GSTA1, GSTA3, GSTP1, MGST1, GSTO1"
"Ovarian steroidogenesis",0.489,0.99,1,49,6,"CGA, ALOX5, PLA2G4D, LDLR, PLA2G4A, JMJD7-PLA2G4B"
"Renin-angiotensin system",0.495,0.993,1,23,3,"ACE, AGT, MME"
"RNA degradation",0.501,0.993,1,76,9,"LSM6, PABPC5, LSM4, PABPC1L2A, PARN, EXOSC10, EXOSC4, EXOSC5, PABPC4"
"FoxO signaling pathway",0.504,0.993,1,129,15,"GABARAPL2, EGFR, G6PC, IKBKB, KRAS, SMAD4, PDPK1, PLK1, MAPK13, BCL6, BRAF, TGFB2, PIK3R3, CCND2, CCNB2"
"Phosphonate and phosphinate metabolism",0.515,0.993,1,6,1,"CEPT1"
"Endocrine resistance",0.522,0.993,1,95,11,"JAG1, E2F3, EGFR, SHC2, JUN, KRAS, NOTCH4, MAPK13, SP1, BRAF, PIK3R3"
"Pancreatic secretion",0.522,0.993,1,95,11,"CFTR, ATP1B4, PLA2G2D, ITPR3, KCNQ1, ATP1A3, ATP1B2, ATP1B3, ATP2B3, PLCB4, RAP1A"
"Glycerophospholipid metabolism",0.522,0.993,1,95,11,"CEPT1, LPCAT4, PLA2G2D, PLA2G4D, PNPLA7, PLA2G4A, PLA2G6, DGKZ, DGKE, PLPP1, JMJD7-PLA2G4B"
"Thiamine metabolism",0.522,0.993,1,15,2,"AK7, AK4"
"Metabolism of xenobiotics by cytochrome P450",0.55,1,1,70,8,"ADH4, CYP2A6, CYP3A5, GSTA1, GSTA3, GSTP1, MGST1, GSTO1"
"Type I diabetes mellitus",0.55,1,1,43,5,"HLA-DQA2, IL1A, IL1B, IL12A, CD28"
"Natural killer cell mediated cytotoxicity",0.553,1,1,124,14,"CSF2, PTK2B, SHC2, LAT, ICAM1, IFNA13, IFNA14, IFNA16, KRAS, PPP3R2, PTPN6, BRAF, SYK, PIK3R3"
"Autophagy - animal",0.566,1,1,125,14,"GABARAPL2, CTSD, EIF2S1, MRAS, ATG9B, KRAS, LAMP1, SH3GLB1, PDPK1, PPP2CB, BCL2L1, MAP3K7, PIK3R3, CFLAR"
"Ribosome biogenesis in eukaryotes",0.566,1,1,71,8,"NXF1, RPP40, RPP25L, CSNK2A2, NXT1, GNL2, SNU13, RPP25"
"Antigen processing and presentation",0.566,1,1,71,8,"CREB1, PDIA3, HLA-DQA2, HSPA5, NFYB, NFYC, TAP1, CALR"
"Pyrimidine metabolism",0.58,1,1,99,11,"POLD3, DCK, TWISTNB, NT5C, POLE, POLR2F, POLR2J, POLR2J3, NT5M, POLD4, ENTPD4"
"Phosphatidylinositol signaling system",0.58,1,1,99,11,"PIP5K1C, INPP5J, ITPR3, PLCE1, INPP5K, PIK3C2A, PLCB4, PIK3R3, DGKZ, DGKE, INPP4B"
"Regulation of lipolysis in adipocytes",0.588,1,1,54,6,"CGA, ADRB2, GNAI3, NPY, PDE3B, PIK3R3"
"Axon guidance",0.59,1,1,172,19,"CFL1, CFL2, EFNA2, GNAI3, EPHA6, ITGB1, KRAS, PLXNA1, SSH3, PPP3R2, PARD3, BMP7, BMPR1B, TRPC6, WNT5A, CXCR4, PARD6G, PIK3R3, CDC42"
"Insulin signaling pathway",0.591,1,1,136,15,"FBP1, EXOC7, G6PC, SHC2, GYS2, ACACB, IKBKB, KRAS, PDE3B, PDPK1, INPP5K, PRKAR2B, BRAF, PIK3R3, SOCS2"
"Type II diabetes mellitus",0.592,1,1,45,5,"IKBKB, KCNJ11, CACNA1C, PIK3R3, SOCS2"
"TGF-beta signaling pathway",0.597,1,1,82,9,"BAMBI, SMAD1, SMAD4, SMAD6, PPP2CB, BMP7, BMPR1B, SP1, TGFB2"
"Nicotinate and nicotinamide metabolism",0.632,1,1,28,3,"NAMPT, NT5C, NT5M"
"Autophagy - other",0.679,1,1,30,3,"GABARAPL2, ATG9B, PPP2CB"
"Circadian rhythm",0.679,1,1,30,3,"CREB1, RORA, NR1D1"
"Ferroptosis",0.682,1,1,40,4,"ALOX15, GPX4, PRNP, TF"
"Fat digestion and absorption",0.682,1,1,40,4,"PLA2G2D, APOB, DGAT2, PLPP1"
"Salivary secretion",0.696,1,1,89,9,"ADRB2, ATP1B4, GUCY1B3, ITPR3, ATP1A3, ATP1B2, ATP1B3, ATP2B3, PLCB4"
"Antifolate resistance",0.701,1,1,31,3,"IKBKB, IL1B, RELA"
"Synthesis and degradation of ketone bodies",0.701,1,1,10,1,"HMGCS2"
"Melanogenesis",0.714,1,1,100,10,"CREB3, CREB1, EDN1, GNAI3, GNAO1, KRAS, PLCB4, WNT5A, WNT3A, CREB3L1"
"Basal transcription factors",0.719,1,1,42,4,"TBPL2, TAF1, TAF4, TAF12"
"Terpenoid backbone biosynthesis",0.732,1,1,22,2,"HMGCS2, MVK"
"Inositol phosphate metabolism",0.739,1,1,73,7,"PIP5K1C, INPP5J, PLCE1, INPP5K, PIK3C2A, PLCB4, INPP4B"
"SNARE interactions in vesicular transport",0.741,1,1,33,3,"STX18, STX1A, GOSR2"
"Hedgehog signaling pathway",0.784,1,1,46,4,"GRK2, SUFU, CSNK1G1, CCND2"
"Glycolysis / Gluconeogenesis",0.789,1,1,67,6,"ADH4, FBP1, ALDOA, G6PC, GAPDH, PGAM2"
"Non-homologous end-joining",0.792,1,1,13,1,"DNTT"
"Fatty acid biosynthesis",0.792,1,1,13,1,"ACACB"
"Longevity regulating pathway",0.798,1,1,88,8,"CREB3, CREB1, ATF6B, KRAS, RELA, EHMT1, PIK3R3, CREB3L1"
"Intestinal immune network for IgA production",0.798,1,1,47,4,"HLA-DQA2, TNFRSF17, CXCR4, CD28"
"Complement and coagulation cascades",0.799,1,1,78,7,"A2M, FGA, ITGAM, BDKRB1, BDKRB2, SERPING1, C5"
